id,user,date,timestamp,commentText,likes,hasReplies,numberOfReplies,replies.id,replies.user,replies.date,replies.timestamp,replies.commentText,replies.likes
UgyK6W5eN1nHOp0xqs94AaABAg,Felipe Botelho,6 hours ago,1528739446268,Quando deu dormento cancelou voto !,0,false,0,,,,,,
UgyZcPSqLIGcYbZDt9B4AaABAg,Joao Paulo Luiz da Silva,3 days ago,1528501846278,Fraude p o candidato voto nulo?,0,false,0,,,,,,
UgxTXeIHfVc-hNhz6gp4AaABAg,Leandro de Oliveira,1 month ago,1526082646282,E esse voto no aecio aí fera ??? Kkkk,0,false,0,,,,,,
Ugyl9mMy3LbZnUcAu4h4AaABAg,Patrick Oberholzer,1 month ago,1526082646290,"O voto obrigatório e a urna eletrônica são jaboticabas inventadas por agentes/servidores públicos e político brasileiros se não corruptos, coniventes com a corrupção ou com suas capacidades mentais e cognitivas significativamente diminuidas. Nenhuma Democracia avançada no mundo adota o sistema de voto com urnas eletrônicas : eu estou me referindo a nações que dominam as tecnologias mais avançadas do mundo (aeroespacial) e que são democracias maduras, pq ?  por uma simples razão : a urna eletrônica não garante que o voto do eleitor seja processado de forma correta, sem trapaça; com a urna eletrônica é impossível proceder a uma recontagem dos votos que seria um controle cruzado de informações. Holanda, Bélgica e EUA testaram e não quiseram e hoje somente o beiçola, o rei do frango e da polenta e o analfabeto funcional do STF, o ditador Maduro, e a  Raquel Dodge defedem o sistema de urna eletrônica : por que tanta teimosia ?",0,false,0,,,,,,
Ugz6sQIv41nWDSFKvJF4AaABAg,Luana Machado,4 months ago,1518393046299,Ele vota 44 e depoia aperta no vermelho. Tem q ser no verde pra ir o nulo. O povo nao sabe votar mesmo literalmente.,0,false,0,,,,,,
UgyKr5HctBNtANgqjCB4AaABAg,Wallace Lopes,4 months ago,1518393046301,44 não seria o número do PRP?,0,false,0,,,,,,
UgwUWiiuGRGHOhghR-t4AaABAg,Druca Fate,7 months ago,1510444246311,O programador que digitaliza o resultado das pesquisas que colocam o Lula da Silva lá em cima é o mesmo que programa as urnas eletrônicas de votação...,0,false,0,,,,,,
UgyjTovLMkF_0waZbY54AaABAg,André Mariano,7 months ago,1510444246314,"Cara tira este vídeo. Vc está passando vergonha. Para saber se há segurança na urna procure ver os vídeos do especialista que constatou os problemas no software, Diego Aranha.  Fazer um vídeo como esse aqui não ajuda em nada. Falta de vergonha na cara.",0,false,0,,,,,,
Ugyv1WUrjVS9NB81fjV4AaABAg,Elimar Cardoso,8 months ago,1507765846323,"Esse é o motivo de proibir filmar, é para eles terem a chance de roubar sem ninguém perceber. Não! As urnas eletrônicas, fora! Curruptos.",0,false,0,,,,,,
UggTauVATy6z3ngCoAEC,E ZD,11 months ago,1499817046327,mau de Parkinson,0,false,0,,,,,,
UgiWR8ru2f9KWHgCoAEC,francisco peracelli peracelli,1 year ago,1497225046335,O BRASIL NESSE MOMENTO ESTÁ VIVENDO UM MOMENTO HISTÓRICO ...COMECEI A FALAR DAS URNAS ELETRÔNICAS NESSE DIA 13.05.2017 E FUI EXCLUÍDO DO FACEBOOK...PENSO ESTAR O BRASIL SOFRENDO UMA GRANDE CONSPIRAÇÃO....NESSE MOMENTO....#INTERVENÇÃOMILITARJÁ,0,false,0,,,,,,
UgijuaDTwjBqRHgCoAEC,Musico Gomes,1 year ago,1497225046341,Os computadores da nasa  foram invadidos do Google tambem do banco do brasil tambem etc ... so a URNA eletronica  que não kkkkkkkk fala serio,7,false,0,,,,,,
Ugj14KFEWi4VCngCoAEC,Romeu Da Silva Pereira,1 year ago,1497225046348,Lula e Dilma ganharem duas vezes ou as urnas são fraudadas ou o povo brasileiro é burro!,0,false,0,,,,,,
UghGKH6uKGO1aHgCoAEC,cqfstv companhia de quem fala só,1 year ago,1497225046357,cachorros,0,false,0,,,,,,
UghVbXYl23xIYXgCoAEC,MrCarlosband,1 year ago,1497225046361,"vejo 2 irregularidades. A primeira FILMAR a urna,  se um fiscal de partido pega poderia anular a Sessão inteira. 
a Segunda é tentar enganar as pessoas fazendo malabarismos com a urna. 
Ele aperta e segura o 4 fazendo com que o sistema entenda que você digitou o 4 duas vezes. Aperte e segure o 4 no seu teclado pra ver.  A urna tem um Sistema Operacional que lê um teclado da mesma forma que o seu computador faz. 

Se houver fraude esta não é na urna, mas no sistema apurador que fica no TSE.  A Urna eletrônica é relativamente segura, mas como qualquer dispositivo eletrônico pode apresentar problemas, fazendo com que a votação demore. Parece ser o caso desta que está muito lenta. 

A atitude que esse cara fez em levar um celular e filmar é CRIMINOSA...",0,false,0,,,,,,
Ugire4WcweJol3gCoAEC,Simao Manoel Da Silva,1 year ago,1497225046370,pessoal deixa de ser idiota essas urnas eletrônicas só tem no Brasil porque o resto do mundo não quis essa bosta fraudulenta até o Paraguai não quis isso,1,false,0,,,,,,
UghxX77VhS8E9ngCoAEC,Abraão Moraes,1 year ago,1497225046374,"kkkkkkk o idiota ou analfa digita 44 e quer 45 kkkkkkkkkkkkkkkkkk ala serio, a urna é ótima",0,false,0,,,,,,
Uggueco-UspDH3gCoAEC,PATRIOTA Brasil!,1 year ago,1497225046382,Urna eletrônica é FRAUDE! Fomos enganados!,1,false,0,,,,,,
UgjLKjjTrWbegXgCoAEC,PATRIOTA Brasil!,1 year ago,1497225046391,Urna eletrônica é FRAUDE! Fomos enganados!,1,false,0,,,,,,
UghbsrsqCDNBk3gCoAEC,PATRIOTA Brasil!,1 year ago,1497225046396,Urna eletrônica é FRAUDE! Fomos enganados!,1,false,0,,,,,,
UgjkzpaIDbWM-XgCoAEC,Steel3423,1 year ago,1497225047710,Fraude é a urna ser rejeitada em mais de 50 países por ser facilmente adulterada KKKKKKKKKKKKKK,1,false,0,,,,,,
UgimCoFK7juD7XgCoAEC,tadeu alves,1 year ago,1497225047719,"Nao vi fraude nao, so um idiota digitando 44 entao aprece a frase ((nulo) ele diz ta dando problema. Quando ele digita 45 aparece o candidato do psdb ele comfirma o voto e diz agora foi. Onde esta a fraude? A fraude nao esta nesta urna. Esta na escola que ensinou este jumento, que 44 e igual a 45",1,false,0,,,,,,
Ugjfwmby90v_N3gCoAEC,Glaucia da Luz,1 year ago,1497225047722,"Conclave de Brasília II, 31 de agosto de 2016. Importante Fórum
Internacional que visa a maior transparência nos processos eleitorais e a
instalação da CPI das Urnas Eletrônicas. É um evento gratuito e aberto ao
público. Visite no Facebook: Eventos Pela Democracia",0,false,0,,,,,,
UgiTkfI8E4uD2XgCoAEC,Murilo Edevalter Passos,2 years ago,1465689047727,"Como pode , eu voto democracia e a urna me entrega ditadura , não tem ninguém do outro lado pra vê esse errrrrrrrrrrrrrrrrrrrrrrrrrrrrrrrrrrrrrrrrrrro grossssssssssssssssssssssssero cadeia neles",0,false,0,,,,,,
UggYqpffWMXoOHgCoAEC,Adherbal Borges,2 years ago,1465689047732,"dá zero pra ele. BOSTA, BRINCANDO COM COISA SÉRIA. VÁ SE FUFU.",0,false,0,,,,,,
Ugge5ePF_o3WSHgCoAEC,SR GuiguiCFBR,2 years ago,1465689047736,ele q é burro mesmo... e a maquina ta com lag.,0,true,2,,,,,,
,,,,,,,,Ugge5ePF_o3WSHgCoAEC.8DStnxT9Ogg8DTDj5n1RpS,MARIO FERNANDO,2 years ago,1465689048107,+GuiguiCFBR https://www.youtube.com/watch?v=KdxlRgAzkLU,0
,,,,,,,,Ugge5ePF_o3WSHgCoAEC.8DStnxT9Ogg8DTEobZvM91,SR GuiguiCFBR,2 years ago,1465689048117,"não estou defendendo essa porcaria, mas sim dizendo que esse cara ai que votou é burro mesmo.",1
Ugg5ksM79l9tW3gCoAEC,fabricio lima,2 years ago,1465689047743,Q cara burro não sabe digitar! Acho q ele estava tentando escrever o nome do candidato q nem antes q cada número eram 3 letras,0,false,0,,,,,,
UggpWf-tWFYLuXgCoAEC,GUIAGPS -,2 years ago,1465689047747,"É muito fácil destinar urnas seguras para locais passíveis de fiscalização e destinar outras urnas com cartões corrompidos e que não são fiscalizadas e destinar votos necessários para determinar a vitória de um ou outro candidato.
devemos exigir para eleição presidente da república o método tradicional e para as demais, votos com recibo para o eleitor sem mencionar a intenção do eleitor.
É Também possível analisar a insatisfação do eleitor e utilizar os votos dos indecisos para promover a vitória do candidato que desejarem.",0,false,0,,,,,,
UgggqQ6hQXwaVXgCoAEC,Contra o Golpe de Estado no Brasil 2016,2 years ago,1465689047754,Tbm querendo votar no PSDB,0,true,2,,,,,,
,,,,,,,,UgggqQ6hQXwaVXgCoAEC.8CJbpTgYxrg8ChDyt8ewu4,MeuBrasil power,2 years ago,1465689048141,"+Jonathan Marques melhor que qualquer petista FATO ,  e claro melhor que quAlquer eleitor petistas kkkkk perderam malandros kkkkkkkkkkkkkkkkk",1
,,,,,,,,UgggqQ6hQXwaVXgCoAEC.8CJbpTgYxrg8EEjleXp9ZD,Contra o Golpe de Estado no Brasil 2016,2 years ago,1465689048150,+brasileira de verdade Vc acha PSDB melhor? kkkkkkk,0
UghZoWgRgaxXE3gCoAEC,Gustavo Camargo,2 years ago,1465689047760,"Ainda vota MAU. Quando é q o brasileiro vai aprender q político ""BOM"" não tem como fazer campanha milionária e não compra voto .",0,false,0,,,,,,
UghH4Fexzbwbr3gCoAEC,Reginaldo Lucas - Pulga,2 years ago,1465689047767,"Fraudado ta esse bosta de eleitor, é só apertar 00 e confirmar!",7,true,20,,,,,,
,,,,,,,,UghH4Fexzbwbr3gCoAEC.8ARVhR_NLjp8DMqF8gpON7,DINHO SP.,2 years ago,1465689048302,"+Reginaldo Lucas - Pulga. Falou tudo. É só mais um vídeo dos NAZIfascistas da Extrema-direita brasileira manipulando e criando sensacionalismo. URNA FRAUDADA foi em 1982 quando A GLOBO, VEJA E os MILITARES FILHAS DA PUTA roubaram a eleição do BRIZOLA no ""escândalo da PROCONSULT.""",0
,,,,,,,,UghH4Fexzbwbr3gCoAEC.8ARVhR_NLjp8DNXW114J-U,MARIO FERNANDO,2 years ago,1465689048308,+Pauta Paulista https://www.youtube.com/watch?v=KdxlRgAzkLU,1
,,,,,,,,UghH4Fexzbwbr3gCoAEC.8ARVhR_NLjp8DRVnuLZ4dH,DINHO SP.,2 years ago,1465689048316,"+MARIO FERNANDO  LINK LIXO.
Se fraude fosse possível o PT tomaria SP e RJ e não conseguem.

Fraude em eleição foi dos CANALHAS MILITARES em 1982 roubando o Brizola. MILIARES e EXTREMA-DIREITA NAZIfascistas são um lixo.",0
,,,,,,,,UghH4Fexzbwbr3gCoAEC.8ARVhR_NLjp8DRalKr-HID,MARIO FERNANDO,2 years ago,1465689048321,+Pauta Paulista https://www.youtube.com/watch?v=-PM-dduR0RM,0
,,,,,,,,UghH4Fexzbwbr3gCoAEC.8ARVhR_NLjp8ErymNGPmvd,Hassows CS,2 years ago,1465689048330,+Pauta Paulista pmdb e pt sao a msm coisa,0
,,,,,,,,UghH4Fexzbwbr3gCoAEC.8ARVhR_NLjp8Esx5cQsIqe,DINHO SP.,2 years ago,1465689048338,+Hassows CS Sim. E o BolsoNAZI + LIXO Cristão é igual a NAZISMO.,0
,,,,,,,,UghH4Fexzbwbr3gCoAEC.8ARVhR_NLjp8EszHvzTHzh,Hassows CS,2 years ago,1465689048342,+Pauta Paulista n fala asneira cara pesquise sobre ele pq falar isso?,0
,,,,,,,,UghH4Fexzbwbr3gCoAEC.8ARVhR_NLjp8EszSB7Ynns,Hassows CS,2 years ago,1465689048351,"+Pauta Paulista nazismo? kkkk oq ele tem haver com esse periodo socialista do partido nacional dos TRABALHADORES ? hitler disse ""o maior exemplo do socialismo sou eu"" eh so pesquisar",0
,,,,,,,,UghH4Fexzbwbr3gCoAEC.8ARVhR_NLjp8Et-HFqlPTe,DINHO SP.,2 years ago,1465689048356,+Hassows CS Quem escreve asneira é você. Deve ser um pivete fácil de ser manipulado pelos Nazistas atuais da política brasileira.,0
,,,,,,,,UghH4Fexzbwbr3gCoAEC.8ARVhR_NLjp8Et-c0UhGs6,Hassows CS,2 years ago,1465689048364,+Pauta Paulista kkkkk ok nazistas da politica kkk,0
,,,,,,,,UghH4Fexzbwbr3gCoAEC.8ARVhR_NLjp8Et15evdPqx,DINHO SP.,2 years ago,1465689048368,"+Hassows CS Hitler inventou características para o socialismo e o que era ser Ariano. 
Ariano é PERSA. PERSA isto mesmo = IRÃ. Estude.
E socialismo para ele era outras coisa louca. 

Nazismo era Capitalista não liberal. O Nazismo foi financiado pelos magnatas da Alemanha e até dos EUA. Eles apoiaram o Nazismo e jamais alguma empresa virou estatal. Ao contrário. Ficaram gigantes porque praticaram o pior do capitalismo que é CARTEL. E as empresas existem até hoje como a BAYER, AGFA, HOESCHT que eram a IG-FARBEM e foram acusadas no Julgamento de Nuremberg sendo desmembradas. Outras empresas famosas até hoje são a SIEMENS, PORSCHE, HUGO BOSS, KODAK, etc.
Até dos EUA os nazistas recebiam financiamento: FORD, IBM, GE e o banco do patriarca da família Busch. 
Henri FORD foi o primeiro não alemão condecorado pelos NAZISTAS e existe foto dele recebendo a condecoração. Ele depois da Guerra pediu desculpas.
Hitler chegou a ser eleito ""HOMEM DO ANO"" pela Revista TIME em 1938.

Não adianta você estudar e pesquisar idiotices repetidas no Google, por gente que escreveu a vida de Hitler. A maioria desacreditada e classificada como farsante.

Você tem que estudar pelo chamado Google DOCs, isto é, artigos aceitos pela comunidade científica, HIstória também é Ciência,

E outra mentira sobre o Nazismo é que era ocultista.
O NAZISMO era OFICIALMENTE CRISTÃO. 
Hitler quando chegou ao poder fez como uma de suas primeiras medidas copiar a Inglaterra e tornar a IGREJA CRISTÃO PROTESTANTE a oficial da Alemanha.  O líder era o Bispo Luterano LUDWIG MULLER.
Todos os soldados nazistas podiam optar e ter na fivela do cinto o símbolo Cristão escrito Deus está ao nosso lado.
Você acha milhões destas fivelas vendidas no Ebay.",0
,,,,,,,,UghH4Fexzbwbr3gCoAEC.8ARVhR_NLjp8Et2GVpyKYM,DINHO SP.,2 years ago,1465689048375,+Hassows CS kkk é KU KLUX KLAN. exatamente a mesma turma de Racistas da Extrema-direita brasileira que fiz ser tudo COITADISMO.,0
,,,,,,,,UghH4Fexzbwbr3gCoAEC.8ARVhR_NLjp8GkwTRRyHw0,MeuBrasil power,1 year ago,1497225048380,"mas a petezada bando de gados vão la e votam nos bandidos petistas e se ferramos novamente é isso msm que vc quer ??? pq se nós de bem não votarmos os vagabundos petistas votam  e os candidatos deles ganham novamente , ou vc é um petralha usando essa tatica pra convencer os ignorantes ou é inocente msm",0
,,,,,,,,UghH4Fexzbwbr3gCoAEC.8ARVhR_NLjp8Glb7SOQl11,DINHO SP.,1 year ago,1497225048388,"+brasileira de verdade Queria que votos no BolsoNAZI ou nos safados dos PSDB do idiota inútil. FRAUDE em PAPEL como no escândalo da PROCONSULT contra o Brizola feito pelos MILITARES LIXOS, Ibope e Globo é que não prestou.",0
,,,,,,,,UghH4Fexzbwbr3gCoAEC.8ARVhR_NLjp8GlbdBGm9o5,DINHO SP.,1 year ago,1497225048393,"+brasileira de verdade Brasileira de MENTIRA você DOUTRINADA pelo Olavismo INcultural deve preferir lixo NAZISTA para votar e depois no poder eles fecharem o Parlamento como fez HITLER.
Ficam vendo vídeo de Oavo TULLA de Carvalho LUANA, Chupando Rôla, Click MERDA e Cachorro LABRE e depois escrevem besteira na internet.O cara do vídeo dissimulando um defeito na Urna Eletrônica é bem o tipo de você. Um Manipulador FRACASSADO.",0
,,,,,,,,UghH4Fexzbwbr3gCoAEC.8ARVhR_NLjp8MfwDBwj_1y,MrCarlosband,1 year ago,1497225048399,"Se você fizer isto, apenas estará dando seu voto para o vencedor. Votar Nulo ou em Branco é coisa de LEIGO, que não entende o processo eleitoral. 
Se você fez isto em 2014  e agora fica dizendo que não votou na Dilma, que ela não te representava, eu sinto muito te dizer, mas você a ajudou a vencer.  Foram mais de 20% entre nulos, brancos e abstenções,  e a diferença entre Dilma e Aécio foi de menos de 3%. 

Votar Nulo não é solução,  o ideal é escolher o que você achar MENOS PIOR na sua concepção.",0
,,,,,,,,UghH4Fexzbwbr3gCoAEC.8ARVhR_NLjp8MhkHvlc6Pb,Reginaldo Lucas - Pulga,1 year ago,1497225048404,"MrCarlosband Leigo é vc que acredita que voto nulo e branco vai pra quem ganha, vá pesquisar um pouco, mas pesquise direito e não em sites que defendem partido A ou B e mais leigo ainda é quem ainda acredita em qualquer partido, são todos farinhas do mesmo saco. As provas estão ai, Lula, Aécio cheirador e traficante, Alckmin, Serra e vários outros envolvidos em corrupção! Não babo ovo pra partidos de direita ou de esquerda, e pra sua informação eu não votei nas eleições pra presidente e nem pra prefeito e pretendo nunca mais pisar em uma seção eleitoral, não sou trouxa!",0
,,,,,,,,UghH4Fexzbwbr3gCoAEC.8ARVhR_NLjp8Mj8Kc1vd8c,MrCarlosband,1 year ago,1497225048411,"+Reginaldo Lucas - Pulga  kkkkkkkkkk eu que tenho que pesquisar?  kkkkk.. apaga ai que ainda dá tempo...

Eu fui mesário por 4 vezes ô mané... 
Não preciso pesquisar em site de partido nenhum. 
O voto que não conta e que pode anular uma eleição é o voto ANULÁVEL, aquele que você vota em um candidato que morreu durante as eleições ou que foi impedido de exercer seu mandato. 
É incrível como depois de tantas eleições ainda existe gente que não entende o sistema. 

Desenhado pra incauto entender....:

http://www.politize.com.br/votos-brancos-e-nulos/",0
,,,,,,,,UghH4Fexzbwbr3gCoAEC.8ARVhR_NLjp8Mj93T9WoAz,MrCarlosband,1 year ago,1497225048421,"+Reginaldo Lucas - Pulga   Tá ai outra pra você aprimorar seu entendimento...
Vou reproduzir aqui uma parte pra você entender:

""O voto em branco pode favorecer algum candidato?

Indiretamente, sim. Apesar do voto em branco não ir diretamente para nenhum candidato, quanto maior for o número de votos em branco ou nulos, menos votos válidos serão necessários para vencer a eleição. Isso pode gerar consequências na forma como a eleição será definida, se irá ou não para o 2º turno, por exemplo""

E desenhando de novo...  Se há 100 pessoas para votar e só 2 candidatos A e B. 

se, 50 votarem nulos ou brancos.
e 30 votarem no candidato A.
e 20 votarem no candidato B. 

O CANDIDATO A GANHARÁ AS ELEIÇÕES, mesmo tendo menos votos do que o total de nulos ou brancos. 

Sabe o que é mais engraçado disso tudo... É QUE VOCÊ PODIA PESQUISAR ANTES DE ME CHAMAR DE TOLO.




https://www.eleicoes2016.com.br/voto-em-branco-vai-para-algum-candidato/",0
,,,,,,,,UghH4Fexzbwbr3gCoAEC.8ARVhR_NLjp8hDBWlOpn-8,NOÉLITO ™,3 days ago,1528501848426,"DINHO SP. Calma cara, tá exaltado kkkk Hitler comunista de esquerda. Ideias totalmente de esquerda.",0
UggCaNKxPEy4DXgCoAEC,Vinicius Paiva,2 years ago,1465689047772,Esse trambolho não pega nada! O negócio mesmo é a nova urna com impressão digital! (Só falta adicionar o voto impresso nela pois todo o mundo tá fazendo isso!),0,false,0,,,,,,
Uggj1_6U5eCLNHgCoAEC,Aleslom Xd,2 years ago,1465689047779,Seria legal esse cara aperta o numero 4 uma vez só ^^ 1:03,0,false,0,,,,,,
UgheRABHw6qad3gCoAEC,Mayke Rocha,2 years ago,1465689047782,"Espero que esse cidadão aprenda a votar, definitivamente, até 2016. Apertar um botão mal intencionado pra simular fraude, é no mínimo, falta de caráter.

O cara pressiona o botão além do necessário e sai papagaiando que a urna tá fraudada. É pra acabar mesmo!",0,false,0,,,,,,
Ugjc_Q2Hra-xU3gCoAEC,Benites,2 years ago,1465689047786,"Eu também votei no Aécio e elegi a Dilma ¬¬""",2,false,0,,,,,,
UgjYlaPhH4hCs3gCoAEC,Guiks TV,2 years ago,1465689047791,kkkkk a urna n queria estragar são paulo amigo kkk,0,false,0,,,,,,
UgjKeUEHYvEGvXgCoAEC,Agnaldo Mesquita,3 years ago,1434066647797,cara eu também acho que a urna é uma fraude mas o que vc fez não tem nada a ver com fraude e sim com burrisse!,0,true,1,,,,,,
,,,,,,,,UgjKeUEHYvEGvXgCoAEC.7zITkUV1W-T86xCXOOPWhk,Marcelo Cunha,2 years ago,1465689048092,"+Agnaldo Mesquita Acusar os outros de ""burrisse"" é uma grande burrice!",0
UghG-TFTNhPe-3gCoAEC,Daniel santos,3 years ago,1434066647805,SEUS PETISTAS PAU MANDADO PESQUISEM SOBRE CONCLAVE DE WASHINTON E PAREM DE SER ALIENADOS ISSO TA NA CARA QUE E FRAUDE!!!!,2,false,0,,,,,,
Ugi8Cknwg6qj7XgCoAEC,Papagalis Renascencis,3 years ago,1434066647813,PORQUE APOIAMOS A INTERVENÇÃO DOS MILITARES  https://www.youtube.com/watch?v=n8L5IawoKiw,0,false,0,,,,,,
Ugho2nlE0D8_5HgCoAEC,Alexandro de Paula,3 years ago,1434066647818,"É CLARO QUE ELE APERTA A TECLA 4 DUAS VEZES SEGUIDAS E DEPOIS CORRIGE ... JÁ É DESCULPA DE PERDEDOR !!!!!
ELE ERRAVA DE PROPÓSITO !!!!!",2,false,0,,,,,,
UgiTx6ADSm7U9HgCoAEC,Zeca Destrói,3 years ago,1434066650077,"Denunciado... da próxima vez escreva o título do video assim:
CIDADÃO BURRO PRA CARALHO NÃO SABE DIGITAR O VOTO PRA PRESIDENTE.",9,true,1,,,,,,
,,,,,,,,UgiTx6ADSm7U9HgCoAEC.7-H0Z7-IkUR8UIDuTZ2bxR,E ZD,11 months ago,1499817050629,hiahauhauah,0
UghxkM5qL3o9zHgCoAEC,Sérgio Sumi,3 years ago,1434066650085,"Você vê o que quer ver. O cabra filma o seu voto, o que é proibido. Digita várias vezes o número dos candidatos a governador e presidente. Corrige e vota novamente. FIM. Onde esta a fraude?",2,false,0,,,,,,
UgjvvZ5LEiK8gXgCoAEC,Potew,3 years ago,1434066650095,"Por ser em SP, presumo que o botão 4 tenha sido apertado tantas vezes que até começou a dar defeito no final. Já o 1 e 3 deviam estar novinhos em folha!!",21,true,1,,,,,,
,,,,,,,,UgjvvZ5LEiK8gXgCoAEC.7-H0Z7--erk76TeNSqkSWq,Guiks TV,2 years ago,1465689050574,+Potew infelizmente pq o alckmin soh ta fudendo a poha toda,0
UgiL8uar5aYusXgCoAEC,RENATO xavier,3 years ago,1434066650104,Ele votou no Serra e na hora de votar no Geraldo travou...a urna tava com sede!,1,false,0,,,,,,
UgiqjYFkfup-y3gCoAEC,Gerson Dimarzio,3 years ago,1434066650110,"PERCEBERAM ?  O ELEITOR   ACIONOU  VARIAS VEZES E FOI COMPUTADOS COMO VOTOS  NULOS , ISSO  BENEFICIARA  A CANDIDATA . E AINDA QUEREM
DISCUTIR AS ELEIÇÕES ??? , FORA  AS URNAS  QUE  COMPUTAVAM VOTOS,
SOZINHAS !!!!  E O TAL DO TÓFOLI (CUPINCHA DO PT )  FOI COLOCADO COMO
CHEFE DO TSE ??  PUZ ERAM  O  GATO PRA  TOMAR  CONTA  DOS PEIXES.
E VAI FICAR  POR  ISSSO ????",5,true,1,,,,,,
,,,,,,,,UgiqjYFkfup-y3gCoAEC.7-H0Z7-IrBO7-YRLrldcQ9,Gerson Dimarzio,3 years ago,1434066650614,"que  autoridade é essa  dada  ao tal  de tófoli  de  impedir  a inspeção das  urnas, comprovadamente  programadas.Que
lei é éssa?  Um cupincha do crime  mandar  desse geito?
Não  temos  uma  autoridade  superior  para  se  impor ? vamos ter que  engolir   toda  esta  safadeza?  Já já  vamos
ter  Fidel Castro  no  alvorada  e  daí ??????",1
UgiJzMTk6gAvF3gCoAEC,canalha352,3 years ago,1434066650121,Palestrino. Vc é petista e como todo bom comunista não aceita que pra presidente ela tava com bug. Pelo menos o fato aceite.,2,false,0,,,,,,
UggajhA0fhyW1HgCoAEC,Palestrino Prudente,3 years ago,1434066650125,Era mal contato,1,false,0,,,,,,
Ugj4TevWx8CyangCoAEC,Palestrino Prudente,3 years ago,1434066650134,"oh meu Deus quanta burrice, nao tinha candidato a governador nem Presidente com o numero 44, por isso o voto foi considerado nulo. Entendeu, seus imbecis?",1,true,2,,,,,,
,,,,,,,,Ugj4TevWx8CyangCoAEC.7-H0Z7-Awg6706q-X5d-bF,Gabriel Martins,3 years ago,1434066650549,PUTA QUE PARIL NINGUÉM TA FALANDO DISSO PORRA!!!,2
,,,,,,,,Ugj4TevWx8CyangCoAEC.7-H0Z7-Awg671t9LlFPwLR,Potew,3 years ago,1434066650558,Tinha que ser PTralha...,3
Ugh9J2mF55YAcXgCoAEC,Daniel Alves,3 years ago,1434066650144,"Quando vota no corrupto, a urna da erro!",2,false,0,,,,,,
UghdiJIKD_96T3gCoAEC,Fernando Kaltenbach,3 years ago,1434066650153,SOU TESTEMUNHA DESTA FRAUDE!!!!! UMA SENHORA  URNA PASSOU PELO MESMA FRAUDE NA ELEIÇAO !!!! ELA CHAMOU O MESARIO POIS PERCEBEU QUE TINHA DIGITADO O NR ERRADO E ELE DISSE QUE IRIA CHAMAR O PESSOAL DE TI DE PLANTÃO. DEPOIS DE MIUITA ESPERA ELA DESISTIU DO VOTO E DEIXOU NULO! ISTO NÃO FOI UM CASO ISOLADO!!! EU PRESENCIEI,10,false,0,,,,,,
UghzedeLkmVlQHgCoAEC,Shemarlison Junior,3 years ago,1434066650158,"Retardado

Não sabe apertar um botão

lixo do caralho

fraude teu cu imundo",3,true,2,,,,,,
,,,,,,,,UghzedeLkmVlQHgCoAEC.7-H0Z7-TItw7Ain4PzDmGL,Victor Gil,2 years ago,1465689050594,+Shemarlison Junior Cara vc é muito ingênuo que acha que usar um computador da década de 80 é seguro para votar .,2
,,,,,,,,UghzedeLkmVlQHgCoAEC.7-H0Z7-TItw7EtSvtnoirm,Artur Gamer,2 years ago,1465689050597,alienado do governo!  só pode se petista,3
UgjEJMx4DMCF3XgCoAEC,Eu Adoro Dicas,3 years ago,1434066650168,olhem quantas pessoas reclamando no youtube: Fraude nas urnas - Eleições 2014 Fraude a favor da DILMA ( Eleições 2014 ) Fraude Eleitoral - Mais uma suspeita Denúncia grave! Urna eletrônica não aceita voto para presid BOMBA! VIDEO MOSTRA A FRAUDE NA URNA ELETRÔNICA! COMPARTILHEM! Denúncia grave! Urna eletrônica não aceita voto para presid urna eletronica jornal da band fraude nas eleições 2014 isso é revoltante.,0,false,0,,,,,,
UghaeP28PR1kVngCoAEC,kawan antonio machado,3 years ago,1434066650177,"dá pra ver...q ela ta com um ""lag""...mass aquele loading do final eu n curti muito não....",2,false,0,,,,,,
UghXyjq-yd0D6ngCoAEC,wetto,3 years ago,1434066650181,"Isso é um problema comum em eletrônicos, o switch (mecânismo responsável pelo funcionamento do botão) da tecla 4 estava apresentando falhas, tanto que ocorre não apenas no caso do presidente, mas também no caso do governador. Ele não apenas dá o famoso ""duplo-clique"", mas também falhou completamente algumas vezes, ao ponto de não ser registrado.

Problemas similares podem ser vistos em mouses, teclados de caixas eletrônicos, eletrodomésticos, enfim, não é nada anormal (e antes que venham me chamar de PTralha ou algo por tentar defender a urna, eu não votei em nenhum candidato do partido).

Mas enfim, independente a razão da falha, ter filmado na urna eletrônica é um crime e eu iria sugerir retirar este vídeo pelo seu próprio bem, antes que ele seja denunciado ou que autoridades descubram ele.",0,false,0,,,,,,
UgiqxAi-Ih9Jg3gCoAEC,Victor Perszel,3 years ago,1434066650190,"AHSUAHSUAHS olha, a urna deu várias chances pra você não votar no PSDB e você vai lá e diz que ela tá com defeito haha",0,false,0,,,,,,
UggXZuovvGZL_XgCoAEC,Ricardo Barbosa,3 years ago,1434066650200,Pareceu mal contato no botão 4.,9,true,8,,,,,,
,,,,,,,,UggXZuovvGZL_XgCoAEC.7-H0Z7-IDNg7-fFVzoamJM,Antonio Pereira,3 years ago,1434066650748,"É incoerente chamar-se de democracia e ser obrigado a votar.
É um absurdo tentar convencer o povo de que a urna eletrônica é segura e que o TSE é idôneo,se não sai nada impresso que possa servir de prova que o voto de fato foi para quem se quis eleger.",1
,,,,,,,,UggXZuovvGZL_XgCoAEC.7-H0Z7-IDNg7-the1VdAyn,IagoBans,3 years ago,1434066650755,"mal contato sim, UHAEUHAEHAUHEAHE ou você é muito burro ou muito inocente.",0
