id,user,date,timestamp,commentText,likes,hasReplies,numberOfReplies,replies.id,replies.user,replies.date,replies.timestamp,replies.commentText,replies.likes
UgzPuMQB2xM9h08UJ5N4AaABAg,Fabio Ferreira,4 months ago,1518395860687,"A história se repetindo, 31 de março de 1964 “Intervenção militar no Brasil’ para a esquerda, suja e porca “Ditadura Militar”
O povo vai às ruas e pede a intervenção militar, assim foi  feito.
Hoje vivemos em um país de “Direita e Esquerda “  ,  como ocorreu até 31 de março de 1964. https://www.youtube.com/watch?v=540RltdZZPY 
A história esta se repetindo com bilhões de reais  soado de seu povo, sendo roubado, investido em Usinas, Estradas, Metros, Barragens, Siderúrgicas, Gasodutos, Refinarias  entre outras obras que ainda não foram descobertas em outros países como Equador, Chile, Colômbia, Venezuela.  Em 13 anos de governo dos esquerdistas,  bilhões de reais em obras nacionais superfaturadas, por políticos escolhidos por NÒS. Acorda Brasil! Nestas eleições devemos exigir “o voto impresso ao lado das urnas” com a fiscalização do exercito brasileiro, eu votarei em um homem, patriota, pai, esposo, honesto e religioso. Pesquise e tire suas conclusões, Jair Messias Bolsonaro, ele não se candidatou, ele foi escolhido pelo povo, pela sua trajetória política, sempre em defesa dos seus compatriotas, sendo um entre poucos no Congresso Nacional do Brasil, que respeita o seu país.
Vamos refletir um pouco¿
O que eu quero para o meu país¿ Eu quero que sejamos mais unidos, possamos respeitar nossas leis, nossas diferenças de sexo, cor, raça, religião e possamos viver em um país próspero, com impostos mais justos para nosso crescimento e desenvolvimento agrícola, pecuário, industrial, científico, turístico e histórico. E você, o que quer para seu País¿
Somos um povo forte e com uma terra rica, devemos ser mais patriotas com nosso país, nossa pátria tão respeitada e amada por estrangeiros, e nós, pouco fazemos por ela. Ame sua pátria respeite sua bandeira, pendure em sua janela, muros ou telhados uma bandeira de seu país.
Diga, Sou brasileiro, quero minha liberdade, quero um país com segurança, quero ter o poder de defender meu patrimônio, minha família e ao meu próximo, e que a justiça fique do meu lado e não contra mim, quero que os bandidos sejam punidos e cumpram 100% de sua sentença, em regime fechado, que todos tenhamos direitos iguais por mérito e não com divisores da sociedade (cotistas), que tenhamos escolas militarizadas em todos os bairros de baixa renda do país, https://www.youtube.com/watch?v=uRK29hwTVEU e que todos tenham pelo menos direito a uma educação básica no país, uma vaga garantida na  faculdade indiferente de cor, raça ou  sexo,que  seja  igual para todos, e  que nós juntos, com o nosso presidente possamos conquistar muito mais.
Este ano, vemos todos juntos para as ruas, no dia 31 de março de 2018 as 08:00 horas, no mesmo dia em que ocorreu a intervenção em 31 de março de 1964. Você empresário, ferido por tantos impostos e agora o governo querendo administrar a sua empresa, junte se a nós não abra a sua empresa,  traga seus funcionários familiares, e vamos exigir que os militares intervenham , “INTERVENÇÃO MILITAR JÁ” e assumam o nosso governo e faça cumprir a nossa constituição, “General Pujol defende a fala do General Mourão diz” https://www.youtube.com/watch?v=E9RgAumZsjI e assim colocando na cadeia todos os corruptos que se encontram hoje no poder, “ELEITOS POR NÓS” usando do nosso dinheiro para se reelegerem  e aprovarem leis que vão contra a nossa constituição de 1988 http://www.amperj.org.br/store/legislacao/constituicao/crfb.pdf e atual constituição http://www.stf.jus.br/arquivo/cms/legislacaoConstituicao/anexo/CF.pdf não é, nenhum dos três poderes que esta pedindo, mais sim o comando maior, o povo brasileiro. CONVOCO MEU POVO PARA  IRMOS AS RUAS NESTA DATA E JUNTOS SEM MEDO EXIGIRMOS O COMANDO MILITAR DO BRASIL UMA INTERVENÇÃO.
Fabio Alexandre Nunes Ferreira  - Brasileiro – Patriota Pai, Esposo e Religioso – Por um país com mais igualdade, justiça e prosperidade. 
Copie e Compartilhe urgente, pendure na frente de sua casa a bandeira do Brasil e compartilhe para os compatriotas, amigos e familiares, não se esconda, agora você é um soldado do Brasil e essa bandeira dará sentido aos militares para agirem.
Brasil um país para todos os brasileiros!
Alguns vídeos para vocês analisarem em que pais querem viver. 
https://www.youtube.com/watch?v=t8BNR-w5pLE 
https://www.youtube.com/watch?v=zu6WekbV7Xw  Este vídeo traz a verdade,  e você não vai acreditar, mais é a pura verdade ,eles querem que constem  em nossa constituição.
https://www.youtube.com/watch?v=6iF36QNTT4Q 
Participe como eu, cadastre se e faça parte deste grupo de brasileiros que apóia um pais livre de corrupção 
http://www.brasilnasruas.com.br/quemsomos/",0,false,0,,,,,,
Ugy4bns9Qw9_lAQNA5B4AaABAg,Guto Lima,4 months ago,1518395860694,"smartmatic que elegeu maduro, e uns outros animais aí, foi proibida nos EUA e outros paises por causa de fraude.",5,false,0,,,,,,
UgwFYit1yvfYka-1TRB4AaABAg,Rodrigo Z,4 months ago,1518395860701,"Pessoalzinho : Viva Bolsonaro , Voto Impresso , 2018 é o ano da mudança...

Vão a merda ! Não sei nem se quem diz isso acredita no que ta  falando . Se realmente quisessem mudar algo , mudariam , não esperaria por alguém fazer por você . Quer voto impresso , impõe isso Caralho , quem faz a merda de um país não é uma pessoa . Tem medo de entrar em um confronto e morrer ? Então pare de falar merda na internet !

Querem falar de esquerdista . Mas quando um filho da puta apontar uma arma na tua cabeça , tu vai ser o senhor capitalista , ou vai virar socialista e dividir o que você trabalhou para conseguir com quem não fez nada , como se o socialismo significasse isso ...

A mas eu sou a favor do porte de arma . Então enquanto isso não acontece , você pode virar socialista as vezes , quando é necessário...

Dai dizem : --Você é socialista ? Então porque Ta com um Iphone novo , pq tem carro , me empresta ?
Você quer que o outro viva o socialismo por ser socialista , mesmo num capitalismo . Mas não quer ser capitalista quando , causaria mal a você ...

Esse é o problema das pessoas , só pensam nelas , por isso o Brasil ainda é um cachorro de uns países .

Ai os EUA são um pais de primeiro mundo .

Poise , quem Ta no comando la sabe como jogar , porque as pessoas que vivem lá são as mesmas daqui . Se você é escravo , você aprende a ser isso ...

E não , não é a maioria das pessoas do mundo que são boas . 
Ser covarde não é ser bom !

As pessoas vão continuar como estão , dando valor a coisas que não valem nada ...

Descartando poucas exceções , isso é o que são as pessoas , uns mais espertos , outros menos .",0,false,0,,,,,,
Ugwp0l_F2dVw4PlBUBh4AaABAg,Mundo da Gabi e do Miguel Gabi muniz e Miguel Sávio,4 months ago,1518395860707,Mas a Raquel deu parecer contra que se deve fazer?,2,false,0,,,,,,
Ugw5RJpgkRL00EcD_CR4AaABAg,Hospital Instituto Mineiro de Obesidade,4 months ago,1518395860712,"O voto tinha de voltar a ser de cedula comum, nada de voto impresso, isso só gera um custo absurdo para poupar poucos dias de apuração, um gasto completamente injustificável. Papel e caneta é a melhor resposta, é assim que os paises mais desenvolvidos fazem.",0,false,0,,,,,,
UgzQ8__x-9I91FrjgA14AaABAg,Oswaldo La Marck,4 months ago,1518395860719,"É DURO TER QUE CONTAR COM O OVO ANTES DA GALINHA BOTAR. OS FDP NÃO VÃO ABRIR MÃO DA URNA ELETRONICA, É O ÚNICO TRUNFO QUE ELES TEM PARA CONTINUAR NO PODER E AINDA ESTÃO NO PODER. DEU PARA ENTENDER ?????",0,false,0,,,,,,
UgyK3Z5NttHfCzGAtw14AaABAg,Julio Cesar Rocha Dos Santos,4 months ago,1518395860726,Bolsonaro 2018,0,false,0,,,,,,
UgwiIn5G8pJj0mNa7R94AaABAg,Fredy,4 months ago,1518395860731,"FIM DAS URNAS JÁ! !!!!
BOLSONARO 2018",0,false,0,,,,,,
UgwU_DZNAp1xUWyzz014AaABAg,andicreti,4 months ago,1518395860737,"Estou dizendo algo.....vamos ter voto no papel e caneta, Bolsonaro vai ganhar e fara a intervenção com o exército.....isto já esta combinado",0,false,0,,,,,,
UgwUiE2M2pG8QaPxFl94AaABAg,Jorge Ogata,4 months ago,1518395860744,pega essa  porcaria  e  da  pra  criancada  rincar  q  e  mais util,0,false,0,,,,,,
UgxA93xR2xlG15Jv9Ht4AaABAg,Raul Marlyson,4 months ago,1518395860748,Essa música de entrada do Slipknot ficou foda 😍,0,false,0,,,,,,
UgxKc2C73YuFRdWnWJZ4AaABAg,Paulo Roberto Duarte,4 months ago,1518395860755,"Meu Deus!!! E aonde estão nossas Autoridades Militares??? Está ""cristalino"" que as eleições vem sendo fraudadas!!! Intervenção Militar Constitucional Já!!!",0,false,0,,,,,,
UgxKZtLcHZSysygLyIl4AaABAg,AIRTON JUNIOR,4 months ago,1518395860764,BOLSONARO neles. Se DEUS permitir meu voto sera dele o MITO 2018.,0,false,0,,,,,,
UgzLIZkRPK8PF_gmx1t4AaABAg,Zero The Hunter,4 months ago,1518395860770,"Que merda de canal, transformar um político em um meme, fazer edições toscas, quanta palhaçada, deve ser adolescente, parece até que gostam de ser chamados de bolsominion",0,false,0,,,,,,
UgxWMFAmWUSoIf8GKQ14AaABAg,webert Antunes de Siqueira,4 months ago,1518395860778,o que eu acho engraçado que países de primeiro mundo ñ usam essas porcarias de urnas  se fosse tão boa o EUA e tantos outros países ricos usariam,0,false,0,,,,,,
UgxSL3IfWNqzrkxCwjN4AaABAg,Quem não chora não come,4 months ago,1518395860783,"Isso não procede, seria bom se fosse verdade",0,false,0,,,,,,
UgwgvJULeJfr-wGfUO14AaABAg,Saullo Souza,4 months ago,1518395861630,Levou deslike por torcer a informação!!! Acorda povo!,0,false,0,,,,,,
UgyutvX74ZABD2DVZ6J4AaABAg,silvio gomes,4 months ago,1518395861639,"Fomos enganados nas eleições passadas, cambada de f.d.p., por isso estes canalhas não saem do comando.",0,false,0,,,,,,
Ugz8RVI0hkoa6Nkz72d4AaABAg,Albano Junior,4 months ago,1518395861642,"ACORDA BRASIL ! A eleição deve ser no papel, na urna convencional !  Nenhum outro tipo de tecnologia ou empresa pode garantir a legalidade do voto.",0,false,0,,,,,,
UgwYNsJfAgCeH4GbwKZ4AaABAg,Brasil Limpo,4 months ago,1518395861651,Hino Nacional .....,0,false,0,,,,,,
UgzWviHtHIwJKD4tpg14AaABAg,Giovani Lima,4 months ago,1518395861655,"Nada a ver falar q urnas eletrônica vai ser proibida, a única coisa q mudou foi a empresa q vai administrar a apuração. Ainda vai ter urna eletrônica",0,false,0,,,,,,
Ugw9seMaMzi2kCbIGnd4AaABAg,Rosangela Rodrigues,4 months ago,1518395861664,Meu Deus que noticia abençoada🙏👏bolsonaro 2018,0,false,0,,,,,,
Ugw-5Y9incup_im1dvl4AaABAg,Fedora,4 months ago,1518395861671,"Só esperando o Brasil virar uma potência, rsrs.",0,false,0,,,,,,
UgzkChAel3WUzpuqddZ4AaABAg,Hercules Reis,4 months ago,1518395861676,"Parabéns para todos nós, que as eleições  sejam em cedulas",0,false,0,,,,,,
UgyuFA3sTGeqo-3lcgx4AaABAg,Adriano Maciel,4 months ago,1518395861684,Fake news.,0,false,0,,,,,,
Ugz5gxsR_XB2QW9t_Z54AaABAg,Plenitude da Palavra,4 months ago,1518395861690,#Bolsonaro17PRESIDENTE,0,false,0,,,,,,
UgwL3D4SOIdMZ6XoaQZ4AaABAg,RIKO,4 months ago,1518395861699,"o povo quer no papel e o tse quer urna eletrônica, qual a vontade que tem quer ser cumprida do povo que quer uma urna auditável, ou o tse que quer uma urna duvidosa?
Que país é esse?",0,false,0,,,,,,
Ugw3xJOqSr8TSN5K-V54AaABAg,Emilio 4Games,4 months ago,1518395861710,"Esse negócio tá complicado, tão querendo barrar isso..até agora não é nada certo, tomara  que conseguimos votos impressos",0,false,0,,,,,,
UgwBUtyH70SSU_EbXbx4AaABAg,WELLINGTON GOMES CARDOSO,4 months ago,1518395861721,"se for verdade o pt está extinto,não vamos mais ser enganados por um bando de corjas comumistas que só querem implantar a pobreza eo caos no pais,más o meu sonho maior é a intervenção militar e sonho por esse dia prq que eu possa ver cada um desses criminosos travestidos de políticos na cadeia avante brasil o niobio é nosso.",0,false,0,,,,,,
Ugx3i4unN26pF1XIJ4p4AaABAg,Paulo JZ,4 months ago,1518395861731,Dr Ray presidente 2018 tmj,0,false,0,,,,,,
UgxrNp7UKX6OEV4m7KN4AaABAg,J Cesar Ribas F,4 months ago,1518395861738,SE PREPAREM VAMOS PARA A RUA EXIGIR O VOTO IMPRESSO 👏👏👏👏👏👏👏👏👏👏👏. ASSISTA ATÉ O FIM REPASSE. VAMOS NOS ORGANIZAR... A PRIMEIRA MEGA MANIFESTAÇÃO SERÁ DIA 31 DE MARÇO... EM APOIO A PRISÃO DO LULA. .. A LAVA JATO... PELO VOTO IMPRESSO ... POR ORDEM E PROGRESSO ... ENDURECIMENTO DO CÓDIGO PENAL. .. QUEM FOR PRESO PORTANTO ARMA DE GUERRA TEM QUE FICAR PRESO NO MÍNIMO 10 ANOS PORQUE MATOU OU IRIA MATAR E SÓ NÃO MATOU PORQUE FOI IMPEDIDO. PELO FIM DO FORO PRIVILEGIADO E A IMPUNIDADE GERAL***,0,false,0,,,,,,
UgzelN5Ach5-2mdLczR4AaABAg,você leu ?então comi seu cu!,4 months ago,1518395861746,o pipapaparapo no começo tava melhor,0,false,0,,,,,,
UgzuRcwnItvqGXYHmlh4AaABAg,Maykoum Winchester,4 months ago,1518395861751,Agora tiro na bunda de bandido já está garantido !,1,false,0,,,,,,
Ugy4bsyiLgPk8AKAUjZ4AaABAg,Sergio Henrrique,4 months ago,1518395861759,Vamos todos com Bolsonaro galera,0,false,0,,,,,,
UgxJkalaPLW1qPSOu3Z4AaABAg,lara Br,4 months ago,1518395861767,Graças a Deus!! assim as coisa vão andar. O Brasil será novo Brasil em 2018,0,false,0,,,,,,
UgyqSpDZ50lvdDehSlB4AaABAg,Top Filmes,4 months ago,1518395861794,nao estou acreditando ainda nisso!surreal,0,false,0,,,,,,
UgwThx8PAcj3fRsFxOF4AaABAg,filho do pai,4 months ago,1518395862635,Esse mito já tem meu voto :) e a de vocês !!!,4,false,0,,,,,,
UgzCJqNG1pmlLCyYOJx4AaABAg,Mario C.F.,4 months ago,1518395862644,"É golpe!!!!...; Eles vão trocar a SmarthMatic!!!...; Vai ser descartada sim!!...; Por uma empresa pior que ela, com urnas ainda mais fraudáveis!!!....,e em colúio com o TSE e as forças esquerdistas...",0,false,0,,,,,,
Ugz4SInQ9VIlGJkjTx54AaABAg,Rsus 741,4 months ago,1518395862654,É  a mão  de Deus ...só   pode  !,0,false,0,,,,,,
Ugz_DqJ_F6RFlDX5V1B4AaABAg,Cidadão De Bem,4 months ago,1518395862658,#Bolsonaro2018,12,true,1,,,,,,
,,,,,,,,Ugz_DqJ_F6RFlDX5V1B4AaABAg.8cM5dvqtUu48cMyuMP_pcr,Marcos Amorim,4 months ago,1518395863098,"NÃO AS FRAUDULENTAS URNAS ELETRÔNICAS!!!
Após assinar vc receberá um email para validar a assinatura, só então será validada!
http://www.peticaopublica.com.br/pview.aspx?pi=BR103801

Fim do foro previlegiado!!!
https://secure.avaaz.org/campaign/po/brasil_foro_privilegiado_loc/?copy",1
UgwAuY-7XysD4ku1FXR4AaABAg,Cidadão De Bem,4 months ago,1518395862668,Tamo junto Bolsonaro,13,true,2,,,,,,
,,,,,,,,UgwAuY-7XysD4ku1FXR4AaABAg.8cM5a3lKSMv8cMzOhy-Wn-,Marcos Amorim,4 months ago,1518395863114,"NÃO AS FRAUDULENTAS URNAS ELETRÔNICAS!!!
Após assinar vc receberá um email para validar a assinatura, só então será validada!
http://www.peticaopublica.com.br/pview.aspx?pi=BR103801

Fim do foro previlegiado!!!
https://secure.avaaz.org/campaign/po/brasil_foro_privilegiado_loc/?copy",0
,,,,,,,,UgwAuY-7XysD4ku1FXR4AaABAg.8cM5a3lKSMv8drr-4dkUdo,Marcos Amorim,2 months ago,1523493463120,"Se for por Urna eletrônica não votarei, simples assim!",0
Ugy_MOIjU7DhnXro51F4AaABAg,Junior,4 months ago,1518395862679,"Imagine o quão sujo são esses caras!!!!
O Aécio sabe que pode ter perdido pra Dilma por fraude e enfiou o rabinho no meio das pernas
Imagine a sujeirada desses caras!",0,false,0,,,,,,
UgzCCElx5oU13O6-Bbx4AaABAg,Junior,4 months ago,1518395862691,Se essa urna fosse confiável país de primeiro mundo estaria usando!,0,true,1,,,,,,
,,,,,,,,UgzCCElx5oU13O6-Bbx4AaABAg.8cM5N4snWG28cMvGq9B-pu,davideliasantos,4 months ago,1518395863160,Tomem cuidado pois pode ser uma trama do STE.  É possível que estejam fazendo uma manobra para dar um cala a boca no povo. Não esqueçam que a política não é transparente e o que ela divulga ao público nem sempre é a verdade.,0
UgxNYbbdVHzxjc6aXRJ4AaABAg,Kemerson Machado,4 months ago,1518395862702,"as eleições presidenciais desse ano promete muito, vai ser épicamente épico #bolsonaro 2018",0,false,0,,,,,,
Ugw3DJatLSgYez679b54AaABAg,Stricker,4 months ago,1518395862706,"Eu não duvido nada q ainda é capaz do Bolsonaro perder na vdd tá até meio na cara pois esses fdputas ai sempre tão por traz de tudo e as urnas vão continuar sendo eletrônicas provavelmente.. Mas c Bolsonaro perder n vai ficar igual tá hj pelo menos, vai ter mta MTA treta contra o governo..",0,false,0,,,,,,
Ugxmkx7JN2ilFFp_z3x4AaABAg,Flávia SuperIdéiasBR,4 months ago,1518395862713,#BOLSONAROPRESIDENTE2018,8,false,0,,,,,,
Ugzix-awJadH2I52EAF4AaABAg,ps2maniax,4 months ago,1518395862718,"Segundo o filho da puta comunista ""não importa que vota e sim quem conta os votos"". Contagem pública de votos.",4,false,0,,,,,,
UgzDyuJ8uK3k458czkl4AaABAg,Brandão,4 months ago,1518395862725,Será mesmo ? quero muito que isso aconteça pro Brasil. Chega de falcatrua. Mais ainda acho difícil que isso aconteça.,0,false,0,,,,,,
UgwwNpK6SgQ_YHgffKB4AaABAg,Diogo Santos,4 months ago,1518395862730,estamos ganhados,0,false,0,,,,,,
UgwAHlje2klKxN_lDER4AaABAg,Diogo Santos,4 months ago,1518395862738,yeeeeeeeee porra isso,0,false,0,,,,,,
Ugwcu2mMLDdMfClqpzV4AaABAg,Samanais Games,4 months ago,1518395862749,Começo da renovação #BOLSONAROPRESIDENTE,5,false,0,,,,,,
Ugzmg3tVHinmbDMRoGV4AaABAg,Vossa Letra,4 months ago,1518395862753,https://youtu.be/RM2cIpf0Mhg,1,false,0,,,,,,
UgwAY0fehsKbJP7V8iB4AaABAg,Bruno Soares,4 months ago,1518395862761,"vamos nos acautelar,o inimigo sempre prepara das suas armadilhas,nao comemorem ainda..",0,false,0,,,,,,
UgzCSO_Z5TAnqchhwYt4AaABAg,Bruno Soares,4 months ago,1518395862768,"se isso ocorrer creio q Bolsonaro tera enorme chance de vencer,pois veremos de uma ves por todas q as urnas eram e sao fraudadas,beneficiando quem o sistema era programado a comcuputar os votos...",0,false,0,,,,,,
Ugz2LIN4D4lscVmKkQB4AaABAg,Alex Nascimento,4 months ago,1518395862775,Vou ter o prazer de dizer que não usei essas urnas nojentas em toda minha vida kkkkkkk,0,false,0,,,,,,
UgwG8HZgxlgIQIANKVN4AaABAg,Gordo,4 months ago,1518395862782,É JAIR BOLSONARO NA CABEÇA......AHAHAHAHAHA   ''' O MITO ESTA CHEGANDO '''',0,false,0,,,,,,
UgxMfJveoLneAB9vPP14AaABAg,Edmar Santos,4 months ago,1518395864108,Lembro bem nas eleições passadas quando o eleitor votava em aecio aparecia o nome da Dilma. urna  eletrônica é uma fraude.  Só para ter uma idéia os hacks conseguem invadir um sistema financeiro de um banco ultra seguro .imaginem uma urna que geralmente dão defeitos. ..,0,false,0,,,,,,
UgzAZWf1hcP_2HLT-tN4AaABAg,Berg Teixeira,4 months ago,1518395864114,"ESSA URNA É UMA FRAUDE. JÁ TINHA DESCONFIANÇA DELA, TRABALHEI DE FISCAL UMA VEZ E TIVE MUITAS DÚVIDAS SOBRE ESSA URNA ELETRÔNICA SABIA MEU POVO. VAMOS ABRIR NOSSOS OLHOS!",0,false,0,,,,,,
UgzPoY07a88Q3iQ8Vpp4AaABAg,Paulo Mesquita,4 months ago,1518395864120,"Para ser fiscal, tem que ser técnico em programação, não adianta mudar o nome da urna ou empresa, tem que ser voto no papel",0,false,0,,,,,,
Ugx_S3s1GXOm0yrLx_14AaABAg,Paulo Mesquita,4 months ago,1518395864126,Qual proxima urna eletrônica virá? A Dumb Matic?,0,false,0,,,,,,
UgzEqp56cb3b4vstmTx4AaABAg,Daniell Gomes,4 months ago,1518395864130,Graças a Deus!!!!!!,0,false,0,,,,,,
UgynSe6_K9bTzW5tLmt4AaABAg,Victor Freitas,4 months ago,1518395864139,Finalmente,0,false,0,,,,,,
Ugy3LCFeWLUaO5IGvYJ4AaABAg,Victor Freitas,4 months ago,1518395864147,Ooooooooooooooooooooooooooooooooooooooooooooooooooooooooooooooooooooooooooooooooooooooooooooooooooooooh,0,false,0,,,,,,
UgyL-1CHbWD7N5NuZxh4AaABAg,Kelly Gomes,4 months ago,1518395864152,glórias a Deus,0,false,0,,,,,,
UgwTvZ5zoBccOwOcAnp4AaABAg,Michael Prieto,4 months ago,1518395864161,Juntos somos invenciveis,0,false,0,,,,,,
UgwaA4cGFEy3QS5LKs14AaABAg,Jhoanes Oliveira,4 months ago,1518395864164,Graças a Deus isso é uma notícia maravilhosa,0,false,0,,,,,,
Ugyl2z7Zp33cQiwmtjV4AaABAg,jair Bolsonaro,4 months ago,1518395864174,#mito2018caralho 😎,0,false,0,,,,,,
UgwvGnaVWhjuyzoB0sV4AaABAg,Douglas camargo camargo,4 months ago,1518395864183,"MENOS ESTADO, MAIS CIDADAO COM ECONOMIA LIBERAL...FORA COMUNISMO E SOCIALISTA FABIANO..TCHAU AÉCIO,LULA E FHC",0,false,0,,,,,,
Ugx3qnkTSJHWUd2Tk4B4AaABAg,Douglas camargo camargo,4 months ago,1518395864189,"fora urnas comunas... acabou para a esquerda...fora lula,Aécio,Dilma,FHC E TODA CORJA ESQUERDISTA DE ARAQUE..",0,false,0,,,,,,
UgxIWFsyB3gWzatSlu54AaABAg,Vinícius Jeremias Cavalheiro dos Santos,4 months ago,1518395864198,"Primeiro que não tem como proibir as urnas eletrônicas pra essa eleição,  pois existe uma lei que determina que a votação é eletrônica. Mesmo que mudassem a lei, pra essa eleição não valeria, pois teriam que alterar em outubro do ano passado (um ano antes).
Segundo que a empresa reprovada vai fornecer as impressoras que vão acopladas às urnas eletrônicas. 
Então o voto vai ser na urna eletrônica, mas o eleitor poderá conferir pelo visor da impressora se o voto que foi impresso corresponde com aquele que ele registrou na urna.
No mais, salvo em caso de auditoria, o voto e a apuração das eleições serão realizados da mesma forma.",0,false,0,,,,,,
UgzPFxlk8kfUocT4TQV4AaABAg,Tiago Martins Bandeira,4 months ago,1518395864204,Bom vomos ter a chance de mudar o Brasil Duma ves bolsonaro neles .estás urnas o PT ia roba direto e reto,0,false,0,,,,,,
UgzFUF56e0VMKREOMfd4AaABAg,SrCabalo,4 months ago,1518395864210,"16 esse ano , partiu votar Bolsonabo :P :3",0,false,0,,,,,,
UgyX7by7V7VwJ_1296d4AaABAg,Maria Aparecida Caldas Ferreira,4 months ago,1518395864219,Parabéns  também  para os desembargadores do TRF4.,0,false,0,,,,,,
UgwQiL67CaiXZKg8yDZ4AaABAg,Don Juan by Venezuela,4 months ago,1518395864223,Eduardo Jorge 2018,0,false,0,,,,,,
Ugw4O2A9r_UV-XMLDEh4AaABAg,#Bolsonaro2018,4 months ago,1518395864231,A opening anterior é bem melhor que a atual :/,0,false,0,,,,,,
UgwvBZfpHVsurd3W56N4AaABAg,Sergio Leandro,4 months ago,1518395864235,"Estamos sendo enganados de novo,pois o povo estava revoltado com as urnas fraudulentas da smartmatic,solução    dizer que as maquinas da Smatmatic não presta e usar uma empresa em nome de laranja ou vcs acham que eles não tinham um plano B,c,d...,Essas empresas já foram abertas a tempos só esperando dar ruim pra elas agirem,voto tem que ser na caixa com numero de rg,assinatura,e digitam como carimbo ai eu até desconfio menos o resto é fraude .",0,false,0,,,,,,
UgyiEC-hBDsarI0Atb14AaABAg,Aldo Rocha,4 months ago,1518395865265,Bolsonaro Presidente 2018,0,false,0,,,,,,
Ugxq6nE3OcIl7oxHS_l4AaABAg,Alexsandro rocha,4 months ago,1518395865275,"Que Deus ajude Bolsonaro a vencer essa eleição , e que nós brasileiros possamos ter mais ar de esperança em um Brasil melhor!",0,false,0,,,,,,
UgzswiWa3Vo3dYHlK754AaABAg,luzinaldo valentim,4 months ago,1518395865283,Estou feliz por isso👍,0,false,0,,,,,,
Ugwr7efhkY13sFaB83l4AaABAg,Washington Pereira,4 months ago,1518395865287,"Até q enfim Boa notícia...
Vamos Lutar patriotas, contra um Brasil comunista...",3,false,0,,,,,,
UgybXpaALPgAvrFEoJx4AaABAg,Sergio Leandro,4 months ago,1518395865296,"Quanto custa uma caixa de papelão era mt melhor antes se essa bosta prestasse  tinha no Japão e nos EUA,isso serve pra superfaturar e fraudar eleições,voto impresso uma bosta nenhuma quero é marcar um (x) e assinar meu nome isso sim seria o justo.",0,false,0,,,,,,
UgybKB-3Ll3LBptY47x4AaABAg,Mestre Ip,4 months ago,1518395865302,#Lula2018,0,true,1,,,,,,
,,,,,,,,UgybKB-3Ll3LBptY47x4AaABAg.8cLmbBwVr3K8cLodZy0mJ9,Mestre Ip,4 months ago,1518395865774,"Cabo Mantena me desculpa, mas não pedi sua opinião arrombado!",0
Ugx7TTk64fykO1jgEUZ4AaABAg,Selma Regina,4 months ago,1518395865312,"Bonzinhos a outra empresa também tem fraude...Esquecam ....
Voto impresso é outra fraude.  
O voto tem que ser manual....",0,false,0,,,,,,
UgxbcwggjtDFK8weSYx4AaABAg,Marcello Silva,4 months ago,1518395865321,👏👏👏👏👏👏👏,0,false,0,,,,,,
UgzQ5IkuScEiuiywNFx4AaABAg,Maya Magliano,4 months ago,1518395865331,MEU DEEEEEEUUUUUSSSS!!!!! Agora assim!!!!!,0,false,0,,,,,,
UgyGlRP1Cfmf9xQ-fu14AaABAg,Vander Son,4 months ago,1518395865334,Mas que otima noticia..BOLSONARO 2018,0,false,0,,,,,,
UgwwQdAQ_xDYhr6nCKF4AaABAg,Erick zakovsky,4 months ago,1518395865343,Next president of Brasil 2018? Like,0,false,0,,,,,,
UgxF3ZORlb_30eh0Bsl4AaABAg,Anderson Gameplay,4 months ago,1518395865349,"Eu com 13 já quero vê Bolsonaro eleito, e se eu pudesse votar nele já tinha votado mil vezes",0,false,0,,,,,,
UgySvvxTWJzME17GYzx4AaABAg,3GP PROJECT 8,4 months ago,1518395865356,eu já sabia o heneias tava certo.,0,false,0,,,,,,
UgzxUqpVjN9nyqzTKU94AaABAg,Wiliam Santana,4 months ago,1518395865362,"É necessário primeiramente saber, se a parlamentar, conhece a terminologia americana: ""voto impresso"", pois, ou a mesma desconhece completamente, ou está tentando vender uma mentira rodeada de verdades ñ tão verdadeiras assim. Como é parlamentar, quem é q vai ter as caras de explicar: O que sucinta e verdadeiramente é, o voto impresso, inclusive com o ritual do eleitor, desde o momento de chegada no curral eleitoral, ate a saida do mesmo, com o nome dos novos documentos, que o mesmo vai levar, saindo dali. Quem vai explicar ?!!!",0,false,0,,,,,,
UgxDb9z44jfddW0-k6B4AaABAg,ted ferreira,4 months ago,1518395865367,Hoo Glória!,0,false,0,,,,,,
UgyrgYIkkPZVk4XujJJ4AaABAg,Vando Silva,4 months ago,1518395865374,Bolsonaro chegou para arrumar essa zona que está o nosso país,0,false,0,,,,,,
UgyGrzqhyzGD3BTg39l4AaABAg,Diego Sniper Lopes,4 months ago,1518395865379,Hurra... Vamos em frente.,0,false,0,,,,,,
UgyM2Kt1RYpSVT9JAUl4AaABAg,Wilson gilberto juventino da silva,4 months ago,1518395865387,"QUALQUER ELEIÇÃO COM ESSAS MÁQUINAS FRAUDAVEIS DA SMARTMATIC NÃO É CONFIÁVEL , É FRAUDE COM CERTEZA!!",0,false,0,,,,,,
