id,user,date,timestamp,commentText,likes,hasReplies,numberOfReplies,replies.id,replies.user,replies.date,replies.timestamp,replies.commentText,replies.likes
UgyKDGCVGMbyYOVaHYp4AaABAg,Alex Cristiano,1 day ago,1528678412808,Sempre tiver a certeza que estas urnas são umas fraudes. Jair bolsonaro presidente 22018.Mesmo sem voto impresso.,1,false,0,,,,,,
UgwlEDJg75N7f26WvNd4AaABAg,Patrick Oberholzer,1 month ago,1526086412815,"O voto obrigatório e a urna eletrônica são jaboticabas inventadas por agentes/servidores públicos e político brasileiros se não corruptos, coniventes com a corrupção ou com suas capacidades mentais e cognitivas significativamente diminuidas. Nenhuma Democracia avançada no mundo adota o sistema de voto com urnas eletrônicas : eu estou me referindo a nações que dominam as tecnologias mais avançadas do mundo (aeroespacial) e que são democracias maduras, pq ?  por uma simples razão : a urna eletrônica não garante que o voto do eleitor seja processado de forma correta, sem trapaça; com a urna eletrônica é impossível proceder a uma recontagem dos votos que seria um controle cruzado de informações. Holanda, Bélgica e EUA testaram e não quiseram e hoje somente o beiçola, o rei do frango e da polenta e o analfabeto funcional do STF, o ditador Maduro, e a  Raquel Dodge defedem o sistema de urna eletrônica : por que tanta teimosia ?",1,true,3,,,,,,
,,,,,,,,UgwlEDJg75N7f26WvNd4AaABAg.8ewS5PpDdJV8exuwdLgLgd,aaanjr57,1 month ago,1526086413510,"Ok Patrick,perfeitas considerações,concordo com tudo e só poderia acrescentar que a razão apresentada que não tem dinheiro para atualização com impressão do voto,não convence a maioria dos especialistas,já que o TSE por exemplo recusou a iniciativa do IME/ITA para uma urna muito mais barata com a impressão do voto(E não podemos esquecer com total transparência na apuração).Só podemos conjecturar o interesse político para manter como esta,com um provável governo das sombras capitaneado  pelo Foro de São Paulo por exemplo para prevalecer um governo socialista como já ocorre na Venezuela com votações através tb do fraudável sistema da Smartmatic,abraços e obrigado pelo excelente comentário!",1
,,,,,,,,UgwlEDJg75N7f26WvNd4AaABAg.8ewS5PpDdJV8exxjhqDQOa,Patrick Oberholzer,1 month ago,1526086413514,"Não vi os cálculos dos custos comparando o sistema manual  (clássico/com boletim de voto manuscrito) com possibilidade de recontagem dos votos (vc compara a quantidade de boletim de votos depositados na urna clássica contra a quantidade de assinaturas de eleitores no caderno da seção eleitoral e vc apura 1 por 1 quem foi o candidato votado) versus o sistema de urna eletrônico acoplado com uma impressora que comporta os seguintes custos : custo de equipamento da urna eletrônica (custo incide para cada seção) + impressora especial (custo incide para cada seção) + o custo de back-up para substituir equipamentos defeituosos (custo rateado nas seções do Brasil todo) + custo operacional informático que é pesado (custo rateado nas seções do Brasil todo). Acredito que já fizeram essa ponderação nas tais democracias avançadas as quais me referi anteriormente e chegando a conclusão que era mto caro introduzir o sistema eletrônico mantiveram o velho sistema, é verdade um pouco mais lento mas nem tanto pois não há obrigatoriedade de votar nessas democracias;  para mim a obrigatoriedade do voto é outra jaboticaba brasileira que não deveria existir mas não é o assunto aqui...",1
,,,,,,,,UgwlEDJg75N7f26WvNd4AaABAg.8ewS5PpDdJV8ez4meBOjkG,aaanjr57,1 month ago,1526086413523,"Muito bem Patrick,esclarecedora análise,tb não vi os cálculos dos custos,mas vi e coloquei neste canal(https://www.youtube.com/edit?o=U&video_id=Rlk0VbUS70w) ,onde neste vídeo tb é esclarecido que os custos não são um problema para o orçamento destas urnas mais confiáveis com impressão do voto e de última geração!
Também concordo com a retirada da obrigatoriedade do voto,onde o que acontece hoje é que as pessoas preferem pagar a multa e não votar,abraços e obrigado pelos comentários elucidativos!",1
UgzwDySf6pF7LDGU15F4AaABAg,pedross64,2 months ago,1523494412826,"""ELEIÇÃO FRAUDULENTA DEVERÁ SER ELIMINADA. PORQUE ?""
*A VOTAÇÃO é SECRETO, mas a CONTAGEM NÃO. ASSIM o VOTO IMPRESSO como fica ? TAMBÉM NÃO !!! O SINCRONISMO ENTRE AS INFORMAÇÕES entre VOTO IMPRESSO e TOTALIZADORES LOCAIS devem ser mantidos SECRETOS, e entre os TOTALIZADORES FINAIS ser NÃO SECRETOS. ENTRETANTO A CONTAGEM ATUALMENTE É EFETUADA DE MODO TOTALMENTE SECRETO, PERMITINDO A FRAUDE, POR NÃO PERMITA A RECONTAGEM, A AUDITAGEM !!!
ONDE POSSA SER EFETUADA A TOTALIZAÇÃO FRAUDULENTO ? NAS URNAS, SÃO MUITO LENTO E QUANTIDADE MUITO PEQUENA PARA INFLUENCIAR A CONTAGEM !!! MAS ATENDA PARA AUDITAGEM !!!
A TESTE DE INVASÃO DAS URNAS PELOS ""ESPECIALISTAS"" CONVIDADOS  FOI DE EXTREMA ABSURDO. COMO FOI EFETUADA a TRANSMISSÃO (Wi-Fi, pen drives etc), os CONCENTRADORES e os  TOTALIZADORES e outros. A SEGURANÇA (INTERCEPTAÇÃO  E INJEÇÃO) DEVE SER MANTIDA RIGOROSAMENTE EM TODOS OS ESTÁGIOS. PORTANTO É DE EXTREMA IMPORTÂNCIA A ATUAÇÃO INTEGRADA DE SOFTWARE E HARDWARE DE CADA ESTÁGIO QUE PODERIA PERMITIR A FRAUDE. TODAS AS UNIDADES TOTALIZADORES FINAIS DEVEM ESTAR NO TERRITÓRIO NACIONAL.
SE A ELEIÇÃO FRAUDELENTA CONTÍNUE ENTÃO DEVE SER CONSIDERADA NULA, JÁ QUE PERMITA DECRETAÇÃO DE REGIME CONTRÁRIO A MAIORIA ABSOLUTO DA POPULAÇÃO BRASILEIRA POR ATENDER ARTIGOS 1 E 14 DA CONSTITUIÇÃO FEDERAL BRASILEIRA, CRIMINALMENTE.
PORTANTO, A VOTAÇÃO EM PAPEL COMO ANTIGAMENTE É MUITO MAIS SEGURO, POR ISSO CONTINUA SER UTILIZADA NA MAIORIA DOS PAÍSES DEMOCRÁTICAS DO MUNDO.
DEVE SER OBSERVADO RIGOROSAMENTE O INÍCIO DE CONTAGEM SIMULTÂNEA APÓS ENCERRAMENTO TOTAL DA VOTAÇÃO NO TERRITÓRIO NACIONAL.*
IMEDIATA INÍCIO DE AUDITORIA TÉCNICA INTEGRADA HARDWARE-SOFTWARE DO SISTEMA ELETRÔNICO DE VOTAÇÃO ATUAL PARA DETECÇÃO DAS IRREGULARIDADES, E AS PROVIDÊNCIAS A SEREM TOMADAS.",1,false,0,,,,,,
Ugz8uLuEAgZpdSNMLYl4AaABAg,Baker Crossroads,3 months ago,1520816012836,É preciso explodir o TSE e acabar com toda a justiça eleitoral!!!!,0,false,0,,,,,,
Ugyhc2FNBEABzgw784t4AaABAg,kleber wellington Frederico,4 months ago,1518396812846,Fraude com certeza,1,false,0,,,,,,
UgzAcmgl8-9ZAbJaO054AaABAg,ET Rivel,6 months ago,1513040012855,"DESOBEDIÊNCIA CIVIL É:
--- NÃO PAGAR NEM DECLARAR MAIS IMPOSTO DE RENDA
---  NÃO PAGAR O IPTU
--- NÃO PAGAR PEDÁGIO SEM NOTA FISCAL
--- PAREM AS FÁBRICAS
--- PAREM OS TRANSPORTES
--- GREVE !!!
--- PASSEATAS !!!
--- QUEBREM AS URNAS
--- ACAMPAMENTOS NOS CORREDORES DO CONGRESSO!!!
--- POLICIAIS, AJUDEM O POVO. NÃO REPRIMAM PORTE DE ARMAS, NÃO IMPEÇAM O POVO. --- POLICIAIS NÃO ATIREM NO POVO.  NÃO DEFENDAM O CONGRESSO, VAMOS TOMA-LO.
--- ESSA QUADRILHA PEDIU E VAI PAGAR.
--- ELES QUEREM O NOSSO SANGUE, VAI JORRAR É O DELES.
--- SOMOS MILHÕES CONTRA 500
...
--- VAMOS RETOMAR O PAÍS.
--- VAMOS DEFENDER NOSSOS BENS E NOSSAS FAMÍLIAS.
--- G U E R R A  ! ! ! 
....
CUSTE O QUE CUSTAR
https://www.youtube.com/watch?v=jgz-9DiRQsg&t=1s
CUSTE O QUE CUSTAR
https://www.youtube.com/watch?v=2zFWNoLdUKE
CUSTE O QUE CUSTAR.


A URNA ELETRÔNICA FOI DESENVOLVIDA PRINCIPALMENTE NA UFRJ, POR VOLTA DE 1982 NO NCE (NUCLEO DE COMPUTAÇÃO ELETRÔNICA), COM COMUNISTAS E DURANTE A GESTÃO DO REITOR COMUNISTA HORÁCIO MACEDO.
COINCIDENTEMENTE FOI NESSE PERÍODO QUE OS COMUNISTAS EXILADOS RETORNARAM AO PAÍS.
QUANDO A UFRJ DEIXOU DE SER UNIVERSIDADE PARA VIRAR CABIDE DE EMPREGO DE MAIS 3000 COMUNISTAS, COM AMPLA DISTRIBUIÇÃO BARATA DE DROGAS AOS ALUNOS.
...",1,false,0,,,,,,
UgwD4aWQ8Jy6rubLyxZ4AaABAg,Ricardo D,8 months ago,1507769612861,"Isso parte do pressuposto que o TSE não quer a fraude eleitoral. O TSE realmente não quer a fraude?
Tenho minhas dúvidas.",1,false,0,,,,,,
UgymQ53NToH9m0vZUNl4AaABAg,Daniel Rachadel,9 months ago,1505177612871,Na verdade temos 11 Ministros no supremo que são bandidos da pior especie e eles não ouve ninguém como se o brasil fosse terreiro das putarias deles. E pior não dão ouvido a ninguém como se ele estivessem acima da lei e da ordem!,1,false,0,,,,,,
UgjpJao_iCCAp3gCoAEC,Ricardo Belavenuto,10 months ago,1502499212881,"O problema mais grave: Um sistema onde o fiscal do processo é ele mesmo, o fiscalizado?? (o Próprio TSE)? ""Meus métodos, minha aprovação?"" A apuração deve ser 100% auditada: PAPEL vs DADOS da URNA. Não me importa que o processo seja mais lento e/ou desgastante. Me preocupa muito mais a legitimidade do processo eleitoral como um todo.",3,true,1,,,,,,
,,,,,,,,UgjpJao_iCCAp3gCoAEC.8V0Xxsho4X68V0meww5ksb,aaanjr57,10 months ago,1502499213388,"Ok Ricardo, concordo e ainda bem que tivemos a ação do deputado Bolsonaro para imprimir o voto permitindo auditoria física da eleição, muito obrigado por seu comentário inteligente e abraços, AJr.",1
UgjQUU_6gmA1fHgCoAEC,Augusto César Gomes,1 year ago,1497228812893,É bem curioso que o molusco se tornou presidente 2 anos após a efetiva implantação da famigerada urna. Vocês não acham ?,4,true,2,,,,,,
,,,,,,,,UgjQUU_6gmA1fHgCoAEC.8Prn-7JEQCA8PsnDBC9aTR,aaanjr57,1 year ago,1497228813402,"Realmente Augusto,principalmente considerando esta urna ser uma aplicação idêntica da que é usada em Cuba,e na Venezuela dos amigos ditadores de Lula e amplamente rejeitada em países do 1º mundo(aliás até no Paraguai não é aceita)...a pergunta que não quer calar é ""Até quando o Brasil vai aceitar isso?"",abraços!",2
,,,,,,,,UgjQUU_6gmA1fHgCoAEC.8Prn-7JEQCA8Q6MYcXulhN,Augusto César Gomes,1 year ago,1497228813411,"Sim, vc acha que o Bolsonaro propôs o PL do voto impresso (aprovado) a toa ? É provável que ele saiba sim do esquema de propinocracia bem como das fraldes que ocorrem aqui. Essa PL foi aprovada e em 2018 já será impresso o comprovante do candidato para presidente, governadores, senadores e deputados. Mas o que é triste é ver como muitas pessoas defendem o molusco apedeuta. Mas ele deverá estar atrás das grades até lá.",1
UggOsBp-ax2eMngCoAEC,wal gonçalves,1 year ago,1497228812905,"Nós brasileiros, temos que cobrar do TSE a retirada das urnas eletrônicas e voltamos a votar como antes.Nós podemos exigir isso,apenas não nos interessamos.",1,false,0,,,,,,
UggftBP_0qCtIXgCoAEC,Gilson De Paula,2 years ago,1465692812915,"Houve fraude eleitoral! Várias análise de dados mostram isto. Mas um o sistema que não possui o atributo de recontagem de votos (Isto por si só já é uma fraude.) e não gera prova física (Voto impresso) do que foi feito (Isto por si só também é uma fraude.) é perfeito para os planos de poder do PT. Caia na real, se não se pode recontar os votos não há democracia. Outra coisa, não existe margem para fazer algo muito diferente do que está neste estudo. Tente imaginar uma outra forma eficiente e sutil de fraudar esta eleição. Difícil não é? Sim, mas aqui esta provado que se pode fazer deste jeito. Quem pode refutar?
https://www.youtube.com/watch?v=hF7UOsZMQn8",3,false,0,,,,,,
UgjBvvA6yrnM5HgCoAEC,Rodnei C. R.,2 years ago,1465692812921,"É de se perguntar então por quê o TSE forçou o uso das urnas sem ao menos o mecanismo de impressão dos votos? Só eu ou mais alguém achou aquela ""apuração de votos"" a coisa mais esquisita do planeta? O relatório completo dos testes da equipe do Aranha contém provas contundentes da insegurança das urnas eletrônicas brasileiras, e pode ser acessado em https://sites.google.com/site/dfaranha/pubs/aranha-karam-miranda-scarel-12-pt",2,false,0,,,,,,
Ugg_ilVaTGP7MngCoAEC,Gilson De Paula,2 years ago,1465692812931,"O desafio continua, quem pode refutar este estudo definitivo, que demonstra a fraude eleitoral em 2014? 
https://www.youtube.com/watch?v=hF7UOsZMQn8",2,false,0,,,,,,
Ugh7JrMHh2PIvngCoAEC,Gilson De Paula,2 years ago,1465692812939,"+aaanjr57 , entenda definitivamente a fraude. Avaliem este estudo por favor. Se gostar compartilhe.
https://www.youtube.com/watch?v=hF7UOsZMQn8",2,false,0,,,,,,
UgikkN43l8RkengCoAEC,919deezy,3 years ago,1434070412949,"Provas ?! Nossa BR é plebe mesmo, não sabendo interpretar um vídeo. Ele nunca provou nada, apenas salientou de forma sistemática que assim como qualquer outro sistema de segurança, a urna eletrônica apresenta falhas, falhas como dito por ele de projeto do sistema de segurança. De qualquer forma mesmo havendo falhas não significa que há ou houve qualquer tipo de falsificação, até pq como descrito por ele a maior parte das falhas é ""física"". Vc precisaria de alguém monitorando as filas, ou tendo acesso a documentos que são documentos federais, ou até mesmo tendo acesso ao cartão físico da urna. Isso não prova nada, além de que vc não sabe interpretar um simples vídeo.",0,true,6,,,,,,
,,,,,,,,UgikkN43l8RkengCoAEC.7-H0Z7-6T9N7-JW2PxJWzR,aaanjr57,3 years ago,1434070413445,"Sr 919deezy,provas sim,vamos aos fatos...essas ""falhas"" que ele relatou e provou são gravíssimas(Não é a toa que nenhum país do mundo adota estas urnas).
As urnas eletrônicas têm de atender a dois requisitos essenciais:

1) Princípio da publicidade: poder demonstrar que o resultado eleitoral foi correto.
Isso significa que o conteúdo do voto tem de ser público e conferível pelo eleitor no local de votação e pelo fiscal de partido durante a apuração;

2) Princípio do sigilo do voto: não possibilitar a identificação do autor do voto. É fundamental para se evitar a coação de eleitores, que é uma fraude com poder muito forte de distorcer o resultado eleitoral.

A urna eletrônica brasileira nunca atendeu corretamente ao requisito de transparência (publicidade). Por exemplo, o nosso eleitor não pode ver o conteúdo do Registro Digital do seu voto (o eleitor argentino e o alemão podem!).

Até agora, acreditava-se que a urna preenchia o requisito do sigilo do voto.

Por lei (art. 59 da lei 9.504), cada voto confirmado pelo eleitor é gravado num arquivo chamado Registro Digital do Voto (RDV); é de forma embaralhada para que não pudesse ser usado para identificar a ordem de votação.

Aliás, vale lembrar aqui que um dos requisitos na antiga lei do voto manual (Inc IV do art. 103 do Código Eleitoral) já exigia que a urna de lona fosse suficientemente larga para embaralhar os registros (cédulas) do voto.

Pois bem, o professor Diego conseguiu desembaralhar o arquivo RDV. Com isso, provou que as urnas não garantem o sigilo do voto: uma vez ordenados os registros dos votos, há muitas formas de se coagir eleitores por identificação do voto de cada um.
Inequivocamente, o professor Diego provou em testes que simulavam o ambiente real (como está dito no edital dos testes) que a urna eletrônica não assegura a inviolabilidade do sufrágio, já que, para quem conhece o código do software das urnas (como os funcionários de TI do TSE), é possível achar a ordem em que os registros dos votos (RDV) foram introduzidos.
Não sei o que é mais grave: a impossibilidade de averiguação da inviolabilidade do sistema, a concentração de poderes do TSE(organiza e julga o processo eleitoral , isso comprometeria a isenção do órgão), segundo os especialistas ou a desinformação da maioria da população sobre o assunto. 
Conclusão: deveriam ser nulas as eleições com urnas eletrônicas que não garantissem o embaralhamento dos votos.De nada adianta o direito de votar se o eleitor não tiver também o direito de conferir o correspondente voto impresso e guardado em urna para uma posterior conferência se necessário(o voto só digital não permite isso). Falar em direito de votar mas sem poder conferir, não passa de retórica.
Eu sempre me pergunto, como pode um país entregar o seu destino histórico a um processo eleitoral eletrônico sem qualquer forma de auditoria?
A fraude pode acontecer na urna (aplicativo, sistema operacional, firmware , cpu, etc.), como também no programa que abre o arquivo da urna para fazer a totalização, por exemplo. Existem muitas maneiras de adulterar o resultado.
Se nem as maiores empresas de software e instituições bancárias do planeta conseguem evitar a ação de código malicioso (vírus), fraudes, invasões de redes, etc., por que o nosso TSE conseguiria? Não adianta afirmar que são ""100% seguras"", como se fosse um dogma religioso. Tem que provar!
Eu não confio nas eleições brasileiras, em especial quando o interesse popular estiver contraposto ao interesse dos poderosos!",4
,,,,,,,,UgikkN43l8RkengCoAEC.7-H0Z7-6T9N7-Ko4NuUtFq,919deezy,3 years ago,1434070413451,"+aaanjr57 Concordo com vc em parte.

1° - ele apresentou ""provas"" de que há a possibilidade de fraudar a eleição.

Até então nada de novo, espera-se, pois todos nos sabemos, e como descrito por vc, nenhum sistema de segurança é isento de possibilidade de falhas, erros e intercepção. De fato os erros do programa descrito por ele aparentam ser grandes, mas quem entende de segurança sabe que embaralhar dados é a melhor forma de protege-los, exatamente como foi feito, é claro que trazem outras consequências que são inerentes do método utilizado.

2° - o código das chaves são todas iguais

Okay, um problema sério do ponto de vista computacional, mas até então presume-se que como o cartão é físico guardado por órgãos federais em locais específicos, sendo ainda sujeito a crimes investigados pela PF o cartão aparentemente está seguro. Sempre podemos entrar no mérito que alguém consiga o cartão, mas mérito por mérito podemos tmb afirmar que é possível invadir outros sistemas de segurança. É sempre bom ter em vista que nenhum é totalmente seguro, até mesmo os de papeis estão sujeitos a erros gravíssimos, como já ocorreu nos EUA na eleição de Bush. Logo não é nenhuma surpresa que possam haver erros.

3° - Como havia dito os erros são mais físicos do que computacionais

Tudo bem, uma vez  que se tenha acesso a chave física, para conseguir a chave pro acesso do sistema, que consiga desembaralhar todos os votos, ou no mínimo uma quantidade significativa de votos, para que se possa coagir ou seguir pessoas... novamente, não discordo de vc e acho que tudo descrito por vc foi muito bem pontuado, acho apenas um exagero como as pessoas tratam falhas em sistemas de segurança como se fossem do outro mundo, ou como o nosso sistema fosse o pior quando é considerado como um dos melhores pelo resto do mundo . O de cédulas está sujeito a falhas assim como o nosso eletrônico, não poderia dizer que qual é o mais seguro, mas acredito que como é feito no Brasil é muito bom em comparação com o resto do mundo.",0
,,,,,,,,UgikkN43l8RkengCoAEC.7-H0Z7-6T9N7-LuJu1tMf5,aaanjr57,3 years ago,1434070413457,"+919deezy Muito bem 919deezy,gosto de dialogar com um especialista porque assim podemos aprofundar o assunto...tb concordo com vc que nenhum sistema é 100% seguro, mas o problema no caso brasileiro é o índice maior de insegurança e a impossibilidade de uma conveniente auditoria posterior sem a impressão do voto.
A fraude no sistema exclusivamente eletrônico como o brasileiro, é difícil de ser identificada porque não há outra maneira de contagem de votos que identificaria um erro ou sabotagem. Se o voto eletrônico fosse combinado com o impresso seriam duas contagens que precisariam ser correspondentes e uma funcionaria como auditoria da outra. Em caso de fraude, ficaria muito mais difícil ao responsável pela sabotagem corromper os dois meios de votação, impresso e eletrônico.
""Uma solução interessante é adotada na Argentina: cada cédula de votação carrega o registro impresso (para verificação pelo eleitor) e eletrônico (para apuração rápida) de um voto individual"".
Comparando com sistemas de votação eletrônica no mundo(No Brasil,é de 1ª geração,o mais atrasado do mundo),o equipamento usado no Brasil é do modelo DRE (Direct Record Electronic) foi criado em 1991. Ele conta votos eletronicamente, mas não permite a verificação ou a recontagem independente de software. Isso quer dizer que se a votação ou a apuração for violada dificilmente será identificada e sua auditoria não é possível, apontam especialistas.

Há também equipamentos de 2ª geração como o modelo VVPT (Voter-Verifiable Paper Audit Trail) criado em 2000. Esse sistema exige um registro impresso do voto digital para que seja possível uma auditoria independente do software da máquina. Alguns tipos de urna requerem o registro material (de papel) na entrada da coleta eletrônica, onde uma cédula é escaneada, enquanto outros geram o registro material como saída, imprimindo uma cédula correspondente ao voto digital coletado. Esse modelo é passível de sabotagem também porque se houver discrepância entre a contagem eletrônica, automática, e a física, com o papel do voto, a auditoria não consegue  descobrir qual delas foi violada.

Os especialistas destacam o modelo E2E (End-to-End auditability) que é de 3ª geração como o mais transparente. Essas máquinas começaram a ser usadas em 2006 na Argentina e em regiões dos Estados Unidos. O modelo concentra as duas versões de voto, a impressa e a digital. O voto é eletrônico, mas gera um papel com voto e um chip com o registro do voto eletrônico. Assim, caso haja alguma discrepância entre uma contagem eletrônica e do voto impresso, é possível identificar a origem do erro ou da fraude.
CONCLUSÂO:Todo tipo de urna tem seu calcanhar de aquiles, mas com graus de importância que variam conforme a perspectiva: 
-As urnas de primeira geração tipo DRE,no caso brasileiro,permitem formas invisíveis de fraude por atacado através do software, situação que se agrava quando o operador do sistema é o mesmo encarregado de julgar eventuais tentativas de impugnação do resultado.
-As urnas de segunda geração, do tipo VVPAT (Voter-Verifiable Audit Trail), tornam detectáveis as fraudes por atacado via software, mas ao custo de reintroduzir formas de ataque de varejo praticáveis no papel, sem no entanto apontar a origem da falha ou da manipulação quando houver diferença entre a contagem eletrônica e a manual amostrada.
-As urnas de terceira geração, do tipo E2E (End-to-End Chain of Custody), permitem ao eleitor rastrear a correta apuração do seu voto, e aos candidatos detectar a origem de falha ou manipulação significativa se houver, ao custo de uma proteção ao sigilo do voto mais complexa.
A pergunta que não quer calar=> ""Já que as urnas de 3ª geração são as mais seguras do mundo atualmente,por que o TRE não as adotou ainda?Falta de recursos para adquiri-las com certeza não é...""",3
,,,,,,,,UgikkN43l8RkengCoAEC.7-H0Z7-6T9N7-M1vIHITf7,919deezy,3 years ago,1434070413464,"+aaanjr57  Entendo e concordo com você, agora me foi explicado com clareza e sanidade os problemas. É verdade que saímos do principio que seria complicado obter os dados da votação, mas caso aconteça, não haveria qualquer forma de verificar com certeza se houve algum tipo de invasão ou roubo de dados por conta do modelo atrasado ainda usado no Brasil. Mas esse ponto é o que devia ser cobrado, urnas mais confiáveis, apesar de ter de passar por um processo longo e de petições seria algo interessante de ser feito. Adoraria em saber que você como entendedor  e crítico do assunto pudesse fazer um petição pública para enviar ao TSE, garanto que depois dessas informações seria o primeiro na lista.",1
,,,,,,,,UgikkN43l8RkengCoAEC.7-H0Z7-6T9N7-N55MEwdlk,aaanjr57,3 years ago,1434070413469,"+919deezy Ok deezy,agradeço a sugestão e prometo que pensarei sobre o assunto,abraços!",1
,,,,,,,,UgikkN43l8RkengCoAEC.7-H0Z7-6T9N7Arp72fivdF,Marcelo assis da silva,2 years ago,1465692813475,"+919deezy  O título diz: ""Provas SOBRE A POSSIBILIDADE DE FRAUDES"" e não: Provas da FRAUDE.",2
UgiPEuSrlMbhtXgCoAEC,Jose silva,3 years ago,1434070412973,As urnas podem ser facilmente fraudadas. Não sei pq essa gravissima noticia não sensibilizou os nossos congressistas e o MP..,4,false,0,,,,,,
UghwsJx6PufWp3gCoAEC,Alexandre M,3 years ago,1434070412984,"Não adianta deixar de votar, fazem o querem com esse sistema da urna eletrônica criminoso. Mais de 55 grandes nações do mundo recusaram por saber da vulnerabilidade. É preciso que se investigue isso à fundo e se tomar as providências cabíveis. Cadê o TSE?",3,true,2,,,,,,
,,,,,,,,UghwsJx6PufWp3gCoAEC.7-H0Z7-0vse7-f1HkpssoW,SNOBI 2018,3 years ago,1434070413486,"O TSE ESTÁ APARELHADO, É O RESPONSÁVEL DIRETO PELO RESULTADO DAS URNAS.",4
,,,,,,,,UghwsJx6PufWp3gCoAEC.7-H0Z7-0vse7-f8B9NiTKW,Alexandre M,3 years ago,1434070413491,"Só falta o PT ""unificar as polícias"", dominar as polícias e o exército para oficializar a ditadura comunista.",4
UggdSX55WIi3AHgCoAEC,Kelvin Floresta de Andrade,3 years ago,1434070412990,"Meu caro, eu aplaudiria o senhor de pé, não pela análise (pois como dito, qualquer um graduado poderia fraudar a eleição), mas por mostrar seu ponto de vista e dizer o que eu gostaria a respeito do software, situação e o TSE.",4,false,0,,,,,,
Uggol2qIaBcqfHgCoAEC,Renilson Silva,3 years ago,1434070412998,do que adianta ficar chorando a dilma manda em tudo no tre na policia federal no ministerio publico ela manda em tudo mesmo,1,false,0,,,,,,
Ugh3xaJ4HlJnTngCoAEC,Geovah Miranda,3 years ago,1434070414382,Se a oposição política ao PT não se unir urgentemente a vaca vai com a corda.,4,false,0,,,,,,
