id,user,date,timestamp,commentText,likes,hasReplies,numberOfReplies,replies.id,replies.user,replies.date,replies.timestamp,replies.commentText,replies.likes
UgzX5dU9-zfbwS_cFdt4AaABAg,Valério Venancio,2 days ago,1528589352803,"No minimo após este levantamento,  os senhores ministros deveriam  ter um pouco de respeito a posição do nobre advogado e abrir uma auditoria para apurar a veracidade dos fatos, usando os próprios peritos que verificaram os  elementos conflitantes antes de votar a questão do voto impresso. Tenho vergonha da nossa justiça que mostra de forma clara abraçar as pernas da justiça e leva-la para o fundo do oceano e afoga-la , tirando dos brasileiros alguns fios de esperança que ainda permeiam nossa sociedade, acreditando na possibilidade de mudanças.",4,false,0,,,,,,
UgzlQY3zql_K38liDMB4AaABAg,Capitão Planetaaa!,2 days ago,1528589352812,"O STF só valoriza a CUT.  Ele avisou em nome de quem falaria e onde foi feito a análise. Porém estavam ocupados pensando onde inveatiriam os lucros da votação, que não deve ter sido pouco  !  TSE/STF são o joio no meio do trigo  !!!!",24,true,1,,,,,,
,,,,,,,,UgzlQY3zql_K38liDMB4AaABAg.8hFivxAixXf8hN8sciaBC8,Anselmo Duarte,1 hour ago,1528758553285,"Corte não,  quadrilha!",1
Ugx_xFVRUQ6e0n0BhsF4AaABAg,sidney abreu,2 days ago,1528589352824,"É uma vergonha termos uma Suprema Corte extremamente desacreditada, provocando de forma inacreditável, insegurança jurídica com as suas decisões!!!",7,false,0,,,,,,
UgxmD-U-WqFb77zjWVN4AaABAg,Canal do Carioca,2 days ago,1528589352834,"Em um país que se rouba merenda escolar e fica tudo bem , Já era de se esperar , semana que vem talves vai ter votação para saber se Pablo Vittar tem menstruação ou não , Parabens aos nossos ministros , estão trabalhando direitinho.  👏🏽👏🏽👏🏽👏🏽👏🏽👏🏽👏🏽👏🏽👏🏽👏🏽👏🏽",0,false,0,,,,,,
UgyvH4k9kPV95B7HP9d4AaABAg,Alex Custodio,2 days ago,1528589352844,parabens....amei...salvem nosso brasil,0,false,0,,,,,,
UgxhjtVnvf9hIsKlNil4AaABAg,Bruno Paiva,2 days ago,1528589352880,Arrasou  Advogado esse é macho kkkk,0,false,0,,,,,,
Ugztcyz0Ga6KHoS8NhB4AaABAg,Sonia Santos,2 days ago,1528589352884,"Esse comportamento agitado de toda a  CORJA DE TOGA,  já  fica evidente que todos são favoráveis  às urnas eletrônicas e que vão enterrar o voto impresso. Estes ministros bandidos já tinham um acordão formado,  tanto que não estão nem aí para os argumentos dos contrários as urnas. Estão ali só para fazer presença e tentar atrapalhar  a defesa do voto impresso. QUANTA CANALHICE!!!",0,false,0,,,,,,
Ugy5IlqbiZ1jDn5zADx4AaABAg,Tom Silva,2 days ago,1528589352894,O povo não quer mais nada com esses juízes que fazem e com vontade a injustiça parecer justiça!!,0,false,0,,,,,,
Ugxz_lBnaHv2-lZnWRN4AaABAg,luiz antonio oliveira,2 days ago,1528589352905,"bandidos de toga,não merecem o cargo que ocupa e não os respeitos e não os reconheço omo ministros,e sim como bandidos usando toga e cometendo injustiça.",0,false,0,,,,,,
UgyqODAb_me0DiyiW0d4AaABAg,cesar webber,2 days ago,1528589352913,"Brasil precisa parar, estamos indo rumo a Venezuela.",0,false,0,,,,,,
Ugy10cQATqs7EakwbwV4AaABAg,cesar webber,2 days ago,1528589354042,STF é corrupto e estão com medo da direita ganhar a eleição.,0,false,0,,,,,,
UgyOeaMCadD_CD3uqxh4AaABAg,Deysiane Maciel,2 days ago,1528589354054,"STF não é pela democracia, é pela manutenção do controle... triste.",0,false,0,,,,,,
UgxLNOPFJAGdjWLSNhZ4AaABAg,ediberto santiago,2 days ago,1528589354066,Não vão deixar o advogado falar não mesmo?,0,false,0,,,,,,
UgyZ9tqh7f1m9cg1c794AaABAg,Emerson Castro,2 days ago,1528589354079,"Em tão pouco tempo ao advogado dado, tiro a ele o CHAPÉU resumiu excepcionalmente, de 800 bilhões gastos com bhla bha, não se pode INVESTIR NA TRANSPARÊNCIA COM MEROS 2 bilhões? É muito pro meu raciocínio,pós nem formação educacional eu pode ter na minha vida, agora me responda os intelectos? Que Brasil nos queremos pro FUTURO.",0,false,0,,,,,,
UgwOz9NDHir8I5Aoi1R4AaABAg,Emerson Castro,2 days ago,1528589354091,"Vergonhosa a tamanha transparência do supremo tribunal federal de iguinorar a que pelo valor que o governo gasta em publicidade anual,em vista do custo nos cofres públicos. Não é sobre retroceder ao avanço da urna eletrônica,mas sim a transparência na eleição, somente acrescentar mais uma segurança! Preguiça de viver num país que tem tudo para ser verdadeiramente DEMOCRÁTICO, MAS OS QUE ESTÃO NO PODER DE ESCRAVISAR A POPULAÇÃO NÃO ABREM MÃO DE PERDER O PODER....",0,false,0,,,,,,
UgyPX8b2pDF8FjYBvFh4AaABAg,Marco Dias,2 days ago,1528589354099,"Todos os argumentos usados pela procuradora geral da república e os ministros do SuPTremo foram refutados, mas como todos estavam acertados, não adiantou nada. E mais uma vez as fracas forças armadas, os politicos que se dizem honestos e os brasileiros vão colocar o rabo entre as pernas e serão manipulados pelas mídias e torcerão pela seleção brasileira que já fez ""muuuuuuito"" pelo Brasil e tudo ficará como antes - corrupção correrá solta.",0,false,0,,,,,,
UgzZAQEYHD63vCs_-Ch4AaABAg,Erika Soares,3 days ago,1528502954109,Não gosto de xingar. Mas tenho que dizer que esses ministros são canalhas. Não existe seriedade no que fazem. Ficaram tão envergonhados que nem deixaram o advogado falar direito. O ano não importa ministro. Seus técnicos são hackers incompetentes porque lhes convêm. Uma pena que estamos entregues a gangue do STF. Se protejam agora.,0,false,0,,,,,,
UgyKwv4c1Fe3j3sfQMF4AaABAg,Fernando Santos,3 days ago,1528502954114,"A inquietação foi tanta que deu parecer que eles são os donos da Urna. (tipo: Como  assim meu aparelho não funciona direito ?)
Exija sua nota fiscal. Ops. Exija seu comprovante impresso :)",0,false,0,,,,,,
Ugyn_IB9CuWrc8_91BB4AaABAg,Kim Joung-un,3 days ago,1528502954124,"O negócio é a democracia. 
Isso é a maior mentira já inventada, só serve para manipular mais ainda a massa.",0,false,0,,,,,,
UgyhbSdrwMpxpEnPC2Z4AaABAg,Anderson Braga Rangel,3 days ago,1528502954134,Pura verdade....,0,false,0,,,,,,
UgzdhxZY3cp4PQZ7wul4AaABAg,cleiton junio,3 days ago,1528502954145,👏🏾👏🏾👏🏾👏🏾👏🏾👏🏾👏🏾👏🏾👏🏾👏🏾👏🏾👏🏾,0,false,0,,,,,,
Ugzjs11_-lR-Nf9Rp914AaABAg,Lucas Cardozo Cardozo,3 days ago,1528502954156,"""Estavam em teste quem?? seg o ministro"" estavamos nos o jiraya , Jaspion, blacmenrider..batman e a agora o titan loco ""thanos""
Vai ver se eu to na esquina ..é so falar q vcs vai vetar essa votação e pronto...qta abobrinha",0,false,0,,,,,,
UgwLVGovihgqMSYo1q54AaABAg,S. vitor,3 days ago,1528502954165,"Porque  vocês do senado não começam a impeachar ministros do STF? Começando por Gilmar solta bandido. Vocês podem, aproveitem essa oportunidade. Se o gilmar puder ferra vocês ele não vai pensar duas vezes.",0,false,0,,,,,,
UgwfTWi-25PwJVKFuIN4AaABAg,Edson Karsten,3 days ago,1528502954170,Bando de raposas corruptas que mamam na teta do dinheiro público.,0,false,0,,,,,,
Ugzb4N6s7jUW8yZ9x0x4AaABAg,Sebastião Ferreira,3 days ago,1528502954179,"Para quê gastar dinheiro com urna eletrônica? Vamos votar em cédulas de papel e urnas de lona, igualzinho aos países subdesenvolvidos e que não dispõe de tecnologia em informática  como o Japão, EUA, Alemanha, França, Inglaterra.....kkkkkk",0,false,0,,,,,,
UgwDTSno3CUdZpkEbG14AaABAg,Josileno Moura moura,3 days ago,1528502954191,Bando de abutres!,0,false,0,,,,,,
UgxwjpxdZ6-Gz8LjXhh4AaABAg,Ivaldo Sobral,3 days ago,1528502954196,Isso não é nenhuma novidade sobre essas urnas eletrônicas...quantas eleições foram manipuladas e acontecendo fraudes...kkkkk palhaçada essa urna cego é aquele que acredita nessas auditoria kkkk kkkk,0,false,0,,,,,,
UgzDwcGWqGAtFJ_tyTJ4AaABAg,Ale Silva,3 days ago,1528502954203,"Se hackeiam a NASA, o Pentágono, o Google. Me digam uma coisa: Quem é a urna eletrônica nesse universo ? 
Dá licença né ...",0,false,0,,,,,,
Ugwv7GyOHD7Tr_J4m-14AaABAg,normal sempre,3 days ago,1528502954210,"Escória dessa sociedade podre, corrupta e apodrecida por esses vermes servos de satanás.",0,false,0,,,,,,
UgyrtKZzMNV03eEQBJt4AaABAg,eziquielpa,3 days ago,1528502954218,"Parabéns, senhor advogado! Representou tudo que penso a respeito das urnas eletrônicas,.",0,false,0,,,,,,
Ugw3LADgrPXGP32nzhR4AaABAg,Sousa Mendez,3 days ago,1528502955040,STF Supremo Traidores Farsantes.,0,false,0,,,,,,
UgxAxzwB6x3pv7p9btJ4AaABAg,Avani Queiroz,3 days ago,1528502955049,Parabéns ao Advogado.,0,false,0,,,,,,
UgxCRIN9TUTktuVgbj94AaABAg,lucelia oliveira,3 days ago,1528502955057,"S
TF vergonha Nacional como poderemos acafar com essa quedrilha Maldita Ladrões Esse Gilamr deveria ser enxotado , afinal lá não se salva nada Temos q, nós unir para acabar com esses 3 Poderes que é uma vergonha para nosso País!!!",0,false,0,,,,,,
UgzXQfdAZadD5woH7Gp4AaABAg,eziquielpa,3 days ago,1528502955064,"""Seriedade do TSE""? Só podem estar brincando com os brasileiros!",0,false,0,,,,,,
UgzVSbuKfDzNMGuQwVF4AaABAg,renato oliveira,3 days ago,1528502955071,"Voto impresso ou ninguém vota! Acorda Brasil, até quando cairemos nessa falácia chamada TSE????",0,false,0,,,,,,
Ugw7jbyTREKy3l5yKyZ4AaABAg,Domingos Fernandes,3 days ago,1528502955078,"Parabéns advogados , lição de cidadania.",0,false,0,,,,,,
Ugx2lStP0u0SR7BnSJZ4AaABAg,Fernando Nando,3 days ago,1528502955084,Não vou nem comentar.,0,false,0,,,,,,
UgzdprHCJEiwJyzDTWN4AaABAg,Guy Warner,3 days ago,1528502955089,FORA NÃO ELEITOS!!,0,false,0,,,,,,
UgyzKslB99DYJi74LyF4AaABAg,Jack,3 days ago,1528502955096,"Caralho, o quê tem haver os altos? O problema está ali, só não vê quem não quer.",0,false,0,,,,,,
UgyPEs7YcBccfj1a2tx4AaABAg,Jair Felipak,3 days ago,1528502955102,Ojeito é não votar em urna eletrónica. Ai podemos anular nossos votos pra que esse bando de pilantras saião!,0,false,0,,,,,,
Ugxhhh4cr12MsUhZ9B94AaABAg,alvaro ejr,3 days ago,1528502955110,os vagabundos corruptos estão alvoraçados ministros safados comunistas.,0,false,0,,,,,,
UgwjRAgotmDYrv1Bw_t4AaABAg,Daniel Diniz,3 days ago,1528502955115,Tem hora que até o argumento de um Ministro do Supremo ( cargo máximo da carreira jurídica) se torna uma desculpa esfarrapada...,0,false,0,,,,,,
UgyZFZ5QvB2bVBpJ7lp4AaABAg,Daniel Diniz,3 days ago,1528502955121,Tem hora que até o argumento de um Ministro do Supremo ( cargo máximo da carreira jurídica) se torna uma desculpa esfarrapada...,0,false,0,,,,,,
UgzNSP-5T4VWR8SzuBF4AaABAg,Daniel Diniz,3 days ago,1528502955128,Tem hora que até o argumento de um Ministro do Supremo ( cargo máximo da carreira jurídica) se torna uma desculpa esfarrapada...,0,false,0,,,,,,
Ugw-Cxyg2HOD7OSZRmR4AaABAg,Daniel Diniz,3 days ago,1528502955134,Tem hora que até o argumento de um Ministro do Supremo ( cargo máximo da carreira jurídica) se torna uma desculpa esfarrapada...,0,false,0,,,,,,
UgymdWw_HBc6bQ8_2R14AaABAg,Domingos Batista,3 days ago,1528502955141,"STF: Se cercar vira zoológico, se gradear vira presídio, se se colocar lona vira circo, se colocar luz vermelha vira puteiro. Op's....já virou!",0,false,0,,,,,,
Ugzs56BSgW1I_BM21gl4AaABAg,RedBOzZO,3 days ago,1528502955146,O PC da Xuxa é mais seguro que essas urnas,0,false,0,,,,,,
UgzDl7SjXZv0FLU3PWJ4AaABAg,Valdeci da Silva,3 days ago,1528502955154,Tsé fez teste???? Quem tem que testar as partes contrários ao Tsé que são os caras que o povo não confia.,0,false,0,,,,,,
UgzLQeZhIAGwttCt3oN4AaABAg,vitor campos,3 days ago,1528502955158,EH O TEATRINHO DOS HOMENS DE CAPA,0,false,0,,,,,,
UgxjfF-wpgyMja5I4_x4AaABAg,VILMAR CAUS,3 days ago,1528502955166,Estes ministros são os mais corruptos dos Brasil vagabundos eo que eu penso...,0,false,0,,,,,,
UgzbMLhW0cabEYL8EpB4AaABAg,m g,3 days ago,1528502955906,Bando de corrupto,0,false,0,,,,,,
UgwImJe6BEm8nr38rpx4AaABAg,luan like a boss,3 days ago,1528502955910,Isso e uma guadrilha organizada,0,false,0,,,,,,
Ugzyunxb2Ymh9zK2X5J4AaABAg,Carlos Oliveira,3 days ago,1528502955919,"tem uma desgraça de um velho com uma tosse do capeta com o microfone ligado atrapalhando a fala do advogado falta de respeito,se bem que nesse antro nao existe isso.",0,false,0,,,,,,
UgyO3WxTavXLUAMG6Y14AaABAg,Paty Meneguel,3 days ago,1528502955924,"Eu queria saber depois de tantas evidências das fraudes, ainda votaram contra o voto impresso? Estão parecendo uma baratas tontas, depois dessa revelação, bando de vermes, me dá nojo essa corja. Aí ninguém é confiável",0,false,0,,,,,,
UgxUAMwhrIHvvW4WelJ4AaABAg,nervouzzzzz,3 days ago,1528502955932,"Gilmar Mendes e um mafioso, bandido da pior espécie, asqueroso fdp",0,false,0,,,,,,
UgyqOOiV4ZFaQjP_3a94AaABAg,lùtium yfy,3 days ago,1528502955941,Eu já desisti desse país e aconselho que façam o mesmo.,0,false,0,,,,,,
UgwCkIJ3Mn151yLtDOF4AaABAg,FABIANO PEREIRA DA SILVA,3 days ago,1528502955948,"👏👏👏👏👏👏👏👏👏👏😆😆😆😆😆😆😆😆😆😆 STF tome lá,kkkkkkkkkkkkkkk",0,false,0,,,,,,
Ugymd3j5KVHAcKAAPeh4AaABAg,William,3 days ago,1528502955955,Eu so voto em candidatos contrarios a urna eletronica. Pelo menos sei que a intencao deles nao eh negociar o cargo.,3,true,1,,,,,,
,,,,,,,,Ugymd3j5KVHAcKAAPeh4AaABAg.8hFSBazRZ9y8hIgdkfLLEL,Ana,1 day ago,1528675756407,"William 
Boa. 👍👏👏👏",0
UgzUnQT35IPboBg_ZTl4AaABAg,FABIANO PEREIRA DA SILVA,3 days ago,1528502955967,Não deixa o advogado falar turma de comunista.Eles sabem que as urnas tem  fraude.Intervenção já já.,0,false,0,,,,,,
UgxRI6_8Cutfqmz8Tjt4AaABAg,LOS ZETAS 762,3 days ago,1528502955977,Voto eletrônico e pura fraude e roubo,0,false,0,,,,,,
UgyOyTrPaXSLztdV_UJ4AaABAg,Adailto A. neri,3 days ago,1528502955988,Coitada das mulheres que tem esse tipo de marido...,0,false,0,,,,,,
UgzOgh_DyOHq9k_akNl4AaABAg,Alex Souza Santos,3 days ago,1528502955998,"Coitado do advogado, tentando convencer o lobo a não comer as ovelhas. Isto é uma fraude legitimada pelo STF.",0,false,0,,,,,,
Ugwk8Mm8qLHQTeimJf54AaABAg,TodoPoderEmanaDoPovo Povo,3 days ago,1528502956011,Amigos Vejam Quem os Indicou e Não Precisa Dizer Mais Nada ! Acorda Povo Brasileiro Deixa de Ser Escravizado e Enganado Por Esta Casta Imunda Que Acaba Com Nosso País ! Intervenção Já ! Liberdade ao Povo Brasileiro !,7,true,1,,,,,,
,,,,,,,,Ugwk8Mm8qLHQTeimJf54AaABAg.8hFRAw2JR3U8hKvfNN5glN,Jose Cassemiro,22 hours ago,1528682956377,TodoPoderEmanaDoPovo Povo l,1
Ugy4kJNIuQNNKBJ3PS54AaABAg,Andressa Dark,3 days ago,1528502956023,Vrauuuu,0,false,0,,,,,,
UgxFZ_lPblp1VV0cq9p4AaABAg,Fabio Marcello,3 days ago,1528502956034,Pormi deichava com militares eja era,2,false,0,,,,,,
UgzdXEwfBwz1OXj04214AaABAg,Beto Saraiva Beto,3 days ago,1528502956044,"sou mais um brasileiro q  enquanto essa porra dessa maldita urna eletrônica existir aqui no Brasil jamais votarei.... se essa porra dessa urna fosse tão boa a Europa, USA e outros países d primeiro mundo adotariam essa porra dessa urna eletrônica...",0,false,0,,,,,,
Ugwg5q_vyidOL6nO5_V4AaABAg,Fabio Marcello,3 days ago,1528502956053,Muito mimimimi a nada fazem,3,true,1,,,,,,
,,,,,,,,Ugwg5q_vyidOL6nO5_V4AaABAg.8hFQ_qsmo7h8hMz2DPiCfD,Rogério Alves Camargo,3 hours ago,1528751356393,"Fabio Marcello Pelo seu comentário, vc deve adorar fazer fraude, ratão!!!",0
UgxWgGozZuS1kCLa8ep4AaABAg,Fabio Marcello,3 days ago,1528502956063,Tados sabam que e falho esta urna mas adianta oq se eles queren que o brasil se esploda eles q dinheiro,0,false,0,,,,,,
UgxJ_MZOqq85Cfx_mcV4AaABAg,Ni Junior,3 days ago,1528502956069,STF vergonha.................,0,false,0,,,,,,
Ugw4YWfyS7paaQntrHV4AaABAg,Mariana Duarte,3 days ago,1528502956077,"O Problema é que os Ministros tem medo de transparencia pois muitos fazem politicagem com seus cargos e o Sistema Judiciário é uma Caixa Preta e avesso a transparência desde as primeiras instâncias, são lobos em pele de cordeiros e se sentem acima do bem e do mal ! É a nova forma de controlar uma nação através de um poder podre e corrupto !",0,false,0,,,,,,
UgwjbJfMYdjEeC0Xwul4AaABAg,Michel Silva,3 days ago,1528502957110,"NA ÉPOCA DA DILMA O GILMAR FOI CHAMADO PARA PRESIDENTE DO TSE PQ O PRESIDENTE ATUAL, DA ÉPOCA, IA FAZER UM TESTE PÚBLICO ABERTO PORQUE ANALISTAS MOSTRARAM QUE AS URNAS APRESENTAVAM PROBLEMAS. ACONTECEU QUE TAL PRESIDENTE FOI DESTITUÍDO E ASSUMIU O GILMAR QUE VETOU TAIS TESTES ABERTOS E FARIAM APENAS TESTES INTERNOS. DAÍ O RESTO VC JÁ SABE NÉ.",0,false,0,,,,,,
UgysmqR8Pqt9r3LtxzB4AaABAg,TWOBEERS PRIZZ,3 days ago,1528502957117,Eu não sei vcs...mas eu não confio nessa urna eletrônica e não vou votar. Simples.,0,false,0,,,,,,
UgwRUtkXJLuZicUFQbJ4AaABAg,Michel Silva,3 days ago,1528502957123,"ESSE PROCESSO É SÓ PRA  APARECER QUE ESTÃO VERIFICANDO E RESOLVENDO AS FALHAS, MAS NA VERDADE É SÓ DE APARÊNCIA, O STF, A MAIORIA FAZ PARTE DA QUADRILHA E O INTERESSE É COLOCAR NA PRESIDÊNCIA ÀQUELE QUE IRÁ LIVRAR A CARA DE TODOS OS BANDIDOS ENVOLVIDOS, INVESTIGADOS E ETC. É UMA PALHAÇADA!",0,false,0,,,,,,
UgygWoTrkEpST7Gou5F4AaABAg,jackson luiz ozelame,3 days ago,1528502957133,"Tao com o cu' na mao! esses vermes corruptos...se povo o brasileiro fosse unidos ,derrubavam estes safados...olha o apavoramento dessa corja!",0,false,0,,,,,,
UgxfJGnh8K8yva17G2p4AaABAg,estaneslau soares,3 days ago,1528502957142,"É NOTÓRIA  a quebra de raciocínio do advogado pelos togados, não consigo ter confiança nesses Ministros, me sinto pessimamente representado  pela classe política que os colocou  onde estão, vejo as palavras de nossa bandeira sendo desbotadas a cada dia  e dando lugar ao simbolo tão querido por eles, a foice e o martelo, e as cores em um vermelho cor de sangue tipico das ditaduras do proletário que os intelectuais picaretas tanto sonham.",0,false,0,,,,,,
UgwnjD4lCflRdCuUvw54AaABAg,Delmar Lazzeris,3 days ago,1528502957145,"STF vergonha do Brasil, canalhice pura!!!",3,false,0,,,,,,
UgwpBop_FTR5RhCE99d4AaABAg,jo santi,3 days ago,1528502957154,O STF deveria ser derrubado por vontade do povo !,0,false,0,,,,,,
UgyOdU3srPM1-NnSY9h4AaABAg,J RANGEL,3 days ago,1528502957161,Eles querem e fraudar roubar distruir tudo não importa como quem discosda que essa galera aí não quer ajudar os amiguinhos a continuar a fazer o que fazem..,0,false,0,,,,,,
UgxvrO1Iev3XF7TcIRt4AaABAg,Flavio Bonaldi,3 days ago,1528502957166,Matou à pau....  Urna sem impressora e mais uma mentira para o povo engolir.,0,false,0,,,,,,
UgxcHdqrK4xPSd6TCXx4AaABAg,tropz BR,3 days ago,1528502957176,Lixo de país,0,false,0,,,,,,
Ugycbl3FRdjroJ3UTt14AaABAg,Samuka Santos,3 days ago,1528502957184,Rebanho de Bandidos com a Torga sabe que existem falhas porque eles não  quer o voto empressor porque sabe que assim eles não poderam rouba.,0,false,0,,,,,,
UgykgEeLbrsqd4N0TG94AaABAg,Delmar Lazzeris,3 days ago,1528502957189,"Urna eletrônica é piada , é roubalheira,  de quem quer fraudar eleições,! Ta na cara que a esquerda quer a urna eletrônica para fraudar as eleições!!! Eles vão eleger quem eles querem!!!",3,false,0,,,,,,
UgzGp4b48gc-7CzWSlt4AaABAg,leuboss lru,3 days ago,1528502957197,"ali so uma metralhadora .50 no lugar do advogado, sao um bando de filhos da puta!",0,false,0,,,,,,
UgzMHHaEe_VlQ7FWGBt4AaABAg,leuboss lru,3 days ago,1528502957201,ministros  vagabundos de fato. urnas sao fraldadas 100 vagabundos!,0,false,0,,,,,,
Ugw4Xv83Bg8qr_-pILt4AaABAg,Jorge JF,3 days ago,1528502957210,"Não deixaram o advogado falar . Interromperam o tempo todo. Isso tem nome ""Medo"".
Brasil de patifarias . O povo não tem direito a não ser pagar impostos .  Quem ainda não percebeu que já estamos vivendo uma ditadura. STF ditadores do brasil.  É brasil com b minúsculo . Maiúsculo somente o STF.",0,false,0,,,,,,
UgxFd2qZhNJPfzRVpPl4AaABAg,Fabio Nunes,3 days ago,1528502957219,Esse advogadozinho deveria ser preso imediatamente (GM mode: on),0,false,0,,,,,,
UgxAi45W1tWePWcOuaB4AaABAg,Elder Pirulito,3 days ago,1528502957225,Este é o tipo de material que Jair Bolsonaro deveria estar popularizando.,0,false,0,,,,,,
Ugz0r64hgu0HzcF4ZNR4AaABAg,Flavio Bonaldi,3 days ago,1528502957231,"Mas não era para encontrar nenhuma falha, muito menos diversas!!!!  E agora, o que irão decidir?.... Ah! igualzinho na Venezuela, eu decido.  Ar urnas burladas não serão examinadas pela comissão examinadora, são milhares de urnas....",0,false,0,,,,,,
UgyAmBZ4vB0_xKpQJlt4AaABAg,Elder Pirulito,3 days ago,1528502957240,Isso não foi uma defesa. Foi um estupro.,0,false,0,,,,,,
UgxXsyWiRhX_WoZQhud4AaABAg,Mi MILI,3 days ago,1528502957250,ESSE ADVOGADO FOI EXCELENTE---E OS 11 BANDIDOS  FRAUDADORES NÃO ACEITARAM OS ARGUMENTOS,3,false,0,,,,,,
UgzjFkWa9Rw5gD2JXqV4AaABAg,Godha Marçal,3 days ago,1528502958105,GOSTARIA QUE OS MELHORES HACKERS DESSE PAÍS SE JUNTASSEM E DESSEM PAU EM TODAS AS URNAS PRA SUMIR COM OS VOTOS DE TODA POPULAÇÃO.,0,false,0,,,,,,
UgyQsQ9kLRfHiOWW_5N4AaABAg,Crescer Crescer,3 days ago,1528502958113,Olha cara de pau desses ministros mostrando surpresa!,0,false,0,,,,,,
Ugz96zXEEAb7bZO29-R4AaABAg,luiz felipe nascimento jr,3 days ago,1528502958143,"O comportamento dos ministros, foi compatível com a postura e conduta de advogados desesperados, agarrados na "" Causa das Urnas Eletrônicas.""",4,false,0,,,,,,
Ugz56f3rl7DuRs4d4jd4AaABAg,Rosângela Rabêlo,3 days ago,1528502958150,CAMBADA DE SAFADOS TODOS PREOCUPADOS! FORAM OS RESPONSÁVEIS POLO CANCELAMENTOS DO VOTO IMPRESSO! MINISTROS MAU CARÁTER! SEM EDUCAÇÃO PORQUE NÃO DEIXA O JOVEM ADVOGADOS COCLUIR A SUA FALA! REALMENTE AÍ TÊM FRAUDE NO VOTO ELETRÔNICO! PORQUE NÓS USA FUNCIONA É AQUI NESTE PAÍS LIXOOO NÃO! ESTRANHO NÉ! 🤔🤔🤔,0,false,0,,,,,,
UgxVvTa2HvF2NSJzqt54AaABAg,Rivanilda Dantas,3 days ago,1528502958159,eu não confio nas urnas só no Brasil existe essa porcaria fabricada pela Venezuela!!!!!,0,false,0,,,,,,
Ugxo1SqBg5fAn1dnARt4AaABAg,ANTONIO HENRIQUE MORAES,3 days ago,1528502958163,"INFELIZMENTE O POVO BRASILEIRO ESTÃO TODOS ESCRAVOS, ESCRAVIDÃO TOTAL DE 99% POR ESSA MINORIA DE 1% QUE ESTÃO NO COMANDO DA NAÇÃO, VEJAM O EXEMPLO DA QUEDA DA BASTILHA EM QUE O POVO SE CANSOU E ELIMINOU ESSA MINORIA DE CÂNCER DA NAÇÃO, LIMPANDO COMPLETAMENTE E DE FORMA DEFINITIVA. ACORDEM, O POVO TEM O PODER, UM CABO DE AÇO NÃO É FEITO POR SOMENTE UM FIO MAIS POR MUITOS UNIDOS, ASSIM É O POVO SOMENTE COM A UNIÃO DE TODOS DEIXAREMOS DE SER ESCRAVOS, POIS HOJE SOMOS ESCRAVOS E DESPROVIDOS DE QUALQUER DIGNIDADE QUE UM SER POSSA TER.",0,false,0,,,,,,
UgzjmNM32WsCUU0en_54AaABAg,saxzuke,3 days ago,1528502958172,O STF é uma redoma de filhos da puta,0,false,0,,,,,,
UgyCQT1PJke8-eMef3t4AaABAg,Fábio Santos,3 days ago,1528502958183,Existe um grupo muito bem articulado por trás disso...,0,false,0,,,,,,
UgzonCwyXNGWsXXFIRZ4AaABAg,D Alves,3 days ago,1528502958195,Bla bla bla...vamos enrolar o gado.,0,false,0,,,,,,
UgwiQkaR8qUaNXg_Ujx4AaABAg,D Alves,3 days ago,1528502958203,Novidade....era feita na Venezuela??? Ou ja mudaram de fabricante??,0,false,0,,,,,,
UgwMHhfW2zRNkX-sA-x4AaABAg,Cleber Caetano,3 days ago,1528502958208,"Ministros do STF muito mal educados, uma vergonha...",6,false,0,,,,,,
UgxQul2vgcr1HR9KYjF4AaABAg,Patrícia Regina,3 days ago,1528502958217,"Pessoal, assinem e compartilhem a petição que pede o impeachment de TODOS dos ministros do STF e da procuradora da republica Raquel Dodge. Não podemos mais permitir o abuso de poder deles.   http://www.peticaopublica.com.br/pview.aspx?pi=BR106703",2,false,0,,,,,,
Ugw51sjQijwBiCdnsZF4AaABAg,Carlos Silva,3 days ago,1528502958223,Intervenção militar já nesses bandidos,0,false,0,,,,,,
UgzeCby0-raWVJk20Ad4AaABAg,Álvaro Ismael Pinheiro Filho Pinheiro,3 days ago,1528502958231,Se é tão segura é só imprimir a via do votante !!!Que tanta contestação.,0,false,0,,,,,,
UgwLY3ygI3uc0GjrTpN4AaABAg,Allan Campos,3 days ago,1528502958240,MINISTRO CORRUPTOS SE BENEFICIAM DAS URNAS FRAUDULENTAS,0,false,0,,,,,,
UgxuBjVa6kCPGZv4ipR4AaABAg,Marcastle Castle,3 days ago,1528502958246,"NÃO QUEREMOS URNAS FRAUDADAS E PRONTO O DINHEIRO É NOSSO DO POVO QUEREMOS VOTO IMPRESSO POIS QUEM VAI PAGAR É O POVO, O DINHEIRO É NOSSSSSSSSSSOOOOOOOOOOOOOOOOOOO",0,false,0,,,,,,
UgxVtQMXHOIrfTWjypN4AaABAg,Álvaro Ismael Pinheiro Filho Pinheiro,3 days ago,1528502958253,Queremos cédulas de papel com vias para os votantes .,0,false,0,,,,,,
Ugwc7ekdd8XSVZW-45p4AaABAg,Megatech Informática Channel,3 days ago,1528502958261,"Desde que a urna nasceu, vários descendentes possivelmente surgiram: ilicitude, resultados falaciosos, subordinados, ou seja, jamais gerou uma eleição em que o povo seja de fato o eleitor.",0,false,0,,,,,,
Ugz__7C1r8ixZL1tPMp4AaABAg,Silvio Victor Campos,3 days ago,1528502958266,"Sou Oficial de Justiça e trabalhei na ultima Eleição e afirmo categoricamente que não só é possível como bastante fácil fraudar as eleições, uma simples substituição de um pendrive já realizaria esse intento. Eu trabalho DENTRO do sistema e não confio nele.",0,false,0,,,,,,
UgyxRawowKgIS9HZQtR4AaABAg,JOHNYS REZENDE,3 days ago,1528502958275,"sou afavor do voto eletronico , mais esese advogado foi jantado.",0,false,0,,,,,,
Ugzqz3fZG5vAl6Ibsf54AaABAg,Nivan Boot,3 days ago,1528502959029,Conversa nao qjuda com bandidos. So fqz eles ganharem tempo,0,false,0,,,,,,
UgxQxINMZwdJ69G0Zy94AaABAg,Paulo Alexandre,3 days ago,1528502959040,Bando de bandidos,0,false,0,,,,,,
Ugw0W4cuinaQTsKO6CV4AaABAg,JOÃO ALVES,3 days ago,1528502959046,FICARO TODOS NERVOSOS,0,false,0,,,,,,
UgwNkMX7g4rhD-FQEPV4AaABAg,Fazenda das Taipas,3 days ago,1528502959056,Não salva um desses malditos imundos,0,false,0,,,,,,
UgwwUApYi978sGwTjp54AaABAg,Fazenda das Taipas,3 days ago,1528502959063,"Turma de vagabundos imundos ministros do demônio, a prova está ai e vocês corromperam a votação impressa",0,false,0,,,,,,
