id,user,date,timestamp,commentText,likes,hasReplies,numberOfReplies,replies.id,replies.user,replies.date,replies.timestamp,replies.commentText,replies.likes
UgysQLKqk9LQihDCuAR4AaABAg,Fausto Fonseca,7 hours ago,1528739720048,Ciro Gomes,0,false,0,,,,,,
UgwcwKTqueyxCiutOp94AaABAg,Cândido jr,3 days ago,1528505720057,"Melhor nem comparecer nas eleições, não confio nesse sistema fraudulento!!! Colocam candidatos corruptos que os caciques dos partidos escolhem, os mesmos serão eleitos por urnas fraudadas e depois dizem ""o povo não sabe votar"", e chamam isso democracia???",0,false,0,,,,,,
UgxtUb6cYOb8YTq-3rp4AaABAg,Kadu Zama,2 weeks ago,1527555320061,"DEMORARAM PARA DESCOBRIR. SÓ LEVANTARAM ISSO PORQUE QUEM GANHAVA COM AS FRAUDES, PASSARAM A PERDER POR OUTRAS QUADRILHAS, ENTÃO AGORA A URNA NÃO É BOA. MAS A VERDADE É QUE NUNCA PRESTOU, SEMPRE HOUVE FRAUDE, COM AS URNAS ELETRÔNICAS NÃO É POSSÍVEL DETECTAR A FRAUDE.",0,false,0,,,,,,
UgwvCUFDC1_mVRfzG4p4AaABAg,Lucas Pingret,1 month ago,1526086520070,INTERVENÇÃO MILITAR PARA IMEDIATAMENTE ....COMUNISTAS NA CADEIA,0,false,0,,,,,,
Ugw6rhoZxUKvIgkX3PB4AaABAg,Lucas Pingret,1 month ago,1526086520075,A MESMA FRAUDE USADA NA VENEZUELA....O BRASIL É UM PAIS DE OTÁRIOS E BABACAS.,0,false,0,,,,,,
UgzhGN-w2pjzLNwi_th4AaABAg,Lucas Pingret,1 month ago,1526086520083,"QUANTO AO VOTO IMPRESSO NÃO PODE HAVER ALGUMA DISCUÇÃO, É LEI E NÃO CABE QUALQUER APARTE PRINCIPALMENTE PELOS COMUNISTAS",0,false,0,,,,,,
UgxoQpoPB_sA22cNV_14AaABAg,Lucas Pingret,1 month ago,1526086520091,"O BANDIDO FHC É O AUTOR DESTE CRIME CONTRA A NAÇÃO BRASILEIRA, MERECEDOR DA FORCA",0,false,0,,,,,,
UgwRpvgO3bbj4DMpf0x4AaABAg,Paulo Roberto,1 month ago,1526086520095,Quem era o governo em 90,0,false,0,,,,,,
Ugxe_E0ptjPiQKFktXR4AaABAg,manze Pereira,2 months ago,1523494520103,VOTO IMPRESSO VOTO IMPRESSO VOTO IMPRESSO  VOTO IMPRESSO  VOTO IMPRESSO  VOTO IMPRESSO VOTO IMPRSSO,0,false,0,,,,,,
UgyPRGtH4tuiA7XkbS14AaABAg,Alberto Marques,2 months ago,1523494520108,Não vamos aceitar povo na rua urgente não vamos aceitar,0,false,0,,,,,,
Ugy4ycrhQ0uvd-Hm2tN4AaABAg,Alberto Marques,2 months ago,1523494520116,O povo paga essa conta nos brasileiros com certeza deposita esse dinheiro,0,false,0,,,,,,
Ugw_5tSsVAKMb_e_VpV4AaABAg,Elimara,2 months ago,1523494520123,Voto impresso nas eleições 2018. Quero ver o PT ganhar eleições.,1,false,0,,,,,,
Ugw02hfjmEWnRMIW7iZ4AaABAg,Sandro Wagner,2 months ago,1523494520129,"se a nasa é invadida, essas urnas não seriam?",0,false,0,,,,,,
UgxjhjP43DLFSCtGJcB4AaABAg,Sergio Ribeiro,2 months ago,1523494520144,Quem criou a urna eletrônica foi o governo do Fernando Henrique Cardoso ou seja foi o PSDB ou seja foi a direita estuda porra,0,false,0,,,,,,
UgzS7KfuPp-ot6bYztd4AaABAg,Fabio Pinheiro Carvalho,2 months ago,1523494520152,Se o Bolsonaro não ganhar vai ficar muito nítido a fraude nas urnas eletrônicas kkkk,0,false,0,,,,,,
UgwBBGIUTITrFQDn4k94AaABAg,Maria Sartori,2 months ago,1523494520162,É  SÓ  AUDITAR a eleição  do RUIMDDAD em SP que haverá  FARTA  comprovação e MUNIÇÃO  contra essa URNA VENEZUELANA,0,false,0,,,,,,
UgwcsgaeZuBI_AN0e9t4AaABAg,bluejysm2007,2 months ago,1523494520167,Fora as urnas eletrônicas e sim ao voto impresso já.,0,false,0,,,,,,
UgxAF-f9aPfLF0-XC5N4AaABAg,11WallStreet,2 months ago,1523494520176,"ISTO NAO PODE FICAR BARATO, NAO NAO NAO",0,false,0,,,,,,
Ugz3owlO9LlKjpvU9XB4AaABAg,MARCOS J P C ALVES,2 months ago,1523494520183,A luta é pelo voto de PAPEL ! O voto impresso pela máquina maligna do 😈 tem que ser estirpada. O voto impresso é um olhar pelo da máquina.,0,false,0,,,,,,
UgybmBVHeBrIdAei0854AaABAg,Jose Candido,2 months ago,1523494520190,Somos todos Bolsonaro presidente do Brasil em 2018,0,false,0,,,,,,
UgzfSy_gOh97V6jX66J4AaABAg,C CMaia,2 months ago,1523494520821,"Não vamos nos entregar não, Seu Fidelix. Está mudando, vamos ter fé que tem gente boa trabalhando pra mudar, pra chutar bundas, pra provar que o bem tem força.",0,false,0,,,,,,
UgwB13uUgmalbgpJXMV4AaABAg,Antônio Nonato,2 months ago,1523494520830,"Levy, o Brasil só tem um jeito, é melhor Jair se acostumando, no primeiro turno com 70% dos votos, facil fácil.",0,false,0,,,,,,
UgwlTb8veIFv-nDrMbl4AaABAg,Hélio Pereira Cunha Pereira Cunha,3 months ago,1520816120840,"TRAIDOR  DA PÁTRIA.  EU  TE ADMIRAVA, MAS  PERCEBI QUE   SUA  VAIDADE É MAIOR  QUE SEU  SENTIDO PATRIÓTICO. VC   FIDELIX, JAMAIS SERÁ  PRESIDENTE  DA  REPÚBLICA E  SABE  PQ? PQ  VC  É  SOBERBO E  NÃO   DIMINUI  PRA  QUE OUTROS CRESÇAM.",0,false,0,,,,,,
UgyQTdHKsMn7yhJHvXV4AaABAg,Fabio Teixeira,3 months ago,1520816120852,Levi Fidélis você e o único brasileiro inteligente que o Brasil tem hoje,0,false,0,,,,,,
UgzOPaQZ7DY41fC32Z94AaABAg,Fabio Teixeira,3 months ago,1520816120862,"Faz tempo que Levi fidelixe o dr Enéias carneiro vem acordando o povo brasileiro 
Mais o comunismo não deixa que o povo acorde . pra sair do comunismo só o conhecimento acorda o povo😀
Eles tomaram as escolas a mais de 30 anos no Brasil e 15 a 20 anos só pra tentar voltar o normal.",0,false,0,,,,,,
UgxsZJ4h8leqMQFpOu14AaABAg,Yan Fagundes,3 months ago,1520816120874,"""Não reproduz""",0,false,0,,,,,,
UgzbaWhn8mLJySLSzu54AaABAg,Leandro Mota,3 months ago,1520816120878,E triste e  povo sofrendo...,0,false,0,,,,,,
UgxRZE4hN5ooOGmaK594AaABAg,Leandro Mota,3 months ago,1520816120888,Vamos sair nas ruas e pedir voto impresso.,0,false,0,,,,,,
Ugz75pMdPkxhv3Z4U1Z4AaABAg,Faith makes all things possible!!!!!!!!!!! Darkners,3 months ago,1520816120898,"Tem gente que ainda acredita nessa farsa bando de gado mesmo, enquanto vocês estiverem ocupados com suas novelas e seus times de futebol os políticos se fartam  com o dinheiro de vocês, raça de alienados sai da maldita zona de conforto e vai pra Brasilia brigar pelo seu País,mas como se a ""TV"" não deixa o povo pensar e raciocinar resultado milhões de zumbis sugados pelo sistema no dia a dia enquanto estiverem assim vão ser sempre simples escravos do Monstro chamado ipva,cofins,dpvat iptu,e por ai vai uma carga tributaria abismal sem fim.",0,false,0,,,,,,
UgyR_3Ti63IyBcKPkQp4AaABAg,josé amaro Silva,3 months ago,1520816120908,"Urnas eletrônicas não passam de intestino. Fidelix, lula, Temer... não passam de cocôs. Não acredito em nenhum destes putos!",1,false,0,,,,,,
UgwD99velq5tP_Sc2Xl4AaABAg,Monsenhor Castro,3 months ago,1520816120914,"Hoje vemos que os melhores candidatos que tínhamos na década de 90/2000,  era Levy Fidelis e o saudoso Dr Enéas Carneiro,  que alhiás foram podados também no tempo de TV. E votamos em quem ?  Votamos nos canalhas comunistas, psdb, pt e pmdb, e estamos pagando muito caro por isso.",1,false,0,,,,,,
UgytpbRkmf9k5LOZzup4AaABAg,Oswald Fsouza,3 months ago,1520816120924,Bolsonaro 2018,0,false,0,,,,,,
UgwzCi1sc662u6zwbA14AaABAg,Edward Ruanas,3 months ago,1520816120935,É uma farsa o sistema de voto eletrônico!,0,false,0,,,,,,
UgzfmEaOtVRT0PfHA_d4AaABAg,Gustavo Fonseca,3 months ago,1520816120942,"Ninguém utiliza urna eletrônica mas o Brasil sim, ou seja, todo mundo tá errado e o BR tá certo. É brincadeira.",1,false,0,,,,,,
Ugx_nzkUUve-_7c20NB4AaABAg,Irene Grams,3 months ago,1520816120951,Vamos fazer movimento se não for voto impresso não votaremos em urna eletronica,0,false,0,,,,,,
UgzpKgGEPhCLtAuQdrx4AaABAg,DAVINCCI LOURENÇO DE ALMEIDA,3 months ago,1520816120960,CELSO RUSSUMANO CEDEU LUGAR PARA HADDAD AÉCIO NEVES CEDEU LUGAR PARA DILMA DO SATANÁS,0,false,0,,,,,,
UgzJJ6DYvzEJ-78wU-54AaABAg,vivaldo mendes costa Costa,3 months ago,1520816120969,"BOLSONARO PODERIA GANHAR AS ELEIÇÕES EM PRIMEIRO TURNO COM VOTO IMPRESSO, POREM COM URNAS ELETRONICAS JAMAIS SERA ELEITO, QUE PENA",1,false,0,,,,,,
UgyIr9rFhsdTdqOS9FF4AaABAg,Marcelo Ferreira,4 months ago,1518396920973,Eu me surpreendi com esse vídeo e isso que o povo tem que prestar atenção esse merece também ser presidente do Brasil Levi meus parabéns pelo seu discurso,0,false,0,,,,,,
UgwDEOi3wMAHm1OAHsN4AaABAg,Luiz Correa,4 months ago,1518396920982,"URNAS SEM RECIBO É GOLPE COMUNISTA!
Necessitamos de Intervenção Militar para obtermos Urnas com Recibo para que nossa Nação possa ter garantia na Justiça Eleitoral no Brasil!
Não precisamos de Fraude Eleitoral de novo; onde nós só vemos ""VIOLAÇÂO SECRETA NA CONTAGEM"" dos Votos!
Até porque essa Raquel Dodge da PGR faz parte dessa Rede de Comunista Bolivarianos os quais não desejam Lisura nas Urnas Venezuelanas Fraudáveis dessa Fraude Eleitoral chamado de tse!",0,false,0,,,,,,
UgyVNBTrSFbjkCVY4Bd4AaABAg,Justino João Selis,4 months ago,1518396920991,"O Brasil não precisa de eleições, mas sim de militares no poder.",0,false,0,,,,,,
UgyoUrGis7OBA89aDpF4AaABAg,Music Play-USA,4 months ago,1518396921827,se n tiver impresso foda-se não voto,1,false,0,,,,,,
UgzU0ZA0vcX1_B3TW2t4AaABAg,Sil sras,4 months ago,1518396921837,"Guarda Nacional será formada por Reservistas das Forças Armadas e substituirá Força Nacional
 24/01/2018 Messias Dias  33 Comentários
Estudos do Ministério da Defesa, Justiça e Gabinete de Segurança Institucional, sugere a criação da Guarda Nacional Permanente, em substituição a FNS – Força Nacional de Segurança  http://ibarp.org.br/ – CADASTRE-SE

http://www.defesanet.com.br/pf_prf/noticia/28238/Guarda-Nacional-Permanente—Governo-Temer-inicia-discussoes/    


Foto Imagem – DefesaNet de 23 de janeiro de 2018 – Substituição da FNS por Guarda Nacional Permanente
O ministro da Defesa, Raul Jungmann (PPS), informou nesta segunda-feira (22) no Debate da Super Manhã da Rádio Jornal que o presidente Michel Temer (MDB) solicitou estudos sobre a criação da Guarda Nacional Permanente. Formada por um efetivo permanente, a Guarda atuaria no combate ao tráfico de drogas e de armas nas fronteiras e na preservação da ordem pública em casos extraordinários.

Segundo o ministro, esse efetivo atenderia a demandas de segurança no país com uma capacitação especializada em atuação policial, uma solução intermediária entre as Polícias e as Forças Armadas. Atualmente a Força Nacional de Segurança, cumpre o papel de preservação da ordem pública, combatendo grandes rebeliões em presídios federais ou auxiliando na segurança de Estados em que a polícia se encontra em greve, por exemplo. Porém, eles só são convocados de acordo com alguma eventual necessidade.

“A Constituinte de 1988 era oito ou 80. Ou você ficava com as forças de segurança locais, na situação ordinária, ou extraordinariamente você convoca as Forças Armadas, não tem nada no meio. Deveria ser a Força Nacional de Segurança, mas a Força Nacional de Segurança é uma coisa que você organiza para a tarefa, ou seja, eu tenho um problema no Pará, então eu pego 100 de Pernambuco, 500 de São Paulo (POLICIAIS), que é o que acontece hoje”, afirmou o ministro.

Reunião

A criação da Guarda Nacional Permanente foi discutida em reunião no início de janeiro com Temer, Raul Jungmann, representantes da Secretaria Nacional de Segurança Pública (SENASP) e do Gabinete de Segurança Institucional (GSI). Os estudos concluídos devem ser enviados ao presidente ainda no mês de Janeiro. Para ser viabilizada, a Guarda deve ser aprovada por meio de Projeto de Lei pelo Congresso Nacional.

NOTA DO EDITOR: RESERVISTAS DAS FORÇAS ARMADAS COMO PRIORIDADE – http://ibarp.org.br/ – CADASTRE-SE

Dentro dos estudos estaria a previsão de aproveitamento dos Reservistas das Forças Armadas, especialmente os oriundos de Tropas Operacionais, tais como: Comandos, Paraquedistas, Fuzileiros Navais, Selva, Polícia do Exército, Polícia da Aeronáutica, Batalhões de Infantaria leve, Reservistas de 1ª Categoria de Tropas Operacionais, dentre outros.

“Em 2015, defendemos tal propósito em Carta ao Comandante do Exército” – http://ibarp.org.br/ – CADASTRE-SE",0,false,0,,,,,,
UgzvBHBgLmoyq3iBIft4AaABAg,BOLSONARO PRESIDENTE EM 2018,4 months ago,1518396921842,Mais uma vez o Judiciário vai nos fazer de palhaços nesta eleição de cartas marcadas. O STF anti democrático formado por bandidos esquerdistas da pior espécie. Levi Fidelix esta corretíssimo. Espero que se alie a Bolsonaro e participe de seu Governo,0,false,0,,,,,,
Ugzm4MG9kjVQnX5G1wJ4AaABAg,Orlando Carneiro,4 months ago,1518396921851,"O que tenho à dizer é obrigado Levy Fidelix por sua coragem em nos defender, em denunciar toda essa bandidagem existente neste país, começando por essa imprensa corrompida com muitos profissionais de comunicação fingidos e delinquentes. Como exemplo cito o tal prof. Villa da Jovem Pan que ao invés de usar seu expediente como analista político e  denunciar  toda este safadeza como as urnas eletrônicas, denunciando esta bandalheira e conclamar a todos a se juntarem em favor do voto lícito ou seja o voto impresso, fica com veemência a atacar Jair Bolsonaro como se esse fosse o responsável de toda tragédia que vivenciamos.",0,false,0,,,,,,
Ugw9YN9-P_b0FFFhvJ14AaABAg,jose alves Alves,4 months ago,1518396921860,Fraudulenta mesmo,0,false,0,,,,,,
Ugxn3b-BDg_i-vCfxtF4AaABAg,RODRIGO PEREIRA,4 months ago,1518396921866,Boca no TROMBONE!!....,0,false,0,,,,,,
UgwKO3ifGWmwXsk8eM94AaABAg,ЯΔГΩ РΩLΪΓΪСΩ,4 months ago,1518396921875,Acorda povo gado!!!,0,false,0,,,,,,
UgzlmNLtflMBYZtwsS94AaABAg,Julio Cesar,4 months ago,1518396921886,Lamento mto. Levi vc era meu unico candidato. Ms vc tbm eh a favor do voto impresso. Qm eh contra a vontade do povo n merece meu voto e nem da minha familia. Voto impresso nada mais eh q a ultima versao das urnas eletronicas de Caracas da Venezuela q assugaro o governo autoritarismo q se tornou a Venezuela e ainda enviamos bilhoes pra Venezuela. Queremos voto no papel. Cgega d sermos enganados e manipulados.,0,false,0,,,,,,
Ugy-KO5YyJbg6-5q7Ex4AaABAg,Jô Sá,4 months ago,1518396921890,"Tem que fazer as chamadas em todas as postagens sobre eleições...""Boicote às urnas""...Ninguém deve votar!. Se começarmos a fazer esta chamada em todas as redes e colocar o link como o deste vídeo, quem sabe traga o resultado esperado...Nénão?...afffff",1,false,0,,,,,,
Ugxp7ypEr5zGNRUyi3x4AaABAg,Jose Afonso Rocha,4 months ago,1518396921900,"Lamentavelmente o Dr. Enéas morreu, mas graças a Deus ficou o Sr. Levy Fidelis, que deveria ser presidente, tem discurso e conhecimento. Estas exposições são extremamente corretas. Sou Jaroc",0,false,0,,,,,,
Ugze9Gi5GoWeVxWDL-p4AaABAg,Tiago Matos,5 months ago,1515718521909,"Se estas urnas são fraudadas mesmo, Bolsonaro nunca ganhará. Temos que acabar com essas urnas. Explodi-las, quebrá-las e exigir voto no papel! O povo faz manifestação e quebra tudo quanto é tipo de prédios públicos, mas o que deveria mesmo ser quebrado, são essas urnas",0,false,0,,,,,,
UgyhtgixaDvcl2hv4mZ4AaABAg,SILÊNCIO 607,5 months ago,1515718521913,SOMOS MAIS DE CEM MILHOES DE ELEITORES CONTRA UM MERDA CHAMADO GILMAR MENDES DO STE QUE QUER MANTER AS URNAS ELETRÔNICAS FRAUDOLENTAS  PARA QUE SEUS AMIGOS CRIMINOSOS DE COLARINHO BRANCOS CONTINUEN  NO PODER. QUANDO O POVO SE UNIR E EXIGIR O FIM DAS URNAS ESTE CANALHA NAO TERA MAIS CHANCE !!!PORQUE CEM MILHOES CONTRA UM !!! A CHANCE DELE É ZERO !!!!,0,false,0,,,,,,
UgwsDGcz-_idgbA_O0p4AaABAg,gomes da silva Silva,5 months ago,1515718521922,"Prisão perpétua urgente urgentíssima para todos os criminosos e comunistas corruptos por crimes de leza pátria Bolsonaro Presidente do Brasil vice presidente General Mourão, você tem que vim Senador federal",0,false,0,,,,,,
Ugw-zwhQef3-8hXnfXF4AaABAg,Carlos André Oliveira,5 months ago,1515718521932,"É farsa mesmo,por um bando maligno.",3,false,0,,,,,,
UgyP4JQ4HzrJGc32wnB4AaABAg,Carlos Araújo,5 months ago,1515718521939,"O VOTO TEM QUE SER IMPRESSO PARA QUE POSSAMOS RECONTÁ-LOS EM CASO DE ALGUMA DÚVIDA, SE NÃO FOR ASSIM, EU CONCLAMO MEUS IRMÃOS BRASILEIROS A NÃO VOTAREM MAIS, NÃO VOTEM EM BRANCO OU NULO, POIS AS URNAS ESTARÃO FRAUDADAS E  ESSES VOTOS IRÃO PARA O GOVERNO, A NÃO SER QUE O VOTO SEJA IMPRESSO, AÍ NÃO TEM PROBLEMA, MAS SE NÃO FOR, APENAS JUSTIFIQUEM SEUS VOTOS EM OUTRA JUNTA. ""ACORDA BRASIL"".",0,false,0,,,,,,
Ugzx8HmbPvCMgER59X14AaABAg,"TORCIDA DO TIMÃO, DE SERTÂNIA - PE",5 months ago,1515718521948,Eu nunca confiei nesses BOSTAS DE URNAS DE MERDA ...,0,false,0,,,,,,
Ugw17NL2RgfqP1VGPHt4AaABAg,Helder Farias Forte,5 months ago,1515718521957,Intervenção Civil Militar Já !! Governo Militar por tempo necessário !,0,false,0,,,,,,
Ugwjn5m4TbuhAE2eo6R4AaABAg,Sinister S,6 months ago,1513040121966,Esse pilantra chamado Levy Fidelix fala sobre perpetuação da esquerda ao mesmo tempo detonando  o Jair Bolsonaro. É somente mais um pilantra travestido.,0,false,0,,,,,,
UgzynDplGWunK1XcVFt4AaABAg,Devanir Borba,6 months ago,1513040121978,"Toda a astúcia que vemos acontecendo no Brasil, faz parte de um plano maior :a instalação de um governo mundial. Então, tudo o que não presta vem sendo implantado no mundo, para se chegar a um governo totalitário e absoluto no mundo.",0,false,0,,,,,,
UgyN-qhSxmyMTn49jGV4AaABAg,D. P. Mendonça,6 months ago,1513040121987,"Se estivesse mais interessado em explicar do que em aparecer (com seus cabelos no ombro e bigode pintados e tentativa de disfarce da ""calva""), a direita conservadora poderia estar bem representada.
Desse jeito, com esse desempenho teatral, continua nessa ""pobre roubada"" em que se encontra!",0,false,0,,,,,,
UgwbhG51iS2t0dBrbHV4AaABAg,José Silvio,6 months ago,1513040122825,eu não voto em urnas eletronicas ...pra que votar....uma palhaçada,0,false,0,,,,,,
UgypKfVRawuz4rJvkN94AaABAg,TheGios100,6 months ago,1513040122836,Só falta dizer que três raças de reptilianos estão no poder do governo mundial,0,false,0,,,,,,
Ugx8GA7YJjlh7Q0FBhB4AaABAg,Maria Donato,6 months ago,1513040122846,As urnas eletrônicas é uma frabricas de fazer políticos corruptos genocidas comunista estão roubando destruindo o nosso Brasil acabou morreu!,0,false,0,,,,,,
UgwnBjKehdOTSvNLH_l4AaABAg,Luciano Ferreira,6 months ago,1513040122856,Bolsonaro2018 :D,4,false,0,,,,,,
Ugxz6c1HGlUs7sT-wBF4AaABAg,Flavio Bonaldi,8 months ago,1507769722879,"Título do vídeo é corretíssimo, concordo plenamente.",2,false,0,,,,,,
UgyXpteUsS4l5wJECCx4AaABAg,Fabricio Northeast,9 months ago,1505177722888,Levy Fidelix 2018.,1,false,0,,,,,,
UgwEya4_qm0OHflthlB4AaABAg,Rui Andrada,9 months ago,1505177722898,#SemEstado2018,0,false,0,,,,,,
Ugzut6vpCZYKuIfnDiR4AaABAg,Adriano Heleno,9 months ago,1505177722904,"Nós somos mesmo um povo dos mais medíocres,demos a chance para uma mulher que não sabe a que veio,uma verdadeira porta,um pinguço machista populista semi analfabeto​,é um professor de quinta categoria burguês que não crê em Deus,e conseguimos deixar de votar em um Dr Enéas,ou um Levi,nesse caso eu fico a pensar: ""Do que é feito o cérebro do brasileiro?"".",7,true,2,,,,,,
,,,,,,,,Ugzut6vpCZYKuIfnDiR4AaABAg.8WsL5SLQPCo8ZWcKPeobBw,Adriano Heleno,7 months ago,1510448123273,"thesun &themoon Caramba,acho que isso mesmo,kkkkkkkk",1
,,,,,,,,Ugzut6vpCZYKuIfnDiR4AaABAg.8WsL5SLQPCo8d-DPfsuOdq,Leonardo Lawlyet,3 months ago,1520816123283,A direita mesmo vai fazer isso de novo. vao votar no bolsonaro ao invés de votar no fidelix,1
Ugx3NbeCx-rqgcWFbO14AaABAg,Gabriel Peixoto,9 months ago,1505177722915,"Esse Levy Fidelix é brilhante, seria com certeza um ótimo presidente para nossa nação não tenho dúvidas quanto a isso!",15,true,2,,,,,,
,,,,,,,,Ugx3NbeCx-rqgcWFbO14AaABAg.8WIAsfyFaWz8ZGWViC17Ss,rafael darabas,7 months ago,1510448123308,"GVBRIΣL P3IXOTO boa, curta a minha pagina no Face LEVY PRESIDENTE URGENTE e vamos a luta",2
,,,,,,,,Ugx3NbeCx-rqgcWFbO14AaABAg.8WIAsfyFaWz8cKLmoxQ2T8,BOLSONARO PRESIDENTE EM 2018,4 months ago,1518396923311,Levi deveria se aliar a Bolsonaro e participar de seu Governo.,0
UgwLwtPjlPnEkqcxjEF4AaABAg,Daurio Prado,10 months ago,1502499322927,NÃO DEVERIAMOS ACEITAR URNAS ELETRONICAS,2,false,0,,,,,,
UgxscPFuzIQYJYct5gx4AaABAg,Alexandre Magno,10 months ago,1502499322936,"Levy Fidelis.....
vocês da ""direita"" estão de brincadeira!
Lixo puro.",0,false,0,,,,,,
Ugxu_Ll8dZ7pxkE9Y6l4AaABAg,Edson Chaves,10 months ago,1502499322947,"HACKERS CONSEGUEM ENTRAR EM SITES DA NASA, FBI, CIA E NÃO CONSEGUEM MEXER NESTAS BOSTAS DE URNAS ELETRÔNICAS ?? ME ENGANA QUE EU GOSTO !!!!!!!",10,false,0,,,,,,
UgwlrHuRGFl9F_cyS2B4AaABAg,Ana Claudia B. Constancio dos Santos,10 months ago,1502499322956,Vamos votar pela saída de Prefeitos ou governadores que não cumpram seu papel. Através de um plebiscito o povo insatisfeito poderá fazer isto! Apoie esta ideia..https://www12.senado.leg.br/ecidadania/visualizacaoideia?id=86934,0,false,0,,,,,,
Ugz6djPm7TF4tX8g2L94AaABAg,Valéria Rocha,10 months ago,1502499322963,Bolsonaro 2018,6,false,0,,,,,,
UgzKLVMO9ZhHfoY9ZgZ4AaABAg,AURY GAMES,10 months ago,1502499322971,Bolsonaro presidente 2018 Levy Fidelix vice,1,false,0,,,,,,
Ugx4BNQg6g8WKN0_IuN4AaABAg,Macris frafer,10 months ago,1502499322979,"É mesmo! A grande imprensa não vem por que é vendida, não é porque esse cara é ridículo e está aproveitando uma chance que essa direita perdida está dando,  para falar qualquer bobagem! Inacreditável! Essa é inacreditável!",0,false,0,,,,,,
UgyTmBrhuqDd1MZ98tN4AaABAg,Macris frafer,10 months ago,1502499322988,"Eu sabia! Eu sabia que o grande estadista Levy Fidelix não ganhava as eleições por causa das urnas! Eu sabia! Como pode ser que esse grande estadista com esse grande projeto do Aero Trem nunca ganhava? É lógico! Só pode ser culpa das urnas eletrônicas! Francamente, vocês perderam o bom senso! Esse cara está falando exatamente tudo o que vocês querem ouvir, e ainda tirando a culpa da sociedade que fez merda, sabendo ou sem saber, e não quer assumir, assim essa coisa não vai longe, não! Quem não assume o erro, não procura consertar, é uma vergonha! Vergonha! Levy Fidelix sendo levado a sério! Gostaria que fosse piada!",1,false,0,,,,,,
UgxL2eZXrUlZ9FJFKRR4AaABAg,Erminio Barbosa,10 months ago,1502499322999,TEU CÚ Ô BIGODE DE PÊLO DE PAU! SE FOR NO PAPEL ENTÃO É QUE FODE MESMO! SE FOSSE ASSIM NENHUM CANDIDATO DE OUTRO PARTIDO GANHAVA!,0,false,0,,,,,,
Ugz9EaZTeGCwSHby5414AaABAg,Marcelo Andrade Andrade,10 months ago,1502499323010,inteligência pura.,1,false,0,,,,,,
UgwQPFVDTr2t1bLx-yB4AaABAg,Otávio Oliver,10 months ago,1502499323016,Ele seria o vice perfeito pro Bolsonaro.,3,false,0,,,,,,
UgzJa2BR7lu9RoTz_DR4AaABAg,domrock2012,10 months ago,1502499323994,"Essa urna eletrônica do satanás, tem que ser extirpada da face da terra, projeto comunista do cão, #Bolsonaro2018 e Levy vice",5,false,0,,,,,,
UgwKYc_R3WBx8dc9Sft4AaABAg,Ivan Silva Gonçalves,10 months ago,1502499324005,MUITO OBRIGADO!,1,false,0,,,,,,
UgwseTwGQwyVD1TBKCh4AaABAg,Nanci Correa Martins,10 months ago,1502499324011,Nunca vi ninguem na rua fazendo pesquisas !!!!!,1,false,0,,,,,,
UgyP8KdrikWMKYcD6HR4AaABAg,claudionorsj,10 months ago,1502499324020,"Como é que um canal se nomeia ""Verdade política"" afirma que as urnas são uma farsa para manter esquerda no poder? Se fosse assim, não haveria partidos de direita na Câmara, Senado, governos estaduais e prefeituras...",0,true,1,,,,,,
,,,,,,,,UgyP8KdrikWMKYcD6HR4AaABAg.8VjuuCDBGFm8ZckmCucX3P,Eliane Beck Eidt Beck Eidt,7 months ago,1510448124528,A que governo de direita vc se refere? kkkkkkkkk,0
Ugxqm7bo1zqwjWa_y4Z4AaABAg,Moreno,10 months ago,1502499324044,"Se nao fossem esses homens: mito, levi, magno, caiado etc, oq seria do Brasil?",1,false,0,,,,,,
UgwYfCDaXIDETBNrMrZ4AaABAg,Luis  Vieira,10 months ago,1502499324054,em São Paulo o PSDB sempre ganha será que tem fraude? ??,4,true,2,,,,,,
,,,,,,,,UgwYfCDaXIDETBNrMrZ4AaABAg.8VjjdfbVo6L8ceS-CyrUuU,Lya 2017,3 months ago,1520816124549,Luis  Vieira Ainda tem dúvidas? Pesquise e encontrarás. Você não tem noção de que maioria dos partidos são capazes de fazer. Você saberá quem são os verdadeiros por destras de suas máscaras.,0
,,,,,,,,UgwYfCDaXIDETBNrMrZ4AaABAg.8VjjdfbVo6L8eQnta-YqUQ,Luiza,2 months ago,1523494524552,Luis  Vieira Porque a dúvida??,0
UgwieN-SzYkCxaATzvB4AaABAg,Marcos Siqueira,10 months ago,1502499324113,Bolsonaro 2018 presidente sim,0,false,0,,,,,,
UgxHNuF0fFDDZDydcNJ4AaABAg,Marcos Siqueira,10 months ago,1502499324121,Esse cara é fera show,4,false,0,,,,,,
UgzMtASCwwUC-L1Trml4AaABAg,Fredy Santos,10 months ago,1502499324124,Fora urnas fraudulentas malditas,17,false,0,,,,,,
UgzHtl9r_b-9Ep6kShx4AaABAg,elisabeth bornsen,10 months ago,1502499324132,PRECISA ACABAR COM URNA ELETRÔNICA URGENTE. O POVO PRECISA IR PARA AS RUAS E ACABAR COM ESSA PROMISCUIDADE E ROUBALHEIRA DESSA ESQUERDA CAVIAR .,1,false,0,,,,,,
Ugw_ACvo9LrY7gL1YwN4AaABAg,dragon mall,10 months ago,1502499324135,"Id digital + voto papel 

Fim mec, cef, bndes, concessoes, autarquias, fumdacoes, cartorios....independencia ou morte",0,false,0,,,,,,
UgxrpYa3XkS-ZbusH6l4AaABAg,Regina Regina,10 months ago,1502499324145,Esse Levy Fidelix é um homem muito inteligente.Pena que ninguém vê.LIKE PRO CANAL INFORMATIVO☆☆☆☆,4,true,1,,,,,,
,,,,,,,,UgxrpYa3XkS-ZbusH6l4AaABAg.8VjQ0xDkciA8Vjb5ogZ9ZX,vitor Vitor,10 months ago,1502499324513,ola regina,0
UghIEx57aAlaqXgCoAEC,antonio ozorio Santos,10 months ago,1502499324157,Levi fidelix ou Bolsonaro ?,14,true,8,,,,,,
,,,,,,,,UghIEx57aAlaqXgCoAEC.8VjKTCuaVNJ8VjalA5QcBl,vitor Vitor,10 months ago,1502499324670,bolsonaro com ajuda de Levi,5
,,,,,,,,UghIEx57aAlaqXgCoAEC.8VjKTCuaVNJ8VkVxlojIy6,Otávio Oliver,10 months ago,1502499324679,Levy vice do Bolsonaro.,9
,,,,,,,,UghIEx57aAlaqXgCoAEC.8VjKTCuaVNJ8Vl95tvJXT6,antonio ozorio Santos,10 months ago,1502499324690,boa aprovado,3
,,,,,,,,UghIEx57aAlaqXgCoAEC.8VjKTCuaVNJ8WFLgODD8Nf,Ricardo Teatrologia Política,9 months ago,1505177724700,Bolsonaro presidente e Levy Fidelix vice. Seria perfeito,5
