id,user,date,timestamp,commentText,likes,hasReplies,numberOfReplies,replies.id,replies.user,replies.date,replies.timestamp,replies.commentText,replies.likes
UgjhNsh1soEYTHgCoAEC,Ulysses da Costa Pereira,3 years ago,1434070448712,Quem vai fazer essas coisas Otário?,0,true,1,,,,,,
,,,,,,,,UgjhNsh1soEYTHgCoAEC.7-H0Z7-BTAw7-JZaamoNH9,Canal do Otario,3 years ago,1434070449043,Espero que ninguém...,0
Ugi39KFUGQITRngCoAEC,Tiago Reis,3 years ago,1434070448719,Kkkk muito foda. É o melhor canal brasileiro.  Democrático e verdadeiro.,0,false,0,,,,,,
UgiMaVznGIaRnngCoAEC,Mirella Ferro,3 years ago,1434070448725,Sera q sem querer eu tocar na tela da urna ela quebra ou sei la oq?,0,false,0,,,,,,
UggBJw--himc7XgCoAEC,Todeolho Nabarata,3 years ago,1434070448731,E a galera ainda não entendeu o vídeo? Tamos fudidos mesmo.,0,false,0,,,,,,
Ugh1Oj1xwK6DengCoAEC,Tony Nugent,3 years ago,1434070448736,+OtarioAnonymous (Canal do Otário) Sugiro que você poste no +Canal do Otário (Responde) esse vídeo comentado....,0,true,1,,,,,,
,,,,,,,,Ugh1Oj1xwK6DengCoAEC.7-H0Z7-TOCx7-Kr3OR-8qu,Canal do Otario,3 years ago,1434070449114,É uma possibilidade ;-),2
Ugh4q4PijiUnbngCoAEC,Cadu Silveira,3 years ago,1434070448746,Cara eu dei like no video pela causa. Mas esse video foi mt ruim. Sem nenhum proposito aparente. Ja entendi a ironia das urnas mas dai me explicar q nao devo mandar o cachorro cagar na urna eh demais ne. Volta com as denuncias po!,0,false,0,,,,,,
Ugiyrk_bwnFZcngCoAEC,Dr. Leandro Almeida,3 years ago,1434070450107,Acho que ele pediu pra quebrar sáporra galera! uaheuaheuaheuaheuahe,0,false,0,,,,,,
UgjIXp8-vGdvrXgCoAEC,Rafael Almeida,3 years ago,1434070450113,"Ei senhor otario, explica o que mudou com com essa nova regra de meia entrada e essa nova carteirinha de estudante nacional. fiquei com duvidas pra saber se tem alguma pegadinha ou algo do tipo",0,false,0,,,,,,
Ugg_8or0PzwzangCoAEC,Juliokiabbo,3 years ago,1434070450120,Se uma ÚNICA urna for danificada e os voto forem perdidos pode significar a mudança do atual sistema de votos brasileiro. Quem aí se candidata a ficar alguns dias presos por uma causa maior?,0,false,0,,,,,,
UghTdO38KeX9t3gCoAEC,Daniel,3 years ago,1434070450123,é sério q tem gente q n entendeu o video?,0,false,0,,,,,,
Ugi_sLhh4s-H9XgCoAEC,Lucas Rocha,3 years ago,1434070450143,"Esse canal realmente é para OTÁRIOS. Nada mais. É muita irresponsabilidade um vídeo desse. Ainda mais com um público que tem, que não tem capacidade crítica mínima. Os caras não sabem ABSOLUTAMENTE NADA sobre a logística das urnas eletrônicas e o funcionamento dos sistemas eleitorais no Brasil e querem criticar o sistema... Prega que os eleitores não acreditem nas afirmações na Justiça Eleitoral, mas não faz mais do que lançar SUPOSIÇÕES ALEATÓRIAS tentando legitimar seu discurso conspiracionista barato. O pior, parte da premissa de que se ""nenhum outro grande país"" usa um sistema eletrônico, é porque o nosso é falho, ou seja, que somos incapazes de sermos bons e pioneiros em qualquer área. Ao invés de ficar lançando esses vídeos sem qualquer conteúdo concreto, deveria realmente buscar entender sobre os temas que fala e fazer algo de relevante para a sociedade. Por que não menciona em seus vídeos conspiracionistas sobre a urna eletrônica que o Ministério Público, OAB e todos os partidos podem elaborar programas próprios, em mídias próprias, pra rodar nas urnas e verificar o funcionamento do sistema? Por que não menciona as auditorias que são feitas antes do pleito, em que diversas urnas são sorteadas e recolhidas de todo o Brasil para uma simulação de votação pública com a conferência aberta dos votos e resultado? A urna é violável? Claro que é, assim como qualquer aparelho eletrônico, mas a forma como é tratada, não permite o contato com agentes estranhos ao processo eleitoral. Por que não menciona que a mesma não possui nenhum contato com a internet? Por que não menciona que o ato de carga de software nas urnas é público e ocorre próximo às eleições, bem como que, após esse processo, são usados lacres oficiais com a assinaturas dos juízes e promotores eleitorais da zona, que se rompidos, qualquer fiscal de partido pode constatar no dia do pleito? ou mesmo que existem diversas etapas fiscalizatórias e públicas capazes de detectar alterações no sistema eleitoral? Que MP, OAB e Partidos tem acesso ao conteúdo dos sistemas eleitorais? Por que também não menciona que todos os atos de manuseio do software de urna é público? Explique para seu público que a totalização dos votos na Junta Eleitoral, após as eleições, também se dá com a presença de fiscais partidários, MP e OAB, e ainda, que a imprensa pode acompanhar a recepção e totalização dos dados em tempo real? Por que não explica para seu público acéfalo uma lógica simples: se o sistema é furado, alguém poderá ser beneficiado, certo? Sendo assim, logicamente existirão prejudicados no processo eleitoral, correto? Por que esses prejudicados nunca se levantaram contra o sistema, uma vez que possuem acesso pleno ao mesmo?! O sistema fiscalizatório é feito justamente para isso, pra se houver alguma violação, existir diversas possibilidades de detecção por diversos órgãos independentes. A transparência é total. Poderia ficar aqui o dia todo elencando ARGUMENTOS FÁTICOS em relação à segurança do sistema eleitoral brasileiro, mas é perda de tempo, afinal suas CONJECTURAS e SUPOSIÇÕES são mais lógicas, né? Afinal a resposta mais óbvia é que toda a Justiça Eleitoral, Justiça Comum, Ministério Público, Ordem dos Advogados, Instituições Privadas de Auditoria e TODOS os Partidos Políticos estão unidos para acobertar as manipulações das eleições, né? (Até porque, se você fosse honesto intelectualmente, não teria ibope...)",0,false,0,,,,,,
UggL6M0NAsJdAHgCoAEC,Henriique .s,3 years ago,1434070450147,- I R O N I A -,0,false,0,,,,,,
UgivmlElQUJIF3gCoAEC,Igor Rückert,3 years ago,1434070450155,Sarcasmo mode on xD,0,false,0,,,,,,
Ugi2jy9yr4BjwngCoAEC,Skrillex plays,3 years ago,1434070450157,"Otario desculpe mais eu vi uns idiota falando que o vídeo não ficou engraçado ... seu canal e um canal de humor ???? ou de conscientização ??

pra quem nao achou o vídeo engraçado é por que  nao era pra ser mesmo , querem ver comedia vão ver patati patata e parem de falar merda",0,false,0,,,,,,
Ugj8G7x6VLZSr3gCoAEC,Zebra Productions,3 years ago,1434070450163,a qualidade da animação ampliou muito,0,false,0,,,,,,
UghS1tQ9v0lZgngCoAEC,Rion Malakias,3 years ago,1434070450167,Achei o vídeo uma poesia icônica hahaha. Mt bom!,0,false,0,,,,,,
UggwaZ1x3vuZ3XgCoAEC,Jonathan Almeida,3 years ago,1434070450170,"kkkkkkkkkkkkkk, mt bom o vídeo",0,false,0,,,,,,
UgiSfPbJFXjDengCoAEC,Klebersson Dutra Cardoso,3 years ago,1434070450178,Nem o Paraguay quis essa urna eletrônica brasileira... pra vcs verem a grande merda que deve ser isso...,0,false,0,,,,,,
UgjO8X6au1WYpXgCoAEC,Marcus Vinicius,3 years ago,1434070450180,"vc é o cara Otário vc fala oq as pessoas tem medo de dizer, sou um grande fã seu adoro e admiro seu trabalho!!!",1,false,0,,,,,,
UgiDVvSGwAhj7ngCoAEC,Lucas Maduar Carvalho Mota,3 years ago,1434070450189,"Para aqueles que acham que sabem tudo:
1. Se uma pessoa não entendeu alguma coisa, não significa que ela seja burra.
2. Às vezes uma mensagem pode ser interpretada de diversas formas, mesmo que o autor não tenha a intenção de ser ambíguo.",1,false,0,,,,,,
UggtYRXiT092_HgCoAEC,Gordo de TI,3 years ago,1434070450192,"Infelizmente pessoas cagam na urna, muitas por sinal.... mas não abaixam as calças pra isso... defecam com os dedos!!

você esqueceu de colocar isso no vídeo, nobre otário!!",0,false,0,,,,,,
UgjTpHexj-I-5HgCoAEC,Linnknight,3 years ago,1434070450200,"OBSERVE A DESPESA DE UMA MULHER SUSTENTADA PELO BOLSA FAMILIA:

- Desempregada... recebendo seguro desemprego. (R$724)
- Recebe uma casa (R$10.000) e um empréstimo para comprar moveis. (R$5.000)
- Agora pegará um empréstimo para comprar um carro. (R$10.000) 
- Está seriamente pensando em ter um segundo filho. (BOLSA POBREZA)

Adivinha quem vai trabalhar SÓ 5 MESES durante o ano para pagar tudinho?
- Se olhou no espelho, pois então?
- Você já deu sua cota diária de 40% para o governo hoje?
- Vai continuar votando no PT... seu animal?

É TÃO REVOLTANTE que tive que compartilhar, FAÇAM O MESMO PESSOAL, essa é mais uma prova que o governo do PT NÃO PRESTA!
- Se não for compartilhar, ao menos deixe seu +1, isso ajuda na divulgação, obrigado.﻿

 #RevoltaArmada   #ForaDilma  #ForaPT 
 #ForaEsquerda   #Eleições2014",1,false,0,,,,,,
Ugh3Na4uRDrNN3gCoAEC,Rafael Molina,3 years ago,1434070450204,"Pô, os videos do canal são interessantes, mas a voz utilizada no personagem é extremamente irritante.  Isso é um erro grotesco. Você está fazendo um bom material, mas a voz utilizada é tão irritante, que eu não consigo assistir.",0,true,4,,,,,,
,,,,,,,,Ugh3Na4uRDrNN3gCoAEC.7-H0Z7-KL9U7-IKRfoZt25,Canal do Otario,3 years ago,1434070450591,Minha mãe disse que minha voz é perfeita ;-),8
,,,,,,,,Ugh3Na4uRDrNN3gCoAEC.7-H0Z7-KL9U7-StCA7hezc,Gabriel Roque,3 years ago,1434070450595,+OtarioAnonymous (Canal do Otário) Oooooooo que legaaaal kkkk Eu gosto.,0
,,,,,,,,Ugh3Na4uRDrNN3gCoAEC.7-H0Z7-KL9U70SY2SAhaZ3,Eden Alves,3 years ago,1434070450598,"Então não assista, vc não faz diferença alguma. Foda-se.",0
,,,,,,,,Ugh3Na4uRDrNN3gCoAEC.7-H0Z7-KL9U70uk9Nb4Q58,Rafael Molina,3 years ago,1434070450607,Eu nunca mais assisti.,0
UggPjkUcq1nBD3gCoAEC,Douglas Prieto,3 years ago,1434070450212,kkkkkk poisé XD,0,false,0,,,,,,
UgiJ4oBoWnf1OHgCoAEC,Helio Pinheiro,3 years ago,1434070450215,"Por algum motivo os videos do canal do Otario nao tocam no meu youtube. Os ultimos 7 videos que eu tentei ver acontece a msm coisa, nao carrega. Já tentei usar outros navegadores mas acontece a msm coisa!",0,false,0,,,,,,
Ugil5QBJdIHRdXgCoAEC,Victoria Oliveira,3 years ago,1434070450219,"Nunca ri tanto, porque é justamente, o que a maioria tem vontade de fazer .",0,false,0,,,,,,
Ugjrw_130wr50XgCoAEC,Rafael Melo,3 years ago,1434070451447,Por que não consigo assistir seus vídeos pelo Google Chrome? Que bug é esse?,0,false,0,,,,,,
UghShbh5kWNWkHgCoAEC,Ezequiel R,3 years ago,1434070451455,Não vai cagar na urna.,0,false,0,,,,,,
UgiZRu_bjg9SlXgCoAEC,Cirano Shibuya,3 years ago,1434070451459,"Otario, o professor Diego Aranha, da Unicamp, está tentando desenvolver um aplicativo para a conferência dos votos (apenas parte do processo pode ser verificado).

Caso interesse, segue o link.

http://www.catarse.me/pt/VoceFiscal

Abs",0,true,1,,,,,,
,,,,,,,,UgiZRu_bjg9SlXgCoAEC.7-H0Z7-Cp_s7-H2cAUTuIZ,Canal do Otario,3 years ago,1434070451849,Confira ;-) http://wp.me/p2OgjU-2hP,0
UgghOEHM6HIOcHgCoAEC,KADS GAMES,3 years ago,1434070451467,Sempre fazendo seu papel,0,false,0,,,,,,
Ugg1B4jS4-PGHHgCoAEC,Chumbens Jr,3 years ago,1434070451487,Ohhhhhhh!!! Que legal!!,2,false,0,,,,,,
UgjOuUWpLAZVDXgCoAEC,fernando roberto de pieri zanela,3 years ago,1434070451496,"é incrível observar pessoas crentes no PAPAI NOEL , COELHO DA PÁSCOA, O LULA NÃO SABIA DE NADA ,   OS FUNCIONÁRIOS DAS EMPRESAS DESENVOLVEDORAS DE SOFTWARE DAS URNAS ELETRÔNICAS NÃO SE TORNAM CORRUPTOS POR ALGUNS MILHÕES , E MUITOS MENOS OS '' TÉCNICOS PARTIDÁRIOS ''. 
Parabéns aos que corajosamente saem quebrando tudo instigando uma guerra civil , pois os malditos jornalistas da tv aberta dão  ênfase em matérias forjadas pra induzir a opinião pública de que bandeira branca da paz resolve. bandeira branca é rendição . 
o PT está instalando a ditadura na cara de todos e nenhum covarde faz nada.
OS BRASILEIROS TEM INVEJA DO POVO ESTADUNIDENSE  (AMERICANO) , sonham com os frutos de um país mais justo  economicamente , mas ignoram que esse povo(AMERICANO) antigamente teve que partir pra guerra contra o proprio governo.
vamos deixar de acreditar nesses formadores  de opiniao de meia tigela que rasgam criticas negativas sobre quem protesta e se exalta , fato  [e que o povo tem que deixar de ser pacato e partir pra briga , ou  , 
ficar morrendo de inveja dos AMERICANOS",0,false,0,,,,,,
Ugg8ot2jpUyMCXgCoAEC,Fex,3 years ago,1434070451506,A verdade sobre urnas eletrônicas! (eng. Amílcar Brunazo),0,false,0,,,,,,
UghfcvRzfRpj6ngCoAEC,CyberBrains2013,3 years ago,1434070451511,"Com os nomes que estão disponíveis para voto nesta eleição, realmente fico em duvida sobre o que fazer na hora de votar. Estou entre nulo, cagar ou taco de beisebol . Já quanto aos comentários só me resta a tristeza de testemunhar o quanto esse povo é limitado. Entender um simples vídeo ironizando a falta de opção na nossa política não é tão complicado assim. Sim pois votando ou não, o resultado independe dos votos. Pois o sistema já foi hackeado ;)  hihihihihi.",5,false,0,,,,,,
Ughz5Oxf6pHrNHgCoAEC,Raio X,3 years ago,1434070451518,"eu tenho meu emprego estável mesmo, to pensando seriamente em esbarrar na urna eletronica sem querer e derrubuar ela no chao e ainda vou processar o estado por deixar obstaculos na hora que fui votar.",0,false,0,,,,,,
UgicoSiwsrdQLngCoAEC,Ericson Seixas,3 years ago,1434070451521,"boa garoto, mando bem, kkkkkkkkkkkkkkkk.",0,false,0,,,,,,
UghmppAx3IsXoHgCoAEC,Thomas Turbando,3 years ago,1434070451529,"CARA EU MORO DO LADO DA CIDADE  ADMINISTRATIVAN OU SEJA A ULTIMA COISA  E SERIA EU NAO QUERO MORRES ESPLODID
O",0,false,0,,,,,,
Ugig3DVkRj9oZXgCoAEC,Tigrão Tony,3 years ago,1434070451532,"Pode deixar que farei tudo isso sim... heher
Quero dizer... Não farei o que diz para não fazer. E sim o que diz. heher
Valeu.",0,false,0,,,,,,
Ugj7A7Wr0fFFLXgCoAEC,AKAH,3 years ago,1434070451541,Prevejo urnas no mínimo mijadas nessa votação. hahahaa,1,false,0,,,,,,
UgiFjYMqiDi_i3gCoAEC,Joao Abadia,3 years ago,1434070451544,e fazer essas coisas com os politicos pode?,0,false,0,,,,,,
UgjsrNFW0KDlPXgCoAEC,Mick Oliver,3 years ago,1434070451548,A última dica realmente é a que dá vontade de fazer!,0,false,0,,,,,,
UggqwN2KzvuPiXgCoAEC,Bianka Lima,3 years ago,1434070451555,"Oooooooooooooooooooooh que Legaaaaaaaaaaaaaaaaal , mas ainda não posso votar",0,false,0,,,,,,
Ugj4S0n5rNx4DXgCoAEC,Paulo Vinicio Santana Mendes,3 years ago,1434070451559,oooohhhhhh!!!! QUE LEGAAAAAAAUUUUUU,2,false,0,,,,,,
UgigQoraaU3NGHgCoAEC,Vinicius Maschio,3 years ago,1434070451566,"Você tem que acredita que seu voto esta indo pro candidato que aparece na tela, ou pau no seu cu    =)",0,false,0,,,,,,
UghAGaNMh6H7fHgCoAEC,Anderson MOura,3 years ago,1434070451571,Não seria ma ideia levar um copo de agua descartável pra área de voto kkkkkk,0,false,0,,,,,,
UgirAkJ6N_TUX3gCoAEC,Anderson MOura,3 years ago,1434070451580,Não seria ma ideia levar um copo de agua descartável pra área de voto kkkkkk,0,false,0,,,,,,
UgjJDKwKOHOfq3gCoAEC,Claudiane Carneiro,3 years ago,1434070452631,que tal vc fazer um vídeo falando sobre os candidatos mais polemicos para a presidência....o Aécio Neves ou Jair Bolsonaro?,3,false,0,,,,,,
Ugg2sR3c8MNuVngCoAEC,Bruno Chaves Animais,3 years ago,1434070452635,"Nunca leve seu dinossauro de estimação quando for votar, pois ele pode comer a urna. kkkkkkkkkkkkk",3,true,2,,,,,,
,,,,,,,,Ugg2sR3c8MNuVngCoAEC.7-H0Z7-L3r97-H9kaz_Swy,Elisandro viva o niilismo! siga nos,3 years ago,1434070453102,kkkkkkkkkkkkkkkkkkkkkkkk,1
,,,,,,,,Ugg2sR3c8MNuVngCoAEC.7-H0Z7-L3r97-HAUPaXhhB,Bruno Chaves Animais,3 years ago,1434070453104,+shinigami siga nos kkkkkkkkkkkkkkk,2
UggY-0aTOuNNf3gCoAEC,Bruno Chaves Animais,3 years ago,1434070452644,"Nunca ande a cavalo perto de uma urna, pois ele pode dar um coice nela. kkkkkkkkkkkkkkkkkk",5,true,2,,,,,,
,,,,,,,,UggY-0aTOuNNf3gCoAEC.7-H0Z7-N70M7-H8olORRAH,Elisandro viva o niilismo! siga nos,3 years ago,1434070453115,kkkkkkkkkkkkkk,1
,,,,,,,,UggY-0aTOuNNf3gCoAEC.7-H0Z7-N70M7-HAW2a9wf5,Bruno Chaves Animais,3 years ago,1434070453118,+shinigami siga nos kkkkkkkkkkkkk,0
UghnSc8xGTG5RHgCoAEC,Bruno Chaves Animais,3 years ago,1434070452652,"Nunca tente fazer um kamehamehá perto de uma urna, pois vai que você consegue e acerta a urna, kkkkkkkkkkkkkkkkkkk",4,true,4,,,,,,
,,,,,,,,UghnSc8xGTG5RHgCoAEC.7-H0Z7-K5uD7-H8q6ZoHbG,Elisandro viva o niilismo! siga nos,3 years ago,1434070453153,O problema não é destruir a urna é matar os eleitores e a urna ficar intacta!,0
,,,,,,,,UghnSc8xGTG5RHgCoAEC.7-H0Z7-K5uD7-HAlUOxKse,Bruno Chaves Animais,3 years ago,1434070453161,+shinigami siga nos vendo por esse lado kkkkkkkkkkk,1
,,,,,,,,UghnSc8xGTG5RHgCoAEC.7-H0Z7-K5uD7-HB2Dy7oh9,Elisandro viva o niilismo! siga nos,3 years ago,1434070453163,+Bruno Chaves Animais o otarioé de mais né amigo sou fã dele!,0
,,,,,,,,UghnSc8xGTG5RHgCoAEC.7-H0Z7-K5uD7-HTXtXJj_c,Bruno Chaves Animais,3 years ago,1434070453170,"eu também sou fã dele, ele é muito bom",0
UgjLVO3irzahhngCoAEC,Bruno Chaves Animais,3 years ago,1434070452664,"Nunca belisque o Quico perto de uma urna, pois o objeto que a dona Florinda vai tacar em você pode acertar a urna e danificá-la. kkkkkkkkkkkkk",2,true,2,,,,,,
,,,,,,,,UgjLVO3irzahhngCoAEC.7-H0Z7-MDgE7-HA__D4cTu,Elisandro viva o niilismo! siga nos,3 years ago,1434070453089,Insentive o seu madruga bater no kiko em outubro kkkkkkkkkk!,0
,,,,,,,,UgjLVO3irzahhngCoAEC.7-H0Z7-MDgE7-HAtBvvwQG,Bruno Chaves Animais,3 years ago,1434070453091,+shinigami siga nos isso mesmo kkkkkkkkkkk,2
Ugg4NKgZhCH4eHgCoAEC,Bruno Chaves Animais,3 years ago,1434070452674,"Nunca faça uma batalha de pokemons perto de uma urna, pois o ataque de seu pokemon pode danificá-la. kkkkkkkkkkkkkkkkkkkkkk",2,true,1,,,,,,
,,,,,,,,Ugg4NKgZhCH4eHgCoAEC.7-H0Z7-JBki7-HAwD_6coE,Elisandro viva o niilismo! siga nos,3 years ago,1434070453174,Boa dica pois pode ferir os votantes e a urna pode não ser atingida kkkkkkkk,0
UggN40X5fsZwQHgCoAEC,Bruno Chaves Animais,3 years ago,1434070452684,"nunca bata punheta perto de uma urna, pois sua ejaculação pode danificá-la kkkkkkkkkkkk",2,true,3,,,,,,
,,,,,,,,UggN40X5fsZwQHgCoAEC.7-H0Z7-OegO7-H7b7uJlOn,Elisandro viva o niilismo! siga nos,3 years ago,1434070453130,kkkkkkkkkkkkk Detona otario!,1
,,,,,,,,UggN40X5fsZwQHgCoAEC.7-H0Z7-OegO7-H7n0xGbLj,Bruno Chaves Animais,3 years ago,1434070453137,+shinigami siga nos oh yeah kkkkkkkkkkkkkk,2
,,,,,,,,UggN40X5fsZwQHgCoAEC.7-H0Z7-OegO7-H8fcm79tD,Elisandro viva o niilismo! siga nos,3 years ago,1434070453139,+Bruno Chaves Animais kkkkkkkkkkkk,1
UgjTHHwvpl_VIHgCoAEC,Mateus Ribeiro,3 years ago,1434070452696,"Mano nada a ver eu ja fui mesário e vc imprime 3x o resultado dos votos no final da eleição. Não da pra saber quem votou em quem, mas da pra saber exatamente quantos votos cada candidato levou e o numero sempre bate com a quantidade de pessoas que votaram na secão. Inclusive quaquer fiscal de qualquer partido pode solicitar a qualquer momento uma impressão parcial dos votos...",1,true,7,,,,,,
,,,,,,,,UgjTHHwvpl_VIHgCoAEC.7-H0Z7-PrBY7-H4cIQ6qQW,Diego Carvalho,3 years ago,1434070453210,"O problema não é esse! O voto impresso é para que o eleitor tenha certeza de que o que votou, eletronicamente, seja verdadeiro, tirando assim a dúvida através do papel impresso após o processo eletrônico. Logo após o papel impresso é posto em outro local lacrado para eventual comparação de votos entre processo eletrônico e impresso.",6
,,,,,,,,UgjTHHwvpl_VIHgCoAEC.7-H0Z7-PrBY7-HYckOA3rT,Kaue Mello,3 years ago,1434070453218,"+Diego Santos Olá, só estou falando a título informativo, sei que não é impossível haver fraude, mas um dia antes das eleições uma urna em cada distrito é sorteada para haver uma votação aberta e é checado a contagem da urna, quanto aos votos, ficam armazenados em uma unidade flash (antes era disquete) e provavelmente no disco interno como backup, embora gaste muito papel não achei de todo mal sua ideia de uma segunda urna de papel.",0
,,,,,,,,UgjTHHwvpl_VIHgCoAEC.7-H0Z7-PrBY7-HZa4fVaSM,Diego Carvalho,3 years ago,1434070453221,"+Kaue Mello Fala, Kaue! Blz?
Já houve inúmeros testes que comprovam que a urna eletrônica é passível de fraude. E olha que foram pessoas especialistas no assunto quem o disseram.
Abraço.",0
,,,,,,,,UgjTHHwvpl_VIHgCoAEC.7-H0Z7-PrBY7-HjWXOe_DW,Mateus Ribeiro,3 years ago,1434070453230,"+Diego Santos Pode ser que depois que a urna sai la da seção aconteça alguma coisa por debaixo do pano. Mas pelo que eu vi de todo o processo aqui em São Paulo (não sei como é em outras cidades), o pessoal é super rigoroso em todas as etapas, e todos procedimentos são bem rígidos, para garantir a legitimidade dos votos (como a lei seca no dia da eleição, por exemplo). A polícia está presente em todas as seções. São muitos ficais, entrando e saindo o tempo todo das salas, conferindo os números e perguntando se está tudo ok. Os mesário são totalmente proibidos de dar sugestões ou responder perguntas sobre o número dos candidatos. É por isso que a galera fica um tempão lá fora olhando aquelas listas na parede. Nenhum partido quer deixar os outros inventarem votos fantasma e fazer boca de urna. Acredito que hajam alguns distritos e locais onde aconteçam irregularidades, mas é muita gente envolvida pra fazer uma fraude gigantesca e ninguém perceber. Além disso, cá entre nós, vocês acham mesmo que eles precisam inventar alguma coisa? É só perguntar na rua, a galerinha baixa renda vai votar em peso na Dilma...",1
,,,,,,,,UgjTHHwvpl_VIHgCoAEC.7-H0Z7-PrBY7-JmvROgmJo,Kaue Mello,3 years ago,1434070453232,"+Diego Santos Olá novamente, quanto a mudar o kernel da urna é perfeitamente possível, considerando que se tenha conhecimento para faze-lo, apenas estou informando que é feito por amostragem uma checagem na urna para saber sé a contagem está correta, mas pense, pegamos as urnas 1 ou 2 dias antes das eleições e fica com um policial em tempo integral tomando contas delas, eu poderia mudar o kernel daquelas urnas, se o policial permitisse claro, e mesmo assim seria apenas uma seção de votação, nesse tempo ainda tem o sorteio para checar as urnas com voto aberto, não estou dizendo que é impossível de fazer, apenas muito difícil.",0
,,,,,,,,UgjTHHwvpl_VIHgCoAEC.7-H0Z7-PrBY7-OlWC0M5Z9,Diego Carvalho,3 years ago,1434070453235,"Mas quem nos diz que as urnas já não vão para os locais com programação duvidosa, de modo que, ao votar em um candidato, outro receba o voto?",1
,,,,,,,,UgjTHHwvpl_VIHgCoAEC.7-H0Z7-PrBY7-SfR6PKrj-,Fernando Leal,3 years ago,1434070453243,"+Diego Santos Infelizmente onde não há transparência, há desconfianças",1
Ugj6MpYyWm9q6XgCoAEC,Andre,3 years ago,1434070452716,"O problema que faz tempo que muita gente ""CAGA"" na urna....",0,false,0,,,,,,
UggiiMT1MZiyJHgCoAEC,TiagoX Inside,3 years ago,1434070452722,"10 Otario, talvez fazendo processo reverso o Brasileiro entenda!",1,false,0,,,,,,
Ugi89HQJ8gi59ngCoAEC,Augusto D' Afonseca,3 years ago,1434070452730,Kkkkkk kkkkkkkkkkkkkkkkkk muito bom.,0,false,0,,,,,,
Ugg1HsBv4-Y2D3gCoAEC,Amandio augusto pereira,3 years ago,1434070452737,kkkkkkkkkkk........ Recebi vosso recado rs !!!,0,false,0,,,,,,
UghwqeH73bM7nHgCoAEC,Adrian S.,3 years ago,1434070452741,"Os politicamente corretos vão à loucura! Parabéns pelo vídeo, Otario. Só uma observação: quando vc faz no formato de animação, a sua voz fica baixa e mais rouca e fina do que qdo usa a sacola de verdade na cabeça. Muito esquisito.  Compare os vídeos com um fone de ouvido para vc perceber isso.",0,false,0,,,,,,
UghBHFAQwukgGngCoAEC,Tomás Vasquinho,3 years ago,1434070452748,Otario oq você acha do Jair Messias Bolsonaro devemos defender ele?,0,false,0,,,,,,
UggNxqVkrPMUrngCoAEC,rafael guiomar caetano vaz,3 years ago,1434070452751,não cague na urna foi foda...kkkkkkkk,0,false,0,,,,,,
UggYVFOyP7vD8HgCoAEC,xFerris,3 years ago,1434070452760,"A ÚNICA coisa que me impede de divulgar mais esses videos do Otário é que ele, todo vídeo, TEM que por uma porra de uma ""merda"" fala palavras como ""cagar"", ""vomitar"", com as respectivas imagens. Concordo com todas suas ideias e tudo mais, acho muito bom a ideologia de seu canal, mas, convenhamos, nem sempre é cabível esse tipo de coisa, acaba perdendo toda a credibilidade por essas ""meninices"", o cara deixa de ser levado a sério totalmente. É foda essa imaturidade a essa altura do campeonato.. . quer ser ouvido por gente séria? Faça algo à altura, se porte como tal. Quer chamar atenção? Nada melhor que impor respeito.",0,false,0,,,,,,
Ugh-_Aw4SxFfLngCoAEC,Fernando Cardoso,3 years ago,1434070452764,"Muito bom! Pena que a maioria dos eleitores só querem saber de Neymar, Beijinho no Ombro e novelas da Globo. Não entenderão esse vídeo.",0,false,0,,,,,,
UghLChYhqP8QaHgCoAEC,Juniior Matos,3 years ago,1434070452773,"Rsrs legal!! Mas não muito importante, caso eu tropece e se caso a urna vim a cair?? Quais os possíveis danos que ela pode ter? E oque aconteceria comigo, iria ta sujeito a alguma penalidade no caso de um desastre sem querer? Rs !  Gostaria da resposta!!",0,false,0,,,,,,
UgiwwOWZn5e37XgCoAEC,Jean Gomes,3 years ago,1434070452784,Vídeo comédia do Canal do Otário.,0,false,0,,,,,,
Ugi9I3Ed1xtW_3gCoAEC,Edson André,3 years ago,1434070452794,"Assim como as urnas, nos outros países, as pessoas não são obrigadas a votar, se vão é por que querem votar em alguém, então que consciência é esta de ir votar, ainda mais obrigados. Por isso que votam em qual quer um e ate colocam analfabetos e palhaços para nos representar nos poderes",0,false,0,,,,,,
