id,user,date,timestamp,commentText,likes,hasReplies,numberOfReplies,replies.id,replies.user,replies.date,replies.timestamp,replies.commentText,replies.likes
Ugx9JwkaBF7qSewRcK14AaABAg,Danillo Mello,3 days ago,1528502992543,"E AINDA ASSIM, STF 8 X 2 BRASIL",0,false,0,,,,,,
UgxTyTLwxekZDvPD_xt4AaABAg,Anonymous Brazil,3 days ago,1528502992552,Vou conversar com minha equipe e a do anonymous globais sobre isso,105,true,17,,,,,,
,,,,,,,,UgxTyTLwxekZDvPD_xt4AaABAg.8hDOsrD1uft8hDabh65tIs,Skull GhosT,3 days ago,1528502993498,"Anonymous Brazil Hehehe Tava na hora dos anonymous fazer uma baguncinha nesse país estão mais que merecendo, esse e uns dos governos mais corruptos do mundo só tem bandidos na política.",23
,,,,,,,,UgxTyTLwxekZDvPD_xt4AaABAg.8hDOsrD1uft8hDcVRAnX_A,Hélio Medeiros,3 days ago,1528502993507,"Eles merecem ter todos os registros divulgados, todos os podres!",12
,,,,,,,,UgxTyTLwxekZDvPD_xt4AaABAg.8hDOsrD1uft8hDlQ8DkPR5,Igor Resende,3 days ago,1528502993511,"Seria foda por como ""vitorioso"" um número que não foi registrado, só pra provar que a urna é ridícula de violavel",14
,,,,,,,,UgxTyTLwxekZDvPD_xt4AaABAg.8hDOsrD1uft8hE61os2t_Y,Anonymous Brazil,3 days ago,1528502993520,Skull GhosT kkkkk verdade,5
,,,,,,,,UgxTyTLwxekZDvPD_xt4AaABAg.8hDOsrD1uft8hESjy8j8Z6,Anton Huna visitem meu canal,3 days ago,1528502993528,"Vocês poderiam anular todos os votos de um estado, a título de teste.",8
,,,,,,,,UgxTyTLwxekZDvPD_xt4AaABAg.8hDOsrD1uft8hET210uBBL,Anonymous Brazil,3 days ago,1528502993533,"Anton Huna visitem meu canal, kkk, a princípio sim",7
,,,,,,,,UgxTyTLwxekZDvPD_xt4AaABAg.8hDOsrD1uft8hEjbGHOUqp,Bruno Lima,3 days ago,1528502993538,Sonho meu.... sonho meu... vai buscar!!! kkkkkkkkkkkkkkkk,1
,,,,,,,,UgxTyTLwxekZDvPD_xt4AaABAg.8hDOsrD1uft8hFZuB5ZDYK,Tine Silva,3 days ago,1528502993546,Anonymous Brazil  Eu gostaria de ter esses conhecimento de vcs Anonymous. Vcs deveriam acabar e tem como acabar com eles. Ajudem nós brasileiros. Esses políticos corruptos estão acabando com nosso pai. Pedimos socorro à vcs...,3
,,,,,,,,UgxTyTLwxekZDvPD_xt4AaABAg.8hDOsrD1uft8hFaBkjRPQY,Anonymous Brazil,3 days ago,1528502993555,"Tine Silva, eu entendo seu desespero moça, mas não por enquanto não posso fazer nada 😫💔 sinto muito",1
,,,,,,,,UgxTyTLwxekZDvPD_xt4AaABAg.8hDOsrD1uft8hGECEAxgwY,Stênio Lima,2 days ago,1528589393558,Já pode começar divulgando os dados pessoais e bancários desses lixos de toga.,2
,,,,,,,,UgxTyTLwxekZDvPD_xt4AaABAg.8hDOsrD1uft8hGzxo-GXvD,Samuel Pedrosa,2 days ago,1528589393568,Piada kkkkkk,1
,,,,,,,,UgxTyTLwxekZDvPD_xt4AaABAg.8hDOsrD1uft8hHB8A4P-N9,Alex Caires,2 days ago,1528589393573,Só não deixa nenhum político da esquerda vender kkkk 🙏,1
,,,,,,,,UgxTyTLwxekZDvPD_xt4AaABAg.8hDOsrD1uft8hHT4v3SWgZ,Olive4781,2 days ago,1528589393580,"Seria engraçado ver a cara dessa gente que acha desnecessário ter voto impresso, se derrepente todos os votos eletrônicos sumissem das urnas bolivarianas 😂😂😂",1
,,,,,,,,UgxTyTLwxekZDvPD_xt4AaABAg.8hDOsrD1uft8hI3aNYqTjY,Thiago Novaes,2 days ago,1528589393590,Kkkkkkkkkkkkkkkkkkkkkkkkkkkkkkkkkkkkkkkkkkkkkkkkkkkkkkkkkk vai dormir parça,0
,,,,,,,,UgxTyTLwxekZDvPD_xt4AaABAg.8hDOsrD1uft8hINS3NAsaz,Rapha Gomez Oficial,1 day ago,1528675793593,"Quebra de sigilo desses caras, joga tudo no ventilador.",2
,,,,,,,,UgxTyTLwxekZDvPD_xt4AaABAg.8hDOsrD1uft8hIi1ZI6bO6,vander matos,1 day ago,1528675793602,Anonymous Brazil manda eles hakear está merdas de urnas eletrônicas e colocar Bolsonaro na frente desta cambada,0
,,,,,,,,UgxTyTLwxekZDvPD_xt4AaABAg.8hDOsrD1uft8hJ7ArZ7WHK,Maurício de Souza,1 day ago,1528675793605,"Se vocês tem força e união suficientes para exercer algum tipo de intervenção, deveriam mesmo fazê-lo. Coloco-me à disposição para colaborar da forma que for apropriada. Sou técnico em T.I., mas não tenho conhecimentos nessa área de Segurança.
Mas tenho um Grupo Brasil Limpo no WhatsApp, de muita expressão na área da política. Ofereço a quem quiser participar.
https://chat.whatsapp.com/D8CSu6vQfNwFuXJhNOnNml",1
UgzvjdC3_bFtnfc47mB4AaABAg,Claudinei Crivellaro,3 days ago,1528502992564,"Falou tudo o Dr. Alberto Emanuel, Brilhante, parabéns!",0,false,0,,,,,,
UgzrWebPWddEVK7ClL54AaABAg,SONIA MARIA ASTROLABIO DOS SANTOS,3 days ago,1528502992573,"A população tem que pedir que a contagem dos votos seja na presença dos militares junto com os candidatos, pois a contagem dos votos tem que ser pública.",0,false,0,,,,,,
UgwzaN6XKmCKUtxgep94AaABAg,Bruney Nascimento,3 days ago,1528502992580,"Esse cara é bom! Estava preparado e embasado. Quiseram pressioná-lo, mas se fd...",0,false,0,,,,,,
UgwhEnr1i5pMd7YXdmp4AaABAg,Rogerio Ribeiro,3 days ago,1528502992596,Qual ministro do STF não é corrupto??????não vejo.,0,false,0,,,,,,
UgzNjeq8ZJkHhYCJMe14AaABAg,Anonymous Brazil,3 days ago,1528502992608,"Kkkk, até eu que sou Hacker amador  consigo manipular uma urna kkkk",148,true,10,,,,,,
,,,,,,,,UgzNjeq8ZJkHhYCJMe14AaABAg.8hDOgTfzqXG8hFLc_rmVw_,Rosângela Rabêlo,3 days ago,1528502993212,Anonymous Brazil APROVEITA QUE VC É UM HARK VAMOS DÁ A VITÓRIA PARA #BOLSONARO 😂😂😂😂TODOS ESSES MINISTROS FICARIAM COM O C... NA MÃO SE O MITO VINHER A PRESIDENTE! 😂😂😂😂👏👏👏👏,6
,,,,,,,,UgzNjeq8ZJkHhYCJMe14AaABAg.8hDOgTfzqXG8hFLjJiROks,Rosângela Rabêlo,3 days ago,1528502993222,Anonymous Brazil Hacher...,3
,,,,,,,,UgzNjeq8ZJkHhYCJMe14AaABAg.8hDOgTfzqXG8hFM3dCphIW,Anonymous Brazil,3 days ago,1528502993229,"Rosângela Rabêlo , moça, diz hacker!!! Blz? Tmj",5
,,,,,,,,UgzNjeq8ZJkHhYCJMe14AaABAg.8hDOgTfzqXG8hFcUQcZ4yZ,Kim Joung-un,3 days ago,1528502993235,Vem pra Koreia? Pago bem. Quero saber o que falam de mim nos porcos do Sul. Bjos,0
,,,,,,,,UgzNjeq8ZJkHhYCJMe14AaABAg.8hDOgTfzqXG8hFiHg3MpsZ,Tremegisto,2 days ago,1528589393244,"Fato é que eles nunca irão inserir o sistema eletrônico de votação em uma blockchain ou em um tangle pois dessa forma a possibilidade de fraude seria ínfima ( se não até mesmo impossível ) e a possibilidade de auditoria, verificação e validação seria absurdamente mais eficiente .... na verdade a contagem dos votos poderia até mesmo ser em tempo real com as urnas online ao ter um risco de quebra de confiança quase inexistente ( se não quiçá inexistente ).",2
,,,,,,,,UgzNjeq8ZJkHhYCJMe14AaABAg.8hDOgTfzqXG8hGD3PFn4pf,LuQuinHaS,2 days ago,1528589393249,"Se eu fosse um hacker bom, eu faria a vida desses políticos um inferno...",4
,,,,,,,,UgzNjeq8ZJkHhYCJMe14AaABAg.8hDOgTfzqXG8hGzbgWqUAg,Samuel Pedrosa,2 days ago,1528589393258,"Acha mesmo que um hacker de verdade fica em vídeo de YouTube se auto intitulando hacker? Ainda coloca nome de anonynous, é cada uma... Kkkk",1
,,,,,,,,UgzNjeq8ZJkHhYCJMe14AaABAg.8hDOgTfzqXG8hHwvkfPu1t,silvana cristina cheli contro,2 days ago,1528589393264,Vai lá faz a urna explodir na hora que esses ministros forem votar,0
,,,,,,,,UgzNjeq8ZJkHhYCJMe14AaABAg.8hDOgTfzqXG8hIbINR2BRH,Maurício de Souza,1 day ago,1528675793273,"Kara, a gente precisava que essa sua informação viesse a publico de uma maneira avassaladora!!",0
,,,,,,,,UgzNjeq8ZJkHhYCJMe14AaABAg.8hDOgTfzqXG8hIqRcYV564,Diego Pires,1 day ago,1528675793281,"impossible amigo, vc nao eh hacker porra nenhuma",0
UgwwR6UbNSP66StDMkl4AaABAg,Paulo Sérgio,3 days ago,1528502992624,"Eu admiro é que ainda existam pessoas que acreditam nesses ministros ladrões.
A pergunta é:  Pq o medo do voto impresso?
Pq sempre debate quando se trata  do voto impresso?
SÃO TODOS BANDIDOS.",0,false,0,,,,,,
UgyO1MQveMRCcYPkp8l4AaABAg,Jose Tavares,3 days ago,1528502992637,Supremo virou piada aff. O único país no mundo com urna eletrônica é o Brasil. ABSURDOOOOOOOO.,0,false,0,,,,,,
Ugx70Xcs5xOVb2_t8g14AaABAg,Patrik Barbosa de Oliveira,3 days ago,1528502992648,Urnas eletrônicas são um fraude,0,false,0,,,,,,
UgyBelwIyB22G4vCbAd4AaABAg,BRM,3 days ago,1528502992657,"Esses merdas do stf já não enganam mais ninguém, são todos lixo, não tem um pingo de credibilidade com a população.",0,false,0,,,,,,
Ugza1KTenzDGrgnyTgl4AaABAg,Elizeu Silva,3 days ago,1528502992664,"E normal ter falhas em urnas eletronicas? O cara tem 8 minutos pra falar, desses ele nao falou 3. Eles nao deixam",0,false,0,,,,,,
UgyluaQzhPAERmEsZvZ4AaABAg,Ewe98,3 days ago,1528502992672,Deixa o cara falar porra,0,false,0,,,,,,
UgzgGxDSfAy4KH-AHY54AaABAg,Jeferson Pessanha  Werneck,3 days ago,1528502992684,"Todos mancomunados com a sacanagem, de excelência não são nadas, uma vergonha a para a nação, falam se como estivessem dentro do bem e do mal, criadores do céu e da terra, sempre obscuros, contraditórios e omissos. Não representam nada, a não ser os interesses próprios escusos. Não passa de um circo montado para uma manipulação contundente da democracia. Vergonha, vergonha, sem vergonhas ! Tenho nojo do estágio de putrefação que vocês deixaram meu pais, com todo esse rastro cristalino de dejetos e atitudes endêmicas.",0,false,0,,,,,,
UgwpZEtErcPsaih0c4x4AaABAg,Peter Weinert,3 days ago,1528502995094,"Tadinho do advogado, ele esta lidando com as Hienas da nação. Todos bandidos com “togas”. Deus nos ajude🙏🏻🙏🏻🙏🏻",0,false,0,,,,,,
UgyZm-oF7tiIO1qInnB4AaABAg,Lucas Vilela,3 days ago,1528502995104,Nem a Rússia utiliza voto eletrônico. taquipariu,0,false,0,,,,,,
UgweSjXj4X8UgYQNe6p4AaABAg,Sther Haramoto,3 days ago,1528502995114,"ATENÇÃO ! CUIDADO ! Em Brasília, 06/06/2018. Após ouvir o Dr. Alberto Emanuel, representante do Sindicato Nacional de Peritos Criminais Federais, por 8 a 2, o Supremo Tribunal Federal (STF) decidiu nesta quarta-feira, 6, suspender a implantação do voto impresso nas próximas eleições, atendendo a um pedido de medida cautelar feito pela procuradora-geral da República, Raquel Dodge. O uso do voto impresso para as eleições deste ano foi aprovado pelo Congresso Nacional em 2015, na minirreforma eleitoral, conforme 59-A da Lei 9.504/1997 que diz:

Art. 59-A. No processo de votação eletrônica, a urna imprimirá o registro de cada voto, que será depositado, de forma automática e sem contato manual do eleitor, em local previamente lacrado. (Incluído pela Lei nº 13.165, de 2015)
Parágrafo único. O processo de votação não será concluído até que o eleitor confirme a correspondência entre o teor de seu voto e o registro impresso e exibido pela urna eletrônica. (Incluído pela Lei nº 13.165, de 2015).

É UM ABSURDO ! FOI CONSTATADO POSSIBILIDADE DE FRAUDE NAS URNAS ELETRÔNICAS.

Assista e posteriormente me responda: Você acredita que existe a chance de ter ocorrido fraude nas eleições de seu município, estado e no Brasil como um todo ?",2,true,1,,,,,,
,,,,,,,,UgweSjXj4X8UgYQNe6p4AaABAg.8hDN1xhnC078hEdtX99mYl,Jorge Telles,3 days ago,1528502995571,"Sther Haramoto,,, isso é mais q juro por Deus",0
UgzAzGVvAoaaIJtqOr54AaABAg,Renan da silva,3 days ago,1528502995125,"10:14 Que gemido foi esse? kkkk

Agora, em relação a esse tema importante, esses ministros do STF são os verdadeiros vilões do povo, manda e desmandam do jeito que querem para auxiliar seus parceiros de crimes.",0,false,0,,,,,,
Ugwelxk5oahEXtNMhy14AaABAg,Marcel Alves,3 days ago,1528502995134,Eu gostaria de fazer uma pergunta a todos...Pq Nenhum país de primeiro mundo tem a urna eletrônica já q ela e tão segurar como se diz e o Brasil um terceiro mundo tem?,11,false,0,,,,,,
Ugw64ukx-qunC36Enx94AaABAg,Marcos Antonio Boffi,3 days ago,1528502995144,Com estás Urnas eletrônicas não da pra confiar nesta eleição vou votar 00+ tecla Verde 50 %1  voto eleições serão canceladas e traidores da pátria perderão seus cargos  por duas eleições.,0,false,0,,,,,,
UgyrCx4o2N_FxeWKVGF4AaABAg,Anissa Harder,3 days ago,1528502995160,"Olha ahi a corja do STF, inclusive a Carmen Lucia, mostrando à que veio, ficando todos nervosos quando o Dr. Alberto Emanuel mostrou a farsa que eh a urna eletronica ---- O dracula Lewandowski, junto com o resto da corja, pensam que o povo eh idiota, que o povo nao sabe que eles pagaram uma fortuna para peritos desonestos mentirem acerca das urnas eletronicas --- Eh muita bandidagem para um lugar so! Essas raposas velhas, querem fraudar as urnas novamente, exatamente como fizeram em 2014 --- e porque estao indo longe demais, num desrespeito sem tamanho ao povo brasileiro, eh que me faz ter a certeza, de que  um julgamento bem pesado vai cair sobre cada um --- espero que nao demore!
Muitas vezes me pergunto, como pode ter gente tao malvada, tao cretina, tao canalha como essa que trabalha unida, no antro de podridao do STF, para tirar o que eh a maior riqueza de um povo --- a sua liberdade.
Espero que os brasileiros nao se conformem com esse golpe nojento, inconstitucional, comunista, traicoeiro, e se juntem, para acabar de vez com essa raca de viboras, que envenenam o lugar que deveria ser o exemplo de justica do Pais, mas que se tornou num covil de ladroes, traidores da Patria e defensores de bandidos, tais como eles, e violadores da Constituicao. Milhoes de vezes,  maldito STF!",30,true,4,,,,,,
,,,,,,,,UgyrCx4o2N_FxeWKVGF4AaABAg.8hDMMAY7Iio8hEY0CQKE9p,Ana,3 days ago,1528502995717,"Anissa Harder 
Menina, tb estou com um nó na garganta após ver este vídeo. É abominável a situação do país nas mãos desses abutres que só fazem nos roubar descaradamente... O BRASIL está sangrando e o povo não colabora nas paralisações. Acho q só conseguiremos mudar esta situações se fizermos a desobediência civil pacífica e o país parar!!!!*",2
,,,,,,,,UgyrCx4o2N_FxeWKVGF4AaABAg.8hDMMAY7Iio8hFBjSi6Tt8,Valdo Manchetes,3 days ago,1528502995725,"Gostei dessa frase...
Acho que ela tem PODER!!!
#DESOBEDIÊNCIA #CIVIL
Esse bando de urubus do infernos tem que ser destruído dessa função urgente pq cada dia é uma cacetada em nós brasileiros",1
,,,,,,,,UgyrCx4o2N_FxeWKVGF4AaABAg.8hDMMAY7Iio8hIfneX233v,Ana,1 day ago,1528675795734,"Anissa Harder 
👍Mandou bem. 👏👏👏👏👏",0
,,,,,,,,UgyrCx4o2N_FxeWKVGF4AaABAg.8hDMMAY7Iio8hJY2ChPFvm,Valdo Manchetes,1 day ago,1528675795743,#destituído,0
UgxSxrhoXp1hy-63Owt4AaABAg,Jorge Lisunenko,3 days ago,1528502995171,eita porra,3,false,0,,,,,,
Ugwn6LTf-KRk4ycFFHt4AaABAg,Rogério Corrêa de Souza,3 days ago,1528502995182,Os filhos das putas não prestam atenção.,0,false,0,,,,,,
UgxU8reLz4FW1J5hGkV4AaABAg,Alvaro Free,3 days ago,1528502995194,Só vamos melhorar o Brasil quando o brasileiro deixar de ser burro.,0,false,0,,,,,,
UgzOUSiWa0wy3YHIQUV4AaABAg,Shei Lima,3 days ago,1528502995200,A verdade é bem simples: Com esse STF que temos estamos fodidos!,0,false,0,,,,,,
UgxLvQwIoL1WMD7RLoV4AaABAg,Ab Tiburcio,3 days ago,1528502995209,Leviandovisk,0,false,0,,,,,,
UgyZfHhvFR5Y5J4rccl4AaABAg,Edival Omodei,3 days ago,1528502995219,"Não tem dinheiro para as urnas, mas para  enfiar dinheiro em propaganda tá sobrando, olha que coloco o Advogado fez no rabo desses canalhas, não merece respeito como ministro...",0,false,0,,,,,,
UgwmSTkGfNZr9Epwh014AaABAg,Heverton Lima,3 days ago,1528502995229,"Kkkkk eles ficaram totalmente incomodados com a situação, BANDO DE LADRÃO FILHO DA PUTA !!!!",0,false,0,,,,,,
UgxwcPgJnGnYicKnlLF4AaABAg,Fabio Moreira andre,3 days ago,1528502995234,justiça tem nos Estados unidos,0,false,0,,,,,,
UgxE4f9Yxkq_EA1fSqB4AaABAg,Fabio Moreira andre,3 days ago,1528502995242,esses juízes só envergonham o Brasil,0,false,0,,,,,,
UgxMp-WrBxqvVWCHTjt4AaABAg,Edival Omodei,3 days ago,1528502995252,"E até ridículo os capa preta não olha para o selentissimo Advogado, deve ter levado um Bak  kkkkkk",0,false,0,,,,,,
UgzhYium937nkILaLE14AaABAg,Força tática ft,3 days ago,1528502995256,Populacão aproveitamos e vamos a rua tb.,41,true,1,,,,,,
,,,,,,,,UgzhYium937nkILaLE14AaABAg.8hDLJo4JjFT8hEX-5ZB9xv,Ana,3 days ago,1528502995625,"Força tática ft 
👍👏👏👏👏",1
Ugy03pZnEC7Xio_mx5h4AaABAg,BFU,3 days ago,1528502995267,Não precisa de provas.... para que provar o que todos sabem?  Brasil comunista....parabéns ao jovem que simplesmente de forma direta comprovou o que muitos dizem que o sistema pode ser fraudado.... com ética não acusou que o é... mas tb não disse que não poderia ser...,0,false,0,,,,,,
UgwPxUkfV3MxnCKAU8J4AaABAg,Força tática ft,3 days ago,1528502995276,GREVE DOS CAMINHONEIROS NESTE SÁBADO DIA 9 AS 00:00,7,true,2,,,,,,
,,,,,,,,UgwPxUkfV3MxnCKAU8J4AaABAg.8hDL6hwZveV8hIUPs4WsAc,Aero Hobby Prazeres,1 day ago,1528675795601,Força tática ft É hoje? Ou amanhã?,1
,,,,,,,,UgwPxUkfV3MxnCKAU8J4AaABAg.8hDL6hwZveV8hJceCJGEWD,Força tática ft,1 day ago,1528675795608,Aero Hobby Prazeres  o governo voltou atrás na tabela de frete da ant e por isso nao houce a greve.,0
UgyqY2-EumBNJHp3Zgh4AaABAg,Vinicius Evangelista de Luna,3 days ago,1528502996561,"Defendeu lindamente.
Parabéns!!!!",95,true,1,,,,,,
,,,,,,,,UgyqY2-EumBNJHp3Zgh4AaABAg.8hDL4jv34cP8hIYBgWKCxk,Aicaramba,1 day ago,1528675797004,Vinicius Evangelista de Luna para que? Tivemos um grande foda-se desses 11 energúmenos,0
UgwI099UsP3lAjlcknB4AaABAg,Bruno Harley,3 days ago,1528502996572,"Bando de vagabundos corruptos, se sentiram incomodados com a VERDADE, os peritos que mostraram os erros se não fossem CONCURSADOS já estariam no olho da rua. O medo de não ganhar o $$$$ deles este ano ficou mais que VISÍVEL EM SEU DESCONFORTO COM AS AFIRMAÇÕES.",0,false,0,,,,,,
UgxPPZcmlFX2AQthAJh4AaABAg,W.C.N. Upatininga,3 days ago,1528502996581,Eles nao deixam o advogado falar a vontade.,0,false,0,,,,,,
UgzupNGvO14Qpmtf1Vx4AaABAg,lucio watanabe,3 days ago,1528502996591,Voto impresso já,0,false,0,,,,,,
Ugy16BROPAlIGA_-6Ch4AaABAg,Inaldo medeiros Nascimento,3 days ago,1528502996597,"COM MAIS UMA DEMONSTRAÇÃO DO DESCASO A VONTADE DO POVO A  ""CORTE"" CHAMADA DE SUPREMA ZOMBA, ESCARNECE E DESMORALIZA E ENVERGONHA A DEMOCRACIA BRASILEIRA. VAMOS ÀS RUAS, FORA TODA ESSA CORJA DE CORRUPTOS.",0,false,0,,,,,,
Ugz-a0cgtWKawJDBWQJ4AaABAg,W.C.N. Upatininga,3 days ago,1528502996604,Ué! chama os melhores rackers? e ser  Rackes é legalmente aceito sr. ministro?,0,false,0,,,,,,
UgwTrSmsa6jXJ8zrZed4AaABAg,Eliete Silva,3 days ago,1528502996613,Intervenção Militar Já!,0,false,0,,,,,,
UgzWjAURP4qeKs5d6tF4AaABAg,E. Rangel,3 days ago,1528502996621,"Canalhas, ficaram apavorados, só quero ver se a população irá ficar com a bunda na cadeira.",0,false,0,,,,,,
UgylSP0HXRke5FTJWQ94AaABAg,Eliete Silva,3 days ago,1528502996630,Não é mais i caso de voto impresso... É FORA OS BANDIDOS TOGADOS!!!,0,false,0,,,,,,
Ugy-HOtA2GRtuP8tV714AaABAg,Archimedes Viana,3 days ago,1528502996640,"QUEREMOS O VOTO IMPRESSO, É LEI .",0,false,0,,,,,,
UgwZ4FyjIHNt5pM2fvd4AaABAg,carlos arthur,3 days ago,1528502996650,"Caro Sr. O nosso país é corrupto e as vossas afirmações colocou em pânico os ministros . O congresso nacional e todas as instituições deveriam tomar posicionamento. Porque tanta resistência ao voto impresso , gasta dinheiro e o dinheiro que será gasto com o fundo eleitoral não é uma indescencia e porque pode? Já sei: corrupção  se permite  coisa honesta não pode. Brasil que vergonha.",0,false,0,,,,,,
UgzFstEKOiwL7H2itRR4AaABAg,Eliete Silva,3 days ago,1528502996659,"É imoral chama_lós de excelência... São bandidos togados! STF prostituto, não me representa. Não salva nenhum...",0,false,0,,,,,,
Ugzqg_vAa2ONYguInqB4AaABAg,anjinhodourado1,3 days ago,1528502996668,"Fingem q escutam, mas não tão nem ai pois já decidiram q não terá voto impresso!",0,false,0,,,,,,
UgxEtWTdeQJB45dzF-F4AaABAg,gaspar transvida,3 days ago,1528502996675,"Não posso nem imaginar esse absurdo.  STF, ninguém irá acreditar no pleito, sem a confirmação impressa. Fraude, fraude, fraude,fraude...",0,false,0,,,,,,
UgydMwTTBD8A_KCyiCt4AaABAg,SHAZAM,3 days ago,1528502996684,"O STF está sendo os três poderes!!! Executivo, legislativo e judiciário.",0,false,0,,,,,,
UgyN1ChVCZlBERJoH1N4AaABAg,Inaldo medeiros Nascimento,3 days ago,1528502996695,OS TAIS DE TOGA ESTÃO UNÂNIMES CONTRA ESSA PROVA CABAL. STF DE SUSPEITOS. SOCIEDADE EXIGE NOVOS TESTES DA URNAS ELETRÔNICAS COM VIGILÂNCIA E OBSERVADORES NACIONAIS E INTERNACIONAIS.,0,false,0,,,,,,
UgzbCaCokPdHFtTf6EZ4AaABAg,deiwesararuama,3 days ago,1528502996702,"Eles sabem que a urna não é segura ,mais como o sistema poderá manipular as eleições ou até a vitória de Bolsonaro? Só assim manipulando as urnas,STF não me representa.",0,false,0,,,,,,
UgwfJtJfEaT67Mm_HjB4AaABAg,Jovel Jovel,3 days ago,1528502996709,Bandidos,0,false,0,,,,,,
UgyuPsZKKCOCGnAn2XN4AaABAg,Hernandes C Silva,3 days ago,1528502996717,Canalhas!,0,false,0,,,,,,
UgzP_BI2XY5PztB5fVJ4AaABAg,Jovel Jovel,3 days ago,1528502996728,Bandidos deram apenas 8 minutos    e ainda interferem pra confundir mas a Justiça Divina triunfará sôbre todos esses já muito amaldiçoados e os outros também,0,false,0,,,,,,
UgzFB0Bl_rrx-JYpc4d4AaABAg,Au Revoir,3 days ago,1528502997666,"STF piadista como sempre; Eles ""Chamam Melhores Hackers"", sabem nem a diferença entre 0 e 1.",0,false,0,,,,,,
UgwFGs8G9WSut7_Rut14AaABAg,Cassiano Pessanha,3 days ago,1528502997671,Cambadas de bandidos safado!!! Temos que ir para as ruas parar o Brasil,0,false,0,,,,,,
Ugzbqwsalg2-8Wcyojh4AaABAg,paulo cesar,3 days ago,1528502997678,Os ratos fraudadores de toga não deixam o advogado falar. Quem acredita nestes bandidos de toga? Serviçais das quadrilhas partidárias que os nomeou para o paraíso das impunidades próprias e de seus chefes.,0,false,0,,,,,,
UgyVt7N-qkyFhcCoeed4AaABAg,Randy Delgobo,3 days ago,1528502997688,Eu nao vou pagar mais nem 1 centavo de imposto nessa merda de País,0,false,0,,,,,,
UgwSCJm4lYavCL9-pKZ4AaABAg,Cassiano Pessanha,3 days ago,1528502997692,Realmente estamos nas mãos dos ladrões,0,false,0,,,,,,
Ugxc_3G7FRIRErci3DZ4AaABAg,José Marcos,3 days ago,1528502997700,"Não irei votar mais..., essas urnas eletrônicas são fraude.",0,false,0,,,,,,
Ugwe-8HYVJHJHnb1LJF4AaABAg,Jovel Jovel,3 days ago,1528502997704,Bandidos dão apenas 8 minutos e ainda interferem descaradamente mas a Justiça Divina triunfará sôbre todos esses já muito amaldiçoados e todos os outros também,0,false,0,,,,,,
Ugwiwi63hhrXNBjklsN4AaABAg,Ibnejas Ibnejas Max Cordeiro Lima,3 days ago,1528502997712,Tenho a maior vontade de matar todos do STF,0,false,0,,,,,,
UgxcMVaAmlCf5WP-ZEN4AaABAg,adriano soares,3 days ago,1528502997721,"Ministro não deviria ser por indicação política, principalmente por ladões.",0,false,0,,,,,,
Ugxm7gmzy1mTvEu_w5N4AaABAg,Duarte Godoy Duarte,3 days ago,1528502997725,"Ditadura SPF, faz o que quiser, é uma lei e STF recusou cumprir. Tipo essa não vale",0,false,0,,,,,,
UgzKE2VoChX_9plM1bh4AaABAg,Antonio Faria,3 days ago,1528502997733,STF cagam para o povo brasileiro.,0,false,0,,,,,,
UgxYZHK8ZffhUu8-aWV4AaABAg,Flavio Renee da Cunha,3 days ago,1528502997738,O rabo desses bandidos tá tão preso que se quer tem eles educação para deixar advogado falar. Se eu pudesse tomava todos os poderes constituídos do Brasil e fechava-os no cárcere. BANDIDOS DE TOGAS FDP VOCÊS RECEBERÃO EM BREVE O QUE É TODOS VOCÊS!,0,false,0,,,,,,
Ugx-VosMW12EGxdnpTh4AaABAg,markushalfmad,3 days ago,1528502997747,Essa cacalhada do STF jogou um monte de pedras no advogado Alberto Emanuel Albertin Malta assim que ele começou a falar com a intenção de intimidá-lo e  desestabilizá-lo em seus argumentos e mesmo assim ele lavou o chão com a cara deles. É isso aí!!,0,false,0,,,,,,
UgyuhYeM8Sndna0epFh4AaABAg,Fredy,3 days ago,1528502997753,Foi falar que as urnas tem falhas que os ratos já saíram em defesa do TSE.,0,false,0,,,,,,
UgzAJWjT-KvMXKpQMW14AaABAg,Leonel Marcos,3 days ago,1528502997761,"Esse muleque mandou bem. Os ministros ficaram todos nervosinhos pra parecer que não sabiam que poderia ser fraudas as urnas, estão enganando o povo brasileiro. E esse perito Osvaldo Aranha é bom!",0,false,0,,,,,,
Ugz4EiA-CmFLbf9yvgp4AaABAg,Edmilson Oliveira,3 days ago,1528502997771,"Trataram logo de ""pisar e diminuir"" o Advogado que os calou em seguida. Ninguém falou mais nada! Perderam a voz! Aí está a prova de que estão contrários à vontade do povo brasileiro. Vai ficar assim? Será que os caminhoneiros terão que tomar frente também nisso?!",0,false,0,,,,,,
UgzAFq7sDecPft9Bpyl4AaABAg,Felipe G,3 days ago,1528502997779,"Esses são os reis do Brasil, mandam e desmanda, se o congresso votou ? Foda-se eles passam por cima e pau no cu de quem reclama, achou ruim ?? pior saber que ministro do stf é indicado por presidentes e não por concurso e o cargo é VITALICIO e ninguém pode fazer nada.",0,false,0,,,,,,
UgybDjB2Lh9YN9bPytl4AaABAg,Marcelo Valente,3 days ago,1528502997783,"Quanta falta de respeito dos tolgados, a palavra está com o advogado, porque de tanto falatório por todos os ministros, tão preocupados em manter o sistema, o mecanismo, onde eles sempre se beneficiaram. Canalhas, corruptos, câncer do Brasil. ACORDAAA BRASIL, OU VAMOS CONTINUAR TOMANDO NO RETO?",0,false,0,,,,,,
