id,user,date,timestamp,commentText,likes,hasReplies,numberOfReplies,replies.id,replies.user,replies.date,replies.timestamp,replies.commentText,replies.likes
UgxVKYQOCj02_Ij4bqN4AaABAg,Kamafeu 00,1 week ago,1528160039934,Sempre q vou votar me da uma vontade de mija,0,false,0,,,,,,
UgyUTHDf6JvbUfSeZqt4AaABAg,Rennan Resende,2 weeks ago,1527555239940,"Muito ótimo todos o vídeos, contribuindo contra a manipulação da minoria manipuladora afavor do enterece proprio, como já vem dez o começo do mundo,  unica coisa que eu posso fazer pra agradecer é compartilha ao máximo é me torna mais um patrão do canal, nos brasileiros temos sorte de ter alquem por nós.",0,false,0,,,,,,
UgzKuAafZUxm4m3hgJN4AaABAg,Daniel Cuman,1 month ago,1526086439948,"😂😂 não vou votar, parabéns otário",0,false,0,,,,,,
UgyGkDr0Y032MMsOaB14AaABAg,Gilson Vieira,4 months ago,1518396839959,Eu vou quebrar essa merda ! quem tá comigo ???????????????????,1,false,0,,,,,,
UgwWSKnYnm7P3mcR6uB4AaABAg,Gilson Vieira,4 months ago,1518396839962,Vamos quebrar essa merda !!!!!!,1,false,0,,,,,,
UgwTu-QxwGbV39cgti54AaABAg,Adilson Carvalho,5 months ago,1515718439965,"VEJA COMO FUNCIONA A FRAUDE DAS URNAS ELETRONICAS, APROVEITE E GANHE UM BRINQUEDO   https://www.youtube.com/watch?v=DarlNs6HZd8&ab_channel=CanaldoConservador",0,false,0,,,,,,
Ugj_TITZT1f31ngCoAEC,Eduardo Scopel,11 months ago,1499820839971,teu canal ta certo alem de otário você é burro ridículo não entende de nada.,0,false,0,,,,,,
Ugi9zCJxpH96lngCoAEC,Renan Cordeiro,1 year ago,1497228839974,"não cague na urna, ou seja não vote no PT ou em qualquer outro partido aliado ao foro de SP",0,false,0,,,,,,
UgiUUEikoCyy3HgCoAEC,Otário Anomynus,1 year ago,1497228839982,2° titulo coisas que vc queria fazer mais não pode kkk...,0,false,0,,,,,,
UggVLbY4B4ZiMHgCoAEC,Léo Rodrigues,1 year ago,1497228839985,Achei que iria ensinar  dar pane nessa matrix,0,false,0,,,,,,
UgiG0oAKnQ9FNngCoAEC,Wilder Luan,1 year ago,1497228839993,vai tomar no cu vídeo de bosta do caralho qual é o serumaninho que existe nessa face da terra vai fazer isso que ele sitou .....,0,true,1,,,,,,
,,,,,,,,UgiG0oAKnQ9FNngCoAEC.8IcpdFNzB6H8JladVMxjgk,Gabriel Nunes,1 year ago,1497228840298,Só digitar no Google homem coloca fogo na urna eletrônica e você vai ser respondido kkkkkkkkkkk,0
Ugh4ol82nWRwh3gCoAEC,Alison Games2,1 year ago,1497228840004,kkkkk... LOL,0,false,0,,,,,,
Ugj1YGtPz-F3dngCoAEC,Nilson Severino da Silva,1 year ago,1497228840008,ÔÔÔôôô que legal.,0,false,0,,,,,,
UgitgaGwnzhgYngCoAEC,Guma Darko,2 years ago,1465692840012,kkkkkkkkkkkkkkkkkkkkkkkkkkkk,0,false,0,,,,,,
Ugj22nh6Nep693gCoAEC,Lucas Vínicios,2 years ago,1465692840018,Toma atras do saco msm viu!!!!!!!!!!!!!!!!,0,false,0,,,,,,
UgjTG5xAa13jmHgCoAEC,MáRcYo H12,2 years ago,1465692840025,sim não Tente Levar a urna pra casa você vai ser Lascar,0,false,0,,,,,,
Ugjj592A1UA4vHgCoAEC,MáRcYo H12,2 years ago,1465692840030,canal Massa demais,0,false,0,,,,,,
Ughra6pp6TwrzXgCoAEC,Robson Costa,2 years ago,1465692840032,"esse é meu video predileto , amo esse canal , viva 2016 o ano da democracia !!",2,true,3,,,,,,
,,,,,,,,Ughra6pp6TwrzXgCoAEC.8CTQgLRAUEz8D-Ayizcq5F,Daniel Bruce Agra,2 years ago,1465692840369,"esse ano promete... 
muita merda",1
,,,,,,,,Ughra6pp6TwrzXgCoAEC.8CTQgLRAUEz8D-UtQ1SDOd,Robson Costa,2 years ago,1465692840374,+Daniel Bruce Agra até 2018 vai tudo ser frenético,0
,,,,,,,,Ughra6pp6TwrzXgCoAEC.8CTQgLRAUEz8D0mDQ7I5sR,Daniel Bruce Agra,2 years ago,1465692840377,+Robson Costa vdd,0
UgiPL26FIU0OJXgCoAEC,bilador araujo,2 years ago,1465692840040,e NÃO cague no numero 1 e 3...,0,false,0,,,,,,
Ugi_m1pd9HNucngCoAEC,Sidorf Souza,2 years ago,1465692840042,nunca ri tanto... Vc é demais otario parabéns muito bom esse canal!! além de aprender muito me divirto... kkk,0,false,0,,,,,,
UgjHuph5A7NiEHgCoAEC,Ciências Humanas TV,2 years ago,1465692841124,Deveria ter a impressão dos votos da urnas.,0,false,0,,,,,,
Ugi7KW0yliE9KXgCoAEC,Anderson Gonzaga,2 years ago,1465692841128,kkkkkkk,0,false,0,,,,,,
Ugi3Hl2nS2x3tHgCoAEC,carlos beto,2 years ago,1465692841132,na verdade agente nao precisa desses parasitas . temos a internet pra que ?  a populacao poderia volta no q a nacao achasse melhor,0,false,0,,,,,,
Ugi_oqPWMjD6fHgCoAEC,Mathias Santos,2 years ago,1465692841137,Como fazer uma animação assim. Qual o programa,0,false,0,,,,,,
Ughc454mSsXUOXgCoAEC,O fantástico mundo de marcel,3 years ago,1434070441146,Tenta falar menos palavão porque até crianças precisam saber disso e os pais n vão deixar,0,false,0,,,,,,
UgiVT49No_IJ9XgCoAEC,Arben Rodrigues,3 years ago,1434070441149,"politicos vagabundos,eleitores trouxas!!! obrigado OTARIO,mete o pau neles mesmo.",0,false,0,,,,,,
UgivBGcdl7SUtngCoAEC,luiz eduardo Alves,3 years ago,1434070441153,E UMA COISA QUE VC NUNCA PODE FAZER NEM PENSAR EM FAZER E DIGITAR 13 NA URNA,0,false,0,,,,,,
UgihBsXAqrtpi3gCoAEC,Caio Bruno,3 years ago,1434070441158,"Otário, eu ouvi dizer que essa forma de vídeo (com desenho animado) é menos trabalhosa, estou correto? poderia me fazer o favor de dizer o porquê?",0,false,0,,,,,,
Ugg8bew358x153gCoAEC,Guilherme & knuckles,3 years ago,1434070441161,Há tano um sarcasmo como uma veracidade nas falas do otário. Meus parabéns!,0,false,0,,,,,,
Ugje2Aj7qgh6mXgCoAEC,Acroporium sp.,3 years ago,1434070441164,"Ficou parecendo aqueles programas de auditório que passam horas explicando os riscos de se colocar no microondas coisas como ovo de avestruz, lata de milho, bombril, etc.",0,false,0,,,,,,
UghBkanPSQiMx3gCoAEC,Vamo Inter.net,3 years ago,1434070441169,Oi Otario td bem ?,0,false,0,,,,,,
UghzdNFHIttY_HgCoAEC,Tiago DMota,3 years ago,1434070441173,"Aqui na minha cidade um cachorro entrou na seção de votos e tirou a urna da tomada, porém segundo os mesários nada aconteceu em relação aos votos.",0,false,0,,,,,,
Ugj5ykDMupAeMXgCoAEC,Max Hero,3 years ago,1434070441180,Também era legal falar pro público não tirar selfie na urna.,0,false,0,,,,,,
Ugg2kJ3fSRo4KngCoAEC,Alexandre Santos,3 years ago,1434070441184,"Sistema seguro voce que pensa seu OTARIO me falaro que mesarios foram pagos pra roubar mais de 500 votos para a quela safada!! IMAGINA ISSO EM MILHARES DE URNAS O RESULTADO TÁ AI!!  você acha que é seguro
(NADA É 100% SEGURO) OTÁRIOS SOMOS TODOS NOS BRASILEIRO!!!",0,false,0,,,,,,
Ugj5Gs_1i6vcN3gCoAEC,Sylvia de Gêmeos,3 years ago,1434070441188,nada me convence de treta nessas merdas!!!!!,0,false,0,,,,,,
Ugg6lHM90fiXCXgCoAEC,Canal do Otario,3 years ago,1434070441194,"Eu falei p/ não fazer isso ;-) O que NÃO fazer com as Urnas Eletrônicas @CanalDoOtario RT @Estadao ""Eleitor é preso após incendiar urna pic.twitter.com/4srmV4aDhG""",20,true,2,,,,,,
,,,,,,,,Ugg6lHM90fiXCXgCoAEC.7-H0Z7-Rx2b7-LlNOyOK5M,Marcelo Sampaio Mendonça,3 years ago,1434070441554,"Acho que ele não entendeu. Hahaha.

Por falar nisso, você viu que em Goiás teve um eleitor que colou a tecla de número 3 com cola instantânea?
http://g1.globo.com/goias/eleicoes/2014/noticia/2014/10/eleitor-poe-cola-em-tecla-e-estraga-urna-eletronica-em-formosa-go.html",1
,,,,,,,,Ugg6lHM90fiXCXgCoAEC.7-H0Z7-Rx2b74WFvPSP4zp,sandrolucas,3 years ago,1434070441557,"Acho que esse eleitor que incendiou a urna, deve ter aprendido com seu vídeo. kkkkkkk",0
Uggb63hxsdkVGHgCoAEC,Mateus S.D.,3 years ago,1434070441199,"Será que foi influenciado por você?
""Homem é preso depois de atear fogo em urna eletrônica.""
Confesso que da vontade, mas iria me dar incomodo.",0,false,0,,,,,,
UghnFahY8KNz_ngCoAEC,Um Balde de Areia,3 years ago,1434070441205,KKKKKKKKKKKKKKKKKKKKKKKKK ESSA E PA VCS N TENTE ROUBAR A URNA PARA MODIFICA VOTOS,0,false,0,,,,,,
Ughp1ZmFAuKd-HgCoAEC,Booty Memes,3 years ago,1434070441213,You suck,0,false,0,,,,,,
Ughi6Y_ki9GjTHgCoAEC,vitordemelooliveira Melo,3 years ago,1434070441217,"O vídeo ta meio q mandando indiretamente vc quebra-las,se vcs n entenderam!",0,false,0,,,,,,
UgjeMSlgtui1CngCoAEC,Rafa Rocha,3 years ago,1434070442383,"É impressão minha ou no final fica ambíguo?  tipo, 1-se você tomar todos os cuidados e não quebrar a urna, vai estar contribuindo para uma eleição rápida e segura. 2- Se você fizer tudo isso e quebrar as urnas vai estar contribuindo para uma eleição rápida e segura... 0õ",0,false,0,,,,,,
Ugg-FqO6833sNXgCoAEC,VOZ DO POVO,3 years ago,1434070442387,"Me sinto impotente diante de imposição que é ser obrigado a votar, e pior votar em uma urna eletronica que identifica o meu voto quando digita o numero do meu título de eleitoral para liberar a votação, além de que o voto não é impresso e nós eleitores, não temos acesso a conferência dos votos, como se fazia no tempo do voto em cédulas de papel.",0,false,0,,,,,,
UgjbppfOd1DCo3gCoAEC,KratosTosi,3 years ago,1434070442394,Que DROGA!!!!! Eu até já tinha comprado um balde novinho para levar cheio de água quando eu fosse votar!,0,false,0,,,,,,
Ugh2DJknd_RTFHgCoAEC,Shanx LB,3 years ago,1434070442398,certa vez o povo da minha cidade não pôde votar por que a tomada da urna tava sendo usada por uma candidata para carregar o celular,0,false,0,,,,,,
Ugjd75YlCx6EAHgCoAEC,Jhonatan Lima,3 years ago,1434070442403,"Otario,  gosto do seu trabalho, mas vc falou besteira. Sou mensário e pra quem n sabe no início do dia das eleições é impresso um relatório com tds os candidatos existentes e seus respectivos números de votos (no caso zero pra tds). Ao final do dia, é tirado um novo relatório onde constam qts votos receberam cada candidato naquela urna. E com isso caso o TSE julgue necessário, pode fazer uma contagem manual a pt destes relatórios. N acho q seja 100% a prova de fraudes, mas pelo número de pessoas envolvidas numa eleição acho pouco provável uma manipulação em larga escala.",0,false,0,,,,,,
Ugj8yYRnZybPjngCoAEC,vipmodelss,3 years ago,1434070442408,"Mesmo assim tem aquela velha história 90% das pessoas no Brasil são burras e ignorantes e facilmente manipuladas é a população que menos le no mundo. Então mesmo sem as urnas eletronicas o povo seria facilmente manipulado através de novelas, jornais, revistas, etc... Então que venham as urnas eletronicas !! O povo é manipulado sem saber, com ou sem urna eletrônica... Mesmo que tenha internet biblioteca, disponiveis, etc.. O povo escolhe por funk, cerveja , pagode , novelas, etc...  Opa esqueci do futebol... E também fazer filhos!!",0,false,0,,,,,,
UghWYyxJhZYxcngCoAEC,vipmodelss,3 years ago,1434070442413,"Vamos a uma pequena historinha... pra terem uma noção da fragilidade desse sistema em 1999 quando ele já estava em processo de desenvolvimento tinha uma pessoa que trabalhava nas urnas, vamos chama-lo de Sr. X ele é filho de um professor de engenharria elétrica que eu tive. O Sr. X foi o responsavel por ""trazer"" a nova plataforma pro brasil , mas ao fazer isso ele identificou que o responsável pela programação das maquinas , pasmem... Seria nada mais nada menos que o filho de um CANDIDATO na epoca... Abismado com tudo isso o Sr. X mudou-se para Europa e nunca mais voltou para o Brasil... Agora percebem a gravidade da situação ??",0,false,0,,,,,,
UghoGOKWuvzyHXgCoAEC,Aurora .Aurora,3 years ago,1434070442419,"Aff, não se pode jogar a urna na parede. .""",0,false,0,,,,,,
Ugi5p4UhebSw43gCoAEC,Edwilson Souza,3 years ago,1434070442424,"Faz um vídeo sobre essas pesquisas eleitoriais de melda. ninguém conhece alguem que já foi entrevistado. e com uma meia duzia de respostas já antecipam quem vai mamar, ops, ganhar.  duvido se essas pesquisas não fossem veiculadas na TV teriam a mesma repercussão.",0,false,0,,,,,,
UghxosEq22a2d3gCoAEC,Leon Volfied,3 years ago,1434070442431,Cara desculpa te contrariar mas eu estou trabalhando com urnas e a tentativa de perder os votos da urna é muito dificil pois os votos são salvos em varios locais ao mesmo tempo.pelos exemplos que vc falou se derrubar a urna ou soca a tela ainda é possivel troca a urna e os votos não vão se perder.inclusive o TRE no final das eleições abre uma auditoria mostrando o programa da urna e possivel fazer testes pra quem não confia nela para que possa ver como funciona e esclarecer todas as duvidas vcs podem fazer isso.o que quero dizer gente eu não achava que urnas eram confiaveis mas da pra ver que são tanto que eles não sabem em quem vocês votaram.podem não saber mas tem muitas formas de ver como urna funciona se é segura se o resultado é certo mas ninguem vai atras ve. desculpe agora a idginação mas as pessoas falam o TRE só pega e fica o dia todo tomando café mas ninguem vai ver como funciona de verdade o trabalho.,0,false,0,,,,,,
UgiGQXvUMubAw3gCoAEC,roberto massareto,3 years ago,1434070442438,"Quero compartilhar no face, mas só dá erro, estamos sendo sensurados.",0,false,0,,,,,,
Ugi9Ul-6tGp65HgCoAEC,Ricardo Carreira,3 years ago,1434070442447,Pior neh otario!!!!,0,false,0,,,,,,
UghJ14A0uR2XgXgCoAEC,James Alves,3 years ago,1434070442453,otario gostaria de saber em quem você vai votar!,0,false,0,,,,,,
Ugh8lXmKVoq6SXgCoAEC,Adamantium #Smash,3 years ago,1434070442458,3:15 é o tiririca,0,false,0,,,,,,
Ugg6f_P3OuVkKngCoAEC,brunomocsa,3 years ago,1434070442465,"Esse pais eh uma piada, o voto impresso nunca vai ser aprovado pq simplesmente as contagens nunca iriam bater. Tem cidades no interior que as urnas sao ate roubadas. Outras que nem o canditado que votou recebeu o proprio voto...",0,false,0,,,,,,
UgjnAoispqpGdHgCoAEC,Bruno Martins,3 years ago,1434070442470,kkkkkkkkkkk um dos melhores videos ate agora,0,false,0,,,,,,
UggV7sdbXwAVhHgCoAEC,Israel Sousa Costa,3 years ago,1434070442477,"Estou procurando uma utilidade para este vídeo... Por que explicar o óbvio é perda de tempo, e assistir é perda de tempo maior ainda.",0,false,0,,,,,,
Ugj6tN53hL6CGngCoAEC,DEMOCRACIA DIRETA JÁ,3 years ago,1434070442488,"É isso aí galera, tem que ter cuidado. Se quebrar a urna, os caras podem cobrá-la de vocês, e custa a fortuna de 1.200 reais. Não é porque o valor deva ser parcelado em trocentas vezes, que a gente possa ter qualquer descuido com esse símbolo de nossa modernidade : )",0,false,0,,,,,,
Ugj4ZB4CVLpjoXgCoAEC,Priscila da Silva,3 years ago,1434070442491,"POVO BRASILEIRO
As eleições estão chegando e o nosso futuro depende de todos nós.
 Vocês estão cientes de como está o Brasil e agora é a hora de juntos resgatar o nosso país do caos em que ele se encontra. Precisamos salvar o Brasil. Quem tem amor no coração irá concordar comigo. Não existe mais amor ao próximo, paz, compaixão, solidariedade, justiça, tranquilidade, respeito, dignidade como era há uns 20 anos atrás.
 POR FAVOR não vamos nos omitir e deixar que os maus acabem de vez com o nosso querido país. Só vejo uma solução para o nosso país: TODOS NÓS, CATEGORIAS MASSACRADAS PRECISAMOS NOS UNIR E PARTIR PARA LUTA, SEM VIOLÊNCIA, MAS COM MUITA SABEDORIA.
 RECEBI UM E-MAIL PROVANDO QUE O SALÁRIO QUE RECEBEMOS; DEPOIS DE 1 MÊS DE TRABALHO; 70% DESSE SALÁRIO CORRESPONDE A TRIBUTOS QUE PAGAMOS. SÃO IMPOSTOS, TAXAS , CONTRIBUIÇÕES DE MELHORIA, PEDÁGIOS, TUDO ARRECADADO PELO GOVERNO E SIMPLESMENTE ESSA ARRECADAÇÃO NÃO É DESTINADA AOS SEUS DEVIDOS FINS ,OU SEJA, NA SAÚDE, NA EDUCAÇÃO, NA SEGURANÇA, ETC, PORQUE FALO ISTO ? PORQUE TUDO NO BRASIL ESTÁ UM CAOS! – SABEMOS MUITO BEM PARA ONDE VAI TODA ESTA ARRECADAÇÃO.
 POVO BRASILEIRO, COMO PODEMOS CONCORDAR COM ISTO?
 PRECISO PASSAR UNS DADOS IMPORTANTÍSSIMOS PARA VOCÊS, TALVEZ VOCÊS NÃO SAIBAM.
 IMPLORO A VOCÊS: É ESSENCIAL QUE LEIAM, ANALISEM, INVESTIGUEM E DECIDAM PELO FUTURO DO BRASIL.
 O BRASIL SE ENCONTRA NUM ESTADO LASTIMÁVEL EM TODOS OS SETORES: SAÚDE, EDUCAÇÃO, TRANSPORTE, SEGURANÇA, MORADIA, CARGA TRIBUTÁRIA ABSURDAMENTE ALTA, FALTA DE DIGNIDADE , CORRUPÇÃO, VIOLÊNCIA, DESIGUALDADE SOCIAL ABSURDA ENTRE OS BRASILEIROS, MUITA POBREZA, MUITA FOME. NADA FUNCIONA NESTE PAÍS.
 PRECISAMOS SABER PELO MENOS ESTES 3 ARTIGOS DA NOSSA CONSTITUIÇÃO E SE ELES ESTÃO SENDO RESPEITADOS PELOS NOSSOS PARLAMENTARES:
ART 6º - SÃO DIREITOS SOCIAIS A EDUCAÇÃO, A SAÚDE, O TRABALHO, O LAZER, A SEGURANÇA, A PREVIDÊNCIA SOCIAL, A PROTEÇÃO Á MATERNIDADE E A INFÂNCIA, A ASSISTENCIA AOS DESAMPARADOS.
ART 7º - É DIREITO SOCIAL, SALÁRIO MÍNIMO, FIXADO EM LEI, NACIONALMENTE UNIFICADO, CAPAZ DE ATENDER A SUAS NECESSIDADES VITAIS BÁSICAS E ÁS DE SUA FAMÍLIA COM MORADIA, ALIMENTAÇÃO, EDUCAÇÃO, SAÚDE, LAZER, VESTUÁRIO, HIGIENE, TRANSPORTE E PREVIDÊNCIA SOCIAL COM REAJUSTES PERIÓDICOS QUE LHE PRESERVEM O PODER AQUISITIVO, SENDO VEDADA SUA VINCULAÇÃO PARA QUALQUER FIM.
ART 5º - TODOS SÃO IGUAIS PERANTE A LEI, SEM DISTINÇÃO DE QUALQUER NATUREZA, GARANTINDO-SE AOS BRASILEIROS E AOS ESTRANGEIROS RESIDENTES NO PAÍS A INVIOLABILIDADE DO DIREITO Á VIDA, Á LIBERDADE, Á IGUALDADE, Á SEGURANÇA E A PROPRIEDADE.
ESTES 3 ARTIGOS SÃO ESSENCIAIS PARA TODO BRASILEIRO TER UMA VIDA DIGNA E COM RESPEITO.
 AGORA PERGUNTO A VOCÊS, ELES ESTÃO SENDO CUMPRIDOS POR NOSSOS GOVERNANTES?
 FAÇO OUTRA PERGUNTA, O SALÁRIO MÍNIMO É DE R$724,00 POR MÊS, POR FAVOR RESPONDAM COM SINCERIDADE, COM ESTE VALOR É POSSÍVEL ATENDER AS NECESSIDADES BÁSICAS DE UM CIDADÃO MAIS A SUA FAMÍLIA?
AGORA QUERO INFORMAR A VOCÊS QUANTO CUSTA POR MÊS PARA A CÂMARA DOS DEPUTADOS UM DEPUTADO FEDERAL. SIMPLESMENTE R$2.000.000,00 ( DOIS MILHÕES DE REAIS). ALÉM DO SALÁRIO ELES TEM VÁRIAS VERBAS E AUXÍLIOS E AINDA GANHAM O 14º E 15º SALÁRIO.
 ESTE VALOR É QUANTO SE GASTA COM UM DEPUTADO FEDERAL MAS SÃO SIMPLESMENTE 513 ( QUINHENTOS E TREZE).
 PERGUNTO NOVAMENTE A VOCÊS POVO BRASILEIRO, PORQUE NESTE PAÍS NADA FUNCIONA?
 TODOS OS PROBLEMAS DO BRASIL SE RESUMEM EM PODER, DINHEIRO , CORRUPÇÃO, EGOÍSMO, ETC.
ALÉM DISTO GOSTARIA DE COMENTAR COM VOCÊS SOBRE OUTRO PROBLEMA MUITO SÉRIO POR SINAL: TRIBUTOS.
 A LISTA É IMENSA, SÃO MAIS OU MENOS 90 TRIBUTOS. PAGAMOS MUITOS TRIBUTOS, A LISTA É IRREAL, NÃO DÁ PARA ACREDITAR QUE O POVO BRASILEIRO DEIXOU O PAÍS CHEGAR A ESTE PONTO. O BRASIL TEM TRIBUTOS DEMAIS E O PIOR, GASTA MUITO MAL O DINHEIRO ARRECADADO.
 PAGAMOS MUITOS IMPOSTOS E O BRASIL CONTINUA UM CAOS. EDUCAÇÃO PÉSSIMA, SAÚDE PÉSSIMA, SEGURANÇA PÉSSIMA, MUITA VIOLENCIA E MUITA CORRUPÇÃO E PARA ONDE VAI O DINHEIRO DOS IMPOSTOS?
 A CARGA TRIBUTÁRIA ESTÁ PESADA DEMAIS. ESTAMOS FICANDO SEM DINHEIRO PARA VIVERMOS COM UM MÍNIMO DE DIGNIDADE. SE NÃO TOMARMOS UMA ATITUDE DRÁSTICA, TODOS JUNTOS, AS COISAS SÓ TENDEM A PIORAR E SE TORNARÃO MAIS DIFÍCEIS. NUNCA ENXERGAREMOS A LUZ NO FINAL DO TÚNEL.
QUERO CONTAR UMA COISA MUITO ESTRANHA PARA VOCÊS E JURO QUE QUERIA MUITO SABER PORQUE ATÉ HOJE (26 anos DE CONSTITUIÇÃO BRASILEIRA ) ESTE IMPOSTO AINDA NÃO FOI COBRADO A QUEM DE DIREITO OS DEVE? ART. 153 DA CONSTITUIÇÃO BRASILEIRA PROMULGADA DESDE 1988 – COMPETE A UNIÃO INSTITUIR IMPOSTOS SOBRE GRANDES FORTUNAS, NOS TERMOS DE LEI COMPLEMENTAR.
 TODOS OS IMPOSTOS IMPRESSOS NA CONSTITUIÇÃO SÃO COBRADOS; MENOS ESTE (IMPOSTO SOBRE GRANDES FORTUNAS); PORQUÊ PORQUÊ POVO BRASILEIRO?????????
OS POLÍTICOS NA SUÉCIA NÃO TEM LUXOS, NEM SALÁRIOS ALTÍSSIMOS, NEM MORDOMIAS. O PAÍS FUNCIONA MUITO BEM E TODOS SÃO FELIZES.
 PRECISAMOS DE MEDIDAS EMERGENCIAIS PRINCIPALMENTE EM RELAÇÃO Á SAÚDE. O POVO BRASILEIRO ESTÁ MORRENDO POR FALTA DE ASSISTENCIA. FALTAM MÉDICOS, ENFERMEIROS, AUXILIARES. FALTA GESTÃO E SOBRA CORRUPÇÃO. NOS HOSPITAIS BRASILEIROS O QUE SE VÊ SÃO PACIENTES ESPALHADOS EM CORREDORES DE HOSPITAIS IMUNDOS E FALTA DE MATERIAIS BÁSICOS COMO MACAS , MEDIDORES DE PRESSÃO E FIOS DE SUTURA PARA CIRURGIAS.
 EXISTEM PRIORIDADES QUE DEVEMOS RESOLVER IMEDIATAMENTE: REFORMA POLÍTICA, REFORMA TRIBUTÁRIA, SAÚDE, EDUCAÇÃO, SEGURANÇA, JUSTIÇA, DIGNIDADE, RESPEITO, ESTUDO SOBRE OS SALÁRIOS DE TODOS OS BRASILEIROS(QUE SEJAM JUSTOS E DIGNOS), QUE NÃO SEJAMOS TÃO DESIGUAIS, UNS GANHANDO MÍSEROS r$724,00 POR MÊS E OUTROS GANHANDO UNS R$1.000.000,00 POR MÊS ALÉM DE AUXÍLIOS, VERBAS .
 TODOS SABEMOS QUE EXISTE OUTRO PROBLEMA MUITO SÉRIO ACONTECENDO NO BRASIL: NOSSO DINHEIRO TEM SIDO DESVIADO PARA PARAÍSOS FISCAIS.
A CONSTITUIÇÃO NÃO ESTÁ SENDO CUMPRIDA E SÓ RESTA A NÓS EXIGIR MEDIDAS URGENTES PARA QUE A LEI SEJA CUMPRIDA.
O OBJETIVO PRINCIPAL DA NOSSA CONSTITUIÇÃO É O BEM COMUM, OU SEJA, GOVERNANTES TRABALHAREM PARA O BEM DE TODOS OS BRASILEIROS. PERGUNTO A VOCÊS, ISTO ESTÁ ACONTECENDO NESTE NOSSO LINDO PAÍS?
 TENHO CERTEZA QUE NÃO! CADA UM ESTÁ VENDO O SEU LADO E O RESTO QUE SE DANE.
O PODER JUDICIÁRIO EXISTE PARA FAZER A LEI SER CUMPRIDA E COMO PODEMOS PERCEBER NADA DISTO ESTÁ SENDO CUMPRIDA.
VAMOS A LUTA! O POVO UNIDO JAMAIS SERÁ VENCIDO!
 CONFIO EM VOCÊS PARA TAL MUDANÇA.
ATENCIOSAMENTE
PRISCILA DA SILVA
OBS: O NOSSO SAUDOSO EDUARDO CAMPOS TINHA UM IDEAL LINDO PARA O NOSSO BRASIL: NOS TORNARMOS UMA SOCIEDADE JUSTA. ESTE TAMBÉM É O MEU IDEAL, MAS POR FAVOR POVO BRASILEIRO VAMOS ABRIR NOSSOS OLHOS, SE NÃO FIZERMOS NADA ESTE IDEAL FICARÁ APENAS NOS SONHOS (COMO SERIA MARAVILHOSO SE TORNASSE REALIDADE, MAS SÓ DEPENDE DE TODOS NÓS). ENCONTRARÍAMOS A FELICIDADE.
 NÃO VAMOS DESISTIR DO BRASIL” (EDUARDO CAMPOS).",0,false,0,,,,,,
Ugg36oH_wSIJhHgCoAEC,Wesley Portela,3 years ago,1434070442500,esse video ficou nojento!,0,false,0,,,,,,
Ugio8_79GnfHBHgCoAEC,Jaqueline Oliveira,3 years ago,1434070443507,muito bom!,0,false,0,,,,,,
UggvZONcC-O1NXgCoAEC,joão serapião,3 years ago,1434070443510,"votar nas urnas brasileiras e aceitar viver com uma mulher traidora, que também não aceita uma auditoria, pra que o marido tenha como saber quantos pies de pano  estiveram com ela, cidadães brasileiro não casem com mulher de primeira geração",0,false,0,,,,,,
Ugh6uPQs8-iLZ3gCoAEC,Herbert Bevenuto,3 years ago,1434070443518,"é verdade 
bom video",0,false,0,,,,,,
UghDuMhRIrwvq3gCoAEC,contabilidadetv,3 years ago,1434070443523,Excelente vídeo,0,false,0,,,,,,
Ugj6p7A-vvkJ5HgCoAEC,Braime Pakudan,3 years ago,1434070443530,"sinceramente, nunca vi tal instrumento tão duvidoso como as urnas eletrônicas, infelizmente colocar o voto impresso não seria viável, uma vez que voltaríamos ao VOTO DE CABRESTO todos sabem que compra de voto no Brasil e comum, logo  um político combinaria com o eleitor que só pagaria depois de apresentado o O VOTO impresso (comprovante de voto) onde se comprovaria se realmente o voto foi efetuado, logo e inviável",0,false,0,,,,,,
UghYdC_KnNviV3gCoAEC,odineirog,3 years ago,1434070443535,boicotaram o canal?Não consigo acessar os videos.,0,false,0,,,,,,
Ugi4awwamQtRnHgCoAEC,William Reis,3 years ago,1434070443543,HAHAHAHHAHA GENIAL,0,false,0,,,,,,
UggbXHJNd7Z0B3gCoAEC,Esio Silva,3 years ago,1434070443551,caraca e garoto neste modo e magiver,0,false,0,,,,,,
UghjYwqcoQFYEngCoAEC,Washington Tom,3 years ago,1434070443556,"sinceramente a coisa e muito mais grave do que se imagina , estamos fudidos",0,false,0,,,,,,
Ugi1HH6KWGpf0XgCoAEC,BRUNO RIZO,3 years ago,1434070443566,AMIGO NÃO SEI O Q FAZER POIS MESMO VOTANDO EM MEU CANDITADO NAO TENHO CERTEZA SE MEU VOTO VAI PRA ELE O Q FAÇO,0,false,0,,,,,,
UghSDJTtn0UWzngCoAEC,pedro pavan,3 years ago,1434070443570,óóóóóó que legaaaaaaaaaaaaaaaaaaaaal,0,false,0,,,,,,
UgjXtKW7wVlXu3gCoAEC,Thiago Bastos,3 years ago,1434070443577,"A urna emite um relatório chamado zerésima quando é ligada e ao final da eleição ela emite outro relatório com os votos computados na seção. Ambos relatórios podem ser impressos mais de uma vez para que sejam afixados na porta da seção para os eleitores verem ou entregue para os responsáveis pelo partido naquela zona eleitoral. A primeira via sempre, junto com o disquete que grava todos os votos é enviada em um envelope lacrado junto com a urna para a comparação dos votos durante a apuração. Na falta de energia elétrica a urna possui bateria e se a mesma descarregar o mesário orienta o eleitor para o preenchimento do voto no papel, como era antes.",0,false,0,,,,,,
UghFYqCu3FzReXgCoAEC,Alex Faustino,3 years ago,1434070443581,faz um video sobre o Novo Sistema de Tributação Receita Federal,0,false,0,,,,,,
UggCiwHpro5xNHgCoAEC,Aleste Sec,3 years ago,1434070443589,Esse ano eu to livre dessa merda de eleição.,0,false,0,,,,,,
Uggf4X3UjcBWoXgCoAEC,Marcelo Teixeira,3 years ago,1434070443593,"Há fabricante das urnas eletrônicas para o Brasil  foi multada nos EUA por corrupção olhem  nesse link!

http://www.folhapolitica.org/2013/12/eua-multam-diebold-fabricante-das-urnas.html",0,false,0,,,,,,
UghlLLRqmUqYy3gCoAEC,Moraes Gamer,3 years ago,1434070443600,"Senti uma enorme ironia nesse video, rí bastante quando o Otário recomendou não cagar, bater ou explodir a urna.",0,false,0,,,,,,
UghdVkN4var2BXgCoAEC,LUCIVALDO BARBOSA,3 years ago,1434070443604,VOCÊ ME DA CADA IDEIA,0,false,0,,,,,,
UggKyzkOq--dO3gCoAEC,Tiburcius Van der Leeuwen,3 years ago,1434070443612,"Se alguém não votar paga uma multa de cerca de 3,00 R$. A grande democracia brasileira pune quem não quer votar nesses pilantras, para ver como o brasil é desenvolvido, tem urna eletrônica, que não é usada em nenhum país desenvolvido do mundo, mas obriga seus eleitores a votar. Por quê será????",0,false,0,,,,,,
UghI5yE-lMmFB3gCoAEC,MrSTheThanatos,3 years ago,1434070443618,"Vou tentar essa de cagar no teclado da urna nas próximas eleições.
Quem votar na minha cidade e sentir o dedo melado sabe o pq.",0,false,0,,,,,,
UgiVOaxNif-0CngCoAEC,Viviane,3 years ago,1434070443625,eu adoro quando vc diz ohhhhhhhhhhhhhh que legal ou entao nao fode essa porra kkkkkkkkkkkkkkkkkkkkkkkkkkkkkk,0,false,0,,,,,,
UgiINi115TuKUngCoAEC,Beatriz  Souza,3 years ago,1434070444259,o sacarmo brasileiro em ação rsrsrs nada como falar a verdade sem falar nada! Haha Parabéns pela mensagem nas entrelinhas Otario ;),0,false,0,,,,,,
