id,user,date,timestamp,commentText,likes,hasReplies,numberOfReplies,replies.id,replies.user,replies.date,replies.timestamp,replies.commentText,replies.likes
UgwE3ie8sZmsquOH4Gt4AaABAg,Alexandre Justi,1 minute ago,1528762055211,Deveriam fazer um teste oficial e legítimo dessas urnas sendo televisionado no horário nobre da Rede Globo para que toda a população brasileira pudesse acompanhar. Que tal meus compatriotas ?,0,false,0,,,,,,
UgxSSZnMFFvTMIscQLZ4AaABAg,Juninho Rodrigues,6 minutes ago,1528761755216,"ESPERAR O QUE DESSA GENTE MANCOMUNADA COM GOLPISTAS QUE APEARAM DO PODER UMA PRESIDENTA HONESTA QUE RECEBEU 54 MILHÕES DE VOTOS E QUE MANTÉM PRESO O MELHOR PRESIDENTE DA HISTÓRIA DA REPÚBLICA FEDERATIVA DO BRASIL, NUMA CONDENAÇÃO VERGONHOSA CUJO PLANETA TERRA INTEIRO TEM CONHECIMENTO?",0,false,0,,,,,,
UgzNZRIRqczDlNgycTl4AaABAg,Juninho Rodrigues,10 minutes ago,1528761515223,ATÉ HOJE NÃO ACREDITO QUE OS PAULISTANOS POSSAM TER DADO 65% DOS VOTOS À DORIA DO psdb EM PRIMEIRO TURNO . TEM COISA AÍ...,0,false,0,,,,,,
Ugw1qemMLyGiaRNvubJ4AaABAg,Titan68 Direct,12 minutes ago,1528761395227,"Reparem que todos ficam olhando seus notebooks ou fazendo outras coisa e nem olham para a tribuna, um verdadeiro desaforo, nem fingem, nem disfarçam, simplesmente ignoram pois a decisao ja estava tomada antes mesmo da sessao iniciar, são terroristas e como tal teem que ser tratados.",0,false,0,,,,,,
UgztgdF60Y1NEcijjuF4AaABAg,gomes barbosa,20 minutes ago,1528760915235,´É isso ai jovem brilhante colocou colocou todos no bolso;,0,false,0,,,,,,
UgzDO4ydmFXpfJl2I9d4AaABAg,fellipe red,25 minutes ago,1528760615240,deixa o cara responde pqp,1,false,0,,,,,,
Ugw95V5Lwenrj-RZK_54AaABAg,777espiao,35 minutes ago,1528760015247,"Se essas urnas eletrônicas fossem confiáveis, os EUA já estariam usando há muito tempo,  MAS NÃO ESTÃO, PORQUE SERÁ..............",0,false,0,,,,,,
UgyI-m5-83_DQaGj1tl4AaABAg,neto juninho,54 minutes ago,1528758875251,urnas eletrônicas é fraude completa povo acordar vamos reagir,1,false,0,,,,,,
UgxTJnbVKTitVcjxSQZ4AaABAg,neto juninho,1 hour ago,1528758515257,intervenção popular militar essa palhaçada tem que acabar,1,false,0,,,,,,
UgxMMUkgl3LeeTXENC54AaABAg,Vera Couto,1 hour ago,1528758515262,"3 Poderes desacreditados. O povo não acredita nas urnas eletrônicas, e essa resistência do STF só coloca mais pulgas atras de nossas orelhas.",0,false,0,,,,,,
UgwF8PkEHfVaddDXhNh4AaABAg,LUIZ MAZZONI,1 hour ago,1528758515284,Bando de bandidos !,0,false,0,,,,,,
UgwBPz5awlGxZRavs3R4AaABAg,Gomes Lima,1 hour ago,1528758515290,"Obrigado! Sr. Advogado.... esses caras são bandidos eles sabem disso, é foi feita pra isso mesmo "" torna lá impossível de auditar"" justamente porque pretendem continuar manipulando e escravizando o povo. .. mas o dia de cada um deles chegará ... realmente eles acreditam piamente que são seres diferenciados... bando de fantoches e oportunistas. ... o Brasil mas que numca acompanhará estas urnas... precisamos ter o cuidado quanto ao q será feito pois ainda pode vim desfavores e novos enganos ao povo!  Affff cansado desses manipuladores!",0,false,0,,,,,,
Ugyue6dPcPkMprRURfd4AaABAg,Marco Pacheco,1 hour ago,1528758515295,"E aí,galerinha?Quem vota aí em candidato que não quer voto impresso?Quem acredita nas eleições passadas dá um deslike aí.Voto em ficha limpa-candidato nacionalista-cristão---preciso dizer quem?É melhor Jair se acostumando.",0,false,0,,,,,,
UgyZiJ5yD_UiVGU_aS14AaABAg,marcio ravel,1 hour ago,1528758515301,Incrível como eles cortam o rapaz e não deixam ele falar tudo não é mesmo pensa e analisa isso. E ainda ficam confudindo o povo que vê o vídeo so mesmo intervenção civil militar nos 3 poderes mesmo. Ja ja ja ja.,0,false,0,,,,,,
UgzLYDHv08lrDARnIwN4AaABAg,Eliane Castro,1 hour ago,1528758515305,Quando a muita relutância  aí tem,0,false,0,,,,,,
Ugwz0-Oyrh4mKP2iHY14AaABAg,PG de Oliveira,1 hour ago,1528758515313,"o advogado mal começou a falar e os veiacos de toga começaram a interromper e querer desestabiliza-lo. Mas ele foi impecável! infelizmente esses ratos de toga não trabalham pelo povo, e sim por interesses supranacionais. VERGONHA! #ELEIÇÕESSEMVOTOIMPRESSOEFRAUDE",0,false,0,,,,,,
Ugw0TXNcd0MKjtrkRU14AaABAg,JULIANO ANDRIOLLI,1 hour ago,1528758515317,Dêem uma olhada nesta notícia! A empresa americana que fabrica as urnas eletrônicas brasileiras recebeu multa milionária por fraudes!http://rdplanalto.com/noticias/3583/eua-multa-empresa-das-urnas-eletronicas-usadas-no-brasil-por-fraude,0,false,0,,,,,,
Ugw2lZUWKijj4oFH8aZ4AaABAg,Glauce Rabelo,1 hour ago,1528758515323,Essa corte está parecendo um covil de víboras.,0,false,0,,,,,,
UgzHY4ccY0-EiZtGbaN4AaABAg,Sarah Machado De Moraes,1 hour ago,1528758515328,A QUADRILHA EM PESO NÃO DEIXA O ADVOGADO FALAR...PORQUE SERÁ HEM? PAREM DE FARSA....SERÁ QUE VOCÊS ESTÃO COM MEDO??,0,false,0,,,,,,
Ugzj6HDTVTZYen0_eIR4AaABAg,zeliamyano,1 hour ago,1528758515331,Srs ministros do STF que tal repensarem sobre a perigosa decisão que os srs tomaram? Ainda dá tempo! Um pco de responsabilidade e amor ao Brasil não fará mal a ninguém! Por favor!!!🙏🙏🙏🙏🙏,0,false,0,,,,,,
Ugx_EsCXjHIyHS0XWYl4AaABAg,Eliane Castro,1 hour ago,1528758516162,Tinha que ser o petista Levandovski,0,false,0,,,,,,
UgySAxJiXJwipViIYvN4AaABAg,Nenita Graca,1 hour ago,1528758516171,STF e TSE corrupto quadrilha não admitidos suas análises das urnas !😠,0,false,0,,,,,,
UgwTo2nr9khmy5HRdlV4AaABAg,ANSELMO POLISELI,1 hour ago,1528758516181,"Advogado muito bom , parabens! Uma pena que nao adianta nenhum argumento porque os Deuses do STF fazem aquilo que lhes convem em favor de seus protegidos!",0,false,0,,,,,,
UgzkpqCCCZKbY3Avdpl4AaABAg,Mariano Nunes Stos,1 hour ago,1528758516187,O futuro do Brasil nas mãos desses canalhas,0,false,0,,,,,,
UgzXycjf3Ob-n_L0V-V4AaABAg,ramos alcântara,1 hour ago,1528758516195,"meu deus,estamos lascados com esses canalhas,mas assim mesmo meu voto vai ser de Bolsonaro e pronto",0,false,0,,,,,,
UgwP9VEGIkiPxHHSyPR4AaABAg,pr .Eduardo Barbosa,2 hours ago,1528754916201,"Aos ver Los falar da uma impressão que são imortais, tamanha arrogância",0,false,0,,,,,,
Ugz7GMLb_FqLP_bN5AN4AaABAg,aranha,2 hours ago,1528754916209,pulgueiro danado.....uma vergonha essa casa!!,0,false,0,,,,,,
UgwV3x2krLkSbGwxjL54AaABAg,Jefferson Mendes,2 hours ago,1528754916218,É mesmo diante disso os bandidos votaram contra o voto impresso,0,false,0,,,,,,
Ugx0l7tBpCGUbiX0EC54AaABAg,José Luis Scognamiglio,2 hours ago,1528754916222,Brincadeira.. olha o medo deles...dá nojo.,0,false,0,,,,,,
UgxE1DjTUug8K8YI6tF4AaABAg,MSP_666 CCTV_AccessControl,2 hours ago,1528754916230,"Que bando de filho da puta, temos que executar todos.",0,false,0,,,,,,
UgxnKhelkeYgJcbEMkV4AaABAg,José Luis Scognamiglio,2 hours ago,1528754916253,Kkkkkkk,0,false,0,,,,,,
Ugyn-Um1Qq8sZF5cGhJ4AaABAg,José Luis Scognamiglio,2 hours ago,1528754916259,Kkkkkk,0,false,0,,,,,,
UgyVziB5FFxYhJxdJKt4AaABAg,Muriel Fr,2 hours ago,1528754916266,"Feito publicamente no SEUS rabos Exus capas pretas,pode ter certeza dê uma coisa o inferno não vê á hora de vocês tombarem lá,o tacho quente os esperam.Parabens ao único digno , que é o jovem advogado.",0,false,0,,,,,,
UgwK-ucyajEvpmt2HwB4AaABAg,ciro cerqueira,2 hours ago,1528754916274,"O brasileiro merece os seus governantes! Sinto pela minoria que aqui comenta, como eu, mas a grande maioria de nossa população é composta pelo pior tipo de gente que existe. Enquanto há preocupação com copa, novela, mengão, eles ferram a gente de tudo que é jeito.",0,false,0,,,,,,
UgxuZG3YcjfLZYRadl14AaABAg,VAQUEIRO DO CEARÁ Almeida,2 hours ago,1528754916281,***ESTE STF STE A VERGONHA DO BRASIL É IGUAL AO FORO DE SÃO PAULO O MAIOR INIMIGO DE NOSSO PAÍS CORJA DE PILANTRAS ASQUEROSOS CÃOMUNISTAS QUE FAVORECEM O LULADRÃO E A PTRECAIADA CÃOMUNISTAS SÓ SABEM MENTIR ROUBAR DESTRUIR COMO FIZERAM NOS TREZE ANOS DE ROUBALHEIRA PT ORCRIM ORGANIZAÇÃO CRIMINOSA A PIOR JÁ VISTA NO MUNDO CORJA DE PILANTRAS ASQUEROSOS LADRÕES DESTRUIDORES DE NOSSO PAÍS****,1,false,0,,,,,,
UgyX9hLEmoYQC0ja2gN4AaABAg,Jose De Paula,2 hours ago,1528754916289,"O MALANDROWSK como sempre um moleque trombadinha, uma figura medonha como todos os demais",0,false,0,,,,,,
UgxvOnPznk5dErUJosB4AaABAg,Santíssima Virgem Maria rogai por nós,2 hours ago,1528754916293,Tem que convocar um plebiscito para a aprovação de urna eletrônica... Afinal cadê a democracia?,0,false,0,,,,,,
UgwGnq0KYYdByWztz8t4AaABAg,Francisco dos Anjos Ramos,2 hours ago,1528754916303,Cabra bom....! que pena que ele está na minoria...! e tem mais uma coisa... a mídia já sabem qual é seu papel nesta resenha...! eles vão fazer parecer que verdadeiro o candidato que as urnas fraudadas vão eleger...!,0,false,0,,,,,,
UgwmLq61d0go10QUGsx4AaABAg,guilao guilasso,2 hours ago,1528754916310,"Olhem só: não adianta ficarmos dizendo essas abrobrinhas do tipo: eu não suporto a cara desse Gilmar Mendes; ou: acho ele um cara de bandido; ou: acho que ele é pior que lixo; ou: gostaria da passar merda na cara dele; etc. Essas coisas não levam a absolutamente nada. Será que ninguém percebe isso não? Todos nos que votamos, que somos cidadãos temos pelo menos nosso direito e mais ainda nosso dever de votar. Agora a gente vai até a Seção Eleitoral vota e depois nosso voto não é computado por conta de uma   U R N A  V A G A B U N D A ? Vagabunda que nem esses ministros que gastam  oitocentos milhões só com propaganda e ainda veem falar que o gasto com as impressoras é muito alto para o país gastar? Não chega nem a meio por cento (0,5%) do valor da propaganda. Isso é brincadeira de muito mal gosto e nós não podemos, de forma alguma, tolerar esse abuso conosco, com o nosso voto, onde queremos mais do que nunca acabar com a bandidagem que se instalou em todos os altos comandos do nosso pais e isso será possível somente através do nosso voto.",0,false,0,,,,,,
Ugy7dG63JbcRKjwZvyx4AaABAg,pauloab777,2 hours ago,1528754916318,Só uma Intervenção Divina para varrer esses satanistas e mandá-los para seus lares - o inferno!,0,false,0,,,,,,
UgxQm8ZUpf9-MjjcTeZ4AaABAg,Valmir Santos,2 hours ago,1528754917085,Não tenho outra palavra para descrever essa corte: NOJO,0,false,0,,,,,,
UgxMmLH99Qi15YqV2qt4AaABAg,Francisco dos Anjos Ramos,2 hours ago,1528754917088,As urnas são fraudadas....conheço pessoas que não voltaram na eleições últimas....ele perdeu a hora...e quando ele procurou a justiça eleitoral para pagar a multa...foram constatados o seguintes relatos...Foi-lhe informado que havia voltado e em quem...! pra ele foi uma grande surpresa...!,0,false,0,,,,,,
UgxjEvq2dONKYz99mKB4AaABAg,bobmarky,2 hours ago,1528754917096,"VÁ SE FODER, SEU FDP! GILMAR MENDES, VC É O PIOR VERME QUE TEMOS NESTE PAÍS!!! SE A URNA ELETRÔNICA FOSSE SEGURA, OS ESTADOS UNIDOS DA AMÉRICA, PAÍS MAIS TECNOLÓGICO DO MUNDO, JÁ A TERIAM ADOTADO! VC MERECE UM TIRO NO MEIO DA TESTA, SEU VAGABUNDO! SABEMOS PQ VCS ESTÃO FAZENDO TUDO ISTO, E É UMA PENA QUE O POVO BRASILEIRO SEJA TÃO COVARDE, UM BANDO DE ALIENADOS, QUE ACEITAM SER ESCRAVIZADOS E VIVEREM UMA DITADURA MAQUIADA, COMO VCS NOS IMPÕE! CANALHA, VC MERECE SER LINCHADO ATÉ A MORTE, SER QUEIMADO VIVO!!!",1,false,0,,,,,,
UgzHRjBOarufN_pfz_94AaABAg,joão paulo Medeiros,3 hours ago,1528751317100,"Os grandes bandidos não estão morando mais nas favelas, eles estão usando ternos e comandando nosso país... oremos.",1,false,0,,,,,,
Ugwe3-OSsEcrPNZVXQB4AaABAg,Ruth Cristina,3 hours ago,1528751317108,Mesmo com toda a demonstração de falhas as V.Exas. FDPs votaram contra o voto impresso.,0,false,0,,,,,,
Ugz96GspsqWcqZX_kA94AaABAg,Um Novo Brasil. Leandro,3 hours ago,1528751317113,O brasil não tem homem de saco rocho pois se tivesse  esse ministros safados não estaria lá,0,false,0,,,,,,
UgxSeasZLZeLCLmwUlV4AaABAg,José Joaquim Carvalho,3 hours ago,1528751317120,"Matou a pau dr. Alberto, os ministros??? não sabiam onde enfiar a cara. Eu poderia até sugerir, mas deixa quieto.kkkkkk",0,false,0,,,,,,
UgwiP3BXhq7hDt-saRF4AaABAg,Edmilson Oliveira,3 hours ago,1528751317129,"Eu confio nessas  'ratoeiras da smartmatik, o tanto quanto confio nesse 'bando' do STF, que diz que é normal fraudar e enganar a nação brasileira, comprovadamente cada vez mais dar a entender que o crime compensa para eles que estão no comando, no topo, é que ninguém ouse- os atrapalhar,  pois se tentar  estará correndo um sério risco de ""ser vítima de um acidente"".",1,false,0,,,,,,
Ugx9x67rnhaN7PjJRJF4AaABAg,Marlene Soares,3 hours ago,1528751317133,Parabéns advogado falou toda a verdade na cara de todos falou bonito👏👏👏👏,0,false,0,,,,,,
UgzJ8rkTQTH2GhVf5zZ4AaABAg,regis morion,3 hours ago,1528751317137,Cambada de criminosos.....,0,false,0,,,,,,
UgwcO6p2urTxp2x8W194AaABAg,eunice maciel,3 hours ago,1528751317144,"ENTÃO GASTÃO 800.000.000 COM JORNAL E NÃO PODE GASTAR 2.000.000, CO O ÓBVIO E NECESSÁRIO , FAÇAM-ME O FAVOR BANDO DE INCOMPETENTES, PENSAM QUE TODOS NÓS SOMOS BURROS COMO VCS????? INTERVENÇÃO JÁ",0,false,0,,,,,,
UgyIakQ9D2SFGU2P27V4AaABAg,Miguel Aniceto,3 hours ago,1528751317151,Este stf e igual laxante so gosta de bosta e carniça,0,false,0,,,,,,
UgzqNaUqAJbEdkMjEM54AaABAg,GAROTASDEPARNAIBA,3 hours ago,1528751317155,"Os Ministros foram ardilosos em responder na maneira mais ignornte possível. Forças Armadas, se manifetem! STF é corruPTo! TSE é CorruPTo!  Que seja aplicado urgentemente uma Intervenção Militar no Judiciário e no TSE Urgente! 142 neles!!",0,false,0,,,,,,
UgyrKFNrKaCOqRcS2hp4AaABAg,eunice maciel,3 hours ago,1528751317163,MEUS PARABÉNS AO JOVEM ADVOGADO.,0,false,0,,,,,,
UgzEku27rvmHmuj5ctp4AaABAg,eunice maciel,3 hours ago,1528751317166,"QUE VERGONHA PRA ESSES JUÍZES DE NADA,",0,false,0,,,,,,
UgxsF8m1WrKYGM7Nx6R4AaABAg,eunice maciel,3 hours ago,1528751317173,ESSES GAROTOS ADVOGADOS DANDO UM BANHO NOS VELHOTES !!!!!!!!!1,0,false,0,,,,,,
UgzcfzZUtKDato3hsSV4AaABAg,ney espindola,3 hours ago,1528751317176,"Não sei em que é mais difícil de acreditar, se na corte ou nas urnas",0,false,0,,,,,,
Ugy61eRA7deruf6RzUp4AaABAg,Edi Calisto,3 hours ago,1528751317195,Parabéns Advogado vc ganhou me respeito,0,false,0,,,,,,
Ugy-ADg_l-6ft2iJ6vJ4AaABAg,Maria Isabella,3 hours ago,1528751317199,Fico constrangida de ter que ver este pessoal brincando de ministro!!,0,false,0,,,,,,
UgzKZmiSKLhwuJveRYZ4AaABAg,Osvaldo Santos,3 hours ago,1528751317207,"Normal só na avaliação destes juízes que não tem responsabilidade com o povo, esta mais que provado que ha falha na urna eletrônica, pagar R$ 4,50 de multa é melhor do que votar.",0,false,0,,,,,,
UgwaFiWX_x1IatWZord4AaABAg,Ian Curtis,3 hours ago,1528751317882,Essa corja deveria ser chutada dai... serem banidos da vida pública....,0,false,0,,,,,,
UgxE65Tr9xJ-fz4a2F54AaABAg,Val Souza,3 hours ago,1528751317885,"Se a corte maior que temos está impregnada dessa praga chamada de corrupção, já não devemos ter esperanças nesse país!",0,false,0,,,,,,
Ugwcw08h6qCACaAvdGZ4AaABAg,UDA Pegasus,3 hours ago,1528751317894,"Advogado tem 8 minutos e so falou por 6, educação de nossos magistrados e bem a cara de nosso pais, uma lastima podre e fétida essa latrina que se chama Brasil, sou programador em 5 linguagens e entendi perfeitamente que as urnas sao sim manipuláveis, mas quem disse que se quer algo honesto neste mais nao e mesmo?",1,false,0,,,,,,
UgxVOxnTS9vXm8hD0BZ4AaABAg,BR Z,3 hours ago,1528751317897,Alguém passa a rede nesses morcegos.,0,false,0,,,,,,
UgxXbwCY-8oX4-jgcSt4AaABAg,Creuza Carvalho,4 hours ago,1528747717905,"PARABÉNS  GAROTO  VALOROSO, ESTES VELHOS CANALHAS QUE SE DIZEM OS TAIS AGORA  TOMA  MAIS E UM POUCO,  VERGONHA   BRASILEIRA, BASTA  DE TANTAS VERGONHAS   PARA NÓS BRASILEIROS  QUE NÃO SUPORTAMOS MAIS  SERMOS ROUBADOS, EU NÃO IREI VOTAR ONDE ESTÃO OS CANDIDATOS?  ACABARAM  OS HOMENS DE CARATER NA NAÇ]ÃO",0,false,0,,,,,,
Ugz_Hp5gpFHMqK3KDgZ4AaABAg,Marcia Coletti,4 hours ago,1528747717910,Parabéns!!!! Excelente exposição  e esclarecimentos até  mesmo para o STF..!!!!,0,false,0,,,,,,
UgxW9_cBQO_QFyilhpB4AaABAg,Igor Igueta,4 hours ago,1528747717918,"e nao adiantou nada, os bandidos do stf, legislam ao seu bel prazer....soh tem bandido na bananolandia....",0,false,0,,,,,,
UgwJ9MoDmUpExK23FTN4AaABAg,Luis Daniel,4 hours ago,1528747717922,Gilmar Mendes e outros ministros não logram a sua fisiocracia insensata e nefasta!,1,false,0,,,,,,
UgxkNnArxpcGoytJ7zl4AaABAg,Fatima Rodrigues,4 hours ago,1528747717929,"Bando de vagabundos, nem deixa o Advogado falar mais.",0,false,0,,,,,,
UgwUjlVuvy5irZM9gpV4AaABAg,rommel wesley,4 hours ago,1528747717933,fico full pistola FUX  kkkkkk 3:49 urnas lixo !!!,0,false,0,,,,,,
UgyXOdSQKuve2T3Op2N4AaABAg,Deonne Santos Barros,4 hours ago,1528747717941,"qual o ministro do STF que solta mais condenados pela lava jato?
porque será?",0,false,0,,,,,,
UgzzTp6bDf_elPy5Fj94AaABAg,Deonne Santos Barros,4 hours ago,1528747717944,"uma pergunta 
qual o minis",0,false,0,,,,,,
UgyFuYSp-plL11TB4-Z4AaABAg,M Lima,4 hours ago,1528747717952,"A única solução é cada um de nós comprar uma espingarda filobé e ELIMINAR todos do STF, um por um, CANCER MALÍGNOS NO BRASIL. essa é a nossa saída.",0,false,0,,,,,,
UgzQeT5FDyrhfUfDPdB4AaABAg,Fabus F,4 hours ago,1528747717956,Percebe-se uma tentativa de coação ?,0,false,0,,,,,,
Ugx3riDGD3dg_TJScGd4AaABAg,rodrigo benedictis,5 hours ago,1528744117964,"São todos ladrões... Com esse sistema que vem sendo imposto para nós brasileiros, a tendência é continuarmos sendo escravos. Chega, basta não é mais sustentável, esse modelo está ultrapassado, vai diretamente contra o progresso e sufoca nosso país, temos tudo para sermos a maior potência. FORA TODOS, REDUÇÃO DE 75% NOS IMPOSTOS, FIM DA ESCRAVIDÃO... VAMOS PRA CIMA DELES GENTE💪💪💪",1,false,0,,,,,,
UgzGH4qj8JJTtb-Zj_B4AaABAg,Sivaldo Rosa,5 hours ago,1528744117968,Ministros vagabundos comunistas canalhas,0,false,0,,,,,,
Ugwesy9s8uZC63zBTnR4AaABAg,Ricardo Carneiro,5 hours ago,1528744117975,STF VERGONHOSO !!!,0,false,0,,,,,,
Ugx8WrBuAtQcEaOlgG94AaABAg,Susana Melo A vida é bela!,5 hours ago,1528744117981,Dr. Alberto MALTA vc tem meu respeito. Obrigada por mim representar diante desses atores do superior TEATRO.,0,false,0,,,,,,
UgybEsXFjn0oJPsiejl4AaABAg,Fatima  Branco,5 hours ago,1528744117988,Este ADVOGADO deixou os ministros inriquietos.,0,false,0,,,,,,
UgwPANAbCw0gDCQNZWd4AaABAg,Shaul Mikarra-él,5 hours ago,1528744117993,Tem que imprimir o voto e melhor fiscal ver voto do que os corruptos criar  votos fantasma para afundar o o BRASIL.,0,false,0,,,,,,
UgzYLNImdmQTKWcLbhl4AaABAg,Meu diário cristã surda,5 hours ago,1528744118779,"AFF
nao  tem legenda",0,false,0,,,,,,
UgxjPY64yXWKodIv-Cl4AaABAg,Elio Antonio Pires,6 hours ago,1528740518786,Parabéns à este advogado!!!,0,false,0,,,,,,
UgyC9ldtsrFJ0D-8mbd4AaABAg,Businessman Certified,6 hours ago,1528740518795,http://www.tse.jus.br/hotsites/teste-publico-seguranca-2017/,0,false,0,,,,,,
UgxKzHNCtSbLqVSnort4AaABAg,João Martins,6 hours ago,1528740518805,"Traidores da Pátria, somos o único país que se diz democrata, mas dota urnas eletrônica de uma empresa venezuelana e sem voto impresso, só o STF acredita nessas urnas, só que dessa vez se houver desconfiança de fraude o Brasil vai parar, chega não aguentamos mais sem governado por essa conja de corruptos e traidores.",0,false,0,,,,,,
UgyMLpzTkCQ37E-oz454AaABAg,Marcus Júnior,6 hours ago,1528740518810,Togados comunistas todos desconjuntados pelos argumentos do advogado... juízes corruptos...,0,false,0,,,,,,
UgxdRHE72IbiUoVNHV14AaABAg,Tube Sports HD+,6 hours ago,1528740518819,Eu tenho quase 100% de certeza que as eleições de 2014 foram fraudadas.,0,false,0,,,,,,
UgxirEOQ9ZgM37T2kht4AaABAg,Leandro Dias,6 hours ago,1528740518829,Ministros acovardados. Incapazes de votarem a favor do povo,0,false,0,,,,,,
Ugyg5CNUDeybGhzc0uN4AaABAg,Daniel Robinson Robinson Paulo junior homem de Deus,6 hours ago,1528740518834,"Essa porcaria de urna só tem em países comunistas, eles não trabalham em favor do Brasil!",0,false,0,,,,,,
UgzZnSBgm-TuYYCLTAV4AaABAg,iata anderson,6 hours ago,1528740518843,Todos os malas tentando para o rapaz,0,false,0,,,,,,
UgzGUu8ifVPfMXRkFHN4AaABAg,Antonio Coimbra,7 hours ago,1528736918853,ai  ta tudo  arrumado se  eles  fossem corretos ouvia  a  voz   do povo vai  entra  quem   eles  quiser .,0,false,0,,,,,,
UgwMMRjdDz53Jzxtvd54AaABAg,Mika Pires Varela,7 hours ago,1528736918860,"11  filhos da puta nessa merdaaaa
Juntamente com a cadela Dodge essa merda de mulher...
Comunistas.....",0,false,0,,,,,,
UgxvcywlkNya1FQHrZl4AaABAg,Josimar Naressi,7 hours ago,1528736918867,"ONDE A ESQUERDA LIDERA EXISTE URNAS ELETRÔNICAS A MISERIA, FOME, CRIMINALIDADE EM ALTÍSSIMA, PROSTITUIÇÃO ESTUPRO E PEDOFILIA DESENFREADA",0,false,0,,,,,,
UgxlNcSoAO5tS2ilJk14AaABAg,livia perez,7 hours ago,1528736918877,"VERDADE POLÍTICA   as 13,51 abrir esse canal para ouvir conforme a manchete estampava """"TESTE NAS URNAS ELEITORAIS FEITO PELO ADVOGADO DA PF  DEIXA MINISTROS DESCONTROLADOS""  mas pude continuar ouvindo em função da ministrada ter caído em cima do advogado

Reprovando alegando quê sempre faz e assim foi cruel

O primeiro a enfurecer o foi seu levandovsk seu fux  , Gil mar inclusive",0,true,1,,,,,,
,,,,,,,,UgxlNcSoAO5tS2ilJk14AaABAg.8hMa8erZcfi8hMawh-HgQ-,livia perez,7 hours ago,1528736919218,"Continuação do comentário 
Inclusive quem enlouqueceu foi a sra. Carmem Lucia 

Foi tão desesperador quê não suportei ouvi a posição da ministrada tentando
Travar o advogado e quem é  muito bom

  NÃO DEIXEM DE OUVIR",0
UgxzVBRArVfi0431kWd4AaABAg,PRIME PRIME,7 hours ago,1528736918888,"Supremo Tribunal Federal vendido. E nos encontramos nas mãos deles, infelizmente. Só eles fingem não ver essa fraude. Foi vetado o voto impresso mais o STF revogou e não aceitou que o voto fosse impresso.",0,false,0,,,,,,
UgylrQeTdETAys7ccRZ4AaABAg,Ponto G,7 hours ago,1528736918899,"Que tal se todos os haques do mundo fizessem um estrago no dia da eleição??
Tipo eleger com 100% um candidato falso...
Ahh 
Seria um sonho",0,false,0,,,,,,
Ugz-WuV19kdz9dHv4qZ4AaABAg,human144,7 hours ago,1528736918908,"Olha como os canalhas ja ficam loucos, indignados tentando desacreditar no relato do advogado sobre essa pilantragem que é Urna Eletrônica. Principalmente esse cara de sapo do Gilmar Mendes !",1,false,0,,,,,,
UgwKkt1mlRyD7Krsn8R4AaABAg,maria stela Figueiredo,7 hours ago,1528736918914,Infelizmente temos um TSE e um STF como esse.,0,false,0,,,,,,
UgxMuunjCpobWOY1Vqp4AaABAg,Rogério Guiraud,7 hours ago,1528736918923,Democracia? Em que país?,0,false,0,,,,,,
UgxubnSFC8vhT3rYpwt4AaABAg,maria stela Figueiredo,7 hours ago,1528736918932,Pq será que esse ministro ainda pode falar. Gil mar  Mendes em qualquer país sério não estaria aí  infelizmente.,0,false,0,,,,,,
UgwBTQ9GaCEhguRSG3h4AaABAg,RITA ANACORETO,7 hours ago,1528736918936,"Ricardo Lewandoswsky...quer enganar quem ??? Todos sabemos que as urnas eletrônicas são muito passíveis de serem burladas, assim como vem fazendo  constantemente o STF , julgando tudo a favor de vcs e da quadrilha que governa este país!!!!",0,false,0,,,,,,
UgwJVcRIzjUJUih5ZlR4AaABAg,Daniel Cunha,7 hours ago,1528736920117,Porque os Paises de primeiro Mundo não adotam esse sistema corrupto?,0,false,0,,,,,,
UgwH85QrDdzUqZgW3-p4AaABAg,Silmara Ferreira De Oliveira,7 hours ago,1528736920127,Se fosse muito bom outros países teriam,0,false,0,,,,,,
UgxyA0G_FxU2qRn1fXl4AaABAg,Fabiano Wenig,7 hours ago,1528736920137,"""Talvez as pessoas não saibam que esses testes são feitos a cada período, publicamente, com chamamento público e dado a público, inclusive, todas as informações relativas."" Min. Cármem Lúcia O.o 
Quis custodiet ipsos custodes?",0,false,0,,,,,,
UgyFjNo49mOJUsQCmgV4AaABAg,Oficina Masterdey,7 hours ago,1528736920145,quem os ministro contratou?chama os perito que a população indicar,1,false,0,,,,,,
UgxYHDQWTcKNH0juYNd4AaABAg,Maikon Arruda,7 hours ago,1528736920155,"Não adianta dar murro em ponta de faca. Esses caras não querem acordo. ""
#Desobediênciaciviljá",0,false,0,,,,,,
Ugw1DdQe7D3nRX1HKLZ4AaABAg,S SOUZA,8 hours ago,1528733320161,"O advogado expôs que estão roubando votos e simplesmente responderam que quem manda nas urnas são eles, os ratos.",0,false,0,,,,,,
Ugye9QWTPaaHKp_Fbwt4AaABAg,RicoSnakeOff,8 hours ago,1528733320171,Não adianta querer corrigir algo onde alguns dos corregedores estão mais comprometidos que a URNA.,1,false,0,,,,,,
UgwctymWPaiJradAZBR4AaABAg,Juninho Casagrande,8 hours ago,1528733320177,"Todos nas ruas, pelo voto impresso, nossa única saída",0,true,5,,,,,,
,,,,,,,,UgwctymWPaiJradAZBR4AaABAg.8hMS0Ka_JSg8hMU2W2TtRs,Roque MIguel Nascimento,8 hours ago,1528733320666,l,0
,,,,,,,,UgwctymWPaiJradAZBR4AaABAg.8hMS0Ka_JSg8hMU2uxC0Y2,Roque MIguel Nascimento,8 hours ago,1528733320678,l,0
,,,,,,,,UgwctymWPaiJradAZBR4AaABAg.8hMS0Ka_JSg8hMU3zqiE5t,Roque MIguel Nascimento,8 hours ago,1528733320687,li,0
,,,,,,,,UgwctymWPaiJradAZBR4AaABAg.8hMS0Ka_JSg8hMU4OodpkX,Roque MIguel Nascimento,8 hours ago,1528733320697,l,0
,,,,,,,,UgwctymWPaiJradAZBR4AaABAg.8hMS0Ka_JSg8hMU4u1CgmT,Roque MIguel Nascimento,8 hours ago,1528733320707,"l
z",0
UgzByI-M39Z_Jaswl014AaABAg,André Soares,8 hours ago,1528733320192,"Só um idiota não acharia que a urna não era fraudável, resta provar se ela foi fraudada aí está a diferença. Mas concordo que as urnas devam ser como na venezuela, com contraprova impressa e biometria.",0,false,0,,,,,,
UgyuGh9dcuLyEINd5XJ4AaABAg,wpqe l,8 hours ago,1528733320197,"Voto impresso já 
Urna eletrônica é fraude
Michel temer é esses ministros presos já com Lula e todos os petralhas para sempre...",0,false,0,,,,,,
