id,user,date,timestamp,commentText,likes,hasReplies,numberOfReplies,replies.id,replies.user,replies.date,replies.timestamp,replies.commentText,replies.likes
UgzwRUW-dz85MLFJXH94AaABAg,Luiz xavier dos Reis,4 months ago,1518395926603,1000 like o capitão bolsonaro,0,false,0,,,,,,
UgzxLZEsGu4HTKbngz94AaABAg,Um Otaku Pensativo,4 months ago,1518395926607,SE FUDERAM PTTTTTTTTT CUUUUUUUUUUUUUUUUUuu,2,false,0,,,,,,
Ugw4jNKUBP9Zkqf4UA14AaABAg,Joab,4 months ago,1518395926614,BOLSONARO PRESIDENTE DO BRASIL !!!!!!!  PORRA !!!!!!!!,0,false,0,,,,,,
Ugxv0zbgoEt2Bpl0jiV4AaABAg,Wiliam Cdr,4 months ago,1518395926618,Graças a Deus e ao trabalho de muitos guerreiros patriotas nosso pais esta prestes a se livrar desses safados da nova ordem mundial,0,false,0,,,,,,
Ugxudojf5auKR4J6Kh14AaABAg,Gilson Grosh,4 months ago,1518395926626,"daí eles pegam o pessoal da outra empresa, lavam a mão deles também e fica tudo como era dantes no reino de Abrantes...",0,false,0,,,,,,
Ugx67QQ42DFtLmGAmnx4AaABAg,Sagest 2,4 months ago,1518395926634,"Galera, as urnas eletrônicas não foram proibidas, esse título É MENTIRA. O que aconteceu é que a Smartmatic, que é a empresa que fabrica as urnas eletrônicas, participou da licitação do TSE para a compra de IMPRESSORAS que seriam acopladas às urnas para impressão do voto, mas não foi aprovada. Não quer dizer que ela não fornecerá mais as urnas, muito menos que as urnas estão proibidas no Brasil.",4,true,2,,,,,,
,,,,,,,,Ugx67QQ42DFtLmGAmnx4AaABAg.8cKzdcPR69k8cL3mAQMZ33,Família021 Garcia,4 months ago,1518395927021,Sagest 2 Bem colocado mas vc não colocou em pauta a mulher patriota que falou no vídeo então quanto isto não me convenceu esse seu comentário em desmintir o título!,0
,,,,,,,,Ugx67QQ42DFtLmGAmnx4AaABAg.8cKzdcPR69k8cLBctZKZod,Sagest 2,4 months ago,1518395927027,"O título diz que as urnas eletrônicas serão proibidas no Brasil. Se fosse verdade estaria em destaque em todos o sites grandes do Brasil. O que a mulher do vídeo quis dizer foi que essa rejeição do TSE em relação ao módulo de engenharia da Smartmatic é um bom sinal, uma esperança de que a mesma possa deixar de fornecer as urnas. Inclusive ela diz no video que estão preparando ações para isso.",1
UgxAiS_HUVcbrcFraFV4AaABAg,Francisco De Grandis,4 months ago,1518395926640,"Por favor, troquem esse senhor que narra o vídeo.  É muito ruim. Não sabe nem ler o texto. Parece mais um robô.",0,false,0,,,,,,
Ugzth9JCj_JMnLzh5rN4AaABAg,Anderson Huss,4 months ago,1518395926647,DEUS ABENÇOE!!!!🙏🙏🙏🙏,0,false,0,,,,,,
UgxEzJ7w7b2gEwUQmLh4AaABAg,Eder Cuer,4 months ago,1518395926650,"Meu pai amado, quem fez o vídeo ta sabendo legal kkkk
Não foi proibida coisa nenhuma. A Smartmatic não foi aprovado, logo, a segunda colocada será convocada para testes.",0,false,0,,,,,,
UgzJXWLe33EyG_Rxv6x4AaABAg,Aílton Dias,4 months ago,1518395926658,"Mais um Golpe contra a corrupção.... 
Adeus Comunistas.....",0,false,0,,,,,,
UgxQClnhEhkZ7u3H-iN4AaABAg,Ilton de Oliveira Lopes,4 months ago,1518395926661,"Prioridade Número 01 é o voto impresso ou cédula manual.
Sem isso o nosso esforço todo vai por água abaixo.
BOLSONARO 2018 🇧🇷 🇧🇷",23,false,0,,,,,,
Ugx4sp4KayfFtmKo9Ep4AaABAg,cleverson961,4 months ago,1518395926668,Gostei da musica do slip no começo,0,false,0,,,,,,
UgznKV3yzXJJm-2K1gh4AaABAg,ZerinhoOuAlgoAssim,4 months ago,1518395926671,"Finalmente,vejo vcs na forca, PT 😉",0,false,0,,,,,,
UgxOO4JsrrbsmGhetfR4AaABAg,Mr Skinner,4 months ago,1518395926675,Tem que ver a proxima urna em!,0,false,0,,,,,,
Ugzlf6QMOlo_AozJsaB4AaABAg,RIAN LS :D,4 months ago,1518395926682,Ótimo!!!,0,false,0,,,,,,
Ugw2V39Z9eIgGrOvGdZ4AaABAg,wanderlei batista,4 months ago,1518395926684,TEM QUE SER COMO NA MINHA EPOCA NO ESCRITO AI QUEM NAO SABE LER E ESCREVER AI NAO VOTA,0,false,0,,,,,,
UgyHJISiyirAGsJyLER4AaABAg,Luiz xavier dos Reis,4 months ago,1518395928021,vossa excelência Jair bolsonaro estou contigo e não abro,0,false,0,,,,,,
UgyfGqbLbH4VTYVigkl4AaABAg,ÁREA LIVRE,4 months ago,1518395928028,"Essas máquinas são piores que a calculadoras chinesas, imagine quanto voto falso saiu dessas urnas , agora imagine o roubo na compra dessas máquinas e vem mais bomba por aí!!!!",249,true,7,,,,,,
,,,,,,,,UgyfGqbLbH4VTYVigkl4AaABAg.8cKzR1qWddc8cLU8OOTsZu,Juscelino R. Lima,4 months ago,1518395928686,ÁREA LIVRE As vitórias do PT foram fraudadas. Mas que raça ruim.,4
,,,,,,,,UgyfGqbLbH4VTYVigkl4AaABAg.8cKzR1qWddc8cLe9u-dUrb,ÁREA LIVRE,4 months ago,1518395928688,"Juscelino R. Lima eu não tenho dúvidas disso, que povo vota em ladrão, quero acreditar que é a memória",0
,,,,,,,,UgyfGqbLbH4VTYVigkl4AaABAg.8cKzR1qWddc8cM1bYXhZD8,Isac,4 months ago,1518395928696,Eita pior que calculadora chinesa.  Senti firmeza,0
,,,,,,,,UgyfGqbLbH4VTYVigkl4AaABAg.8cKzR1qWddc8cMwmXTo0g0,yamatomach5,4 months ago,1518395928700,"É mais fácil falsificar voto em papel , porque é difícil de controlar e contar.",0
,,,,,,,,UgyfGqbLbH4VTYVigkl4AaABAg.8cKzR1qWddc8cN8PEPcAFE,Gui Santtos,4 months ago,1518395928708,ÁREA LIVRE aqui em guanambi na bahia concorria para prefeito o ex prefeito ex governador da bahia nilo coelho e jairo Magalhaes que não era nada e por causa dessas urnas é claro que o bostalhão do Jairo ganhou,0
,,,,,,,,UgyfGqbLbH4VTYVigkl4AaABAg.8cKzR1qWddc8cN9I_qlMT8,Evilzin Abyssranger,4 months ago,1518395928710,ÁREA LIVRE eu duvido . esta eleição sera c urna eletrônica e so 5% dos votos serão impressos. Os outros 95% não vão imprimir nada.,0
,,,,,,,,UgyfGqbLbH4VTYVigkl4AaABAg.8cKzR1qWddc8cQqNvSH2nI,Jonatas Nobre,4 months ago,1518395928712,"yamatomach5 a urna nem se fala, uma criança de dez anos consegue hackear aquele sistema, faz um teste e comprove, voto em papel é muito mais complicado, por isso a demora seu merda.",0
UgxzazmNDyRL5UbYTt14AaABAg,GAP _,4 months ago,1518395928034,Melhor Jair se acostumando!,4,false,0,,,,,,
UgzgNuARXBDUFCZmKQB4AaABAg,Pr. Paulo Roberto Teixeira,4 months ago,1518395928041,"Boa tarde : Raquel Dogde estar mostrando suas unhas,  baixou o espírito de Gilmar Merdas nela a respeito do voto impresso.",0,false,0,,,,,,
UgzHOLg2vuDzqMu6Ljl4AaABAg,Beatriz Silva,4 months ago,1518395928048,Chora metralhaskkkkk,0,false,0,,,,,,
Ugw87fJ_XwaGjaL9zAp4AaABAg,foca barão,4 months ago,1518395928052,"E uma ótima notícia, quanto tempo nos estávamos isso acontecer.",0,false,0,,,,,,
UgzH8WxWhq1F1DllWLl4AaABAg,Victor Nunes,4 months ago,1518395928059,"Quando escuto: ""GENTE, ISSO É MUITO BOM!"" Fico apavorado pois tudo o que vem do governo NÃO É BOM! Esperem por surpresas ruins...COMO SEMPRE!",0,false,0,,,,,,
Ugz72LxGAZIgCitHX0p4AaABAg,Marcio Queiroz Jr,4 months ago,1518395928082,Voz de robô = Deslike,0,false,0,,,,,,
UgyiiIw6IZ4YaQoUCQJ4AaABAg,Antonio Cesaroni,4 months ago,1518395928087,Vejam aquì o bendito dedo da INTERVENçàO !!! Deus faça que de certo.,0,false,0,,,,,,
UgxYI98XIZwsXJ48XN54AaABAg,TAMALLY MAAK ;} BOLSONARO PRESIDENT,4 months ago,1518395928091,"Vamos colocar a DIREITA NO PODER... ORDEM E DISCIPLINA DE UMA VEZ POR TODAS!
Capitalismo e Estado menor.",0,false,0,,,,,,
UgwhSKG2MtjgbTcpL5V4AaABAg,Renaldo Mateus,4 months ago,1518395928097,Agora sim . Bolsonaro presidente !!!,0,false,0,,,,,,
Ugz6Hyb7hZC4EKf8DuF4AaABAg,Cicero Paulo,4 months ago,1518395928104,Bbbbbbbbbbbbbbbbbbbb pppppppppppppora  2018,0,false,0,,,,,,
UgwwELY1KNQUNmsxtfp4AaABAg,LUIS,4 months ago,1518395928108,GILMAR MENDES QUER SOMENTE 5% DAS URNAS COM VOTOS IMPRESSOS. PORQUE SERÁ ? RSRSRS,0,false,0,,,,,,
Ugz43EoIsl-_Mh5OQb54AaABAg,Uly Azevedo,4 months ago,1518395928114,"O PaÍS DO ABSURDO VEJAM SÓ.
OSWALDO MONTENEGRO SOUBE QUE SUA MÚSICA - DROPS DE ANIS - CAIU NO VESTIBULAR DA FEDERAL COMO INTERPRETAÇÃO DE TEXTO.
CONTENTE  FEZ  INSCRIÇÃO  -  AGORA O MELHOR  -  REPROVARAM ELE  KKKKK
QUE PAÍS É ESSE JÁ DIZIA RENATO RUSSO.",0,false,0,,,,,,
UgzliLKgASPTgSjwFNF4AaABAg,Jefferson Rooney,4 months ago,1518395928118,Na época eu admirava essa urna por ser algo tecnológico e que apenas eu via mais aqui sendo usado do que em outros países mas vendo que isso é usado apenas a favor de gente interesseira a urna tem mais é que se tornar algo DESNECESSÁRIO.,0,false,0,,,,,,
UgxFN8sjwtSoxkD7S_54AaABAg,Fernando 11:11,4 months ago,1518395928124,Não entendi! A segunda colocada na licitação vai organizar as eleições!!,0,false,0,,,,,,
UgwFY0i_B16gkrhZjM14AaABAg,José Servo do Deus Vivo,4 months ago,1518395928128,"Se Deus quiser, Bolsonario ganha no primeiro turno com 90 por cento dos votos. DEUS ACIMA DE TUDO. LOUVADO SEJA NOSSO DEUS, PAI DE NOSSO SENHOR JESUS CRISTO. QUE TÁ VIVO SENTADO AO LADO DIREITO DE NOSSO AMADO DEUS.",0,false,0,,,,,,
Ugxrifw5iaJss9eXWp14AaABAg,Gabriel Dantas,4 months ago,1518395928135,Seu sempre começo a rir com essa intro ahuahae,0,false,0,,,,,,
UgzZTIupotV7U2f_frV4AaABAg,Luiz Laurindo dos Santos,4 months ago,1518395928139,"Até que enfim se tocaram que essas urnas eletrônicas é só patifaria, não votei em nenhum patife e acho que meu voto foi pra alguém.",0,false,0,,,,,,
UgxXr9n7kWNuT6Rj8jp4AaABAg,Beatriz Silva,4 months ago,1518395928146,Tamo junto bolsonaro 😎👍,0,false,0,,,,,,
Ugy5HEGz6RDCl515a7t4AaABAg,Carloseduardo Alvesmonteiro,4 months ago,1518395929642,Voto impresso 2018 e sempre !!!,0,false,0,,,,,,
Ugy3hxaqi_CzfRxsPt54AaABAg,itamar oliveira campos,4 months ago,1518395929646,"acabei de chegar em casa,  comprei minha camisa do bolsonaro só falta uma bandeira do Brasil.",0,false,0,,,,,,
UgzmEELzQlzEV6y33vp4AaABAg,Paulo Bitecouski,4 months ago,1518395929653,"Fora urnas falsas ladras de voto , essas desgraça  vem de Cuba, vamos voltar ao voto antigo mais seguro.",0,false,0,,,,,,
UgyABgp0en6feNEsLOR4AaABAg,Edson P. Lopes,4 months ago,1518395929656,Estava escrito isso a muito tempo que essas urnas sempre teve fraude.,0,false,0,,,,,,
Ugw27REiUnVOnpF-Ex54AaABAg,Luiz xavier dos Reis,4 months ago,1518395929661,Nós também não podemos aceitar tem que botar para correr esses corruptos,0,false,0,,,,,,
UgxvqZ3aOy_smIi_v_x4AaABAg,Luciene Lopes,4 months ago,1518395929666,"Notícia de ontem,nada mudou .Continuamos na mesma...",0,false,0,,,,,,
Ugxr-gTcw2QczhWjdjN4AaABAg,Emerson Jair,4 months ago,1518395929670,eu não quero o voto eletrônico .e quero voto impresso e Jair Bolsonaro presidente.,52,false,0,,,,,,
UgxMoRzpmsUZtrlYAjJ4AaABAg,Denisson Costa,4 months ago,1518395929677,bolsonaro 2018!,0,false,0,,,,,,
UgzSdJJvzNfLRDfVL0x4AaABAg,rodrigo ribeiro,4 months ago,1518395929680,"Pelo que li, a smartmatic foi reprovada na licitação para impressora das urnas, então talvez não tenhamos votos impressos. Típica armação esquerdista.
BOLSONARO 2018",0,false,0,,,,,,
UgxiG70MCmMyBNG56ap4AaABAg,Gaah Santoos ',4 months ago,1518395929684,SÓ EU QUE ACHO IRRITANTE ESSA ABERTURA DO CANAL ?,0,false,0,,,,,,
Ugww3vz4LZ3GsBY9WYB4AaABAg,Renato Fernandes,4 months ago,1518395929691,"Agora eles vão fazer outra urna que atende o edital e continuará essa mesma safadeza. Brasil não tem lei, se tivesse não estava essa robalheiras da porra é esse FDP desse Lula estaria preso a anos sem falar os outros canalhas. #Bolsonaro2018 #Brasilsemcorrupção
#Lulanacadeiajá
#stfbandidos
#ptbandidos",0,false,0,,,,,,
UgyCxxnPgfBAyy_7LgJ4AaABAg,Salomão Freitas,4 months ago,1518395929700,Alguém pode me explicar como funciona o voto Impresso?  Vc vota e sai um comprovante  do candidato q vc votou é  isso ? Porq se for O BOLSOMITO VAI GANHAR NO PRIMEIRO TURNO 😅😅😅😅,0,false,0,,,,,,
UgzyHJkfzTjkVjg3ngh4AaABAg,Soldado De Honra,4 months ago,1518395929702,"BOAAAAAAA CARALHO, AQUI É BOLSONARO SEUS PORRAAAA!!!",0,false,0,,,,,,
UgydwwLBXWYU7WHcTTt4AaABAg,fabio campos,4 months ago,1518395929709,Isso é balela!!,0,false,0,,,,,,
UgzzdjD5d7MsKsph0NZ4AaABAg,Gico,4 months ago,1518395929714,"Acho que Bolsonaro tá dando mole pro inimigo, não esqueçam que PT's são quadrilheiros bandidos...redobrar os cuidados é recomendavel...",0,false,0,,,,,,
Ugyv_Klqq0VQTN4Ekd54AaABAg,Sjtsjt76 Sjt,4 months ago,1518395929720,Continência Bolsonaro,0,false,0,,,,,,
Ugw5K7doVmtuWLNTzpV4AaABAg,Gaah Santoos ',4 months ago,1518395929724,ACABOU PARA OS MERDA DE ESQUERDA E OS PTISTA . AGORA É UMA NOVA REVOLUÇÃO.  AGORA É BOLSONARO ' ❤,0,false,0,,,,,,
UgxqD63nzi0XQOAn6b54AaABAg,Gilberto Mezzari,4 months ago,1518395929728,GRAÇAS A DEUS. .AS PORCARIAS DAS URNAS VÃO SUMIR. ..,0,false,0,,,,,,
UgwaeWQKdXztQLk_jIx4AaABAg,henrique reis,4 months ago,1518395929736,#bolsomito,0,false,0,,,,,,
UgzWSM19ossss9dxd-54AaABAg,mario mendes,4 months ago,1518395929739,Vai ser no 1º turno kkkkkk,0,false,0,,,,,,
UgzEk8hwDrhcWxflpih4AaABAg,Uly Azevedo,4 months ago,1518395930719,"https://www.youtube.com/watch?v=Oe_03IBoDLc

Ta demais já. Extrapolaram o límite.
O negócio é ganhar no voto e parar os ónibus em frente a pgr, todos os T... e mandar pra Venezuela com direito a 2 pães com mortadela. Bebidas tem que pagar.",0,false,0,,,,,,
UgyECzK6g6ubE_UjZ0N4AaABAg,André Bottan,4 months ago,1518395930726,Como que isso não passou no jornal e não tem nenhum outro canal falando disso??,0,false,0,,,,,,
Ugw-u0Em-5B2ENB5Z4d4AaABAg,Maria Regiane Barbosa Maia,4 months ago,1518395930734,Beleza agora é nós Bolsonaro 2018,0,false,0,,,,,,
UgyqdETfyx-4ZQcnej14AaABAg,Paulo C.V. da Silva Silva,4 months ago,1518395930739,Neste país não tem justiça Lula Cunha Dilma genuíno Roberto gefersom tem que está preso .para um país voltar a ser confiável tem que prenter,0,false,0,,,,,,
UgzNxSc2ihYUtJ1-hAt4AaABAg,mario mendes,4 months ago,1518395930744,Que notícia boa!,0,false,0,,,,,,
UgwAqeS1Fgq3UaRmQh54AaABAg,Paulo Henrique Junior,4 months ago,1518395930750,"do que adianta mudar o voto eletronico para o impresso? tem que mudar quem vai contar os votos porque como disse algum comunista (Lenin acho eu) : ""quem decide a eleição não é quem vota , mas sim quem vai contar os votos.""",0,false,0,,,,,,
Ugxb0xbbR2EvZPf3zxN4AaABAg,Nei Andrade,4 months ago,1518395930755,Expulsem essa desgraça de Smartmatic do Brasil e votos no papel ja!,48,true,1,,,,,,
,,,,,,,,Ugxb0xbbR2EvZPf3zxN4AaABAg.8cKxx87CH6l8cLx7fSqidH,Bruno Soares,4 months ago,1518395931816,"concordo,tendo em vista q paises de 1 mundo votam ate hoje com sedulas,e o povo se sente seguro na hora de votar...",3
Ugy5Swk6MoTagUI3q6J4AaABAg,Lucas Moura,4 months ago,1518395930770,Gente tambem sou Bolsonaro mas fiquem esperto eles querem mudar as urnas para fraudar as urnas e para o povo não acharem que fraudarem para eleger um que biguem espera fiquem esperto,6,true,1,,,,,,
,,,,,,,,Ugy5Swk6MoTagUI3q6J4AaABAg.8cKxx07eG5q8cKyQVY8sYH,Gaah Santoos ',4 months ago,1518395931726,Lucas Moura bem pensando,0
UgxdZm7aLUhnbsv_a8h4AaABAg,J C MARTINS,4 months ago,1518395930778,Boa!!!,0,false,0,,,,,,
UgzhTLMWHze7ryRq0vl4AaABAg,Xavier Direita,4 months ago,1518395930787,"Chega
 De sabotagem comunista vagabundos",0,false,0,,,,,,
UgyX28hawscmrEs2HZ14AaABAg,Eduardo Pereira,4 months ago,1518395930791,"Que lixo, fake news, lixooo!!!",0,false,0,,,,,,
UgxSx6_Dh2Yi3627Vc14AaABAg,Sergio Castello,4 months ago,1518395930820,"Putz aí sim!!!coloca a faixa no homem logo.....cuidado pretralhas e bando de mamadores, Bolsonaro vem aí e o bicho vai pegar....trabalho de graça,faço campanha,compro camisa,#bolsonaro2018",0,false,0,,,,,,
UgzgKcDFQcRfrkycPBV4AaABAg,Terezinha Guimarães,4 months ago,1518395930826,"Parabéns uma etapa vencida, 👏👏👏👍",0,false,0,,,,,,
UgxYNyrglaaWBUk0kft4AaABAg,alexandre pincano,4 months ago,1518395930833,Infelizmente isto que o locutor colocou é somente para as impressoras. as urnas de votação ainda continuaram a mesma.,0,false,0,,,,,,
UgzhbwdUbnfWaNAAfIB4AaABAg,Sandro Visconti Costa,4 months ago,1518395930837,Estas maquinas nao tem lugar em nenhum País verdadeiramente Democratico... Viva o Brasil!!!,0,false,0,,,,,,
UgxUHULEWjPsRF_pJ3x4AaABAg,VanderleiDireita#Mito2018 Bispo,4 months ago,1518395930844,"Acabem com estas urnas fraudulentas lixo da Venezuela. 
#MITO2019",0,false,0,,,,,,
UgzZaIe9ni6wF6BvsbR4AaABAg,Renan Calliman,4 months ago,1518395930852,"Mas gente, calma... Infelizmente ainda têm as concorrentes ein...",0,false,0,,,,,,
Ugw5WoRM5pNdowXcsQJ4AaABAg,willys rocha nascimento,4 months ago,1518395930856,voto no papel já,0,false,0,,,,,,
UgxBTewHq3qRan69xN94AaABAg,leni bernardi,4 months ago,1518395930864,Finalmente😂😂😂😂😂😂😂😂😂👍👍👍👍👏👏👏👏👏👏👏✊✊✊✊✊✊👊👊👊👊 vencemos,0,false,0,,,,,,
Ugz3-uInJt26bQI3P0x4AaABAg,michael hartamann rodrigues,4 months ago,1518395930869,mito mito mito mito mito mito mito,0,false,0,,,,,,
Ugy2rbhl700OFUEfQTR4AaABAg,Play HarD,4 months ago,1518395932676,Os petralhas devem estar chorando kskskkss,0,false,0,,,,,,
Ugy14PYq7LrCqelxt5p4AaABAg,Samuelplay Lol,4 months ago,1518395932680,Na minha camisa   existem vários bolsomitos,3,true,1,,,,,,
,,,,,,,,Ugy14PYq7LrCqelxt5p4AaABAg.8cKxd11o38u8cKxdiESfHj,Samuelplay Lol,4 months ago,1518395933188,M,0
UgylRYLxyAvFD53fjoR4AaABAg,CÉSAR ALEXANDRE ARAÚJO,4 months ago,1518395932691,nada de comemorar antes da hora povão se no dia da eleição tiver alguma porcaria dessas  lá deve-se malhar no chão e não permitir que ninguém vote caso contrário é tapa e cusparada no meio da sua cara.,0,false,0,,,,,,
UgxnYmchH2_0m0pFHr14AaABAg,Ma. Elza,4 months ago,1518395932699,"Tem gente que adora ser ENGANADO, ACORDA povo!!!!!",0,false,0,,,,,,
Ugxy_MMcyVswOKTPUGx4AaABAg,Matheus Silva ̷fuckγou,4 months ago,1518395932703,Ta começando a melhorar,0,false,0,,,,,,
Ugy-yT-5gswhJDj-kld4AaABAg,WOT TNT,4 months ago,1518395932711,"A empresa X perde mas a Y que ganha pode ser corrompida da mesma forma. É preciso um sistema realmente confiável e transparente, nem que pra isso seja mais lento, o importante é ser confiável, o que nesse país cheio de safado é beeeeem difícil !!!",0,false,0,,,,,,
UgxOWby3OMk63rwtqeV4AaABAg,Dê Dê,4 months ago,1518395932720,E o que acontece agora? Vai abrir licitação? Ou vai ter voto como antigamente?,0,false,0,,,,,,
Ugy_-HIxnRmrwe9H5Ch4AaABAg,bacaninha pra frente Brasil 2018,4 months ago,1518395932728,Choooooora esquerda.,0,false,0,,,,,,
UgyQ67c9eFVhTEwXJGp4AaABAg,Império ball mapper,4 months ago,1518395932733,Tá vendo Deus existe!!!!!,0,false,0,,,,,,
Ugzhf-0eNCGyAHN5B-B4AaABAg,Sra Loli,4 months ago,1518395932742,BOLSO,0,false,0,,,,,,
Ugwk1v6YgrArfeG80L94AaABAg,Danilo Tomaz,4 months ago,1518395932745,"Graças a Deus,que alívio,agora vamos em frente Brasil!!!!!",0,false,0,,,,,,
Ugw_fSUVBy2GkZmsxdx4AaABAg,Emerson Santos,4 months ago,1518395932754,Eu ja falava a tempos que as urnas eletrônicas são fraudadas. Vamos tds aos milhões pra rua pedir intervenção militar porque o TSE e o STF vai fazer de tudo pro Bolsonaro não ser eleito. Intervenção militar JÁ! SELVA.,2,false,0,,,,,,
UgysY-Hl32iZWlsSNOR4AaABAg,SeaEMANUEL BR,4 months ago,1518395932757,BOLSONARO 2018 AAAAAAEEEEEEEEEEE,0,false,0,,,,,,
UgzCzAMEFeShIMrlmuJ4AaABAg,srad 1000 manca,4 months ago,1518395932766,"############################ OLHA A PAUTA DO CONGRESSO PRA SEGURANÇA###############: 1) Federalizar as forças de segurança pública, o que apenas centraliza o poder e é exatamente o oposto do caminho técnico, de aproximar as organizações policiais ao máximo do núcleo social em que atuam;

2) Criar o ""Estatuto do Desarmamento 2.0"", desfigurando as propostas que hoje estão em tramitação, para, na prática, se propor:

- Aumento de pena para os crimes de contato com armas;
- Manutenção da proibição ao porte de arma;
- Eliminação, apenas, da discricionariedade para a posse.

3) Reformas legislativas para ampliação de penas alternativas, afastando ainda mais os criminosos da punição por seus delitos. FAÇAM ALGO E PAREM DE DISCURSO!!!!!!!!!!!!!!!!!!!!!!!!!!!!!!!!!!!!!!!!!!!!!!!!!!!!!!!!!!!!!!",0,false,0,,,,,,
UgyXXM-9tcBjKdELpv14AaABAg,maycondeivis ferrari,4 months ago,1518395932773,TO CAGANDO PRA URNA ELETROMERDAS.............QUERO BOLSONARO2018 VENCENDO NO 1 TURNO ............................,0,false,0,,,,,,
UgzYM2xNJdo6iiIa3g94AaABAg,Luiz Costa,4 months ago,1518395932779,Agente da direita ta mudando o Brasil agr imagina em 2019 hehehehehehehe,0,false,0,,,,,,
UgwdShQVlMZoXSgYE3p4AaABAg,Carlos Urameshi Kenpachi,4 months ago,1518395932788,Agora sim porra!,7,false,0,,,,,,
UgzdVQ74pTlwGoOLHHR4AaABAg,Joao Ruas,4 months ago,1518395932791,"ONDE   SE  LÊ  ""ELES"" LER-SE  ELAS  NO COMENTARIO  ABAIXO.",0,false,0,,,,,,
Ugzq5fxZHibNuJ8yu7l4AaABAg,Jaco Santana,4 months ago,1518395932800,Seriu isso vei vamos ter voto impresso poxa fiquei feliz,39,true,2,,,,,,
,,,,,,,,Ugzq5fxZHibNuJ8yu7l4AaABAg.8cKwu2H65Gh8cLURpv3ddb,sebmanfio,4 months ago,1518395933236,"Jaco Santana  so em 5% das urnas serão de votos imprenso, ou seja falcatruas a soltas",3
,,,,,,,,Ugzq5fxZHibNuJ8yu7l4AaABAg.8cKwu2H65Gh8cLVYc9vE6U,Jaco Santana,4 months ago,1518395933243,sebmanfio aff vei que merda,2
UgxiHs2oaXch0iyOLol4AaABAg,curioso 1620,4 months ago,1518395932811,O Enéas tá se revirando no túmulo!,0,false,0,,,,,,
UgwyrSYn3NEerl5W6m94AaABAg,/.: Doge King:.\,4 months ago,1518395934274,GGGG FINALMENTE CONSEGUUIMOS NAO AGUENTAVA MAIS ESSE BRAZIL!,0,false,0,,,,,,
Ugzyh5v4a96Vtg3iIjx4AaABAg,Jaco Santana,4 months ago,1518395934282,Seriu isso vei vamos ter voto impresso poxa fiquei feliz,0,false,0,,,,,,
UgwzyNReBerQM7u163h4AaABAg,Joao Neto Ferraz,4 months ago,1518395934288,Voto impresso já!,0,false,0,,,,,,
UgyoZNmnvSC1Yps2hIV4AaABAg,messias alexandre onfre onfre,4 months ago,1518395934296,Bolsonaro vamos nessa vamos para frente mudança no país,0,false,0,,,,,,
Ugx_lPQWjcEazlMfR0h4AaABAg,Lucas Zoldeo,4 months ago,1518395934305,AAAAAERRRRGHH POOOOORRRA,0,false,0,,,,,,
UgzCDCXdr9JgsV67nUZ4AaABAg,Joao Ruas,4 months ago,1518395934310,"NÃO VAMOS ACEITAR  URNAS  SEM IMPRESSORAS TODAS  ELES NÃO COMO  A  RAQUEL DODGE QUER ELA  NÃO TEM PRERROGATIVA PARA  ANULAR    LEI APROVADA E  SANCIONADA PELO PODER MAIOR  DO PAIS.CASO NÃO  TENHA   URNAS COM IMPRESSORAS, PEÇO AO POVO BRASILEIRO PARA REJEITAR ESSA URNA  E PEDIR   A VOTAÇÃO  NO MODELO ANTIGO COMO FAZ  OS PAIS MAIS DESENVOLVIDO  QUE  SABEM DA FRAUDE  DESSAS  URNAS.CASO CONTRARIO  PEÇO QUE O POVO BRASILEIRO DEDIQUE ALGUNS MINUTOS DO SEU TEMPO PARA  INFORMAR AO STF E  STE QUE  NÃO VAMOS  VOTAR SE NÃO FOR DO  JEITO QUE  NOS QUEREMOS QUE É O CORRETO.  FAÇA  SEU PROTESTO ATRAVES  DAS  MIDIAS SEM PRECISAR SAIR  DE CASA.",0,false,0,,,,,,
Ugx55ZF2x_b5BRXBz914AaABAg,Uly Azevedo,4 months ago,1518395934317,"Maquiavel Dodge o povo não quer saber a identidade do eleitor como vocês com biometria que diz até se o cara tem chulé ou não e portanto  é inconstitucional.
Vou te ajudar porque é do judiciário e presumo que é ruim para cálculos.
ZONA 10  -  SEÇÃO  20  QUE CONTÉM 100 ELEITORES CADASTRADOS PARA CONTROLE DO TRE. Se tiver difícil fala ok?
AO TÉRMINO DA VOTAÇÃO A URNA GERA UM RELATÓRIO BEEEMMMM SIMPLES !!

NULOS - 5
BRANCOS  -  4
MAQUIAVEL DODGE   -   1
JAIR MESSIAS BOLSONARO  -  90  

Simples, fácil, sigilo preservado e honesto porque eleições sem escrutínio é fraude e INCONSTITUCIONAL,, mas claro que a Sra. sabe porque é quem comanda a PGR e trabalha para o povo ainda bem.",0,false,0,,,,,,
UgzLJZIGl1kXPG1BakJ4AaABAg,Gabriel Mello,4 months ago,1518395934325,"É ISSO AI, VAMOS ACABAR COM ESSA BAGUNÇA.",0,false,0,,,,,,
UgwwzqI-0LgoiqzR7JB4AaABAg,Hulk Lolaxnati Jesus,4 months ago,1518395934331,bolsonaro 2018,0,false,0,,,,,,
UgxtZoV16c_8wkKoLdp4AaABAg,lucas luquinhas,4 months ago,1518395934341,What the next president of Brazil 2018??,0,false,0,,,,,,
UgwrrbvVFhUmv2kZUVt4AaABAg,Douglas Castro de Lima Lima,4 months ago,1518395934351,Deus esta do lado de Bolsonaro acorda povo. A luta dele esta  apenas começando,0,false,0,,,,,,
Ugx7lFq7bxAbsIXWFbV4AaABAg,Susana Melo A vida é bela!,4 months ago,1518395934354,"Pergunta aos esquerdistas: Será mesmo que nesses últimos quase 25 anos, esses psicopatas que estão no poder fomos nós mesmo que colocamos????",0,false,0,,,,,,
Ugy0YeGEx2bFQri1dlZ4AaABAg,JM DJ,4 months ago,1518395934363,"quer dizer que as urnas eletrônicas são passível de fraude, então todas as eleições são fraudadas..... pena de morte já, crime hediondo e terrorismo....",0,false,0,,,,,,
UgzVga4FEh3NUcnrSol4AaABAg,Luan robson,4 months ago,1518395934367,Finalmente 🙌,0,false,0,,,,,,
Ugw2vBGs9G323ZguZjB4AaABAg,canal p piranha,4 months ago,1518395934375,quero ver o pt e outros daçarem,0,false,0,,,,,,
UgwPqe01VmGqMdq0olV4AaABAg,Douglas Casagrande,4 months ago,1518395934379,"Calma aí gente, vai dá merda, nas notícias dizem que ela ""deve"" ser repugnada, não existe certeza, ainda.
Grato Bia K!",0,false,0,,,,,,
UgyCZRi9fuoNZMdRtN54AaABAg,Alcindo Bortolin,4 months ago,1518395934388,"Essa notícia é fake news,
As urnas foram reprovadas e não que foram extintas da próxima eleição.",0,false,0,,,,,,
Ugwn36g1dJ6Ka-HVM7t4AaABAg,Brylon compositions,4 months ago,1518395934396,"A nossa mudança está vindo devagar e nas eleições vai ser a concretização, pois nós mudamos o Brasil.  Bolsonaro 2018.",0,false,0,,,,,,
Ugz_S8m4hVn6wasp1f14AaABAg,Juninho Telles,4 months ago,1518395934402,#Bolsonaro2018,0,false,0,,,,,,
UgzwnjIkyP6X0aD2WFZ4AaABAg,vinicius fernando,4 months ago,1518395934410,Olha os 13 petistas que deram deslike kkkk,0,false,0,,,,,,
UgxQpbSGWelAzl4LEYt4AaABAg,Edson  Belo,4 months ago,1518395935446,cara tuas pronuncias é péssima...... muda de narrador..... péssimo nem assisto. quando escuto essa voz.,0,false,0,,,,,,
UgzRP9UjyAR9G0VxUmp4AaABAg,SeaEMANUEL BR,4 months ago,1518395935449,aaaaaaaeeeeeeeee porrraaaaaaaaa,0,false,0,,,,,,
UgwR5qd_oDfta-sF6xF4AaABAg,meu pentelho no seu celular,4 months ago,1518395935458,Me explica esse voto impresso? Pfv,0,false,0,,,,,,
