id,user,date,timestamp,commentText,likes,hasReplies,numberOfReplies,replies.id,replies.user,replies.date,replies.timestamp,replies.commentText,replies.likes
UgxZ9IiNUbMGukihV6B4AaABAg,Antonio Custodio,4 days ago,1528416641283,"O STF se desesperou com a palavra do advogado, isso mostra que essa cambada estão subordinados a uma organização comunista internacional chamada de ""Foro de São Paulo""
Acorda povo isso é muito grave, se esses caras tivessem a favor do Brasil estariam lá descutindo afavor do voto impresso e pelo máximo da transparência nas votações. Alguém viu pressão dos deputados e senadores que são representantes da sociedade nesse momento? Ninguém.
Depois que o STF cuspiu na cara do povo aí aparece os boca mole pra criticar a atitude do STF.
Na verdade os três poderes estão num barco aderiv, e pode afundar a qualquer momento.",20,true,1,,,,,,
,,,,,,,,UgxZ9IiNUbMGukihV6B4AaABAg.8hCrTxQtedY8hDGUFGYa9H,Joselio Alves,3 days ago,1528503041667,"tudo que é bom para o Brasil
não é bom para o STF",1
UgyBhC3cUvkVfrKxJkB4AaABAg,Mauricio Murgo,4 days ago,1528416641293,"O Perito destruiu o STF, que acabou com a Lei do Voto Impresso. Intervenção Popular seguido de Intervenção Militar ou vira Venezuela.",0,false,0,,,,,,
UgyGe-GCurb5rHbHBJJ4AaABAg,Paulo Pizzio,4 days ago,1528416641297,A urna viciada vai até dar voto pro lixo nessa eleição,0,false,0,,,,,,
Ugz-h_sUcotvAilrpzd4AaABAg,carlos jose barbosa,4 days ago,1528416641305,"é essa ""rapaziada""seria e capaz que não se curvará a esse sistema de corrupção.",0,false,0,,,,,,
UgxdEAV-TV9AqMYkQk14AaABAg,flahl,4 days ago,1528416643492,"esses sao os próprios demônio,esse stf é o atraso da nação  brasileira",0,false,0,,,,,,
UgwBLro_Uyy-gffhO6l4AaABAg,Brunotx Teixeira,4 days ago,1528416643499,👏👏👏👏,0,false,0,,,,,,
UgzlcDt9pBJpgBBFEtN4AaABAg,Aqui a Justiça tarda e falha,4 days ago,1528416643503,"Era para o Advogado falar por 8 minutos, mas não deixaram ele falar nem três minutos.",0,false,0,,,,,,
UgxsJcrdmEv2UMhUXWt4AaABAg,Fabrício ensinando a jogar Jogos,4 days ago,1528416643509,Bolsonaro 2018 ficha limpa o nosso Presidente Sérgio Moura limpa tudo,0,false,0,,,,,,
UgxB3-E7EvLrCwgbnot4AaABAg,JairJunior,4 days ago,1528416643515,"Aonde que é democrático isso? Não importa a opinião de ninguém eles fazem oq quer!!!
STF imundo
Alguém manda bala nesse Gilmar Mendes",0,false,0,,,,,,
Ugz5Xb_4_ibJgPUWKC54AaABAg,Pereira Pinto,4 days ago,1528416643520,"NÓS DEVERÍAMOS IR PRAS RUAS NO DIA DA ELEIÇÃO E FICAR DE BRAÇOS CRUZADOS DO LADO DE FORA DAS SEÇÕES ELEITORAIS E NINGUÉM VOTAR !! A MULTIDÃO NAS RUAS, PARADA, SILENCIOSAMENTE, SEM ENTRAR PARA VOTAR, ERA ISSO QUE DEVERÍAMOS FAZER EM SINAL DE PROTESTO !! VERGONHA, NOJO !!!",0,false,0,,,,,,
UgyxSWEwK38cOhYZZsR4AaABAg,Matheus Moura,4 days ago,1528416643525,A grande maioria da população só quer se manifestar em comentários no YouTube,0,false,0,,,,,,
Ugxrm1hAaiClxt7aMe14AaABAg,Vídeos&Fotos,4 days ago,1528416643533,Eu queria saber como Collor  ganhou pra senador ! Senador !! Seria entendido pra vereador e olhe lá! !!,0,false,0,,,,,,
UgzoDD0d3FCoKMmqAN94AaABAg,Empório Fardin,4 days ago,1528416643538,MENINO CABRA MACHO SO! ENFRENTAR ESSE MONTE DE ABUTRES...,0,false,0,,,,,,
Ugw6NKRSJIEKqWbD0t94AaABAg,Margot Wagner,4 days ago,1528416643545,"Agora me digam, quando este supremo que está aí, ao julgar não averiguou todos os fatos apresentados pelo advogado??? Que absurdo! Olha a preocupação de todos!!!",0,false,0,,,,,,
UgzV1QCt0DTH3ck4IWV4AaABAg,Rocha Rob,4 days ago,1528416643549,"Aprendam de uma vez por todas brasileiros...NAO EXISTE ADMINISTRAÇÃO PÚBLICA (EM NENHUM DOS PODERES) QUE ESTA SERVINDO O POVO!!!!
Só se quer o poder e o dinheiro, nada é feito para melhorar a vida do cidadão, eles morrem de medo que o povo comece a pensar e se revolte.",1,false,0,,,,,,
UgwS1ileyyco-kfoa814AaABAg,André Luiz,4 days ago,1528416643555,Só Deus para fazer o milagre por nós,0,false,0,,,,,,
Ugyab6v_M9Z9rpmdast4AaABAg,Claudinei Lima,4 days ago,1528416643565,Os ministros parece o advogado colocando defeito no cara que tá falando desmerecendo a fala dele,0,false,0,,,,,,
UgzjRXsyYhV5UE7J5xd4AaABAg,Regina Kova,4 days ago,1528416643572,"E URGENTE QUE SE INSTAURE UMA CPI DA URNA ELETRONICA, OU JA ESTAMOS VIVENDO UMA DITADURA NO BRASIL????",0,false,0,,,,,,
Ugy-Cj8g7OzEp4tHMXJ4AaABAg,moto serra,4 days ago,1528416643579,Só metralhando esses vagabundo.,0,false,0,,,,,,
UgysumPJrDdDBvTY07V4AaABAg,Manoel Serralheiro,4 days ago,1528416643584,Toma seus jumentos de toga!,0,false,0,,,,,,
Ugxt-cMlHqZ7U1vA6jh4AaABAg,Patysu Wak,4 days ago,1528416643589,Só acredito no voto em papel.,0,false,0,,,,,,
UgwhhXUlJCIz6547vbp4AaABAg,KfeMineiroGames,4 days ago,1528416643595,"Solução: Votar na Urna/Ela imprimir o voto(segunda via)e ser depositada numa caixa secundaria/Divulgação feita pela urna,e conferencia de fraude feita pela impressão que ser a segunda via conferida pelo exercito/Outro órgão competente!Nao so 1 órgão publico conferir,ser pelo menos 3.",0,false,0,,,,,,
UgztvdwOfzrcrWN9oQl4AaABAg,Willian Rodrigues,4 days ago,1528416643599,Cara olha a cara dos ministros eles tão pouco preocupados com Isso!!!,0,false,0,,,,,,
UgyZCeqYhaDv7IqLXCZ4AaABAg,Sandra Regina,4 days ago,1528416643605,"Os velhacos do STF ficaram sem ação com  os argumentos do nobre jovem Advogado.  As urnas eletrônicas são tão manipuladas que somente elegem e reelegem  os mesmos bandidos corruptos de sempre, os mesmos partidos dos corruptos que indicaram esses ministros cara de pau. Esses patifes querem perpetuar no poder  até morrer.",0,false,0,,,,,,
Ugzs9q0bi4uv_p2grMh4AaABAg,Anselm Schneider,4 days ago,1528416644356,"OHH POVO BURRO....ESTAMOS NUMA DITADURA COMUNISTA E OS BURROS NÃO QUEREM ENXERGAR A REALIDADE. NOJO, NOJO, NOJO....DITADURA COMUNISTA DO DIABO!!!",0,false,0,,,,,,
Ugx252A10szmcDUmd_F4AaABAg,Ric Bel,4 days ago,1528416644367,Muito bom os argumentos!,0,false,0,,,,,,
UgwYEJFKplS0JtFTwHx4AaABAg,Maria Salete Suerkamp,4 days ago,1528416644375,Tem que fechar este museu e está juventude guerreiros tomar posse,0,false,0,,,,,,
UgxEOMO5P5rM8wszmIt4AaABAg,Eliete Soares,4 days ago,1528416644382,"É preciso limpar os três poderes com a máxima urgência. Nenhum deles é representante legítimo do povo.
Fora todos já. Intervenção cívica e Militar agora.",0,false,0,,,,,,
UgzDeQmfq08yetVorcR4AaABAg,Pereira Pinto,4 days ago,1528416644388,DEPOIS ELES FICAM SE PERGUNTANDO O PORQUÊ DE TANTAS PESSOAS ESTAREM PEDINDO UMA INTERVENÇÃO MILITAR...TADINHOS...TÃO INOCENTES. É POR CAUSA DESSES DESMANDOS QUE O POVO NÃO ESTÁ SUPORTANDO MAIS VIVER AQUI !!! DEPOIS NÃO QUEREM SER XINGADOS NAS RUAS !! MEU DEUS...,0,false,0,,,,,,
Ugx8fH_foFeQYgRs-I54AaABAg,Matheus Barreto,4 days ago,1528416644396,Está  urna é fraude e não tem como legitimar  o voto a mesma pode ser violada internamente. STF canalha.,0,false,0,,,,,,
UgxwBcd8yBivf8qpDkx4AaABAg,MENDES QUIMICAUFPI,4 days ago,1528416644400,deixaram nem o perito falar ! para dirimir qualquer dúvida uma nova pericia deveria ser realizada e demonstrada todas as evidências na cara desse ministros! contra fatos não existem argumentos !,0,false,0,,,,,,
UgxKqJsnFz0IzvR0Wi54AaABAg,Anivalda Maria Silva,4 days ago,1528416644409,mas isso não é passado já.......pra que suscitar cachorro morto,0,false,0,,,,,,
Ugzgl9en-OahwwRo6_t4AaABAg,Marina Rute,4 days ago,1528416644417,"Cambada chamar o stf de comunista é a prova cabal de que vcs não sabem nada sobre comunismo parem de passar atestado de burrice peloamordedeus eles são uma casta de privilegiados do sistema financeiro neoliberal que mantém, os pobres cada vez mais pobres ou vcs acreditam nessa balela deque a lei é para todos de comunista esses caras si só tem a  escama",0,false,0,,,,,,
Ugx2PChY6nT7_oAaTl54AaABAg,Rosi Mendes,4 days ago,1528416644422,Cale a boca Lewandowski vagabundo corrupto!,0,false,0,,,,,,
UgwTp1UE5GUyyLW6yQV4AaABAg,Patysu Wak,4 days ago,1528416644430,"Na Venezuela, com máquinas mais modernas que as do Brasil, mesmo com voto impresso, deu no que deu.",0,false,0,,,,,,
UgzvgwVlJFo7Ay6HPQR4AaABAg,Jocimar Rodrigues,4 days ago,1528416644436,Esse advogado é o cara hein,0,false,0,,,,,,
UgzacEBWguvv9LrKx_d4AaABAg,Maria Salete Suerkamp,4 days ago,1528416644464,Não deixam o jovem falar esses crápulas,0,false,0,,,,,,
Ugwuul7A8UINBbm_ZL14AaABAg,Luiz Carlos Noronha,4 days ago,1528416644469,bolsonaro 17,0,false,0,,,,,,
UgzU5lCNCWDjwCpneZV4AaABAg,Arlan Nunes,4 days ago,1528416644476,Algum hacker poderia invadir as urnas bem no dia da eleição e eleger o Trump pra presidente do Brasil kkk,0,false,0,,,,,,
UgxQGhV5M-8hWrEr2LJ4AaABAg,Pereira Pinto,4 days ago,1528416644487,ESSA DISCUSSÃO NEM DEVERIA EXISTIR ! A APURAÇÃO SECRETA É UM ESCÂNDALO ANTI-DEMOCRÁTICO ! É UM CRIME MESMO CONTRA A DEMOCRACIA ! ISSO SÓ EXISTE NAS DITADURAS ! ISSO É UMA VERGONHA DE PROPORÇÕES GIGANTESCAS !!! UM CRIME ! VIVEMOS EM UMA DITADURA DISFARÇADA DE DEMOCRACIA !!!!!,0,false,0,,,,,,
UgxOTHumhsseop1RUCt4AaABAg,Maria Salete Suerkamp,4 days ago,1528416644493,Canalhas,0,false,0,,,,,,
Ugyvwp1FC8ZjbxJ23pl4AaABAg,Geraldo Pereira da Silva,4 days ago,1528416644500,Serrá que entenderam ou precisa desenhar?,2,true,1,,,,,,
,,,,,,,,Ugyvwp1FC8ZjbxJ23pl4AaABAg.8hCqb4BI0Mw8hDCXb5_pvp,Pati Pera,3 days ago,1528503044778,"Geraldo Pereira da Silva 
Acho que nem desenhando...o que é mais triste!",0
UgyS9GgLGEovjM9kbyd4AaABAg,Roberto Souza,4 days ago,1528416644511,É fim do mundo estes guerrilheiros não obederem a lei e a 200 milhões de brasileiros.,0,false,0,,,,,,
UgzNvSC4yL3CTBO2VKZ4AaABAg,Patysu Wak,4 days ago,1528416644518,Quadrilha.,0,false,0,,,,,,
Ugx6GGbDzxVKn9uLbVt4AaABAg,Edilson Pereira Pereira,4 days ago,1528416645570,Esse é oque rasgou a constituição Levandovisk e o nome da praga do Egito 😎,66,true,1,,,,,,
,,,,,,,,Ugx6GGbDzxVKn9uLbVt4AaABAg.8hCq_QpJS2p8hECFpMJjk3,Paulo meireles,3 days ago,1528503046483,É esse mesmo o verme comunista protetor de presidenta de um neurônio só e que tem cabeça de ameba.,0
Ugym_0SMrtv6uYKXqz14AaABAg,Alexsandro Peres,4 days ago,1528416645581,Boa,0,false,0,,,,,,
Ugw9vEt3duvIrBOaaCl4AaABAg,Sinderela Legal,4 days ago,1528416645588,"VOTO IMPRESSO
STF não tem o direito de revogar decisões do congresso.
O congresso é eleito, eles são nomeados.
      Eles já estavam com tudo combinado.
Isso é que dá os deputados serem corruptos SEM MORAL.
Isso é que dá povo covarde SEM CORAGEM.
Vão lá e exijam a revogação dessa palhaçada.
O povo é soberano.
FORA STF
CHUTEM ESSES CANALHAS ""LIBERTADORES DE CORRUPTOS"" DELINQUENTES
SUBSTITUAM ESSA CORJA VENDIDA
JUIZ É FUNCIONÁRIO, EMPREGADINHO E TEM QUE SEGUIR A LEI
.
Deixa eles fazerem o que quiserem agora com um assunto fundamental como esse,
que eles vão soltar todos os enquadrilhados,
que eles vão anular toda a lava jato,
 
Se não quiserem que eles coloquem no governo seus cupinchas corruptos:
VOTO IMPRESSO
VOTO IMPRESSO
VOTO IMPRESSO
VOTO IMPRESSO
VOTO IMPRESSO
VOTO IMPRESSO
VOTO IMPRESSO
VOTO IMPRESSO
VOTO IMPRESSO
VOTO IMPRESSO
VOTO IMPRESSO

... ou...  
GUERRA
Canalhas de toga, isso foi a gota dágua para sua condenação.
.
     Para quê ter um TSE ???
     Os tempos são outros...
     Vamos pensar um pouco em colocar eleições nas mãos do povo.
     FORA COM ESSA CORJA
-",1,false,0,,,,,,
UgwpllE300nnJYaiGI94AaABAg,marcus correa,4 days ago,1528416645593,"O instamento burocrático, a serviço da NOM vai continuar a obrigar o povo a engolir suas mentiras. Pode contar como certo o candidato da NOM vai subir nas pesquisas fraudadas, para justificar o golpe bolivariano comunista.",0,false,0,,,,,,
UgwRMI0lcXO27VCmxNp4AaABAg,Roselene Prado,4 days ago,1528416645597,Greve não vamos votar.,0,false,0,,,,,,
UgwtdOmJ7-PBa5Nrkpl4AaABAg,allan kardson,4 days ago,1528416645605,Bando viboras  esses velhos so prova que urna eletrônica é fraudulenta,12,false,0,,,,,,
UgwG3hRjY-wjfW00e8Z4AaABAg,wic joga,4 days ago,1528416645614,"o advogado falando e um pessoal lá trás mechendo no celular como se estivesse em casa
eles nao tem nem educação de ouvir o que está sendo discutido",0,false,0,,,,,,
UgzGHLbBPSLj6H3Yc9d4AaABAg,MarcosAfmaciel Maciel,4 days ago,1528416645617,"esses caras agora ficaram com medo, eita tomara que isso vá pra frente",0,false,0,,,,,,
UgyhjM7g2DCd4TVEd7h4AaABAg,Roselene Prado,4 days ago,1528416645624,"Urna eletrônica  fraude Carme Lúcia, Gilmar Mendes,  não  querem ouvir , não  querem  ser contariado. Eu não  vou votar nesta urnas  eletrônicas fraudadadas.",0,false,0,,,,,,
UgxcaCA0HsS4n0p4ZtN4AaABAg,IVAN GAMENERD,4 days ago,1528416645629,e um rebanho de vagabundo e ladrões corruptos .,0,false,0,,,,,,
UgzyvD2pHyHqN7nuKUp4AaABAg,marco antonio rocha rodrigues,4 days ago,1528416645638,Essa corte tem que começar do ZERO,0,false,0,,,,,,
UgzJVZR34fkudIoPLxp4AaABAg,Gilmar Lopes Vieira Vieira,4 days ago,1528416645641,O CHEFÃO DA ORCRIN FALOU NAQUELA LIGAÇÃO...UM STF ACOVARDADO UM JUDICIÁRIO ACOVARDADO. E NÃO É QUE ELE TINHA RAZÃO...,15,false,0,,,,,,
UgzHFsJ9lcF71ccx1vt4AaABAg,Joaquim Ferreira,4 days ago,1528416645651,kkkk ta nervoso vagabundo ? vai tirar o ganha pão todos tremendo kkkkk,0,false,0,,,,,,
UgxLEsiidNKPkozPkQ94AaABAg,Edimar Pedrosa,4 days ago,1528416645660,"Os ministros interompem o técnico o tempo todo, parece que não querem ou não interessa  ouvir a opinião dele.

Você acredita na lisura dos técnicos do STE, mas infelizmente o povo brasileiro não acredita e nem aceita.",0,false,0,,,,,,
UgzhhNbZAbQ1-riIb4F4AaABAg,Manoel Messias,4 days ago,1528416645663,POVO BRASILEIRO JUNTOS SOMOS MAIS FORTES VEJAM NOSSOS IRMÃOS CAMINHONEIRO.GREVE GERAL DIA 5/10 ESSA É A HORA.FECHEM TUDO.,0,false,0,,,,,,
Ugyewg7n5CN91fhRUj94AaABAg,wic joga,4 days ago,1528416645672,"até um leigo de informatica consegue burlar essa urna kkkkkkkk
eles falam como se a una eletronica fosse um computador de ultima geração kkkkkkkkkkkkkkk
bando de velho ladrão",0,false,0,,,,,,
Ugx1KOT1JP9wScxRmph4AaABAg,Pereira Pinto,4 days ago,1528416645677,"A RELUTÂNCIA DO STF PARA COM A ADOÇÃO DO VOTO IMPRESSO É ESQUISITÍSSIMA. ELES PARECEM AFLITOS ! NENHUM PAÍS DESENVOLVIDO ADOTA O NOSSO SISTEMA, NENHUM ! POR QUE ESSA INSISTÊNCIA ??? SE HÁ O QUE TEMER, ADOTEM O VOTO IMPRESSO PARA QUE TODAS AS SUSPEITAS SE ACABEM.",0,false,0,,,,,,
UgwaIaD6Cus95j1PD-N4AaABAg,vladimir dutra dutra,4 days ago,1528416645684,Todos esses de toga são comunistas,0,false,0,,,,,,
UgwXf_f8PzvTnI8odyR4AaABAg,Emanuele Santos,4 days ago,1528416645694,Se nao tivessem culpa no cartorio nao criariam caso na questao do voto impresso,0,false,0,,,,,,
UgwyT3jUBK7Tx0dbZVt4AaABAg,guttemberg gabriel,4 days ago,1528416645699,😍gostei desse cara ...,3,false,0,,,,,,
UgyZX5Qmi2GEzC8mrjB4AaABAg,José Eduardo Diniz,4 days ago,1528416647400,Não é possível! O cara falou tudo e é possível haver fraude.,0,false,0,,,,,,
UgwC7FUGWnrMQ9U75pJ4AaABAg,Cláudio Andrade,4 days ago,1528416647407,Se Voto Impresso a Democracia Já Era !  Estamos vivendo em uma Ditadura Esquerdista. Socorro Generais ... Intervenção Militar Já !!!!,4,false,0,,,,,,
UgzTgs6cSS9DPFkCp3h4AaABAg,Agenor Tadeu de Moraes,4 days ago,1528416647412,"Um bando de ladrões do stf. jamais vão concordar que as urnas são fraudadas, tudo o que depende de computador pode ser fraudado.",0,false,0,,,,,,
Ugxp4b0eT8Usd7eEu154AaABAg,EpaHulk,4 days ago,1528416647421,Acabou o país! GAME OVER,0,false,0,,,,,,
Ugwrw1eb9ZUZtnJ33UJ4AaABAg,odair jose franca franca,4 days ago,1528416647425,Tem que ser cancelado essas urnas,0,false,0,,,,,,
Ugz4kMBkS-HAXbDWs6V4AaABAg,Cícero Silva,4 days ago,1528416647461,Olha só quem está falando em segurança do sistema!!! O maior Bandido do TSF.,0,false,0,,,,,,
UgzkPrzK_xR4hNrTZFx4AaABAg,Naná  Naná,4 days ago,1528416647471,"Preocupados?O STF???Por quê?Eles são Supremos,nada os atinge,estão rindo da nossa cara....eles sabem muito bem  da fragilidade das urnas na questão da segurança.Acho que já houve fraudes,principalmente na presidencial..Acho que na reeleição do Lula ...mas comecei a cismar mesmo em 2014...foi muito estranho ...",0,false,0,,,,,,
UgxKpWOsbx1ttiSzQZB4AaABAg,jefferson louvisse,4 days ago,1528416647475,"Matou a pau !!
Mas, infelizmente ....",0,false,0,,,,,,
UgwP0Uxqjp9Xlo3GP694AaABAg,Emanuele Santos,4 days ago,1528416647484,Perfeito posicionamento desse advogado,0,false,0,,,,,,
UgzZRMF7uLD-RNkeX8t4AaABAg,Miracelia Queiroz Freitas,4 days ago,1528416647495,Não é atoa que nesse congresso está cheio de RATAZANAS 🐀🐀🐀🐀🐀🐀🐀 ganhou tudo na base da maracutaia ⁉️🤔.,0,false,0,,,,,,
Ugz0DUxxhFWhuW_b84p4AaABAg,ladrão vacilão,4 days ago,1528416647499,estamos na merda..,0,false,0,,,,,,
UgykCUG9jGEVWKXP0fR4AaABAg,Manoel Messias,4 days ago,1528416647508,QUE VERGONHA NOSSOS TOGADOS.,0,false,0,,,,,,
Ugw0uhuKz4PVQP8omLl4AaABAg,Sandra Souza,4 days ago,1528416647517,"ficaram perturbados com a colocação do perito,são covardes, canalhas,",0,false,0,,,,,,
UgwjaiFJ-inGR4sZbgp4AaABAg,Raiuga Aguiar,4 days ago,1528416647521,E desde quando o que é dito por Levandowski é confiável?,0,false,0,,,,,,
Ugw-tcQza7dUnbiv4KJ4AaABAg,Scoth Phelps,4 days ago,1528416647530,"Ministro Gilmar mendes sendo esculachado em público.
Faça isso sempre que ver alguem do STF por aí. 
https://youtu.be/X4rCSTqUM7A",0,false,0,,,,,,
UgwVEeiKz5JYYp43eW14AaABAg,Guilherme Matos,4 days ago,1528416647535,Fora STF! URNAS FRAUDADAS!,10,false,0,,,,,,
UgwLkjfsJTe-D5onpid4AaABAg,Mateus Daniel,4 days ago,1528416647543,Caraaaca meu irmão... nunca vi o STF tão desnorteado kkkkk gostei desse cara.,0,false,0,,,,,,
UgwWMTukNGvO2ULNRTV4AaABAg,enigmatic,4 days ago,1528416647552,"olha a cara das jararacas do STF KKK, amei!. agora o nó apertou mais.",14,false,0,,,,,,
UgwdLqaqE7YEBf8zmyp4AaABAg,Perspectiva matuta,4 days ago,1528416647555,"Vcs não enganam mais ninguém, bando de pilantras!",0,false,0,,,,,,
UgyvG8rZOMIzDOlxWXJ4AaABAg,Thiago Felipe,4 days ago,1528416647565,Falou bonito e tem o meu respeito! #VotoImpressoJá,0,false,0,,,,,,
UgzJJUqufRjpgYps6MV4AaABAg,jonathan SS,4 days ago,1528416648340,OS FILHOS DA PUTA NEM OLHAM PRO CARA QUE TA FALANDO!!!,0,false,0,,,,,,
UgzlMon5HU781ZnKCkZ4AaABAg,Alexandre César,4 days ago,1528416648349,"Na revolução Francesa esses ministros já teriam voado em 2 s. Se o voto impresso não for acatado, nunca haverá democracia no Brasil.",0,false,0,,,,,,
Ugy-QNFf4LkjYoKJnoJ4AaABAg,juliano ferreira,4 days ago,1528416648355,O brasileiro está acordando cuidado pois pode acontecer o que acontece com os caminhoneiros . Supremo precisa verdadeiramente escultur a verdade.,0,false,0,,,,,,
UgwKqw_f7lCeERm8tsp4AaABAg,Carlos Pinto,4 days ago,1528416648362,"Eleição com urna eletrônica é suspeitíssima! Nos Estados Unidos e Japão, por exemplo, onde a computação está muito mais avançada que no Brasil, com sistemas de segurança rígidos (e mesmo assim hackeados) como da Cia, FBI e Pentágono, não adotam urna eletrônica. As eleições são realizadas ainda no velho sistema do ¨X¨ no papel. A contagem e a divulgação dos resultados é demorada. Porém, podem ser re-verificados. E aqui? Os gênios estão seguros quanto a fraudes? Quem garante que a vontade popular está sendo respeitada? Não seria um meio sostificado de fazer eleições à la Venezuela?",0,false,0,,,,,,
UgyLWoNa85lR4zsWOA14AaABAg,Chiara Araujo,4 days ago,1528416648370,Maldita ditadura...,0,false,0,,,,,,
UgxgNv45XP37tWfcYWJ4AaABAg,guttemberg gabriel,4 days ago,1528416648376,E deu merda ....vamos continuar a atacar as urnas sem problemas 🤡,0,false,0,,,,,,
UgxoKs7I67Zvq5uPtNp4AaABAg,Joao melo Melo,4 days ago,1528416648382,"Nao adianta pessoas dizerem,um rapaz tão novo ,é formado em direito para passar esse país a limpo.
Sendo que essa quadrilha do STF compra ele brincando!
Esse país só Deus para dar um jeito!
E isso se o povo acordar,porque aqui , é carnaval, futebol,é gasolina que fala mais alto!",0,false,0,,,,,,
UgwsfTpw3fH6n1hF2Ct4AaABAg,Moisés Madureira,4 days ago,1528416648388,Vergonhoso o papel destes ministros,0,false,0,,,,,,
UgwgamXaaAeaMQdEICh4AaABAg,Manoel Messias,4 days ago,1528416648394,É VERDADE O STF É TODO INDICADO PELOS CORRUPTOS TAL COMO O TEMARDRACULA.FFAA FECHEM ESSE STF.,0,false,0,,,,,,
Ugydgour9VgKSCJB2bt4AaABAg,MESQUITA LUIZ CARLOS,4 days ago,1528416648401,O GRANDE PROBLEMA DO BRASIL SÃO ESSES ABUTRES TOGADOS. SÃO BANDIDOS. REALIZAM TAIS AUDITORIAS COM PERITOS PREVIAMENTE COMBINADOS E AMESTRADOS. AS RESPOSTAS DESSES PERITOS NOMEADOS POR ESSES RATOS DO STF SÃO PAGOS PARA TRAZER OS RESULTADOS QUE ELES BUSCAM.,0,false,0,,,,,,
UgwwIMExT547sCKIhph4AaABAg,Deivison Oliveira,4 days ago,1528416648407,STF uma vergonha....,0,false,0,,,,,,
UgxUrvXetNFDtKQcP6V4AaABAg,altamiro de araujo,4 days ago,1528416648414,STF CORRUPTOS COMUNISTAS,0,false,0,,,,,,
UgxMFD_pnXeGDfeLbE94AaABAg,Discípula de Jesus,4 days ago,1528416648419,Pessoas como esse advogado que deveriam estar aí neste STF,2,false,0,,,,,,
UgzCl1xGhwVrgjNUBk14AaABAg,Gilmar Lopes Vieira Vieira,4 days ago,1528416648427,SÓ INTERVENÇÃO MILITAR PRA SALVAR O PAÍS DESSES CORRUPTOS...,10,true,1,,,,,,
,,,,,,,,UgzCl1xGhwVrgjNUBk14AaABAg.8hCpYDKkf7V8hD8wGaIw6G,Rodinerio Chaves,3 days ago,1528503048763,"Gilmar Lopes Vieira Vieira meu querido o exército Também tá corrompido, porquê você acha que não fizeram nada até agora, são só funcionários do governo nos pagamos pra nada fazerem como os políticos! Infelizmente.",2
UgzIlee3SGOoHRDztwl4AaABAg,TheBetoBrasil,4 days ago,1528416648436,"O advogado pediu justamente o que o Bolsonaro sugeriu, ou seja, o voto impresso para ser usado em uma possível recontagem.",0,false,0,,,,,,
UgwVgtej97y9ouudByZ4AaABAg,Marlene Munslinger,4 days ago,1528416648443,Vejo uma um grupo organizado em manter um modo operante manipulável de acordo com o acordado Entre os partidos. STF é sem duvida o maior problema do Brasil 🇧🇷,0,false,0,,,,,,
UgxlSPpN_ZuwAe0zTK94AaABAg,Herbert Bezerra,4 days ago,1528416648449,corja de ladrões!,0,false,0,,,,,,
Ugx6xQBKKnrAf5ikuyV4AaABAg,paulo almeida,4 days ago,1528416648456,Isso tá com cara de Venezuela!,0,false,0,,,,,,
Ugycwcj43GYQvUITEeV4AaABAg,Paulo Rogerio Santos Vargas,4 days ago,1528416648463,Dá prá ver claramente que esses ministros são traidores da pátria generais prendam todos são corruptos,0,false,0,,,,,,
UgyTmMyud7zoMU5AIv94AaABAg,RNP Prado,4 days ago,1528416648468,"Veja o Lewandowski está certo, se as urnas suportam altas e baixas temperaturas e até chuva, é lógico que estão imunes a qualquer vírus....oras porra!",0,false,0,,,,,,
Ugwr0oC-LG1PnGvLj6x4AaABAg,Laura Kiss,4 days ago,1528416649624,VÃO MORRER,0,false,0,,,,,,
Ugyq9B_URTs0OSk3VjR4AaABAg,Antonio Souza,4 days ago,1528416649631,Já era eles tiraram o direito do voto impresso esse debate não serve para nada.,0,false,0,,,,,,
UgzpR7HkL9RVKSStxH54AaABAg,CELIO GALDINO,4 days ago,1528416649636,"ESSES BANDIDOS SÃO MUITO CARA DE PAU MESMO! SERA QUE ELES NÃO TÊM VERGONHA NA CARA?,TINHAM QUE SAIR DAÍ TODOS ALGEMADOS E FUZILADOS E A FAMÍLIA TINHA QUE PAGAR AS BALAS, REVOLTANTE .",0,false,0,,,,,,
Ugz-oZNrFb-_lZv6SNZ4AaABAg,JULIO CESAR CANDIDO Cesar,4 days ago,1528416649642,Esses ministros não deixam as pessoas falarem .2018 voto em papel se nao estamos ferrados,0,false,0,,,,,,
UgyEakKDBsdgz-wTiip4AaABAg,Ezildinha Stephano,4 days ago,1528416649648,"Nossa esse povo tem medo de perder o poder e possivelmente irem pra cadeia!
Parabéns para esse jovem advogado.",0,false,0,,,,,,
Ugz_mC8ism816PEr9nl4AaABAg,guttemberg gabriel,4 days ago,1528416649653,Eu mesmo já critiquei essa merda falha e já tocamos o @#$$##&^*,0,false,0,,,,,,
UgzIYUS4L4gc8nYhJSJ4AaABAg,Dilomar Machado,4 days ago,1528416649661,"Bando de calhordas esses ministros ,se acham inteligentes,a unica coisa q sabem é burlar a lei por conhecerem os caminhos ocultos da mesma.",0,false,0,,,,,,
Ugyv9NphFHpRpyVig-J4AaABAg,Hiram Girao Lima,4 days ago,1528416649664,RAQUEL DODEG É UMA LOBA EM PELE DE CORDRIRO!,0,false,0,,,,,,
UgxjUO5v0TsfkVQ06At4AaABAg,Savio Moraes,4 days ago,1528416649673,"Vamos encher de email a cx do STF exigindo o voto impresso, eles não são deuses e estão se apoderando dos outros poderes! http://www.stf.jus.br/portal/push/exibirFaleConosco.asp",0,false,0,,,,,,
Ugzi2FCBLvmDEiNmx_F4AaABAg,"J,Pedro P",4 days ago,1528416649676,"O negócio é no dia da eleição ninguém, mas ninguém mesmo ir às urnas  otarios nesse bando de ladrões.",0,false,0,,,,,,
UgxSc4r3_fxnZjLvXZJ4AaABAg,Antonio Luiz Rodrigues de Assis,4 days ago,1528416649684,Acabar com essa porcaria de voto eletrônico Isto é tudo obra desses ministros ladrões aí eles tem o dedo no meio disso daí acabar com isso impresso é muito melhor,0,false,0,,,,,,
Ugz3XSjoTQ6ayCW8rGF4AaABAg,Joao melo Melo,4 days ago,1528416649692,"Esse boca de sapo do Gilmar Mendes ,tomou todo o tempo do rapaz,essa quadrilha do STF é uma porcaria mesmo!",0,false,0,,,,,,
UgyOVpq1WyMHHol3qzF4AaABAg,Jesus M,4 days ago,1528416649697,gente ta claro que há fraude nas urnas se fosse um país sério isso não aconteceria STF e uma vergonha,0,false,0,,,,,,
UgyvZZZg9i0tibKaHdl4AaABAg,conceição Andrade,4 days ago,1528416649702,Ó QUANTO SÃO INOCENTES! FAZ NOJO ESCUTAR ESSES ABUTRES .,0,false,0,,,,,,
UgzNGXYBnsUMwOiZMvl4AaABAg,Miracelia Queiroz Freitas,4 days ago,1528416649708,CANALHAS 😡 NOJENTOS ‼️😡BANDO DE CANALHAS 😡.,0,false,0,,,,,,
UgwT_42CHn8fsEJra294AaABAg,Francis Nascimento,4 days ago,1528416649740,esse advogado  brasileiro muito bom,0,false,0,,,,,,
Ugw0kO3coPUV9ggCKJ94AaABAg,Francisco Tavares,4 days ago,1528416649743,Quando o povo ficar inteligente vai ficar   uma  eleição  sem votar so uma,0,false,0,,,,,,
UgxMfGJWDbD_7sKd-PR4AaABAg,Eneias Ramos,4 days ago,1528416649750,Eleçoes  raqui  vai  fazer  festa. Kkk,0,false,0,,,,,,
