id,user,date,timestamp,commentText,likes,hasReplies,numberOfReplies,replies.id,replies.user,replies.date,replies.timestamp,replies.commentText,replies.likes
UgjaBN6P6qj3D3gCoAEC,Shadow Mateus,3 years ago,1434070459577,NÃO QUER DIZER SIM KKKKKKKKK,0,false,0,,,,,,
UghHRxWIxwj02ngCoAEC,Ramon Pacheco,3 years ago,1434070459579,até por que a isso nao vale pra qualquer outro tipo de eletronico,0,false,0,,,,,,
Ughb-cVgMJwPr3gCoAEC,Ramon Pacheco,3 years ago,1434070459583,táquepariu,0,false,0,,,,,,
Ughp01iZ3gT0UHgCoAEC,Mayck Lander,3 years ago,1434070459590,"rachei de ri do vomitado, mas é uma vergonha mesmo esse pais, fala serio",0,false,0,,,,,,
UgghjJf1dyH-7ngCoAEC,logan CRS,3 years ago,1434070459592,"O sistema de software das urnas é ridiculo, manipulavel, um mini genio da informatica que não precisa nem ter 10 anos de idade consegue hackear o software da urna. Pior é a bobagem de falarem que é o sistema mais rapido e seguro, o que é uma mentira.
Se fosse bom de verdade, seria usado nos paises de primeiro mundo, que simplesmente acham a urna a pior forma de votação do mundo!
PARABENS PELO VIDEO!
PROBLEMA É QUE NO DIA DA ELEIÇÃO, USAM REALMENTE A CABINE DE VOTAÇÃO COMO BANHEIRO DE VERDADE!",3,false,0,,,,,,
UghSxqxx2YIVrHgCoAEC,Gougoule VSF,3 years ago,1434070459600,Otário você me inspira a fazer coisas legais no dia de votação AHAHAHAHAHAHAHA !!!,0,false,0,,,,,,
Ugi1XfSR4cgxR3gCoAEC,Denis Garcia,3 years ago,1434070459603,O maximo que aconteceria é a anulação das votações e uma nova convocação para uma nova eleição... mais um dia perdido pra quem trabalha...,0,false,0,,,,,,
UggLkn1aCpIv1XgCoAEC,Fabio Serrão Prates,3 years ago,1434070459606,"E se todo mundo votasse num número que não exista?!? Não seria um voto inválido?! Mais de 50% de votos INVÁLIDOS invalidariam a eleição, não? :p",0,false,0,,,,,,
UghqFysROR9TUXgCoAEC,DIONISIO ZANELLI JUNIOR DJ,3 years ago,1434070459614,manipuladas para dar votos ao pt,0,false,0,,,,,,
Ugi5lJsrlwg7H3gCoAEC,DIONISIO ZANELLI JUNIOR DJ,3 years ago,1434070459617,as urnas são manipuladas!!!!!!!!!!!!!!!!!,0,false,0,,,,,,
UgiVjVQBHXMcOngCoAEC,AmazonicoIndio,3 years ago,1434070459625,"O problema que eu tenho com esses últimos vídeos do canal é que eles pressupõe que o cidadão comum vai entender como o governo ou as empresas estão passando a perna neles, por que é ""óbvio"". Pega o vídeo do gol1.0, da merda life, do itaumaxi: todos eles tem em comum que são divididos em duas partes, a primeira que fala toda a propaganda que nós muitas vezes acreditamos,e a segunda que esclarece as tramóias, os esquemas, os lucros absurdos em cima de serviços pobres.
Esses últimos vídeos não, ele só tem a primeira parte, e pressupõe que a segunda é ""óbvia"", que tá na cara o que se tá querendo dizer, mas ainda assim o otario tem ficar colocando exclarecimentos em toda a seção de comentários. Eu sei que ele quer motivar o pensamento crítico, mas dessa forma ele só tá deixando a gente confuso. Eu recomendo que o canal volte aos vídeos simples, diretos, que até uma criança de 12 anos pudesse entender. É por isso que a maioria das pessoas é enganada, por que elas não entendem como elas tão sendo enganadas, por que ninguem explica de forma simples.",2,false,0,,,,,,
UgiTLRYuy2V05ngCoAEC,Sergio Augusto,3 years ago,1434070459627,"- Carta aberta aos que querem votar branco ou nulo 

Você sabe o que significa cidadania? O voto, apesar de não ser o único dever do cidadão, é um dos mais importantes. Sendo assim, exerce-lo da melhor maneira possível é primordial para o país. Quer saber quais políticos são honestos? Leia um jornal por dia, leia uma revista semanal. Esse discurso de que todos os políticos são corruptos é o discurso mais ""chapa branca"" que existe, pode parecer corajoso, mas os bandidos de Brasília adoram isso. Afinal, você coloca aqueles que são virtuosos e honestos no mesmo pacote dos desprezíveis. Dessa maneira, faço um apelo pra que pesquise a vida dos candidatos, fique atento as notícias, se informe e cobre daqueles que estão no governo. Em outras palavras, seja um cidadão.",0,false,0,,,,,,
UgjxFO3rXQcHqHgCoAEC,baianoise,3 years ago,1434070459635,"A urna eletrônica é apenas um detalhe, a democracia é um fracasso devido á vários outros. Os EUA na época do Bush filho por exemplo, o voto era impresso e ele foi eleito pelo ""TSE"" de lá... Eles sempre arranjarão um modo, uma ""back door"" (geralmente a do seu traseiro!)",10,true,3,,,,,,
,,,,,,,,UgjxFO3rXQcHqHgCoAEC.7-H0Z7-4hCZ7-H4DnWmO-X,Jean Lennon,3 years ago,1434070459924,"A democracia representativa é um fracasso. 
O povo precisa saber o que é a democracia pura.",0
,,,,,,,,UgjxFO3rXQcHqHgCoAEC.7-H0Z7-4hCZ7-HA01Z4irP,baianoise,3 years ago,1434070459930,"+Jean Lennon Toda a forma de democracia é um fracasso, Platão pensou a democracia para um grupo pequeno de eleitores, todos maduros e muito bem instruídos numa sociedade que aceitava escravidão, ou seja quase igual a nossa não é?
E além do mais, sempre haverá mais pessoas burras e preguiçosas do que inteligentes e esforçadas, e adivinha de qual maioria será o voto?
Uma sociedade baseado no livre mercado é muito superior em resultados e principalmente moral.",11
,,,,,,,,UgjxFO3rXQcHqHgCoAEC.7-H0Z7-4hCZ7-wK6qQ69Tp,MrSTheThanatos,3 years ago,1434070459934,"+baianoise
O único burro aqui é você, alias tu me conhece para me chamar de burro?",0
UggnpKmXTlqf43gCoAEC,Guilherme Sartorelli,3 years ago,1434070459639,"Caralho manu, que video genial !!!
Confesso que lendo alguns comentarios, me dá vontade de desistir da internet, mas , fazer o que né?!
Abração",1,false,0,,,,,,
UggsAdQJs9TLs3gCoAEC,Felipe Mantovani,3 years ago,1434070459646,Aquele moleque no final do vídeo pagou 500 dólares para aparecer no vídeo é isso?,5,true,1,,,,,,
,,,,,,,,UggsAdQJs9TLs3gCoAEC.7-H0Z7-1PS97-H4i_DKecy,Sapphira Beanã Sophi,3 years ago,1434070459912,será? kkk,0
Ugj5pzGfgNl4nHgCoAEC,Jean Lennon,3 years ago,1434070459650,"Nesta eleição eu não iria até as urnas, 
mas após ver esse vídeo mudei de ideia. =D

O país não esta assim por causa de maus eleitores,
mas sim pelos representantes que sempre se corromperam .

Para que votar em alguém para te representar, 
sendo que a melhor pessoa pra isso é você mesmo ?! 

TODO PODER EMANA DO POVO

""O governo nosso é um direito nosso."" 

 #Eleições2014   ,  #ReformaPolitica   ,  #DemocraciaPura   ,  #DemocraciaDireta",0,false,0,,,,,,
UghEsuZwZg1vIHgCoAEC,Lucas Venhofen,3 years ago,1434070460663,Eu tava comendo...,0,false,0,,,,,,
UgiF9ith7_U4Y3gCoAEC,Bruno Picoloto,3 years ago,1434070460668,Não foi muito boa a idéia de assistir esse vídeo enquanto almoçava :s,0,false,0,,,,,,
UgjkYba64hyxEngCoAEC,Angarato Tasartir,3 years ago,1434070460674,Nissim Ourfali é seu patrão?,0,false,0,,,,,,
Ugix0veUiqjy4HgCoAEC,The Vn Gameplays™ | Gameplays de Battlefield 4,3 years ago,1434070460679,likeeee parceiro ^^,0,false,0,,,,,,
UghnNLhKalsbpHgCoAEC,canaltoafim,3 years ago,1434070460687,Kkkkkkkkkkk XD !!!,0,false,0,,,,,,
UgjEzZvqDCH2lngCoAEC,Raquel doll,3 years ago,1434070460695,"Tem gente que é tão burra!!!!!!!
""Ai, num intendi u propósito du vídiu!!!!"" tss, tss,tss...",1,false,0,,,,,,
UgiV65onikcgrHgCoAEC,Black Fedora,3 years ago,1434070460716,Level de Sarcasmo... It's over Nine Thousand!!! X_D,0,false,0,,,,,,
UghN7GdcEn-1-XgCoAEC,Elon Messias Leite,3 years ago,1434070460721,então por isso que a urna parou de funcionar depois que eu urinei nela nas ultimas eleições kkkk,0,false,0,,,,,,
UgisOC2cmRH1vXgCoAEC,Luis Fernando,3 years ago,1434070460732,"kkkkkkkk....

Não é possível que alguém ainda não entendeu.",0,false,0,,,,,,
UghSl1vDvKaLn3gCoAEC,Matheus Sobral,3 years ago,1434070460742,"Quanta criança estúpida comentando que não achou graça no vídeo ... Se tu é tão imbecil a ponto de não entender uma simples mensagem num vídeo desse, um dia uma mina vai ficar pelada de 4 na sua frente e tu vai achar que ela ta querendo cagar ... Vão assistir vídeos de minecraft criançada ...",1,false,0,,,,,,
UggQSj2rTjJxcHgCoAEC,João Vitor,3 years ago,1434070460746,Putz o que eu vou fazer agr com minha gasolina e fósforos no dia da eleição ?,0,false,0,,,,,,
Ugi7cq4DYo1J9HgCoAEC,Luan Silva,3 years ago,1434070460753,"+OtarioAnonymous (Canal do Otário)  Você pretende falar do projeto popular Eleições Limpas que está recolhendo assinaturas em todo o país?
Além de aumentar a facilidade com que a população possa realizar plebiscitos e criar novas leis... ele visa quebrar o começo do ciclo da corrupção com o fim do financiamento privado de campanhas e estabelecer que a eleição para deputados e senadores seja em dois turnos sem transferência de votos, para que um candidato não leve outro nas costas...",0,false,0,,,,,,
UghWvV-k4rmGdXgCoAEC,Luciano,3 years ago,1434070460757,Urna eletrônica = manipulação de resultado.,0,false,0,,,,,,
Ugh99tItxlN7FHgCoAEC,MilkShakeson,3 years ago,1434070460764,"Ah ki merda, estava louco para cagar na urna, mas não pode :(",6,true,1,,,,,,
,,,,,,,,Ugh99tItxlN7FHgCoAEC.7-H0Z7-JMnm7-HSqt1TnjD,timuskukii,3 years ago,1434070461156,kkkkkkkkkkkkkkkkkkkkkkkkkkkk dei pala aki kkkkkkkkkkkkkkkkkkkkkkkkkkkkkkkkkkkkkkkkkkkkkkkkkk,1
UgjHuXqlR3aIPngCoAEC,Tentando Jogar,3 years ago,1434070460771,Paunoseucu é da bauducco,0,false,0,,,,,,
UggOvCSoizsQrXgCoAEC,Daniel Madureira,3 years ago,1434070460778,Esqueceu de colocar para não digitar o número 13 na urna em momento algum.,0,false,0,,,,,,
Ugi1ENbAY11K7HgCoAEC,Braulio Rocha Miranda,3 years ago,1434070460782,A placa mãe da urna é Gigabyte rs,0,false,0,,,,,,
UggJ2Tb6JDeHUXgCoAEC,X-GaminG StuntinG,3 years ago,1434070460788,to ouvindo porra nenhuma,0,false,0,,,,,,
Ugif_dz6XJ4KVHgCoAEC,Reetrailer,3 years ago,1434070460793,Otario >.< é igual eu ;-;,0,false,0,,,,,,
Ugi_yXDEZbmeO3gCoAEC,Hugo Lima,3 years ago,1434070460799,"Achei tão obvio, acredito que eles quis passar que a fragilidade da urna é tao grande que qualquer pessoa pode avacalhar a contagem dos votos feitos...Eu pelo menos entendi isso",0,false,0,,,,,,
UgiO4k0VepsrLXgCoAEC,Paulo Helison,3 years ago,1434070461888,"Eu tenho uma dica melhor:
NÃO TOQUE NELA! DURMA ATÉ MAIS TARDE.
APROVEITE MELHOR O DIA 5 DE OUTUBRO!",0,false,0,,,,,,
Ugig50pjA5tBtngCoAEC,Lam,3 years ago,1434070461893,Obrigado por contribuir com a democracia seu babaca,0,false,0,,,,,,
Ughu2dMBEtlc4ngCoAEC,Arilson Ozeas,3 years ago,1434070461900,"Dps de um pouco pensar eu entendi muito bem o proposito do video ,ate diria que abriu-me os olhos sobre essa maquina de satã e sua fragilidade  , mas essas crianças acham que isso é canal de humor e vem comentar merda , tudo bando de zé buceta , nao fode .",0,false,0,,,,,,
Ugj2jhG8aWbi_3gCoAEC,vitorSossai,3 years ago,1434070461903,"Otario, na urna eu posso fazer o cheat do Silvio Santos super sayajim como esta descrito aqui (http://peraiblog.blogspot.com.br/2012/07/cheats-pra-urna-eletronica.html)?",0,false,0,,,,,,
UgiQX-MkenraOHgCoAEC,Fabricio Silva,3 years ago,1434070461908,"Sempre Curti videos do Otário, porém esse deixou a desejar, por mais que somos otarios, ignorantes e bla bla bla, não se deve incitar ao vandalismo, que é o propósito do video em mensagens subliminares. Poderia fazer outro tipo de manifestação sem vandalismo, queira ou não as urnas são nós que pagamos e iriam comprar tudo de novo com nosso dinheiro! Se um serviço é ruim não é estragando mais o mesmo que melhoraria! Seria a mesma coisa que destruir um hospital, irao gastar dinheiro pra construir outro, porém, será a mesma porcaria. Vamos fazer protestos conscientes, por exemplo barrando a entrada dos eleitores, explicar na porta de locais de votação a falta de transparencia da urna, ou outra coisa, mas sem estragar nada e sem vandalismo!  #ficaadica   #naogosteidovideodootario   #semvandalismo   #brasilpiorurnadomundo",1,false,0,,,,,,
UgjTwfLichR3gHgCoAEC,Sergio Augusto,3 years ago,1434070461914,"Quem é você? ""Quem é apenas a forma que deve ter um por quê. E quem é você? Um homem de máscara. Não questionei seus poderes de observação, apenas enfatizei o paradoxo de perguntar a um mascarado quem ele é. E, nessa noite auspiciosa, permita-me que no lugar de uma alcunha corriqueira eu sugira o caráter desta 'persona' dramática.""

Por baixo desta máscara não há apenas carne. Por baixo desta máscara há uma idéia, Sr. Otário. E idéias são a prova de balas!",0,false,0,,,,,,
Ughhuehu_XEurXgCoAEC,Celso Grecco,3 years ago,1434070461918,"Cargar na urna não dá nada. Loucura mesmo seria digitar o 13 seguido do botão verde. Mas enfim, quem acredita nas urnas? Quem acredita que o TSE é a única instituição que não foi aparelhada pelo PT?",1,false,0,,,,,,
UghNeYvqejdFkngCoAEC,Richard Winters,3 years ago,1434070461926,"Lendo os comentários aqui postado aqui no vídeo, vejo que muita gente está reclamando sobre o vídeo, dizendo que não achou graça, que o vídeo está sem informação(ou com pouca em comparação a outros vídeos).
Mas gente entendam uma coisa, o que o Otário está querendo mostrar neste vídeo é a vulnerabilidade das urnas. Que qualquer pessoa ""sem querer"" pode causar um dano a urna, e em caso de danos (os mais banais possíveis como mostrado no vídeo) o que é que lhe garante que o seu voto computado naquele equipamento será realmente validado ou contado(mesmo em caso de troca de urnas)? E a sua vontade como eleitor está garantida?

E outra se estão achando ruim o vídeo por que não vão lá e fazem um melhor? ficar criticando é muito mais fácil do que ter todo o trabalho por trás dos vídeos.
Att",4,true,1,,,,,,
,,,,,,,,UghNeYvqejdFkngCoAEC.7-H0Z7-Km1C8VrcmmSQyM_,ATRIUS64,10 months ago,1502499262355,"por isso o país está assim   fodido todo,,,o povo é muito burro, em todos os n´veis imagináveis,,,,,essas porras ficam ricos roubando e fudendo o povo, desde o comerciante até o feirante....TÃO SIMPLES DE ENTENDER O VÍDEO...PORRA TOCA FOGO NESSAS MERDAS CARALHO......ENTENDEU POVO  BURRO QUE ACREDITA EM URNAS DA SMARTMATIC DA VENEZUELA...",0
Ugjevz0sXd3pf3gCoAEC,Sérgio #VivianUru,3 years ago,1434070461934,"este ano vou começar a votar pela primeira vez, valeu Otário por me ajudar!!!!!!!!",0,false,0,,,,,,
Ughw_25dloQpzXgCoAEC,Sergio Augusto,3 years ago,1434070461938,"Existem técnicos que acompanham a contagem dos votos nas urnas eletrônicas e esses técnicos são de partidos diferentes. Por exemplo, tem um técnico do PT e outro do PSDB, isso evita fraude. Ou melhor, isso diminui o risco de fraude, afinal evitar 100% eu diria que é impossivel.",7,true,27,,,,,,
,,,,,,,,Ughw_25dloQpzXgCoAEC.7-H0Z7-HJ8M7-H9FH6bTRk,Carlos Carvalho,3 years ago,1434070462639,"Os técnicos podem acompanhar a contagem, mas a contagem é sobre o que foi registrado.

Nada impede de que quando um eleitor apertar, sei lá... 45, a urna mostre o candidato, diga que você está votando nele e quando aparece aquela mensagem ""FIM!"", o código troque 1 em cada 5 votos 45, para magicamente registrar... Não, sei... 13, por exemplo.

Aí, do que adianta ter um técnico olhando a leitura dos cartões, quando a maracutaia já está feita e registrada?",14
,,,,,,,,Ughw_25dloQpzXgCoAEC.7-H0Z7-HJ8M7-Hmw0XFLWA,Rodrigo Villani,3 years ago,1434070462647,"Não faz muito sentido já que, como o +Carlos Carvalho mencionou, só é considerado o que foi registrado. E isso ninguém sabe se é adulterado (que com certeza é!!).",5
,,,,,,,,Ughw_25dloQpzXgCoAEC.7-H0Z7-HJ8M7-IBks23jOV,fernando roberto de pieri zanela,3 years ago,1434070462649,"eles todos roubam juntos , depois fazem a partilha num restaurante de luxo às custas do dinheiro público. 
ACORDEM",0
,,,,,,,,Ughw_25dloQpzXgCoAEC.7-H0Z7-HJ8M7-Iy0nuSD6-,Adrian S.,3 years ago,1434070462655,"Sergio augusto:

""Existem técnicos que acompanham a contagem dos votos nas urnas eletrônicas e esses técnicos são de partidos diferentes.""

No caso das urnas eletrônicas, a fraude pode acontecer exatamente no momento que o eleitor aperta o botão ""Confirmar"" para registrar seu voto. O algoritmo do software instalado na urna pode ser programado facilmente para desviar votos de maneira automática, baseado em condições pré-determinadas pelos desenvolvedores. Por exemplo, a urna pode ser programada para desviar 10 votos para o candidato X a cada 15 votos computados. E no final imprimir a mensagem ""Voto computado com sucesso!"", para iludir o eleitor, convencendo-o de que seu voto fora realmente para o candidato que ele escolhera.

Se quiser compreender melhor isso, pense num programa de computador travestido de antivírus (conhecidos como Rogueware ou ""rogue security software programs""), mas que na verdade serve para comprometer o computador da vítima. Para o usuario do aplicativo, o programa exibirá a sua interface gráfica bonitinha, com ícones, botões, etc, E PODENDO ATÉ FUNCIONAR COMO PROMETIDO! Mas, como se trata de um malware, e dependendo de como foi programado pelo desenvolvedor, o programa poderá abrir portas que permitem invasão externa ao computador da vítima, logar as suas teclas digitadas (para roubos de senhas, por ex), tirar screenshot do seu desktop, e muitas outras funções. E essas funções podem rodar em paralelo e em ""background"", ou seja, de forma oculta do usuário.

Portanto, o fato de haver técnicos de partidos políticos conferindo a contagem dos votos no final, não resolve o problema da suspeita de fraude nas urnas eletrônicas, já que eles irão contar os votos somente depois que estes já estiverem sido registrados nas urnas.",2
,,,,,,,,Ughw_25dloQpzXgCoAEC.7-H0Z7-HJ8M7-JL9Hf45T4,Sergio Augusto,3 years ago,1434070462660,"+Adrian Smith ""O algoritmo do software instalado na urna pode ser programado facilmente para desviar votos de maneira automática""

De fato, brilhante. Você acredita mesmo que os técnicos são idiotas a ponto de nem se quer testar antes a urna eletrônica que foi programada com o software alterado? É simples, basta testar minutos antes usando um cartão de memória descartável e analisar o que foi computado. Meu caro, esse tipo de fraude e muitos outros esses caras conhecem a muito tempo. São técnicos e vivem disso, conhecem melhor que eu, você e grande partes das pessoas, ou você acredita que os partidos milionários colocam palhaços para cuidar disso? É claro que não!",0
,,,,,,,,Ughw_25dloQpzXgCoAEC.7-H0Z7-HJ8M7-JSjLD8bnr,Adrian S.,3 years ago,1434070462664,"+Sergio Augusto Então me responda, por que somente técnicos selecionados pelo TSE podem fazer esses testes? Por que impedir outros técnicos, cientistas e pesquisadores independentes de fazerem testes nas urnas? Por que não há essa transparência?",7
,,,,,,,,Ughw_25dloQpzXgCoAEC.7-H0Z7-HJ8M7-JfV0J_TUd,Xano Trevisan Kothe,3 years ago,1434070462671,"+Adrian Smith A Urna pode funcionar perfeitamente no momento do teste, o programa fraudulento pode estar dormindo. Mas algum usuário, na hora de votar, pode colocar uma sequência maluca tipo ""1234 anula anula"" (um combo) e aciona o programa que registra os votos para outros candidatos.",6
,,,,,,,,Ughw_25dloQpzXgCoAEC.7-H0Z7-HJ8M7-JgK3yyOBO,Adrian S.,3 years ago,1434070462680,"+Xano Trevisan Kothe então... é possivel fraudar os votos usando o software de várias formas, sem que os eleitores possam ter ciência disso. O fato de não sabermos exatamente o que acontece lá dentro da urna  já é motivo (pelo menos pra mim) para não confiar nela.",3
,,,,,,,,Ughw_25dloQpzXgCoAEC.7-H0Z7-HJ8M7-JhkmRxRaf,Xano Trevisan Kothe,3 years ago,1434070462682,"+Adrian Smith estamos no país da fraude, o que esperavam? mas não dá pra colocar a culpa só na Urna. tem milhares de outras coisas erradas, e eu me sinto impotente, totalmente fora do controle.",3
,,,,,,,,Ughw_25dloQpzXgCoAEC.7-H0Z7-HJ8M7-Jsz1EwgHY,Kaue Mello,3 years ago,1434070462692,"+Adrian Smith Olá, só estou falando a título informativo, sei que não é impossível haver fraude, mas um dia antes das eleições uma urna em cada distrito é sorteada para haver uma votação aberta e é checado a contagem da urna, quanto aos votos, ficam armazenados em uma unidade flash (antes era disquete) e provavelmente no disco interno como backup.",0
,,,,,,,,Ughw_25dloQpzXgCoAEC.7-H0Z7-HJ8M7-K6-Z7Vhfb,Sergio Augusto,3 years ago,1434070462694,"+Adrian Smith Voce deveria confiar nos tecnicos escolhidos pelos TSE, é um tribunal composto por excelentes juízes de direito, prefiro que ele escolha técnicos do que qualquer um faça isso. Amigo, os mais interessados em que se manipulem resultados são os partidos e fique tranquilo que eles cuidam direitinho de todo o processo. Não acredito que nao exista nenhum tipo de fraude ou corrupcao, afinal ela existe em todos os níveis da sociedade. No entanto, voces tratam como se todo sistema eleitoral fosse corrompido. Não é bem assim!! Existem coisas bem mais preocupantes pra se discutir que uma eventual fraude em urna eletronica porque é muito raro isso, os próprios partidos já cuidam muito bem dessa parte.",0
,,,,,,,,Ughw_25dloQpzXgCoAEC.7-H0Z7-HJ8M7-KAc6k_N4w,fernando roberto de pieri zanela,3 years ago,1434070462696,"é incrível observar pessoas crentes no PAPAI NOEL , COELHO DA PÁSCOA, O LULA NÃO SABIA DE NADA ,   OS FUNCIONÁRIOS DAS EMPRESAS DESENVOLVEDORAS DE SOFTWARE DAS URNAS ELETRÔNICAS NÃO SE TORNAM CORRUPTOS POR ALGUNS MILHÕES , E MUITOS MENOS OS '' TÉCNICOS PARTIDÁRIOS ''.
Parabéns aos que corajosamente saem quebrando tudo instigando uma guerra civil , pois os malditos jornalistas da tv aberta dão  ênfase em matérias forjadas pra induzir a opinião pública de que bandeira branca da paz resolve. bandeira branca é rendição .
o PT está instalando a ditadura na cara de todos e nenhum covarde faz nada.
OS BRASILEIROS TEM INVEJA DO POVO ESTADUNIDENSE  (AMERICANO) , sonham com os frutos de um país mais justo  economicamente , mas ignoram que esse povo(AMERICANO) antigamente teve que partir pra guerra contra o proprio governo.
vamos deixar de acreditar nesses formadores  de opiniao de meia tigela que rasgam criticas negativas sobre quem protesta e se exalta , fato  [e que o povo tem que deixar de ser pacato e partir pra briga , ou  , 
ficar morrendo de inveja dos AMERICANOS",3
,,,,,,,,Ughw_25dloQpzXgCoAEC.7-H0Z7-HJ8M7-KSACc-H-L,Adrian S.,3 years ago,1434070462704,"+Sergio Augusto Você fugiu das minhas perguntas e não as resondeu. Pediu para eu confiar cegamente em técnicos financiados por partidos políticos brasileiros. Desculpe-me, mas eu não consigo ter fé no Estado, aindam mais no Estado brasileiro, e motivos não me faltam para isso.",0
,,,,,,,,Ughw_25dloQpzXgCoAEC.7-H0Z7-HJ8M7-KUDdh8qjh,Sergio Augusto,3 years ago,1434070462707,"+Adrian Smith Meu deus, eu explico mil vezes e você nao entende. Cansei dessa discussão que não leva a nada. Ao invés de voce se preocupar com coisas que realmente importam, fica nesse assunto praticamente irrelevante. Se esses tecnicos independentes dizem que é tao facil invadir uma urna, porque não fazem isso numa eleição pra demonstrar que realmente é possivel? Porque é tudo conversa fiada. Chega, encerro aqui. E sugiro que vá atras de coisas que interessem de fato como ler um jornal e aprender a votar.",0
,,,,,,,,Ughw_25dloQpzXgCoAEC.7-H0Z7-HJ8M7-KY6nBgLnc,Adrian S.,3 years ago,1434070462714,"+Sergio Augusto ""Meu deus, eu explico mil vezes e você nao entende. Cansei dessa discussão que não leva a nada. Ao invés de voce se preocupar com coisas que realmente importam, fica nesse assunto praticamente irrelevante.""

Até agora você não explicou nada e sequer respondeu às perguntas que fiz e continua fugindo delas. É engraçado você me mandar pensar em coisas mais ""relevantes"" quando o meio pelo qual se realiza a democracia são as eleições via urnas eletrônicas, que há muito tempo vem sendo questionadas por cientistas e engenheiros de várias partes do mundo.

""Se esses tecnicos independentes dizem que é tao facil invadir uma urna, porque não fazem isso numa eleição pra demonstrar que realmente é possivel? Porque é tudo conversa fiada.""

Você acabou de mostrar sua ignorância com relação ao que os pesquisadores independentes alegam. Eles nunca disseram que as urnas eletrônicas podem ser ""invadidas"". O que eles alegam são que o eleitor não pode saber se seu voto foi realmente para o candidato que ele escolheu. Que através de experimentos conduzidos diretamente nas urnas, eles foram capazes de desembaralhar a ordem dos votos e conseguiram saber exatamente em quem cada eleitor votou. Que não é possível saber o que acontece dentro da urna eletrônica, já que seu código-fonte não é liberado ao público, e o próprio TSE não permite a auditoria nas urnas por parte de pesquisadores independentes.",0
,,,,,,,,Ughw_25dloQpzXgCoAEC.7-H0Z7-HJ8M7-K_33nAcHQ,Xano Trevisan Kothe,3 years ago,1434070462716,"+Adrian Smith perfeito. TSE uns anos atrás liberou por alguns dias a realização de testes, em laboratório fechado, para um grupo estritamente restrito. Tá na cara que eles tem medo da reação da população, ao saber que o sistema não é seguro. Mas não adianta, o sistema não precisa ser invadido em tempo real, a adulteração não precisa ser feita assim, existem muitas etapas que dão chance para a adulteração dos resultados.
""Se esses tecnicos independentes dizem que é tao facil invadir uma urna, porque não fazem isso numa eleição pra demonstrar que realmente é possivel?""
olhou muito filme de ficção, onde o ""hacker"" pega seu smartphone e invade a NASA, não vai ser assim que vão adulterar as Urnas, você precisa de alguém corrupto, que tenha contato direto com a Urna. E pessoa corrupta, no Brasil tem de sobra.",3
