id,user,date,timestamp,commentText,likes,hasReplies,numberOfReplies,replies.id,replies.user,replies.date,replies.timestamp,replies.commentText,replies.likes
,,,,,,,,UggqNoMzSDxIkXgCoAEC.7-H0Z7-Kr4W705WtEqQRp6,Leonardo Campos de Almeida,3 years ago,1434070467203,+edson andre Prefiro deixar de votar quando o PT não estiver mais no poder.,1
,,,,,,,,UggqNoMzSDxIkXgCoAEC.7-H0Z7-Kr4W70DfliqizNo,Washington Tom,3 years ago,1434070467211,+Fabio Elker os militantes do pt,0
,,,,,,,,UggqNoMzSDxIkXgCoAEC.7-H0Z7-Kr4W70HuhumUzAR,Alan Roberto,3 years ago,1434070467215,cara de onde vc tira as ideias para seus videos? '-',1
,,,,,,,,UggqNoMzSDxIkXgCoAEC.7-H0Z7-Kr4W70I2JHiOwtD,"Mic Check 1,2",3 years ago,1434070467222,+Alan Roberto K. Machado Vê o primeiro vídeo do canal dele ou o do terceiro canal dele: Canal Do Otário (Responde),1
,,,,,,,,UggqNoMzSDxIkXgCoAEC.7-H0Z7-Kr4W71I1VbfyxZp,O melhor do Corinthians,3 years ago,1434070467227,"+Leonardo Campos de Almeida verdade eu tb não queria votar na merda da Marina ou Aecio, mais estou sendo obrigado a tirar essa merda do PT",1
,,,,,,,,UggqNoMzSDxIkXgCoAEC.7-H0Z7-Kr4W71Irf4-wKS0,SARV5,3 years ago,1434070467233,minha vontade era fazer tudo isso que não pode do vídeo... o melhor agora é tirar o pt da nossa política.,0
,,,,,,,,UggqNoMzSDxIkXgCoAEC.7-H0Z7-Kr4W725snea0S9A,Jean Lennon,3 years ago,1434070467242,"#ReformaPolítica - Prioridades:

a) Combater a corrupção fortalecendo a Democracia Direta e a Democracia Participativa com a instituição de plebiscitos, referendos, conselhos deliberativos e mecanismos de iniciativa popular;
b) Coibir a influência do poder econômico nas esferas de poder e especialmente no processo eleitoral, assegurando espaços democráticos para a pluralidade de opiniões.

Eu ia votar nulo em todos, entretanto, mudei de ideia ao assistir os debates e ler o programa de governo da Luciana Genro, a qual é a única a favor da #DemocraciaDireta - um governo em que o povo participa de todas as deliberações políticas - #DescriminalizaçãoDaMaconha e #ErradicarAsDesigualdadesSociais.

Antes de ir votar confira ;)
http://lucianagenro.com.br/programa/",0
,,,,,,,,UggqNoMzSDxIkXgCoAEC.7-H0Z7-Kr4W72F0Ls1AuJe,joão serapião,3 years ago,1434070467245,"compras de votos aqui no sertão de alagoas foi a maior de todos os tempo, e tanto que eu decidi não mais votar, vou só justificar o titulo ate porque a mais de 40 anos que votei sendo material de construção pra construir corruptos são vários políticos já candidatando os filhos porque só eles tem dinheiro pra comprar tantos votos.....",2
,,,,,,,,UggqNoMzSDxIkXgCoAEC.7-H0Z7-Kr4W89eMTv3eA-d,Vinicius Paiva,2 years ago,1465692867254,Como vou evitar fraudes nas eleições?,0
,,,,,,,,UggqNoMzSDxIkXgCoAEC.7-H0Z7-Kr4W8YnoJhEUJs-,pedro miguel,7 months ago,1510448067258,"Canal do Otario porra meu irmão, teu canal é porrete de 4 quinas nas costas desses filhos da puta corruptos desse sistema. Você é bom no que faz valeu irmão arrebenta com seus vídeos.",0
,,,,,,,,UggqNoMzSDxIkXgCoAEC.7-H0Z7-Kr4W8cCS-DKC5k1,Gilson Vieira,4 months ago,1518396867266,E se não for assim como vai ficar meu amigo ????????,0
,,,,,,,,UggqNoMzSDxIkXgCoAEC.7-H0Z7-Kr4W8cCS7Au7r-B,Gilson Vieira,4 months ago,1518396867270,A maioria não colabora ! o negócio eé moer essa merda !,0
UgiHFJEVP7LC7XgCoAEC,Cristopher Taborda de Paula,3 years ago,1434070465157,"Será que compensa destruir as urnas?? Se destruir urnas o suficiente, tipo 50%... o que será que acontece?
Eu sinceramente tinha pensado em levar um tubo de super bonder e colar ao menos a tecla confirma... huiahiuaha",0,false,0,,,,,,
UghwX9IfBuvZR3gCoAEC,Guilherme Martins,3 years ago,1434070465163,Muito bom kkkkkk,1,false,0,,,,,,
Ugj0XsanfKSgEXgCoAEC,Xano Trevisan Kothe,3 years ago,1434070465169,"Otário... adianta imprimir? aquela vez que saiu a reportagem sobre alteração do kernel (sistema operacional linux que roda nas urnas), foi apontado que o aplicativo principal da urna conseguia direcionar parcialmente ou até todos os votos para um candidato. Agora se imprimir todos os votos da urna, vai bater com o resultado que a urna tem do mesmo (porque foi computado o voto para outra pessoa, na mesma data/hora, tudo ""certinho""). A única maneira que vejo é a urna imprimir em quem você votou, você olhar e conferir se é mesmo em quem você votou, guardar esse comprovante, e na contagem dos votos, conferir com o resultado da urna. Mas olha o trabalhão e ainda compromete o sigilo do seu voto, não dá pra fazer. Bom, depois que vi aquela matéria, perdi total confiança na urna. Difícil de acreditar, mas eu acharia mais seguro a votação pela internet. Primeiro, conexão segura é uma das tecnologias mais consolidadas hoje na parte de segurança. Segundo, não teria urna pra ser fraudada, ou compromete todo o serviço de votação online (que escândalo) ou não compromete nada, é mais fácil alguém comprometer urnas na putaquepario do que um datacenter. ""Como garantir que o voto online não foi fraudado?"" Hoje, na votação com urna, dependemos de alguns fatores, o mesário precisa confirmar sua presença e liberar a urna (boa fé de uma pessoa) e a urna tem que ter boa fé também (ela pode estar adulterada). No servidor, não teria uma pessoa intermediária e nem deslocamento da urna, a contagem seria instantânea (eu sei, a contagem das urnas é rápida já, mas você já acompanhou ela? é uma confusão!). A única maneira que tem de alguém comprometer o serviço online, seria o computador, aquelas pessoas que não possuem computador em casa ou internet, ou não possuem smartphone/tablet, teriam que votar em computadores públicos, provavelmente comprometidos de alguma forma. No final, não dá pra confiar em nada mesmo.",11,true,13,,,,,,
,,,,,,,,Ugj0XsanfKSgEXgCoAEC.7-H0Z7--A6g7-H3LtxABZu,Foda-se o Google+,3 years ago,1434070465574,"Bom dia cara, então, na verdade o voto impresso na hora, passa pela urna e você o vê, mas não o pega, você apenas vê para confirmar em quem votou, e ele fica armazenado dentro da urna. Sobre votar pela internet, seria muito pior, e menos confiável, em minha humilde opinião de HUE BR, todavia do jeito que está o sistema de votação atual (urna eletrônica), eu abro mão desse ""direito"" e pago a multa de R$ 3,00 vale mais a pena.",2
,,,,,,,,Ugj0XsanfKSgEXgCoAEC.7-H0Z7--A6g7-H5CWkRmPC,Xano Trevisan Kothe,3 years ago,1434070465580,"+Foda-se o Google+ entendi, aqui na cidade não tem esse voto impresso, não sabia como funcionava direito. Nada impede de imprimirem outra ""bobina"" ou ignorarem os votos que estão na ""bobina"", concorda? na internet não teria isso, não passa pela mão dos HUEHUEHUE BRs hehehe",0
,,,,,,,,Ugj0XsanfKSgEXgCoAEC.7-H0Z7--A6g7-HFx7c89sK,Francis Caetano,3 years ago,1434070465585,"+Foda-se o Google+ Qualquer sistema pode ser fraudado, oque iria impedir de imprimir um voto e armazenar outro, se engana quem acha que oque é impresso ou exibido é oque realmente é computado, ""sabe de nada inocentes..."" voto deveria ser facultativo.",0
,,,,,,,,Ugj0XsanfKSgEXgCoAEC.7-H0Z7--A6g7-HI-sJC8d8,Xano Trevisan Kothe,3 years ago,1434070465592,"+Francis Caetano o que mudaria se fosse voto facultativo? quem não votou podia, misteriosamente, ter votado em algum candidato.",1
,,,,,,,,Ugj0XsanfKSgEXgCoAEC.7-H0Z7--A6g7-HJBMuJAeu,Carlos Carvalho,3 years ago,1434070465598,"+Francis Caetano Com código aberto dá para garantir a impressão. Acontece com aquelas máquinas que você encontra em supermercados:

Em muitos sistemas existe uma regra de que toda informação recebida pelo aparelho deve ser impressa imediatamente, sem acúmulo em memória ou tratamento a não ser formatação para impressão.

O código aberto permitiria que qualquer um pudesse observar a programação para ver se realmente é isso que a urna está fazendo (além, claro, do processamento correto do input do usuário e registro dos votos).

O papel poderia sair em duas vias: uma para o eleitor, e uma para um cofre anexo à urna.

No caso de código aberto, aliás, basta ir para o cofre, pois o código já é garantia para o eleitor.",0
,,,,,,,,Ugj0XsanfKSgEXgCoAEC.7-H0Z7--A6g7-HJoR-6jE8,Xano Trevisan Kothe,3 years ago,1434070465602,"+Carlos Carvalho Infelizmente, código aberto não garante nada. podem divulgar um código, mas a Urna que você está usando pode ter outro totalmente diferente.",1
,,,,,,,,Ugj0XsanfKSgEXgCoAEC.7-H0Z7--A6g7-HLOmQVFXl,Carlos Carvalho,3 years ago,1434070465607,"+Xano Trevisan Kothe Isso é uma realidade. Mas aí já entramos no caso de fraudar cédula, pagar contador de cédula de papel...

Todo sistema desse tipo pode ser fraudado, infelizmente.

Mas um código aberto com possibilidade de solicitar um dump imediato ajudaria.

Em suma, concordo que não resolve, mas poderia ajudar.",2
,,,,,,,,Ugj0XsanfKSgEXgCoAEC.7-H0Z7--A6g7-HMIwp8ARB,Xano Trevisan Kothe,3 years ago,1434070465613,"+Carlos Carvalho não entendi, dump do que?",0
,,,,,,,,Ugj0XsanfKSgEXgCoAEC.7-H0Z7--A6g7-HS6pcKIgj,Carlos Carvalho,3 years ago,1434070465618,"+Xano Trevisan Kothe Seria um dump do código que está rodando.

No fundo uma ideia nada prática, mas seria algo como: qualquer cidadão, a qualquer momento poderia trazer um dispositivo (como um flash drive) e solicitar que o código que está rodando na Urna fosse copiado par ao dispositivo. (óbvio que ainda assim não resolve, pois poderia descarregar um código fake)",1
,,,,,,,,Ugj0XsanfKSgEXgCoAEC.7-H0Z7--A6g7-HTYwL_qiw,Xano Trevisan Kothe,3 years ago,1434070465624,"+Carlos Carvalho haha não ia funcionar, primeiro, a população é ignorante, sabem mexer no computador, mas não sabem como funciona, muito menos o que é um código-fonte. Segundo, pode rodar um código no dispositivo e o ""dump"" ser outra coisa... Não adianta, não dá pra confiar em nada",5
,,,,,,,,Ugj0XsanfKSgEXgCoAEC.7-H0Z7--A6g7-JhfFcaTIA,Adrian S.,3 years ago,1434070465628,A conversa aqui tá boa! Os pontos levantados foram muito relevantes.,2
,,,,,,,,Ugj0XsanfKSgEXgCoAEC.7-H0Z7--A6g7-K25_XT-Xr,gomastic,3 years ago,1434070465634,uma resposta sensata.,0
,,,,,,,,Ugj0XsanfKSgEXgCoAEC.7-H0Z7--A6g7-XNkHIMlU-,walaceos,3 years ago,1434070465638,"Já que está na moda culpar eleitor pelos erros dos políticos, então que acabem com as eleições periódicas, criem o voto aberto e que o eleitor possa votar e se arrepender de seu voto a qualquer momento, podendo transferir ele para outro candidato, cada candidato terá um período máximo de permanência de 4 anos, e mínimo de 6 meses, elegendo aqueles que tem mais votos na época de troca e o eleitor terá que renovar seu voto se seu candidato não puder se reeleito. Partidos não serão oficiais e nem receberão verbas publicas, qualquer pessoas com o titulo em dia pode se candidatar, se se um candidato for incriminado, será feito auditoria e instigação sobre seus eleitores que podem ter o titulo cassado ou alguma pena por votar e manter voto em corruptos. Os eleitos terão um salário de 2 a 5 salários mínimos que será determinado pelo emprego anterior ao mandato, mais ajuda de custo.
Será feita também lavagem cerebral por meio de propaganda, evitando que eleitores aplaudam seus candidatos em inauguração de obras, pois a obra não é do candidato e sim publica e com dinheiro do povo, além de outras propagandas gratuitas ensinando que qualquer gasto publico não pode ser utilizado para favorecer candidatos e sua imagem, pois suas ações não são favores, e sim serviço pelo qual ele recebe pra fazer. e viva a utopia....",0
UgijyAcupdWVwngCoAEC,cleitontkd,3 years ago,1434070465178,Sarcasmo mode ON,0,false,0,,,,,,
UgiA-mgW7sIhyXgCoAEC,dsfasdfSDSF,3 years ago,1434070465183,Imaginei a cena do SouthPark quando o Cartman caga em cima da mesa do professor. KKKKK,1,false,0,,,,,,
UghMGp7mm8fFqngCoAEC,Alexandre B,3 years ago,1434070468435,"Beleza. Em tempos de manifestações dos jovens brasileiros o Sr. De forma irresponsável resolve colocar um vídeo como esse esperando que os usuários interpretem como quiserem. Agora teremos que nos.preocupar, além da enorme quantidade de votos brancos e nulos, também com os vândalos quebrando urnas. Ohhhhhh... nada legaallll.   Verdadeiro desservico à democracia esse seu vídeo.",39,true,82,,,,,,
,,,,,,,,UghMGp7mm8fFqngCoAEC.7-H0Z7-9UfA7-H1Iq-YISQ,cleitontkd,3 years ago,1434070469707,"Não muda nada as urnas serem quebradas, afinal elas são fáceis de serem manipuladas uma vez que somente o nosso país utiliza as urnas mais inseguras do mundo.",64
,,,,,,,,UghMGp7mm8fFqngCoAEC.7-H0Z7-9UfA7-H1YIYYpBm,hunter poop86,3 years ago,1434070469711,"Eu queria muito saber em quem você quer votar, já que não concorda com branco nem nulo.",19
,,,,,,,,UghMGp7mm8fFqngCoAEC.7-H0Z7-9UfA7-H1zMfC2X6,hunter poop86,3 years ago,1434070469717,"Quem tem 5% de inteligência, sabe que não adianta porra nenhuma votar. A merda será a mesma. Este vídeo foi uma brincadeira em relação a votar, pois NÃO TEM EM QUEM VOTAR. E mesmo que você vote em alguém que esteja a trabalhar honestamente, não vai alterar em nada, pois as urnas serão manipuladas.",34
,,,,,,,,UghMGp7mm8fFqngCoAEC.7-H0Z7-9UfA7-H2CZLd2L1,Alexandre B,3 years ago,1434070469718,"+kayqueelson Não vou repetir essa explicação, pois é bastante cansativo falar de algo tão trivial. Os votos brancos e nulos não servem para nada, é o que dizem. Mas pense o seguinte. Temos 100 eleitores. Desses 100, 40 recebem tantos benefícios que não deixariam de votar em quem está no poder. Assim, sobram 60 eleitores. Vencerá quem tiver mais de 50% dos VOTOS VÁLIDOS. Assim, quando todos votam, teremos 60 pessoas para votar na oposição, como é necessário apenas 51 votos para ganhar, ainda podemos reverter o quadro. Agora vamos para a segunda hipótese. Temos 100 eleitores. No Brasil, 20% dos eleitores anulam, votam em branco ou se abstém de votar. Sobram 80 votos válidos. Se o gestor no governo, com o uso da máquina pública, já tem 40 votos, como um dia poderemos tirá-lo do governo? Entendeu? Quanto mais votos NULOS, BRANCOS e ABSTENÇÕES, mais certa é a reeleição, exatamente devido aos programas sociais que garantem votos aos gestores no poder. Temos no Brasil o maior programa institucional de compra de votos do Mundo. Não precisamos nos preocupar com fraudes em urnas que deixam rastros. Existem outros meios escusos para se conseguir votos. Dê uma lida no Livro ""O nobre Deputado"" e vocês verão que há muito mais irregularidades antes das eleições, de forma que as Urnas nem precisam ser manipuladas para que alguém vença o pleito.",11
,,,,,,,,UghMGp7mm8fFqngCoAEC.7-H0Z7-9UfA7-H2Edo_laE,Canal do Otario,3 years ago,1434070469722,Meus vídeos são para pessoas com QI superior a 70 ;-),111
,,,,,,,,UghMGp7mm8fFqngCoAEC.7-H0Z7-9UfA7-H2aLDnAYo,Sandruey Hedy,3 years ago,1434070469728,+OtarioAnonymous (Canal do Otário) Boa KKKKKKK,5
,,,,,,,,UghMGp7mm8fFqngCoAEC.7-H0Z7-9UfA7-H2kOlCZts,Alessandro de Oliveira Teixeira,3 years ago,1434070469730,Como tem gente que não sabe interpretar o videos! PQP,7
,,,,,,,,UghMGp7mm8fFqngCoAEC.7-H0Z7-9UfA7-H2mmk14Lz,Matheus Assunção,3 years ago,1434070469734,Democracia? Onde? Eu não estou vendo em lugar algum '-',12
,,,,,,,,UghMGp7mm8fFqngCoAEC.7-H0Z7-9UfA7-H37sYkv7a,leovano1,3 years ago,1434070469739,"Inicialmente, o vídeo é de caráter sarcástico. Então não pode ser entendido ao pé da letra, em nenhum lado da ironia dita.",8
,,,,,,,,UghMGp7mm8fFqngCoAEC.7-H0Z7-9UfA7-H38fcsbmS,Alexandre B,3 years ago,1434070469742,"+OtarioAnonymous (Canal do Otário) Melhor colocar essa informação visível no início do vídeo então, pois, recentemente, sem que você desse a ideia, um sujeito baixou as calças e cagou em cima da urna em uma pequena cidade do Nordeste. Imagine agora com o seu incentivo.",2
,,,,,,,,UghMGp7mm8fFqngCoAEC.7-H0Z7-9UfA7-H3XJ-1Rna,cleitontkd,3 years ago,1434070469746,"+kayqueelson Em ninguém, prefiro pagar pra não votar porque ficarei com consciência limpa que não estraguei esse país.",3
,,,,,,,,UghMGp7mm8fFqngCoAEC.7-H0Z7-9UfA7-H4Mi08bbv,ma rert,3 years ago,1434070469751,"soh votam maiores de 16 anos, se alguem com essa idade n sabe interpretar um video direito merece se fuder msm",7
,,,,,,,,UghMGp7mm8fFqngCoAEC.7-H0Z7-9UfA7-H4eswYQUt,hunter poop86,3 years ago,1434070469753,+cleitontkd Não falei com você amigo. Foi com o cara ali em cima.,3
,,,,,,,,UghMGp7mm8fFqngCoAEC.7-H0Z7-9UfA7-H7t9JQ4yO,Willian Moura,3 years ago,1434070469757,"O QUE NÃO FAZER COM AS URNAS ELETRÔNICAS. Rapaz, volta pra escola. Tem um não de todo tamanho. Não representa negação, utilizado para negar algo, discordar de alguma coisa. ai nego vem e fala ""ele ta sendo irônico"" irônico é o cu da cachorra vc pode usar o lixo dessa palavra pra tudo pra n admitir que ta errado",3
,,,,,,,,UghMGp7mm8fFqngCoAEC.7-H0Z7-9UfA7-H8lwgAMyK,Thiago Nascimento,3 years ago,1434070469763,"ALGUÉM FALTOU A AULA DE IRONIA.
ALGUÉM SE REPROVOU NA AULA DE SARCASMO.",6
,,,,,,,,UghMGp7mm8fFqngCoAEC.7-H0Z7-9UfA7-HANS7-wJO,Yé Yé Girls,3 years ago,1434070469766,"O que entendi do vídeo foi o seguinte, ele demonstra o quanto as urnas são frágeis e quantas coisas simples podem inutilizar qualquer uma delas, se alguém quiser pode mudar o resultado de uma eleição comprando pessoas e mandando elas destruírem urnas da Zona X pois um concorrente direto dele tem maioridade de votos naquela Zona, isso não só pode ser feito como já o foi várias vezes.

http://www1.folha.uol.com.br/folha/brasil/ult96u37250.shtml",5
,,,,,,,,UghMGp7mm8fFqngCoAEC.7-H0Z7-9UfA7-HAjkvGA2H,Roberto Araújo,3 years ago,1434070469771,"Qual o problema de votar nulo? Pouco importa quem será eleito. O que eu não quero é perder o meu tempo indo votar em uma eleição de merda, que não muda nada na minha vida. 
Se muita gente votar nulo, os políticos percebem que voto obrigatório não serve pra nada e acabam com essa bobagem.",3
,,,,,,,,UghMGp7mm8fFqngCoAEC.7-H0Z7-9UfA7-HDUZgB3Vo,Guilherme F,3 years ago,1434070469775,"+Roberto Araújo  Votando nulo você aumenta a proporção entre quem está na frente e os demais colocados, dificultando um possível segundo turno. Com certeza importa quem será eleito... o PT está no poder há 12 anos se não me engano e o País está na merda, creio que os ares precisam ser renovados (se vai mudar algo ai eu não sei, mas temos que tentar mudar alguma coisa)

recomendo esse vídeo para entender melhor como funciona voto nulo e branco:

VOTO NULO - Entendeu ou quer que desenhe",0
,,,,,,,,UghMGp7mm8fFqngCoAEC.7-H0Z7-9UfA7-HFXgMuRTf,Sergio Augusto,3 years ago,1434070469778,"+kayqueelson Você tem 105% de burrice pra afirmar isso né? Sabe o que significa cidadania? O voto, apesar de não ser o único dever do cidadão, é um dos mais importantes. Sendo assim, exerce-lo da melhor maneira possível é primordial para o país. Quer saber quais políticos são honestos? Leia um jornal por dia, leia uma revista semanal. Esse discurso de que todos os políticos são corruptos é o discurso mais ""chapa branca"" que existe, parece uma fala corajosa, mas os bandidos de Brasília adoram isso. Afinal, você coloca os poucos virtuosos e honestos no mesmo pacote dos desprezíveis.",3
,,,,,,,,UghMGp7mm8fFqngCoAEC.7-H0Z7-9UfA7-HGN6wsIy7,joseph rodrigues,3 years ago,1434070469786,"votando ou nao  vai dar na mesma , o Brasil tem um imenço e indestrutivel sistema corrupto. eu mesmo voto nulo e ainda obrigado.",0
,,,,,,,,UghMGp7mm8fFqngCoAEC.7-H0Z7-9UfA7-HGhwPjse8,Matheus,3 years ago,1434070469788,+Willian Moura http://www.dicionariodoaurelio.com/Ironia.html,1
,,,,,,,,UghMGp7mm8fFqngCoAEC.7-H0Z7-9UfA7-HJNdBHoA6,Black Fedora,3 years ago,1434070469791,Eu prefiro ver urnas quebradas do que elas operando livremente. ;-),1
,,,,,,,,UghMGp7mm8fFqngCoAEC.7-H0Z7-9UfA7-HPqsxjfD4,hunter poop86,3 years ago,1434070469799,"+Sergio Augusto Você é imbecil. Em nenhum momento eu disse que todo político é corrupto. E realmente tem que ser bem animal para encaixar ""cidadania"" apenas no contexto de voto. Estou a dizer que mesmo você votando no político honesto, de qualquer forma, as urnas serão manipuladas.",1
,,,,,,,,UghMGp7mm8fFqngCoAEC.7-H0Z7-9UfA7-HS5z3pr_4,Sergio Augusto,3 years ago,1434070469801,"+kayqueelson
1- Voce disse: ""Este vídeo foi uma brincadeira em relação a votar, pois NÃO TEM EM QUEM VOTAR"" e eu afirmei que tem em quem votar e basta você ler pra saber.

2- Eu disse: ""...apesar de não ser o único dever do cidadão, é um dos mais importantes."". Então nao entendi sua colocação de que eu ''encaixei cidadania apenas no contexto do voto''.

3- Aonde você viu e sabe com tanta certeza as urnas são manipulas? Quem faz isso? Como fazem exatamente? Se não conseguir responder essas perguntas, o que você afirma é apenas um crença e não algo que constatou através de fatos, portanto, tendo a desconsiderar.",1
,,,,,,,,UghMGp7mm8fFqngCoAEC.7-H0Z7-9UfA7-HXPgxqjeE,Marcelo Roberto da Silva,3 years ago,1434070469810,"Alexandre, embora esse seja um dos canais mais úteis do youtube, seu comentário foi bastante pertinente. Contudo, me decepcionei menos com o vídeo que com o comentário do autor do canal à sua postagem: ""Meus vídeos são para pessoas com QI superior a 70"".
O sistema eleitoral não é perfeito, e o político é caótico, mas ainda assim sempre haverá algo que possamos fazer para tornar as coisas ""menos piores"".
Ainda que entre a forca e a fogueira haverá uma escolha, e escolher sempre será uma atitude ""menos otária"" que cruzar os braços.",1
,,,,,,,,UghMGp7mm8fFqngCoAEC.7-H0Z7-9UfA7-H_h2CYeWE,hunter poop86,3 years ago,1434070469815,"+Sergio Augusto 01. Eu disse isso de uma maneira mais generalizada. Já que não é novidade nenhuma. E pus ênfase na presidência, embora não especificado, já que os que ganharão serão PT ou PSDB. Sempre é assim.

02. Sobre esse contexto de cidadania, aqui do Brasil, se torna bem zuado. Isso junto com a democracia, permite o cidadão participar dos processos governamentais e fazer com que eles escolham os seus representantes. Aqui no brasil, o voto é obrigatório (só um pouco contraditório) e ainda, permite até os analfabetos votarem. Está certo que eles são cidadãos, porém, o voto de um analfabeto tem o mesmo peso que um trabalhador normal. Isso prejudica muito. Ao contrário dos EUA.

03. Amigo, menos inocência beleza? Só o que tem na internet por aí são vídeos, reportagens e documentários sobre isso. Falarei o que basicamente rola por aí. As urnas eletrônicas possui seu sistema que lá são armazenados históricos de voto, de quem votou e quantos votos. Analistas especializados em computação já obtiveram esses dados e notaram que várias vezes, as informações não corresponderam. É um assunto grande e complexo.",1
,,,,,,,,UghMGp7mm8fFqngCoAEC.7-H0Z7-9UfA7-H_oi0aUQ2,Marcelo ND,3 years ago,1434070469823,Canal do OTÁRIO. O nome diz tudo.,0
,,,,,,,,UghMGp7mm8fFqngCoAEC.7-H0Z7-9UfA7-Hob94JAVP,Sergio Augusto,3 years ago,1434070469828,"+kayqueelson hahahahaha voce mudou tudo o que tinha dito no comentário anterior. Percebeu que leu errado e eu nao tinha dito que cidadania é só voto no 02. e ficou enrolando. Depois mudou o que tinha dito no 01. onde especificou claramente que ""...NAO HÁ EM QUEM VOTAR."" em seguida diz que ""falou isso de uma maneira mais generalizada"" só que me pareceu bem especifico - diga-se, em caixa alta ainda. Já em relação ao ponto 03. voce fica com sua opiniãozinha ai de video de internet que pra mim tanto faz. Conclusão: Voce tem que ler e escrever com mais atenção.",1
,,,,,,,,UghMGp7mm8fFqngCoAEC.7-H0Z7-9UfA7-Hq1f9ydsv,hunter poop86,3 years ago,1434070469834,+Sergio Augusto Haha beleza cara. Não vou mais discutir. flw.,0
,,,,,,,,UghMGp7mm8fFqngCoAEC.7-H0Z7-9UfA7-HrOWcC0ZN,Walter Hauer,3 years ago,1434070469837,+OtarioAnonymous (Canal do Otário) Mais tem pessoas com QI com menos de 10% e conseguiu entender tudo e muito bem.,0
,,,,,,,,UghMGp7mm8fFqngCoAEC.7-H0Z7-9UfA7-I-DeTy7jL,eupeido6 xera,3 years ago,1434070469844,"Cara concordo plenamente com você, o voto não é impresso para não ter represálias. Imagine em um país que se não votar no ""general"" é espancado e é ameaçado de morte, o voto foi criado pelas gerações passadas para não haver um poder único, ao votar você estará exercendo sua liberdade se é que o homem é livre e vive toda sua vida acorrentado.",0
,,,,,,,,UghMGp7mm8fFqngCoAEC.7-H0Z7-9UfA7-I0cFmyWDj,Roberto Araújo,3 years ago,1434070469846,"+oi vc Colega, o cidadão não leva o voto impresso pra casa. Ele é depositado em uma urna e contado manualmente depois, pra ver se o resultado bate com o da urna eletrônica.",0
,,,,,,,,UghMGp7mm8fFqngCoAEC.7-H0Z7-9UfA7-I864QIP0Q,eupeido6 xera,3 years ago,1434070469848,"Nesses países o voto não é secreto, você põem seu nome e o nome do candidato.
O que quero dizer é que a gente é feliz e não sabe. O Brasil melhora a cada ano,mas muito lentamente só vendo de século e século pra perceber mesmo...",0
,,,,,,,,UghMGp7mm8fFqngCoAEC.7-H0Z7-9UfA7-IApn4Ri4s,Sergio Augusto,3 years ago,1434070469857,+kayqueelson Falou!,0
,,,,,,,,UghMGp7mm8fFqngCoAEC.7-H0Z7-9UfA7-IIKU4qS8c,Leandro Costa,3 years ago,1434070469858,"Como tem alienado aqui, ainda acham que tem político honesto no Brasil, mesmo que por um acaso apareça um, será uma maçã boa em um cesto com dúzias de maçãs podres, ou seja, também se corromperá logo.
Voto NULO e aconselho a votarem nulo também, este papinho de que o voto é importante, que é democracia, blá blá bla, é conversa pra boi dormir.",0
