id,user,date,timestamp,commentText,likes,hasReplies,numberOfReplies,replies.id,replies.user,replies.date,replies.timestamp,replies.commentText,replies.likes
UgzSgFP0wiFe4BmG3n54AaABAg,Ivani Silva,1 day ago,1528677425624,Graças a Deus!! Acho que se o exército for fiscal das eleições está de grande tamanho,0,false,0,,,,,,
Ugygnl24LdlLFtLDejB4AaABAg,Fabio Pettenuci,3 days ago,1528504625631,Bolsonaro 2018 tamos juntos por um Brasil melhor,0,false,0,,,,,,
Ugyvg2BhkMfvtJtY4Q54AaABAg,Ronaldo Almeida,3 days ago,1528504625654,Vejam como é fragil nossa democracia!!,0,false,0,,,,,,
UgwthfzyE6_MeC7q6h14AaABAg,Luiz Algusto,3 days ago,1528504625657,adiantou nada. tiraram o voto impresso E aí?  aí vai apertar pro bolsonaro Né. o povo quer fuder ele mas a gente tem que ser forte para subir o mito,0,false,0,,,,,,
Ugz0uGnxa8l1zakpxf14AaABAg,francisco jose,3 days ago,1528504625662,"eles roubam a eleição
também quando voltamos 
o voto a mao  e na  hora da  montagem dos chamados  mapas  logico que e menor. a fraude.",0,false,0,,,,,,
UgxhS58o-p5KoyJoGJd4AaABAg,Intervenção!!! Militar Já!!!,3 days ago,1528504625668,"Já era os ladrãoes do STF já votaram contra voto impresso hoje  já é dia 08/06/2018 foi ontem essa pouca vergunha, nóis temos q invadir aquela porra e quebrar tudo principalmente eles os bandidos de toga.",0,false,0,,,,,,
Ugw-PvsJS0Fkg5bTEVF4AaABAg,Jocimar Rodrigues,4 days ago,1528418225671,"Dançou,mudou dnovo, vai ser fraudadas dnovo, os ladrões votaram p voltar",0,false,0,,,,,,
Ugx2A4QpUZBKRi1lQ5p4AaABAg,ABPF2306 FILHO,4 days ago,1528418225679,"DEUS ABENÇOE O BRASIL, E NOSSO FUTURO PRESIDENTE JAIR BOLSONARO.",0,false,0,,,,,,
Ugy-ElSdzf0Ubdv6rCh4AaABAg,Elielson Cardoso Souza,4 days ago,1528418225683,Antes tarde do que nunca.,0,false,0,,,,,,
UgxqkSqV-kHGoA9G1Wl4AaABAg,Cristian Mallonne,5 days ago,1528331825691,#Bolsomito2018,0,false,0,,,,,,
UgwECQlAoAveMPlHL6B4AaABAg,Frankllin Dias,5 days ago,1528331825695,"Se eu for votar, e não tiver o voto impresso posso me recusar a votar exigindo meu direto sem se punido pelo TSE?",0,false,0,,,,,,
Ugyd39QgcCEmfkHTrc94AaABAg,Wanderley Santos,6 days ago,1528245425701,Voto impresso sim bolsonaro 2018,0,false,0,,,,,,
Ugz18TZsvNFRbnr7KXl4AaABAg,ana Correia Costa,6 days ago,1528245425706,"Hurrru 🙋🙋🙋🙋
Notícia boa 👏👏👏👏",0,false,0,,,,,,
UgxDcy9YNEeR5-1_CvR4AaABAg,adair Miquelino,6 days ago,1528245425711,isso é a intervençao militar,0,false,0,,,,,,
UgxsdtYWISAdYaijQBJ4AaABAg,Josmar Sales,1 week ago,1528159025715,"Voto impresso,Bolsonaro 2018",0,false,0,,,,,,
Ugyk2gIFbT1W3r73cat4AaABAg,Daniel Pelissari Dos Santos,1 week ago,1528159025721,É Bolsonaro,0,false,0,,,,,,
UgwAnvNDlWY5MzHnli54AaABAg,Marlen PLB,1 week ago,1528159025726,"Parabéns Bolsonaro presidente do Brasil uhuuuuuuu graças a Deus 
Graças a Deus....amém obrigada meu Deus 👏👏👏👏👏👏👏👏👏👏👏👏👏👏👏👏😎😎🙌🙌",1,false,0,,,,,,
UgxJNIhG5JYIvHy_svp4AaABAg,Marlen PLB,1 week ago,1528159025730,"Verdadeeeeeeeeee????👀👀
O que maravilhaaaaaaah!🙌🙌
Agora sim vejo luz no fim do turno 😎😎😎😎😎😎🙌🙌🙌🤗",1,false,0,,,,,,
Ugz2YFVhfm-PJP-Qy6p4AaABAg,Tatiana Sampaio,1 week ago,1528159025735,"Me digam se eles ganham em qualquer situação, qual é o medo de colocar o voto impresso...🤔
Povo só falta fazer valer a lei.
Em 100% das urnas. Não só em 5% delas😒.",0,false,0,,,,,,
UgxhB_OXDxO15G4DSgp4AaABAg,M L,2 weeks ago,1527554225739,"BRASIL DE MERDA.
FORÇAS CAGADAS E MILITARES COVARDES.
NAÇÃO INERTE E PREGUIÇOSA.

BRASIL DE MERDA, SIM SENHOR!!!",0,false,0,,,,,,
UgxEuJ-qkvTe0MkGvGJ4AaABAg,MGD,2 weeks ago,1527554226577,BOLSONARO PRESIDENTE !!!!!!!!,0,false,0,,,,,,
UgxZ8vNr-AIjkTMwyUB4AaABAg,Paulinho Marques,2 weeks ago,1527554226581,ESSAS URNAS SÃO UMA FARÇA,0,false,0,,,,,,
Ugypp1J2LiY2WBAZ_lB4AaABAg,Bruno Leandro,2 weeks ago,1527554226589,Voto empreso já !!!,0,false,0,,,,,,
Ugyq4d97yH0mrm7kAd54AaABAg,Josemar Monteiro coelho Monteiro coelho,2 weeks ago,1527554226598,"Se passar o voto impresso, sem a urna eletrônica,vai ser uma zorra.",0,false,0,,,,,,
UgyBNTNZxBh3wURkMZh4AaABAg,Cleriston Borges Dos Santos,2 weeks ago,1527554226602,Bom dia a todos mais um motivo p/ extinguirmos essa merda de urna eletrônica força Brasil estamos juntos é Bolsonaro 2018 não nos decepcione!,0,false,0,,,,,,
UgybnHa3VbIauzKcB-N4AaABAg,Paulo Janio,2 weeks ago,1527554226611,Vinheta muito top!!!!!,0,false,0,,,,,,
UgyZuwGUrxJT1pmeKmp4AaABAg,cosmo sergio leite,2 weeks ago,1527554226613,Esses povo não cansa de postar vídeos falsos,0,false,0,,,,,,
Ugx773UQxri_zQGi2HN4AaABAg,Denisson Rodrigues,2 weeks ago,1527554226636,por isso que o PT não parava de ganhar mano só na pilantragem,0,false,0,,,,,,
UgzeleJYmLCZlVZPmKl4AaABAg,Denisson Rodrigues,2 weeks ago,1527554226645,isso só é pilantragem mesmo,0,false,0,,,,,,
UgwX0at2V93hNtqtUYB4AaABAg,Davi Soares,2 weeks ago,1527554226648,Se essa urna é segura porque os países de primeiro mundo não adotaram essa prática alguém me explique por favor.,0,false,0,,,,,,
UgwxBsK2eBXnnOQ7KW14AaABAg,Pedro Rojel,2 weeks ago,1527554226657,Bolsonaro Presidente do Brasil 2018 vai Brasil,0,false,0,,,,,,
UgzJOhh3gTSY612y3MB4AaABAg,Alex teixeira lima,2 weeks ago,1527554226661,Queremos o voto impresso!!,0,false,0,,,,,,
UgwPe29iSfTtBP4O2U94AaABAg,Lucy Carvalho,2 weeks ago,1527554226670,Te amo Bolsomito,0,false,0,,,,,,
UgzDea0Jai0nxOi9NS54AaABAg,EMMANUEL Felix,2 weeks ago,1527554226674,VOTO IMPRESSO BRASIL PODEMOS EXIGIR SE NÃO NINGUÉM VOTE,0,false,0,,,,,,
Ugzd5sVXRGzgY1KoTmV4AaABAg,Consorti th_miranda,2 weeks ago,1527554226681,Os Candidatos só estão cientes do crescimento do BOLSONARO AGORA.... Que mundo esses caras vivem!?. . . Deus no Comando!!! 👏😍,0,false,0,,,,,,
UgwBmeU9vv1IDpRxCFF4AaABAg,ricardoalberoni Alberoni,2 weeks ago,1527554226684,Até um verme sabe que as urnas eletrônicas são utilizadas no brasil para manipular resultados das eleições. Se fosse bom EUA e países da Europa fariam uso desta porcaria.,0,false,0,,,,,,
UgyCGNrBp5e2kZTswdV4AaABAg,Justiça Espiritual,2 weeks ago,1527554226694,GRANDE MITOOOOOOOO,0,false,0,,,,,,
UgwLXQOXYix99ghZVj54AaABAg,wequexlei Viana,2 weeks ago,1527554226702,A petralha chora,0,false,0,,,,,,
UgwJutBACsloTUBTcup4AaABAg,Marisa Morgado,3 weeks ago,1526949426706,"Mas não mudou nada. A urna continua!!!! Espero que não roubem os votos do Bolsonaro. Que não fraudem a eleição, já que o luladrão não vai participar, POIS ESTÁ PRESOOO!!! 😁BOLSONARO 2018!!",0,false,0,,,,,,
UgzRhAQX2um0jefnxUt4AaABAg,LISA Pastore,3 weeks ago,1526949426714,"Depois que o Senhor for eleito , coloque todos os petistas atrás das grades!",0,false,0,,,,,,
UgxC325uaW8oHjwHEe94AaABAg,LISA Pastore,3 weeks ago,1526949427531,Bolsonaro depois que vc ganhar como presidente . Acabe com  a rede globo.,0,false,0,,,,,,
UgyPTcks4u3JlkG4g7J4AaABAg,Marcio Wanderson Lima,3 weeks ago,1526949427536,"Mas a pergunta e...e as outras eleições.
Ha treze anos temos sido enganados então...",0,false,0,,,,,,
UgyGSm_EvJ6BA5ZhBsR4AaABAg,tremedonho1950,3 weeks ago,1526949427542,HOJE É 21/05/18 E CANCELARAM AS ELEIÇÕES COM VOTOS PAPEL E AGORA.,0,false,0,,,,,,
UgxIznhvYaaK96YT0Sp4AaABAg,Marcelo Januário,3 weeks ago,1526949427546,E sedo para comemorar esses cumunistas vão arrumar un jeitinho de usar essas urnas fraudulenta,0,false,0,,,,,,
UgxNfTiagG3lerPKuh54AaABAg,Oricivania Tomaz,3 weeks ago,1526949427553,Graças a DEUS,1,false,0,,,,,,
UgzfBXiHMCY00GI6f_l4AaABAg,edmilson Suliano,3 weeks ago,1526949427556,"Deixa eu ver se entendi! Quer dizer que depois de várias fraudes acontecendo , no brasil , com referência as eleições , só agora que descobriram que esse sistema de urnas são , fraudáveis.  kkkkkkkkkk. Nenhum sistema é seguro nas mãos de pessoas inescrupulosas . Façam uma pesquisa e verão que até o uso de voto no  papel , no passado , acontecia  fraude .A implantação do voto eletrônico dificulta algumas das antigas e comuns fraudes externas da votação de papel (como o ""voto carneirinho"", ""voto formiguinha"", ou votos de protesto realizados em favor de conhecidos animais como o Macaco Tião e a Rinoceronte Cacareco).O problema , na minha opinião , não está no sistema mas em quem está dentro  do sistema . Honestidade e transparência , são jóias com seus valores incalculáveis.",1,false,0,,,,,,
UgzBBYnQ19gwvFFZJZ94AaABAg,Juliano Sardinha,3 weeks ago,1526949427559,Eu também quero ser fiscal da eleições.,0,false,0,,,,,,
Ugx5fDTknv9HWp256ud4AaABAg,Fabio Pinheiro Carvalho,3 weeks ago,1526949427567,Xiii agora Bolsonaro ganha em 1 turno.,0,false,0,,,,,,
UgypBRivJpdmjY57vEt4AaABAg,Valdir Nunes,3 weeks ago,1526949427573,Urnas ou impresso?,0,false,0,,,,,,
UgwnDhZSE3ZpCBegrZR4AaABAg,gamer top20,3 weeks ago,1526949427579,"VOTO IMPRESSO FOI APROVADO LEI IMPETRADA PELO BOLSONARO, TSE ESTÁ DESCUMPRINDO A LEI COM A AJUDA DO BANDIDO GILMAR MENDES.",0,false,0,,,,,,
Ugzm2TrYbF6YTQ6-tKB4AaABAg,Canal do Carioca,3 weeks ago,1526949427588,"O povo Venezuelano demorou a tomar uma atitude, hoje divide comida com cachorros na rua. 👍",0,false,0,,,,,,
UgxqKQxOLImOfXWjFjV4AaABAg,João Carlos Afonso Pereira,3 weeks ago,1526949427591,"O Brasil tem dar resposta ao ministros corruptos do TSE caso as eleições não for no papel,não devemos ir as urnas eletrônicas porque é corrupção e maracutaia.",0,false,0,,,,,,
UgxaQ9LT6lMcP-dObO14AaABAg,Teresa Oliveira,3 weeks ago,1526949427598,CÉDULA DE PAPEL E URNAS TRANSPARENTES E SUFRÁGIO COM A IMPRENSA. URNAS ELETRÔNICAS MANDEM PARA A TERRA PLANA MUNDO INVERTIDO ETC....,0,false,0,,,,,,
UgxHXmffljG7oEC0NzR4AaABAg,Marcos Antonio Boffi,3 weeks ago,1526949427602,Bolsonaro terá 80% dos votos.o problema será as urnas eletrônicas da Smart Martik preparadas para comunistas ganhar eleições.,1,false,0,,,,,,
UgzxEwfJF83cHGIPHHp4AaABAg,Luizenir Braz,3 weeks ago,1526949427619,"Entao.
boa noite.
nessa situaçao , como fica a regiao amazonica que la tem um grande numero de fraudes eleitorais pricipalmente nas areas ribeirinhas que aparecem saqueadores e roubam as urnas .
como ficara essa area na implantaçao do voto impresso?, qual seram as medidas tomadas e tambem em mato grosso/sul?",0,false,0,,,,,,
UgwnQfv0TccAKhk7BV14AaABAg,Luizenir Braz,3 weeks ago,1526949427628,"Entao.
boa noite.
nessa situaçao , como fica a regiao amazonica que la tem um grande numero de fraudes eleitorais pricipalmente nas areas ribeirinhas que aparecem saqueadores e roubam as urnas .
como ficara essa area na implantaçao do voto impresso?, qual seram as medidas tomadas e tambem em mato grosso/sul?",0,false,0,,,,,,
UgyfvOibrRDc4vGO-Xx4AaABAg,Luizenir Braz,3 weeks ago,1526949427632,"Entao.
boa noite.
nessa situaçao , como fica a regiao amazonica que la tem um grande numero de fraudes eleitorais pricipalmente nas areas ribeirinhas que aparecem saqueadores e roubam as urnas .
como ficara essa area na implantaçao do voto impresso?, qual seram as medidas tomadas e tambem em mato grosso/sul?",0,false,0,,,,,,
UgxpjQZscLNFNB_0dLV4AaABAg,Luizenir Braz,3 weeks ago,1526949427639,"Entao.
boa noite.
nessa situaçao , como fica a regiao amazonica que la tem um grande numero de fraudes eleitorais pricipalmente nas areas ribeirinhas que aparecem saqueadores e roubam as urnas .
como ficara essa area na implantaçao do voto impresso?, qual seram as medidas tomadas e tambem em mato grosso/sul?",0,false,0,,,,,,
Ugx-4YnNXBD_wjn7YXl4AaABAg,Raimunda Araujo Magalhaes Ribeiro,3 weeks ago,1526949427643,Voto impresso ja!,0,false,0,,,,,,
Ugx8XFAuH3RUrd6wkfd4AaABAg,Renato Carlos,3 weeks ago,1526949427650,Parabéns.... Até que enfim.... Mas vamos ficar de olho aberto.... Não podemos confiar em nada.... Fiquemos atento. BOLSONARO PRESIDENTE,0,false,0,,,,,,
UgwSlt8vBlMq5VQ5InV4AaABAg,Telma Cantarim,3 weeks ago,1526949428506,Quero meu voto impresso.,0,false,0,,,,,,
Ugy66GsFmge0D7uOg6Z4AaABAg,Willys Fernandes,3 weeks ago,1526949428509,"É eu sempre digo coisa que não presta próspera aqui no Brasil, mas graças a Deus isso está mudando, Intervenção Militar,a baioneta está calada. Selva!",0,false,0,,,,,,
UgwU3h5i8L3CxgfbmHZ4AaABAg,Flavio Costa De Almeida,3 weeks ago,1526949428517,Pressão nas eleições em 2018 !!!!!,0,false,0,,,,,,
UgxPl4IY3KqW4q0kSWJ4AaABAg,Ludmilla C Pontieri,3 weeks ago,1526949428522,Demorou! Bolsonaro 2018!!!,0,false,0,,,,,,
Ugz9sb_-fXGddEN0tap4AaABAg,Os Democratas,3 weeks ago,1526949428530,"O Brasil tem que copiar os países de primeiro mundo. Se da certo pra eles porque não dar no Brasil.
Smartmatic e urna eletrônica é proibida nos Estados Unidos.
Tem que ser proibida no Brasil.",1,false,0,,,,,,
Ugy356Vey-JmnBtvn6N4AaABAg,Ana Rubia,3 weeks ago,1526949428539,"Fogo nelas, e cobrem o prejuízo de quem trouxe essa imundície para o Brasil",0,false,0,,,,,,
UgyKbMgV5wUspgIWTJ14AaABAg,AltoAstral Abencoado,3 weeks ago,1526949428542,"VIVA VIVA VIVA BOLSONARO PRESIDENTE DO BRASIL EM 2019
AGORA NAO TEM FRAUDE E NEM OS corruPTos vão ser o lixo que sempre foram O BRASIL NUNCA ACEITOU ESSAS almas CeboZas vermelhinhas corruPTas eles roubavam nos municipios e em alguns estados que tinha seus representante para juntar dinheiro e fraudar as urnas eletrônicas pra depois falar que o povo que escolheu mais como se nas ruas apos eleições todos ficavam se perguntando como eles ganharam que de 10 pessoas conhecidas que só 3 votaram neles agora entendemos o porque vermelhinhos corruPTos a fraude acabou",0,false,0,,,,,,
UgzI6vusCgduRFSuab94AaABAg,Manoel J,3 weeks ago,1526949428549,este video e de fevereiro devia estar no lixo esta porcaria de voto ten de ser na porrada so um novo hitler para resolver a situaçao  hitler diz; democracia e humildade nunca tirou o povo das crises causadas por banqueiros donos da midia mundial.,0,false,0,,,,,,
UgzwMPD_fuW2ZDFD_IB4AaABAg,Roberto Correia,3 weeks ago,1526949428552,Bolsonaro 2018 nosso presidente do Brasil.....,0,false,0,,,,,,
UgzbxIujm_KTQBeEv-V4AaABAg,Acílio Mielke,3 weeks ago,1526949428556,É isso mesmo urna eletrônica os Brasileiros não concorda mais isso é só pára pulítico ladrão.,0,false,0,,,,,,
UgwCTjQ7csoWHhKvGb54AaABAg,Humberto Luiz,3 weeks ago,1526949428563,"Presidente Bolsonaro, contamos com o Sr para limpar está baderna... Transformar o Brasil num país justo e digno para todos.🇧🇷🇧🇷🇧🇷🇧🇷🇧🇷 Presidente  porque já está ganho  no primeiro turno... não tem para ninguém.... vamos que vamos..",0,false,0,,,,,,
UgziTC2qSbqWrt8HhNN4AaABAg,Alexandre Cesaro.,3 weeks ago,1526949428567,Bolsonunca kkkk,1,false,0,,,,,,
UgwlzijQIMoeWLFrul94AaABAg,Alexandre Cesaro.,3 weeks ago,1526949428574,É Lula Presidente 13 PT,1,false,0,,,,,,
UgxakhvDPHBlNvD1rg14AaABAg,José Pereira,3 weeks ago,1526949428580,"Voto impresso já! E , BOLSONARO presidente!",0,false,0,,,,,,
UgxD5FHJzIwNejBrP_14AaABAg,Romulo Lara Peredo,3 weeks ago,1526949428584,Melhor noticia do dia assim o voto do cidadao e respeitado e nosso direito. Nos Estados Unidos e promeiro mundo e o voto e impresso e respeitado.,0,false,0,,,,,,
Ugy810FOBqDJ0tD62C14AaABAg,ANA MARIA VERLI DA SILvEIRA,3 weeks ago,1526949428588,Álvaro  Dias enfimmmm huhuhuhuhu,0,false,0,,,,,,
UgyCESmZXwbkAiBeuod4AaABAg,Edson De Oliveira,3 weeks ago,1526949428595,"A melhor notícia dos últimos meses
É bom Jair se acostumando Ptralhada",0,false,0,,,,,,
UgwjGosCYT-L0GL1z4J4AaABAg,Rosi Ribeiro,3 weeks ago,1526949428599,"Sei não .....num  país  de LADRÕES e que dinheiro compra tudo..... isso pra mim só abre uma brexa  e fica  uma dúvida ....quem vai pagar mais pra ser eleito....os traficantes que já estão no poder..... a máfia da carne....a máfia da exportação.... a máfia do setor  automotivo.....a máfia das empresas de água,de luz ,máfia das  empresas de alimentos,a máfia da fábrica de MENDIGOS e trabalhadores mal pagos e abandonados...e aí  ..... quem terá o dinheiro suficiente pra comprar um país tão gigante e péssimamente administrado.....a África, a Alemanha....o Japão....nas mãos de que vamos ficar na próxima eleição .....",0,false,0,,,,,,
Ugx8Yr9EWTg2AaLoXP94AaABAg,rego leonirdes mithiko,3 weeks ago,1526949428606,"ALELUIA TODAS URNAS ELETRONICAS AO LIXO SIM!!!,TODOS NOS BRASILEIROS DO BEM TEMOS TODOS OS DIREITOS E EXIGIMOS O VOTO EXPRESSO SIM!!!,QUEREMOS BOLSONARO A PRESIDENCIA DO BRASIL SIM!!!♡♡☆",0,false,0,,,,,,
UgxFRjkIqRIpaUJk3494AaABAg,rego leonirdes mithiko,3 weeks ago,1526949428610,"E 1- 2- 3- 4- 5- 100.000,000 BOLSONARO EH O PRESIDENTE DO BRASIL SIM POR UM BRASIL MELHOR!!!,♡♡☆VICE PRESIDENTE MAGNO MALTA SIM!!!,ALELUIA GLORIAS AO NOSSO PODEROSO DEUS PAI AMEM＼(^o^)／♡♡☆",0,false,0,,,,,,
UgwiFjLKgVp-4HV60Pp4AaABAg,rego leonirdes mithiko,3 weeks ago,1526949429579,"Aleluia Senhor Jesus Glorias E Gracas Ao Nosso PODEROSO Senhor DEUS PAI AMEM♡♡☆O NOSSO SENHOR DEUS PAI ELE EH MUITO PODEROSO E MUITO FIEL ALELUIA Jair Messias Bolsonaro PRESIDENTE AMEM♡♡☆ TUDO U QUE DEUS PAI NUS PROMETEU ESTA SE CUMPRINDO.,MUITO OBRIGADO MEU SENHOR DEUS PAI POR TEU GRANDE AMOR PARA CONOSCO AMEM＼(^o^)／♡♡☆",0,false,0,,,,,,
UgyWUjOS74VM1Jidpo14AaABAg,Rei leão Sousa,3 weeks ago,1526949429582,Vou mandar fazer umas camisetas com as frases meu voto eu não escondo de ninguém sou bolsonaro para min e minha família para usar no dia das eleições,0,false,0,,,,,,
UgzfuLLC4Lj7MXPZiCl4AaABAg,Charlene Santos Ferreira,3 weeks ago,1526949429589,voto impresso. no final da votacao a mesa fiscalizadora faz a contagem dos votos na presença de todos fiscais . todos mesarios assinam . as assinaturas devem ser previamente registradas em cartório . repassados boletins para as zonas eleitoraus acompanhadas pelos fiscais. depois repassadas para o TRE,0,false,0,,,,,,
UgwjZUiQWfyQNQthNqh4AaABAg,Joao Marcio,3 weeks ago,1526949429594,quem vai comigo que é Capitão  no primeiro  turno .e bom Jair se acostumando.Brasil,0,false,0,,,,,,
UgyWDhR7cUedMnyUojJ4AaABAg,Kennedy Faria,3 weeks ago,1526949429602,#Bolsonaro2018,0,false,0,,,,,,
Ugyf_PRmCDOQyDDCZwJ4AaABAg,Daimler Ribeiro,3 weeks ago,1526949429605,"Jair bolsonaro presidente!  Esse Tribunal Eleitoral é, manipulado por Comunistas há muito tempo!!!",0,false,0,,,,,,
UgyfrNvro6BlrBRVO854AaABAg,Ramon Silva,3 weeks ago,1526949429611,Eu já estava tão acostumado com a roubalheira!!!,0,false,0,,,,,,
UgxtPfaNGJQxch9_kxJ4AaABAg,paula oliveira figueiredo,4 weeks ago,1526344629615,Até que em fim uma boa notícia. Mas só porque agora é que virão a fralde ??,0,false,0,,,,,,
UgzTHOGaoo4_Lvysnv94AaABAg,Otavio Maia,4 weeks ago,1526344629620,Bolsonaro 2018..,0,false,0,,,,,,
Ugzep-qNDkjQbJDzRLd4AaABAg,Nonato Barbosa,1 month ago,1526085429624,Porra colocar tua voz cara,0,false,0,,,,,,
UgyPn40mXVxDuSI4jgl4AaABAg,Raimundo Nonato LIma Lima,1 month ago,1526085429628,"AS URNAS ELETRÔNICAS TERÃO DE SEREM PROIBIDAS, JÁ NAS ELEIÇÕES DE 2018!!!!!!",0,false,0,,,,,,
UgwKkaqPLB_ADqi36u14AaABAg,Livia C. de Freitas,1 month ago,1526085429634,lembrando que essa luta é do BOLSONARO!,0,false,0,,,,,,
Ugye6bVIWFPOggGf7fZ4AaABAg,Cesar Augusto,1 month ago,1526085429637,ME CHAMA DE CORRUPTO !!!!! POHAAA!!!!!,0,false,0,,,,,,
Ugy8uIo3VgEidoxWwQR4AaABAg,Junior Santos,1 month ago,1526085429643,"oq está acontecendo com jair bolsonaro aqui e a msm coisa que aconteceu com Trump 
e sei que bolsonaro vai chegar lá pq Deus quer assim 
o Brasil não aguenta mais tanta impocresia e manipulação !",0,false,0,,,,,,
Ugxyi05NcmLkIp3aEsN4AaABAg,Junior Santos,1 month ago,1526085429648,"oq está acontecendo com jair bolsonaro aqui e a msm coisa que aconteceu com Trump 
e sei que bolsonaro vai chegar lá pq Deus quer assim 
o Brasil não aguenta mais tanta impocresia e manipulação !",0,false,0,,,,,,
UgyGmgkPmnD4NjY0leN4AaABAg,Joao Rodrigues,1 month ago,1526085429655,Consciência a todos os cidadãos.,0,false,0,,,,,,
UgwAotkVecdAT55hysp4AaABAg,gilson adriano da silva Adriano,1 month ago,1526085429659,o mito de 2018 á 2050 kkkkkk depois familia Bolsonaro   kkkkkkkkkkk á dep federais + senadores nos partidos que estao apoiando eles espalhem kkk,0,false,0,,,,,,
UgxGQB7PPY3wrhQ0Cml4AaABAg,Thelma Regina Pugliesi,1 month ago,1526085429665,"Será que é verdade⁉️ Eles estão fazendo a biometria e talvez não haja tempo hábil para realizarem a mudança ‼️ Enfim, estou torcendo para que essas urnas eletrônicas sejam destruídas ‼️",1,false,0,,,,,,
UgwN2yOwjkJ5Sqdspud4AaABAg,Dennison Lisboa,1 month ago,1526085429671,Queremos voto inpresso,0,false,0,,,,,,
UgwTXzzt6zCxus3Ik-54AaABAg,Soldado Desconhecido,1 month ago,1526085429676,"VOTO IMPRESSO JÁ!
FIM DO CADASTRO BIOMETRICO JÁ!
FIM DAS URNAS JÁ!",0,false,0,,,,,,
Ugy2xTPYYuSvJLK7q414AaABAg,Paula Souto,1 month ago,1526085430656,"Tem uma sugestão legislativa em consulta pública do Senado para apoiar o VOTO IMPRESSO, segue o link. Vote e compartilhe o máximo que puder, amigos!
Consulta pública - Voto impresso em 100% das urnas
https://www12.senado.leg.br/ecidadania/visualizacaomateria?id=132598",0,false,0,,,,,,
UgyZPYM_DldpKG3xfMR4AaABAg,Moises Miranda,1 month ago,1526085430691,Brasil é uma palhaçada.,0,false,0,,,,,,
UgwJW0NAsRjQ2eVuRUp4AaABAg,Nanci Correa Martins,1 month ago,1526085430697,"Intervenção Militar para limpar o país da rataria que inunda senado cãmara etc e, tal !!!!!Votar em ratos escorpiões baratas, cupins????????????Não!!!Intervenção militar já!!!!!Por ordem na Zona!!!!!",0,false,0,,,,,,
Ugy2gZvcayrxBkWvVNF4AaABAg,Genilson Pedro,1 month ago,1526085430704,"Graças a Deus, uma vitória para o Brasil, o outra Bolsonaro presidente!",0,false,0,,,,,,
UgyOxJZJi4y9iKIYsQh4AaABAg,SeBASTIAN R.Santos,1 month ago,1526085430713,"Na verdade o TSE fingia não saber,   não duvido nada do TSE está envolvido em corrupção pra ter protegido essas urnas 171",0,false,0,,,,,,
UgxR3KJbUVG315J5Jhh4AaABAg,Fernando AM,1 month ago,1526085430723,"Já esta claro que há fraude nas eleições pois cabral venceu no 1° turno ofendendo a classe trabalhadores chamando policial de vagabundo, bombeiro de terrorista, professor de burro, medico de safado etc... os empresários só existem graças ao trabalhador portanto o trabalhador é maioria esmagadora fazendo isso ficou muito estranho na época. É por esse motivo que não voto em ninguém meu voto tem que ser secreto para eles fraudarem ele.minha sugestão e se eles não tirarem essa porcaria de urna e colocar cédula e se possível usarem o exército para fazer as eleições !",0,false,0,,,,,,
UgyBEMS-4eh3uxi6c-J4AaABAg,Rosinete Duarte,1 month ago,1526085430728,"TSE, por favor pensem no povo pobre do Brasil,os políticos corruptos estão acabando com os brasileiros",0,false,0,,,,,,
Ugx_R72UoG1akY7Qp5t4AaABAg,Rosinete Duarte,1 month ago,1526085430737,"Voto impresso já , intervenção já",0,false,0,,,,,,
Ugz9OqmYQLxlzilEir54AaABAg,Ademir Vani,1 month ago,1526085430747,"Até agora a mídia não reportou nada, eles não vão retirar essa urna, se liguem",0,false,0,,,,,,
UgyRpedXfFdz_K4e5ul4AaABAg,Janaina Veras,1 month ago,1526085430751,Eu sabia antiderrapante abri para votação já tinha voto nas máquinas 👎👎👎.,1,false,0,,,,,,
UgyWqUK_n-MwSNHeGTl4AaABAg,Sergio walmir rijo jahnke,1 month ago,1526085430760,"tsé a grando fraudador da urna,,",0,false,0,,,,,,
UgzKkg1VfaJgCHeXk7J4AaABAg,Sergio walmir rijo jahnke,1 month ago,1526085430769,voto impresso ja,0,false,0,,,,,,
UgyXA8ntxhEqZHEY5bV4AaABAg,Weverton silva,2 months ago,1523493430773,É Melhor Jair Se Acostumando 2018 Vai Chegar #Bolsonaro De Voadora Em Vagabundo ✌❤,0,false,0,,,,,,
UgyRQEStUBdwL0bhXQl4AaABAg,Fernando M C de Mello,2 months ago,1523493430783,"ÓTIMO SABER DISSO, MAS :
A IRA SANTA NÃO SE DEIXA ENGANAR !
SE AS FFAA NÃO FIZEREM A INTERVENÇÃO E EMPURRAREM O BRASIL PARA MAIS UMA ELEIÇÃO EM URNA ELETRÔNICA DA FRAUDE :
SERÁ A REVOLUÇÃO DAS URNAS DA FRAUDE !
URNA QUE NÃO IMPRIMIR VOTO SERÁ QUEBRADA OBRIGANDO O USO DO VOTO IMPRESSO EM CÉDULAS. AUDITÁVEIS, RECONTÁVEIS ! !
ELEIÇÃO 100% VOTO IMPRESSO !
URNA SEM IMPRESSÃO TACA NO CHÃO !
É LEI !
NINGUÉM NOS OBRIGA A VOTAR EM URNA FORA DA LEI !
...
#voto100%impresso #EleicaoAuditavel #UrnaSemImpressaoTacaNoChao
#GLOBO #G1 #GLOBONEWS #BANDNEWS #R7",0,false,0,,,,,,
UgzhLZhGX_5tEq-aKZZ4AaABAg,Super Mario Bros,2 months ago,1523493430791,Não vai ter segundo turno kkk,0,false,0,,,,,,
UgwNDRuVPGHgg2vsOLd4AaABAg,Pedro Alcântara,2 months ago,1523493430798,Tava demorando!! Até q enfim!!!,0,false,0,,,,,,
UgxN6YDyeDpcokopyDl4AaABAg,Vania Mateus,2 months ago,1523493430810,"Voto impresso sim
Bolsonaro 2018",0,false,0,,,,,,
UgxuM78jWah8FKTqGfB4AaABAg,vinícius ecotur,2 months ago,1523493430819,"Podre esse bolsolixo....
Ficam abordando assuntos que fato a populacao quer esclarecimento com o unico intuito de se promover.
Isso e campanha.
E a galera vai no enbalo.
Malote blindado, voto no papelzinho e pessoas popularea co finados pra fazer a co tagem. Isso sim fynciona e nao nescecita de licitacoes milionarias.
Unica forma de gatantir a democracia ...",0,false,0,,,,,,
UgxJlahFZdhcxcx4AG94AaABAg,Luis Guilherme Silva,2 months ago,1523493430831,Sao todos formafos doutorados grafuados.e nao ssbiam........?bolsonaro.neles!,0,false,0,,,,,,
UgyVC8O71xQriWhtBKd4AaABAg,Alan Moises,2 months ago,1523493430843,Bolsonaro 2018,2,false,0,,,,,,
UgyKh8NHsoWxk6k81cB4AaABAg,José Ricardo santos pereira,2 months ago,1523493433482,kkkkkk os comunistas são muito safádos ! Graças a Deus estão fóra !,0,false,0,,,,,,
UgyPGHbXvG8qJZBDNt94AaABAg,Hugo Neves,2 months ago,1523493433488,Urna eletrônica é fraude na certa,0,false,0,,,,,,
UgwObu1yZ2o9AK8drv14AaABAg,Deibson De Oliveira,2 months ago,1523493433495,Só blablabla,0,false,0,,,,,,
