id,user,date,timestamp,commentText,likes,hasReplies,numberOfReplies,replies.id,replies.user,replies.date,replies.timestamp,replies.commentText,replies.likes
UgzJENeCEOK3nEsNtcV4AaABAg,Allyelson Ferreira,4 months ago,1518395892656,"Por isso eles falavam tanto que o voto tem que ser '' secreto''. Bando de imundos, destruidores de famílias. BOLSONARO 2018 já!!!!",0,false,0,,,,,,
Ugxr_wAe2-Cl1sDooBt4AaABAg,Paulo Zilocchi,4 months ago,1518395892662,"Essa proibição das urnas da Smartmatic em razão do laudo técnico que constatou que houve e ainda haverá fraude eleitoral se continuarem a ser utilizadas, coincidência ou não, foi logo após o fim do mandato do presidente do TSE, o vermelhissimo ministro Gilmar Mendes. Agora vem a pergunta que não quer calar:

Será que era ele quem estava impedindo a implantação do voto impresso?

Evidente que sim, já que, obviamente tem o rabo preso com a turma do molusco bandido.",0,false,0,,,,,,
Ugy1xeRTtxipvyPrPyl4AaABAg,Luiz Augusto Ramos,4 months ago,1518395892670,Isso ai vamos bater de frente com esse bando de vagabundos Bolsonaro 2018,0,false,0,,,,,,
UgyuUw55EYEoipOxK-F4AaABAg,Gabriel Melo,4 months ago,1518395892678,isso e uma fake news...,0,false,0,,,,,,
UgxK-k6D3gkHPX7Nty54AaABAg,Alvaro Vocare,4 months ago,1518395892684,"Tocar fogo nessas porras, agora fico mas confirmado",0,false,0,,,,,,
UgzshxAApnF1KIGxoUR4AaABAg,Milton arcanjo oliveira,4 months ago,1518395892701,"VAMOS FISCALIZAR   SIM  CHEGA DE BANDIDAGEM , A VERDADE DEUS AMA  MAIS DO QUE NUNCA , SOU AMANTE  DA VERDADE  E ELA SEMPRE TRIUNFOU E VAI CONTINUAR .",0,false,0,,,,,,
UgxkZP8U46V5dCRvjo54AaABAg,Nathan Azevedo,4 months ago,1518395892723,Aleluia,0,false,0,,,,,,
Ugy0OEmwwpWCPgNnzfd4AaABAg,Alvaro Vocare,4 months ago,1518395892733,Esse é nosso presidente porra,0,false,0,,,,,,
Ugy0go-z8mfRP1AJVed4AaABAg,Lauro Costa,4 months ago,1518395892750,"Bom D+++++++++ pra ser verdade..... Kkkkkkkkkk
Me mijando de ri...  Kkkkkkkkkkk",0,false,0,,,,,,
UgyNGIYK-jQhdq3I9gl4AaABAg,MÁRCIO RÊNIS,4 months ago,1518395892764,Pressão total na cabeça desses esquerdopatas que querem fraudar as eleições e se manterem no poder. A guerra ainda não acabou. Pelo fim dos partidos comunistas no Brasil: Bolsonaro Presidente!,0,false,0,,,,,,
Ugz-s3H8TKoDkcPxLHN4AaABAg,Joel Campos,4 months ago,1518395893892,"Fora corruPTos, viva o Brasil.",118,false,0,,,,,,
UgxJuSi1Wv6RlbwJ-Ll4AaABAg,JACKSON COCHEV,4 months ago,1518395893902,"Bommmmmmmmmmm. Uma já era, agora é tirar a Taurus de campo e deixar a Glock vender suas excelentes armas para as polícias...",0,false,0,,,,,,
UgxlhVlzvM_EtbaRMXJ4AaABAg,Gustavo Angelo,4 months ago,1518395893911,Bolsonaro 2018 !,0,false,0,,,,,,
UgzT9x07F872QKMPwj14AaABAg,galera do bem,4 months ago,1518395893916,"Então esta provado que o pt manipulou todos esse tempo os votos ! Fora comunismo lula na cadeia , bolsonaro 2018",0,false,0,,,,,,
Ugz-GNPsOlL99pBVV8x4AaABAg,Linik Vinicius,4 months ago,1518395893926,Melhor notícia nem acredito e eu assinei a petição pra proibir essas maquinas falsas!,0,false,0,,,,,,
UgyaIHri1alhN0EvOE94AaABAg,Ruan Michel,4 months ago,1518395893933,"Ta, mas a procuradora-geral da República, Raquel Dodge, entrou com uma ação no STF contra a implantação do voto impresso nas próximas eleições, pois segundo ela, a implantação do voto impresso tiraria o anonimato da votacao...",0,false,0,,,,,,
UgwN21Uruk9Sbev7-i14AaABAg,Milton arcanjo oliveira,4 months ago,1518395893940,"VALEU FIQUEI MUITO CONTENTE  , QUE EU SEMPRE  TIVE  UMA CERTEZA QUE ELAS ERAM  FRAUDULENTA .",0,false,0,,,,,,
Ugz0GOhDw8tWIYvSqL54AaABAg,Raphael Bacchin da Silva,4 months ago,1518395893949,"Ae Raquel Dodge vamos dar ênfase no voto impresso todos os brasileiros pedem por isso, vamos lutar pelos nossos direitos. A luta continua patriotas!",0,false,0,,,,,,
Ugw76hWVwGXOF1vUCQ94AaABAg,Brunno,4 months ago,1518395893953,"Acho que a melhor opção seria um urna mista. O voto seria na urna eletrônica, e uma impressora imprime um comprovante, o cidadão que votou coloca o comprovante em uma urna lacrada. Assim, seria possível saber o resultado das eleições no mesmo dia, e como existem os comprovantes seria totalmente viável uma recontagem manual, caso fosse necessário.",0,false,0,,,,,,
Ugw_ka7GmxzUnxEE3vV4AaABAg,Ernandes Assis,4 months ago,1518395893961,Kkkkkkk acabou a putaria agora quero ver pulitico q não tem voto ser eleito,0,false,0,,,,,,
UgwcvRdJHJFhVd3YyEp4AaABAg,Renata Mariana,4 months ago,1518395893965,Perdeu Lula é nois,0,false,0,,,,,,
UgwJvAWBYpswC9y-6FN4AaABAg,Jose Jaires Gutierrez,4 months ago,1518395893973,"Ótima noticia, espero que não fique apenas no bá bá bá. O TRE precisa ser mais rigoroso, e muitos pessoas pensam que o eleitor que decide o rumo de seu país, outro coisa que precisamos acabar é com estes políticos antigos e burros.",0,false,0,,,,,,
UgyfrClybMOCSyHwnUF4AaABAg,Élio Jesus CASCÃO,4 months ago,1518395893978,"AMÉM!!!
BOLSONARO 2018!",0,false,0,,,,,,
UgzGzsZbFW-nqFPiXGN4AaABAg,Raphael Bacchin da Silva,4 months ago,1518395893986,Olha a esquerdalha dando deslike,0,false,0,,,,,,
Ugz4x9knE_KP1Tz8clx4AaABAg,Alex Ferreira,4 months ago,1518395893995,BOLSONARO 2018!,0,false,0,,,,,,
UgwfZhQYYetx-9fJUYt4AaABAg,Lindson e vocês,4 months ago,1518395894004,Huhu BOLSSONARO 2018,0,false,0,,,,,,
UgwCgDnP9lj5VWNSdgJ4AaABAg,Valdinei Ribeiro dos santos,4 months ago,1518395894010,Só me responda uma coisa a quantos anos bolsonaro está na vida pública? Aí depois eu comento,0,false,0,,,,,,
UgxPB702j7oOQURHyOp4AaABAg,Jose Inacio,4 months ago,1518395894018,"A urna eletronica nao é a unica forma de fraudar , claro que se torna um pouco mais dificil , mas nao é impossivel .",0,false,0,,,,,,
UgydlrHi3P-A0pvT0kd4AaABAg,Vitor Gois,4 months ago,1518395894024,"Aiiiiiii, melhorr notícia de todas.... agoraa simmm... Bolsonaro 2018",0,false,0,,,,,,
Ugz192lIqByXSYzN2pl4AaABAg,Rafael Passos,4 months ago,1518395894033,Brasil acima de tudo deus acima de todos.,0,false,0,,,,,,
UgzooL23TveDZqqlLSp4AaABAg,Rafael Passos,4 months ago,1518395894967,Quando Bolsonaro ganha não vamos esquecer de agradecer a Deus por nossa vitória.,0,false,0,,,,,,
UgwrQgtzz1i9yipnVqN4AaABAg,FERNANDO VIEIRA,4 months ago,1518395894971,0:01 Kkkkkkkkkkkkkkkkkkkkkkkkkkkkkkkkkkkkkkkkkkkkkkkkkkkkkkk,0,false,0,,,,,,
UgwzfRt8D_K6GgzYmxp4AaABAg,maria ImA Ima,4 months ago,1518395894979,É isso aí até que enfim #BOLSONARO PRESIDENTE! !!!,0,false,0,,,,,,
Ugzdn76QhVUqTXfjIJF4AaABAg,Leonardo Henrique,4 months ago,1518395894984,"Otima Noticia,e que venha o voto impresso",4,false,0,,,,,,
Ugw6aDCcqFkOqRjgUTp4AaABAg,Bruno1717 romero1717 #chupchup,4 months ago,1518395894991,Já ganho,0,false,0,,,,,,
Ugx-_wC9F3dIGpPcSqB4AaABAg,Wemerson Carvalho,4 months ago,1518395894996,Bolsonaro assume esse ano?,0,false,0,,,,,,
UgyYhN_n_sulpkxtrlh4AaABAg,Argel Amaral,4 months ago,1518395895006,interessante.,0,false,0,,,,,,
UgxX4kArq3wFD057ZJx4AaABAg,Antonio Braga,4 months ago,1518395895014,"Kkkkkk top.......que noticia boa......
Voto impresso ja",0,false,0,,,,,,
UgwOF3cmEs_XMTx3Kth4AaABAg,Raquel Amorim Noronha,4 months ago,1518395895022,Elas só foram aceita na época pra que o PT chegasse no poder.,0,false,0,,,,,,
Ugx4uG-stdhTVE57s_V4AaABAg,Igor Santos,4 months ago,1518395895026,"Não sei porque mais depois de ver essa notícia, e a última fala ""Brasil acima de tudo, Deus acima de todos"" Escorreu uma lágrima nos 2 olhos.",0,false,0,,,,,,
UgwBZiiIT-7bMvCOsZt4AaABAg,Daniele Barboza,4 months ago,1518395895034,Isso aí é verdade mesmo?,0,false,0,,,,,,
UgyldHCSZ5qAokG4jbN4AaABAg,João Paulo Silva,4 months ago,1518395895038,Voto impresooooooooooooo,0,false,0,,,,,,
UgyhB_ZGMKjc98C4OZl4AaABAg,Thiago Rodrigues,4 months ago,1518395895045,Voto impresso é primeiro passo mas queremos mesmo é voto no papel assim como é nos EUA,0,false,0,,,,,,
UgxU5RV9Tfluq2iENBJ4AaABAg,Esequiel Santos,4 months ago,1518395895048,"Notícia melhor que essa só quando o Fantástico anunciar, em outubro, que Bolsonaro é o novo presidente do Brasil. Um abraço.",0,false,0,,,,,,
UgxV7TGHEY6aejf7Ael4AaABAg,Ω Jhoni_ Br Ω,4 months ago,1518395895056,"Esse ano começou meio mal pra mim e minha família, mas todos nós teremos um final feliz se Deus quiser",0,false,0,,,,,,
UgzbaU2ADZYbHP-vdnt4AaABAg,Carmen Silvia Leite,4 months ago,1518395895059,Voto no papel seria o ideal e mais Barato. Intervenção Já. Pelo Amor de Deus.,0,false,0,,,,,,
Ugxq91yMw9F0gzJ3hI94AaABAg,Gustavo Game Game,4 months ago,1518395895063,Fora petralhas,0,false,0,,,,,,
Ugww8u6-tW2rOI3C0DZ4AaABAg,claudinei neizinho,4 months ago,1518395895071,Voto impresso  já  em 2018,0,false,0,,,,,,
UgxrnQe6jVnu8wsHvHN4AaABAg,Renato Rodrigues Pereira,4 months ago,1518395895077,Parabéns que Deus abençoe vc.... o Brasil agradece.,0,false,0,,,,,,
UgwhgdjBjFasCEQZDDF4AaABAg,Alan Walker,4 months ago,1518395895082,Aeee poha,0,false,0,,,,,,
Ugx2Yctd9kVNcn9Zk-h4AaABAg,POR UM BRASIL MELHOR,4 months ago,1518395896395,Uma notícia muito importante,0,false,0,,,,,,
Ugz-3tx_U1-RrTBImN94AaABAg,Notícias  Entretenimento,4 months ago,1518395896402,Inscreva se no meu canal,0,false,0,,,,,,
UgyoszUmkPiEnHE5blh4AaABAg,Vicror Penha,4 months ago,1518395896410,"Desde quando Dilma foi eleita, desconfiei porque quase ninguém estava a apoiando, vários protestos estavam acontecendo pelo Brasil, ninguém queria ela de volta, mais mesmo assim ela acabou vencendo as eleições, ou seja só podia ser fraude mesmo nas urnas.",0,false,0,,,,,,
UgxNxPW94KXLx8n8Y7p4AaABAg,Ediliano Silva,4 months ago,1518395896417,Jair bolsonaro e sem masagem,0,false,0,,,,,,
Ugw0jaWrTVL6nMscYKR4AaABAg,Ronnad Martins,4 months ago,1518395896421,"O Brasileiro é inteligente, apenas dormia muito, Acorda Brasil esse é o Ano da Virada 🎉🙏🏅🇧🇷 Bolsonaro 2018 !",60,true,1,,,,,,
,,,,,,,,Ugw0jaWrTVL6nMscYKR4AaABAg.8cLAWRX_kEK8cNc9YMuVJ2,Otaku BAD,4 months ago,1518395897203,"Inteligente acho que não, o brasileiro só aprende quando se ferra.",2
Ugxh0c7uzugAq5_zJ2Z4AaABAg,Zulmira de Souza,4 months ago,1518395896430,#voto impresso...#voto impresso...#voto impresso....,0,false,0,,,,,,
UgzH3EhB2NFiVCk9eoR4AaABAg,Contente Feliz,4 months ago,1518395896436,Glooooooooorias ao meu senhor. Deus vivo aleluia. Amados temos q comprovar a veracidade dos fatos...se realmente for verdade o Deus todo poderoso vai dar os rumos certos pra nossa nacao. E q se  cumpra a vontade dele!!!!,0,false,0,,,,,,
Ugx0YOhn3Bk5fDe6JwN4AaABAg,Luciano dos Santos,4 months ago,1518395896468,"Povo pra gostar de Slipknot kkkk 👏🏽👏🏽

BOLSONARO 2018!!!!",0,false,0,,,,,,
Ugy8z-_HgEMHyyUFYiV4AaABAg,SCHWARZHAMMER,4 months ago,1518395896476,Vai ser qual empresa? O Exército não tinha mostrado uma máquina?,0,false,0,,,,,,
UgyaKtj2cvxHMA-M__R4AaABAg,paulo b. pereira,4 months ago,1518395896483,Show...graças a Deus,0,false,0,,,,,,
UgwgznxQmFZJ2dD4qrh4AaABAg,ғallen,4 months ago,1518395896488,“Bolsonaro–o filme”,1,false,0,,,,,,
UgzttBexqu8kaw019_F4AaABAg,Lua Moreira,4 months ago,1518395896497,"Quanta desinformação, saiba que do mesmo jeito que a Smartmatic foi rejeitado a outra que foi solicitado também pode ser desclassificado.",0,false,0,,,,,,
Ugwt3GnA6huJVBsU9nN4AaABAg,Boy Straiker,4 months ago,1518395896506,Acabaram de roubar meu pai vem logo Bolsonaro,0,false,0,,,,,,
UgwclXtNrfzOow7RWIJ4AaABAg,Bayron Escudeiro,4 months ago,1518395896510,Glória  a  Deus. Se precisarem de um fiscal e só me chamar.,0,false,0,,,,,,
UgxfPqwKbnqGfi_9pBF4AaABAg,Emanuel Alderson,4 months ago,1518395896518,Nossa muito bom essa notícia,0,false,0,,,,,,
UgyqTlKWRvjrdKHRig94AaABAg,vimeluni club,4 months ago,1518395896528,raquel dodi jogou bosta no ventilador ja deu uma gilmar mendes corruptos.,14,false,0,,,,,,
UgyGCCj_v4XxkAqzBLd4AaABAg,Franck Taylor,4 months ago,1518395896535,"Agora vai...bolsonaro2018
Brasil acima de tudo, Deus acima de todos !",0,false,0,,,,,,
UgwYtkacAL_SXLQ1osF4AaABAg,valter filho antonio,4 months ago,1518395896543,E o MINISTRO do STF o sr.Toffoli  que disse q essas URNAS ELECTRÓNICAS eram super seguras?????,0,false,0,,,,,,
UgyXsjQGoXI_nRVWCuR4AaABAg,BOTO DE NOITE TIRO DE DIA,4 months ago,1518395896552,"Então não está proibida....
A outra empresa vai por urna do mesmo jeito.",0,false,0,,,,,,
UgwXgpoGg--3nXYnU954AaABAg,tercablues,4 months ago,1518395896558,A Smartimatic foi reprovada e imediatamente mandou a Raquel Dodge impedir o voto impresso. Impressionante  !!! Aí tem maracutaia !!,0,false,0,,,,,,
UgzB-lPEGrn2Ksbiq9J4AaABAg,jose policarpo,4 months ago,1518395898255,SOMOS TODOS BOLSONARO ATÉ MORDER EM  2018,6,false,0,,,,,,
UgzhL_zzurYcL6kulmZ4AaABAg,Juliano Pacheco,4 months ago,1518395898265,não entendo se tem fraude nas eleição  o TSE ta no meio não adianta mudar urna eu acho que isso e um álibi di que não tem voto ai vem com essas desculpa kkkkk,0,false,0,,,,,,
Ugz9qj8WWfOzB0Gh0mN4AaABAg,t h e u,4 months ago,1518395898272,Bolsonaro2018,0,false,0,,,,,,
UgzZ0KFPizDFghzRUu94AaABAg,Tô chegando Bolsonaro 2018,4 months ago,1518395898280,😎✌,0,false,0,,,,,,
Ugw885lK_ARNAchUJD54AaABAg,Rafa Ramos,4 months ago,1518395898290,Essas aberturas são um saco,0,false,0,,,,,,
UgwJs2cuCocF7g1YdVx4AaABAg,Rocambole Chocolático,4 months ago,1518395898300,"Bia Kicks, queremos a volta do ""escrutínio"". Era mais seguro a gente olhar o que havia escrito antes de colocar nas urnas. Que saudade!!",0,false,0,,,,,,
UgyuVO7uFFcoZ3NBHwd4AaABAg,André Luis Felizari,4 months ago,1518395898304,Ótima notícia,0,false,0,,,,,,
UgwIN-FdPHKAEozrJxd4AaABAg,Rafael Aguiar,4 months ago,1518395898314,Urna roubotrônica,0,false,0,,,,,,
UgyMymEPGnm4bQuD5iF4AaABAg,乙ᗩᘉǤᗩÐ〇 ᕼᗩᑕḰᔕ,4 months ago,1518395898325,Vim seco aqui pensando que as armas de choque iria ser legal,0,false,0,,,,,,
UgxV5v_AXCZnTxSqi394AaABAg,Toinho Carlos,4 months ago,1518395898335,"Agora sim ,a quadrilha ta fudida ,não pode mas roubar . Bolsonaro presidente",0,false,0,,,,,,
UgxdAfWUDJcxHUPivIJ4AaABAg,WILLIAM CHAGAS,4 months ago,1518395898345,Desistam  kkkk . Bolsonaro 2018,0,false,0,,,,,,
Ugzsac8rQTvd7oa94oR4AaABAg,Nathalia Costa,4 months ago,1518395898355,Será que vai ter voto impresso??,0,false,0,,,,,,
UgwWuicnOOdE2oVe0w14AaABAg,Laiza Cerqueira,4 months ago,1518395898361,#Bolsonaro2018 #Bolsonaroooo,0,false,0,,,,,,
Ugx7uJb5EMA5YSkyOwJ4AaABAg,Old Snake,4 months ago,1518395898370,"Vai demorar 1 ano a apuração de votos mas é melhor que seja assim , já que tem tramóia na votação eletrônica",0,false,0,,,,,,
Ugw0y06eqExqypy8Qe54AaABAg,Fernando Alencar,4 months ago,1518395898379,Uma coisa que não e aceito em país nenhum de tecnologia superior a nossa e que nem sequer copiaram para esses países em suas eleições é porq não e algo confiavel só acontece aqui mesmo no brasil país de corruptos manipuladores de eleições agora quero ver. #Bolsonaro2018👍😉💺,0,false,0,,,,,,
Ugyto4KdYj5IjoqMPix4AaABAg,logistica Cootracap,4 months ago,1518395898388,Voto tem q ser no papel o resto é robalheira bolsonaro neles 2018,0,false,0,,,,,,
UgxpsvefqUmivym7qUl4AaABAg,Marlon Mamede,4 months ago,1518395898400,MARAVILHA!,0,false,0,,,,,,
Ugwn5EnEoOxeuBAoIHZ4AaABAg,Cláudia Lucia,4 months ago,1518395898412,PARABÉNS BOLSONARO! !PARABÉNS GENERAL MOURÃO! !!PARABÉNS A LAVA JATO! !!PARABÉNS A POLÍCIA FEDERAL! !PARABÉNS JUIZ SERGIO MORO!!!😃👍👏👏👏👏👏👏👏👏👏👏👏👏👏👏👏,96,true,2,,,,,,
,,,,,,,,Ugwn5EnEoOxeuBAoIHZ4AaABAg.8cL8leX_hUH8cOHah1elmg,Luiz Vinícius,4 months ago,1518395898875,kkkkkkkkk,0
,,,,,,,,Ugwn5EnEoOxeuBAoIHZ4AaABAg.8cL8leX_hUH8eRY6mWmnvv,alda leal,2 months ago,1523493498880,👏👏👏👏👏👏👏👏👏👏👏👏👏👏👏👍👍👍👍👍👍👍👍👍👍👍👍👍👍,0
Ugxc8eY5xzYRAU0B-B14AaABAg,laercio meurer,4 months ago,1518395898426,"Agora vai hen,um grande passo para vitória. #BOLSONARO PRESIDENTE",0,false,0,,,,,,
UgxVoGJmjKhSspxTteN4AaABAg,walter cunha,4 months ago,1518395898432,quero agradecer todos daqui  que estao lutando por nos. parabens. agradeco de coracao a voceis. todos. vamos melhorar esse nosso brasil. afinal  depende de nos o futuro de nossos filhos. vamos a luta.  acordamos para a vida. essa mulher  ai e guerreira merece  dez.,0,false,0,,,,,,
Ugw82_WqmVB-lMtJ3LJ4AaABAg,Catalogos Hermes,4 months ago,1518395899867,Muito bom!!!!,0,false,0,,,,,,
UgyN4xn-AI1ddwxbyWd4AaABAg,uHenriiqPvP,4 months ago,1518395899872,#Bolsomito,0,false,0,,,,,,
Ugw_9ZaqIoRL6Eiwx_V4AaABAg,Breno Washington,4 months ago,1518395899880,AGORA É PRIMEIRO TURNO 😎✌,2,false,0,,,,,,
UgwDcVqP5_mHPh5MW8x4AaABAg,Maya Ferreira,4 months ago,1518395899883,GRITO DE GUERRA!! 👉Uh é BOLSONARO.. Rhá.Rhá Rhu.Rhu.. 👏👏👏👏🖎❤❤❤,5,false,0,,,,,,
Ugwb7ptCcV6wYB8aYTF4AaABAg,Nilmar Oliveira,4 months ago,1518395899891,Tomara que isso tenha fim mesmo.,0,false,0,,,,,,
UgwM7QXC5qX9UPWjoVd4AaABAg,Leonardo Sanchez,4 months ago,1518395899895,"Agora sim, teremos votações limpas e às claras. Justiça sendo feita.",3,false,0,,,,,,
UgzSyQy7dicp8hHtvcx4AaABAg,Dan Allvess,4 months ago,1518395899903,"Tá esquisito, tá estranho, fácil demais p ser verdade kkk. Tenho é medo! Lula condenado, mas n preso! Vem essa notícia, justo agora?!  Tá rolando algo sinistro! Será mais uma trama do PT? Descobriram um novo método de fraude? Pq só agora? 
Tá estranho, vcs n acham? 
Bom demais p ser verdade! 
 Antes q eu esqueça... #bolsonaro2018",0,false,0,,,,,,
Ugz2sj1fTcXOlDwoXnJ4AaABAg,BOTO DE NOITE TIRO DE DIA,4 months ago,1518395899907,Só acredito vendo 🤔🤔🤔🤔🤔🤔🤔🤔,0,false,0,,,,,,
UgzhIQWG-LMmSbkjk6B4AaABAg,alisson Sousa,4 months ago,1518395899915,Mas a ministra Raquel dodge quer impedir o voto impresso infelismente  vem tiro de todos  os lados.,0,false,0,,,,,,
UgxAk40XXccUR6SCgqV4AaABAg,MarceloFc,4 months ago,1518395899918,"Vamos ter Fé, Bolsonaro vai mudar nosso brasil!!!",4,false,0,,,,,,
UgxNLKQvRneGbf6A5wl4AaABAg,DESTINY MONEY BRAZIL & EUA,4 months ago,1518395899926,Mais essa notícia não era sobre para impressoras do voto impresso?,0,false,0,,,,,,
UgziNOyDVSmleqjGnxp4AaABAg,José Bedelho,4 months ago,1518395899930,"se for verdade é a melhor noticia ,agora só esta faltando o voto na cédula de papel igual antigamente ok ,e viva o BRASIL e a democracia ,abaixo os comunistas e esquerdistas ok",0,false,0,,,,,,
UgwmULDM62I1rPhZ22B4AaABAg,Arminda Honestidade,4 months ago,1518395899936,Parabéns a todos que lutaram arduamente pelo Brasileiro Honesto e Trabalhador.  VOTO IMPRESSO JÁ  - BOLSONARO 2018.,0,false,0,,,,,,
Ugzc8d4D27gd_z_w-F14AaABAg,Kah Tubette,4 months ago,1518395899940,Bolsonaro a caminho da grande vitória 2018,0,false,0,,,,,,
UgwJFTurai48PKx3lSZ4AaABAg,Bima song,4 months ago,1518395899947,#Votoimpressoja,0,false,0,,,,,,
UgxaLvUDk9q-mG9uxWZ4AaABAg,"Pennywise, aqui nós todos flutuamos",4 months ago,1518395899953,"Momento histórico,✌✌💕",0,false,0,,,,,,
UgzAchk9y8hux3ebDgJ4AaABAg,Mirian Cabral,4 months ago,1518395899958,"Vai ser uma bagunça nas urnas. Já no impresso já havia fralde.
Fui mesaria, via como era. De igual modo havia. De colocou as urnas pra facilitar.",0,false,0,,,,,,
Ugy7yP9AV82e8XtJ5_h4AaABAg,joão marcos,4 months ago,1518395899963,BOLSONARO PARA PRESIDENTE DO BRASIL!,0,false,0,,,,,,
UgxSfu6WEnuWfAGGTWB4AaABAg,Gu dextro,4 months ago,1518395899970,sem deputado e sem senador  so bosonaro,0,false,0,,,,,,
UgyH4vluVqFjsUYAnPJ4AaABAg,Luiz Games Android BR ­­,4 months ago,1518395899975,"Seis que vcs acham ele um mito , mas meu professor falo q ele é um preconceituoso de negros, homossexuais , não sei se esse cara é tão mito assim NN🤔",1,true,10,,,,,,
,,,,,,,,UgyH4vluVqFjsUYAnPJ4AaABAg.8cL82zak-9K8cMke63Jt19,Arthur Farias,4 months ago,1518395900443,"Sr Luiz ツ Teu professor é um tremendo de uma fdp,que faz parte de um sistema corrupto de miseráveis.
Pode falar isso para ele.",2
,,,,,,,,UgyH4vluVqFjsUYAnPJ4AaABAg.8cL82zak-9K8cN3QpZ1SJh,Luiz Games Android BR ­­,4 months ago,1518395900448,Arthur Farias nossa,0
,,,,,,,,UgyH4vluVqFjsUYAnPJ4AaABAg.8cL82zak-9K8cNKfc_PhSX,Fabison Souza gameplays,4 months ago,1518395900453,"Sr Luiz ツ honofobico ele não é ele é apenas contra o kit gay, ele é contra o estrupo da mulher ele falou na cara da Maria do presidiário e ela apóia o estuprador e ele disse que só não estrupava ela por que não podia, racista é o krl agora ele ser contra a idéia e opinial de negro é racismo?",0
,,,,,,,,UgyH4vluVqFjsUYAnPJ4AaABAg.8cL82zak-9K8cNLy5xIbIn,Fabison Souza gameplays,4 months ago,1518395900457,"Vou explicar de forma mais explicada nesse comentário:
1°Bolsonario não é homofóbico ele apenas é contra o uso do kit gay nas escolas que por causa disso ele ganhou a fama de ser homofóbico sem nenhum argumento convicente.
2°Bolsonario não é machista, ele apóia a igualdade entre o homem e a mulher só não apóia que as feministas julguem todos como machistas e que se achem superiores ao homem sem motivo.
3°Bolsonario não é racista, ele só é contra que o negro possa chamar o outro de branquelo, que tenha mais chances de passar no enem pela raça, e pra conseguir entrar na política com mais facilidade que o branco.
4°Bolsonario não é a favor do estupro, ele apenas é contra o fato da Maria do Rosário apoiar que o estrupador tenha o direito de estrupar a mulher, ele é a favor da mulher brasileira não ser estrupada.
5° Bolsonario é a favor do cidadão armado no Brasil pra acabar com essa farra no rio de janeiro e nas favelas onde o cidadão passa medo todos os dias com medo de tomar um tiro e não poder ver a família.

Sabe por que eles chamam ele de tudo isso? Por que não tem argumentos convincentes para chama- lo de corrupto.",1
,,,,,,,,UgyH4vluVqFjsUYAnPJ4AaABAg.8cL82zak-9K8cNNVN1Vae6,Luiz Games Android BR ­­,4 months ago,1518395900463,Fabison Souza gameplays tendi agr vlw,0
,,,,,,,,UgyH4vluVqFjsUYAnPJ4AaABAg.8cL82zak-9K8cNXuzM2kot,Suellen Maper,4 months ago,1518395900467,Seu professor mentiu pra você. Procure por você mesmo ver o que o cara fala. Tenha sua própria opinião. Abraço!,1
,,,,,,,,UgyH4vluVqFjsUYAnPJ4AaABAg.8cL82zak-9K8cNcH9XYSMM,Fabison Souza gameplays,4 months ago,1518395900472,Suellen Maper já falei isso pra ele,0
,,,,,,,,UgyH4vluVqFjsUYAnPJ4AaABAg.8cL82zak-9K8cR0FR9aEMp,Marcelo Aragão,4 months ago,1518395900475,pesquise primeiro amigo.. ele e meu capitão. e futuro presidente,0
,,,,,,,,UgyH4vluVqFjsUYAnPJ4AaABAg.8cL82zak-9K8cVbxDGQiwF,murilo forasteiro,4 months ago,1518395900479,Seu professor e comunista cara por isso,1
,,,,,,,,UgyH4vluVqFjsUYAnPJ4AaABAg.8cL82zak-9K8cYt1XQ9LQe,Space Universal BR,4 months ago,1518395900485,"Seu professor recebe bolsa esmola?
Se sim....ele vai odia o bolsonaro..",0
Ugy9oNe9xYvKwrmUJ1d4AaABAg,Sei lá,4 months ago,1518395901547,MAKE BRAZIL GREAT AGAIN!,0,false,0,,,,,,
Ugz7zrLc8Z_Z1F0zWn54AaABAg,José Geraldo Fissicaro Iannini,4 months ago,1518395901557,A noticia é ótima. O voto impresso é direito do eleitor. Esta reviravolta no jogo vai tirar de uma vez por todas os PTralhas do processo eleitoral em 2018.  Vamos gente BOLSONARO na cabeça em primeiro turno. General Mourão Ministro da Defesa.,0,false,0,,,,,,
Ugx8tFfUj4lxOfxngQ94AaABAg,joão marcos,4 months ago,1518395901567,BOLSONARO PARA PRESIDENTE DO BRASIL!,0,false,0,,,,,,
UgybfTFJhI93q_fOCV94AaABAg,Velhofc entretenimento,4 months ago,1518395901577,"Legal mas, e o lula não vai ser preso não ?",0,false,0,,,,,,
Ugxvncx9t7KnhTzc9894AaABAg,Gu dextro,4 months ago,1518395901588,esta urna e do pmdb e do pesdb,0,false,0,,,,,,
UgwxRUNGKTRn3jiGYyJ4AaABAg,Paulo Cezar Grande,4 months ago,1518395901597,Então devolva essas urnas eletrônicas lixo para a Venezuela.,0,false,0,,,,,,
UgwQtPZin9mTzvrXdKV4AaABAg,GameBong,4 months ago,1518395901606,"Poe aquela abertura antiga
""PIPAPAPAROPÔ""

essa que é foda.",0,false,0,,,,,,
UgzsAHzJCLMN2dWzs4N4AaABAg,Vinicius Meckson,4 months ago,1518395901616,Bolsonaro 👊👊💪💪✌,0,false,0,,,,,,
UgyZxXX0XYSRlfj2XGp4AaABAg,Gu dextro,4 months ago,1518395901627,vamos ganhar,0,false,0,,,,,,
UgwDz-KSuWv8ZP4XTyF4AaABAg,walter cunha,4 months ago,1518395901638,"cuidado tambem pela outra firma que vai fazer o servico,. com certeza os corruptos  tambem vao tentar compralos. fiquem atento nisso.",0,false,0,,,,,,
UgwkhXu95Kedmn7eM6l4AaABAg,Marco Eduardo,4 months ago,1518395901649,"NEGATIVEI O VIDEO COM FORÇA. Chamada falsa. As urnas não foram proibidas, só a smartmatic é q não passou no teste. Sou Bolsonaro 2018, mas vc com essa chamada falsa VAI TOMAR NO OLHO DO CU",3,true,1,,,,,,
,,,,,,,,UgwkhXu95Kedmn7eM6l4AaABAg.8cL7lyIRJr-8cLVAVEnr7g,Rafael maia,4 months ago,1518395902176,Marco Eduardo boa.. isso mesmo.. fake news de merda desse cara.,1
UgzXtd1MY8YpwKWepv14AaABAg,Andretay Silva,4 months ago,1518395901663,É mesma que realizou as eleições  na Venezuela,0,false,0,,,,,,
UgyeMdWqTyijekJba3J4AaABAg,Texugo,4 months ago,1518395901673,Quando serão as eleições manos ???,0,false,0,,,,,,
UgzuQQ2Gc5RJCNDuV154AaABAg,leandro soares,4 months ago,1518395901683,👏👐👍,0,false,0,,,,,,
UgxU17PwbHXHdKQezWh4AaABAg,Kev Rodriguez,4 months ago,1518395901695,"Cara, ainda há esperança. Essas carniças de urnas eletronicas so fomentou a estadia dos parasitas no poder.",0,false,0,,,,,,
Ugyqzn3iZhzA-Ar0oOd4AaABAg,Denis Melquíades,4 months ago,1518395901706,"Deus está abençoando Brasil, vai arrancar essa corja de vagabundos ladrões chefiados pelo Lula. Não há outra opção, Bolsonaro é a esperança do Brasil
#bolsonaro2018",11,true,1,,,,,,
,,,,,,,,Ugyqzn3iZhzA-Ar0oOd4AaABAg.8cL7bG4jYrd8cPJ_1cnVrp,Sarah Barros  De Abreu,4 months ago,1518395902195,"Denis Melquíades 
Amém🙌🙌",1
UgwPrWwFWZFYKy7bss14AaABAg,Gal Rt,4 months ago,1518395901719,Melhor esperar pra ver!,0,false,0,,,,,,
