id,user,date,timestamp,commentText,likes,hasReplies,numberOfReplies,replies.id,replies.user,replies.date,replies.timestamp,replies.commentText,replies.likes
UggI9aECZ0jgdngCoAEC,Ismail Kamel Abdul Hak,3 years ago,1434070414391,"Eleições para Presidente 2014
Apenas 5 horas foram necessários para provar que a URNA Eletrônica é insegura!!!
Ministério Publico de São Paulo admite que o sistema é falho!!!
Apos 5 horas da liberação do TSE para testes de segurança na URNA Eletrônica, 
Professor da UNB afirma que não apenas a urna e insegura como pode ser demonstravelmente insegura...! 
Perdi a confiança no TSE, sem contra prova não existe lisura!!!",6,false,0,,,,,,
UggyULpZJif2U3gCoAEC,César Magalhães,3 years ago,1434070414400,TSE ? O que é isso no governo Dilma ? N-A-D-A !!! Quem viver verá ! Lamentável.,2,true,1,,,,,,
,,,,,,,,UggyULpZJif2U3gCoAEC.7-H0Z7-K38P8YMN_oiS0_a,Ricardo D,8 months ago,1507769614902,"TSE é tudo. Quem eles disserem que foi eleito será considerado eleito. As urnas eleitorais brasileiras não permitem auditoria.
A votação é irrelevante.",0
UgisX3Sf2euxcngCoAEC,Arroz_00,3 years ago,1434070414415,e viva a Ciência!,0,false,0,,,,,,
Uggk7pmbIT5A6HgCoAEC,Monica Kfouri,3 years ago,1434070414423,"diante disso tudo, como posso deixar de votar???",1,true,2,,,,,,
,,,,,,,,Uggk7pmbIT5A6HgCoAEC.7-H0Z7-SGwj7-Hw_BFVeIu,aaanjr57,3 years ago,1434070414923,"Olá Monica,infelizmente ""deixar de votar"" não resolve este problema(a não ser que todos deixassem,mas isso é praticamente impossível).O mais lamentável é constatar que todos os países mais desenvolvidos recusam o uso destas ""urnas eletrônicas brasileiras""(até o Paraguai recusou) por absoluta falta de segurança e aqui no Brasil nada acontece,é o absurdo dos absurdos,abraços!",10
,,,,,,,,Uggk7pmbIT5A6HgCoAEC.7-H0Z7-SGwj7-MJ4B-gmFV,Monica Kfouri,3 years ago,1434070414928,"então eu vou para o Estado vizinho um dia antes e depois justifico. Assim acredito que eles não possam ""manipular"" o meu voto, não é?",2
UggxKiRUgU_ppXgCoAEC,Shiraz duarte,3 years ago,1434070414434,compartilhamento em massa facebook,0,false,0,,,,,,
UgiCqgkUMfRAs3gCoAEC,James Patrick,4 years ago,1402534414442,"Vamos em frente, Fera!
Sempre repercutirei seus vídeos.
Se eu puder contribuir com algum conteúdo,
encaminharei para você.
Abraço!",5,false,0,,,,,,
UghpyBaziud6SHgCoAEC,James Patrick,4 years ago,1402534414455,"Fera,
qualquer trabalho de conscientização
é árduo e a impressão que fica é a de que as pessoas
tendem a ignorar essas mazelas por acharem que
pouco ou nada podem fazer.
Há tempos acompanho seus posts.
Assista ao vídeo abaixo e verifique o número de acessos:
Urna Eletrônica Totalmente Violável e Manipulável.
Ou seja, um telejornal expõe situação de extrema gravidade
e que foi debatido até no plenário da Câmara dos Deputados (6:08)
pelo Deputado Fernando Chiarelli.
O parlamentar parece um um pregador no deserto!
De quebra, foi ameaçado de morte pelas denúncias:
http://www.folhapolitica.org/2013/05/deputado-recebe-ameacas-de-morte-apos.html
Ou o telespectador muda de
canal nessa hora, por achar o assunto fora da sua esfera
de alcance, ou já está tão condicionado/manipulado
ao ponto de ficar imune, anestesiado.
Forte abraço!",9,true,1,,,,,,
,,,,,,,,UghpyBaziud6SHgCoAEC.7-H0Z7-EtYR7-HOvYqFc0I,aaanjr57,4 years ago,1402534414824,"James,agradeço novamente seu comentário,realmente vc tem sido um excelente acompanhante do meu canal e agora,diferentemente de críticos que não apresentam um conteúdo contrário,vc apresenta fatos e vídeos para que todos tenhamos acesso sobre este grave problema.Quando vemos tantas reações de vários segmentos da sociedade contra a urna eletrônica e nada acontece para impugná-las,ficamos indignados e tendemos a desistir do tema,mas ""água mole em pedra dura,tanto bate até que fura"",não é possível só o Brasil estar certo,quando tantas nações desenvolvidas não concordam com estas urnas.
Máquinas DRE de 1ª geração começaram a ser usadas em experiências na Índia em 1990 , na Holanda em 1991 e no Brasil em 1996, onde passaram a receber a denominação de ""urnas eletrônicas"".
Porém, em 2008, depois de 17 anos das primeiras experiências, o uso de máquinas DRE sem comprovantes impressos do voto foi proibido na Holanda por falta de confiabilidade. Na Índia, as experiências para implantação do VVPAT se iniciaram em 2011 . Atualmente, apenas no Brasil se continua a usar urnas eletrônicas de 1ª geração sem voto impresso. Em março de 2009, máquinas DRE de 1ª geração, sem voto impresso, foram declaradas inconstitucionais na Alemanha pela mais alta corte judicial do país , por não atenderem o Princípio da Publicidade no processo eleitoral, isto,é, por não permitirem ao eleitor conferir o destino do seu voto sem precisar de conhecimento técnicos especializados.
 Em novembro de 2009, no município de Takoma Park (EUA), ocorreu a primeira experiência oficial com uma nova modalidade de máquinas de votar que utilizava o sistema Scantegrity .
Este novo modelo, ou terceira geração de máquinas de votar, é caracterizada pelo uso de voto escaneado e criptografado com recursos técnicos tais que permite ao próprio eleitor acompanhar e conferir a correta apuração do seu voto, indepedentemente de confiar no software, mas sem que possa revelar o próprio voto para terceiros.
A realidade é simples: as urnas eletrônicas brasileiras estão obsoletas, são inseguras e, mesmo sabendo disso, o TSE, o STF e o Governo se recusam a admitir os fatos e efetuarem as mudanças necessárias, como a troca das urnas DRE pelas de terceira geração, para conferir confiabilidade e segurança ao processo eleitoral e permitir a auditoria dos votos,um forte abraço!",2
UggwnpR2JJZngngCoAEC,James Patrick,4 years ago,1402534414466,"Excepcional post.
Parabéns!",0,true,1,,,,,,
,,,,,,,,UggwnpR2JJZngngCoAEC.7-H0Z7-Mr297-IVL264v5g,aaanjr57,4 years ago,1402534414836,"Muito Obrigado James,apenas procuro realizar meu dever de cidadão e divulgar o que nossa mídia não tem feito com a necessária ênfase...vamos acompanhar o resultado desta denúncia,abraços!",4